timestamp,time,author,message
1567422188174445,4:02:22,Makwa Choma,Jabu on DA municipality level i agree 100% with YOU
1567422260167779,4:03:34,Jabu Malinga,"Makwa, the DA must reform its policies and make them black friendly in terms of land etc. then maybe ppl wil vote for them"
1567422277873557,4:03:51,Jeffrey Kangara,correct
1567422349639949,4:05:03,Makwa Choma,Jabu i think at this stage DA is better options or else the way to maputo is clear
1567422505894917,4:07:40,KEITH SINDILE DINABANTU,"@Jabu Malinga I was like, what? why? He said, ""the thing is, the Keith i know loves or is fond of abiding to law, order, honesty and/or truth."""
1567422537010855,4:08:10,Jabu Nhlanhla,no used to pay Sidney
