timestamp,time,author,message
1535965229880179,-7:24,Lucky123 Thwala,what time are they coming back?
1535965394173966,-4:40,hilton modike,30 minute
1535965411330902,-4:23,Lucky123 Thwala,thanks
1535965531265031,-2:23,TG Swartlane,They’re supposed to be back now@11 Mzansi time
1535965983848146,4:57,hilton modike,guy mara anc is rotten .i mean who on earth would have believed that a guy vincent smith can b corrupted like that
1535966007076356,5:21,hilton modike,going to an extent where he got paid monthly as if it was a salary
1535966059259228,6:12,Lucky123 Thwala,six hundred thousands viva smith viva
1535966206145405,8:40,hilton modike,i guess there is a former head of operations who used to work for busasa willing to tell all .about the people who were paid
1535966248681155,9:22,hilton modike,why is the hawks not arresting this people
1535966258408398,9:32,KEITH SINDILE DINABANTU,"@Lucky123 Thwala Thing is, tea is just a name, there is lots of things to eat first, snacks, muffins, yogurts , fruits... plus chatting. 😁"
1535966475881227,13:10,KEITH SINDILE DINABANTU,"@Lucky123 Thwala I am sorry, you happen to have ideas that appeal as i come in. 600k story by Smith is shocking to me! I was looking forward for Sunday to see this corrupt ANC MP, BOOM, its Smith."
1535966517383512,13:51,hilton modike,iyho 😷😷
1535966581609459,14:55,KEITH SINDILE DINABANTU,@hilton modike Hawks are still trying to entangle themselves from state capture. They were deep in the state capture ditch as well.
1535966670973231,16:25,mfumo walter maluleke,what is this issue about vincent smith. Please fill me in
1535966714682574,17:08,hilton modike,@keith sindile dinabantu i have a feeling that zuma was right when he said he will expose most of the politicians who stole so much .its will take 10 years 4 the Anc 2 clean itself
1535966717893072,17:10,Marvel Mushavhela,"Are there any high profile cases that Hawks persued, charge and win exept being corrupt?"
1535966775309474,18:09,fernando visagie,"Just one question , will the spin doctor Jimmy be summoned to appear before the commission and also charged with interfering with witnesses?"
1535966855290261,19:28,hilton modike,@mfumo Maluleke nwana mhani there was a corrupt tender given to bosasa at the airport and they were paying vincent smith R670000.00 & they did his security upgrade @his home 4 free .at a cost of k200
1535967049843169,22:44,Francois Cape Town,"They should also ask Cyril Ramaphosa what he knew about state capture, and why he didn't do anything about it. It was in the news for years and years."
1535967121568030,23:55,hilton modike,the guptas were real mafias the story that they employed fikile mbalula to b a sports miniter came up again on weekend .i guess made it a point that they put dirts on all the ministers
1535967169398439,24:43,Floyd Nkuna,The position was vacant for 6 years cause the Guptas were still looking for a stooge.
1535967255030565,26:09,Amanda Watson,"What happened was the always accessible, friendly, and professional Phumla was no longer accessible to journalists."
1535967297957618,26:51,hilton modike,cyril ramaphosa have got a women to work with i c a courageous women like thuli madonsela in her .this women was bullied so much & never succumbed
1535967398485316,28:32,hilton modike,@amanda watson i guess there was a way that she could be accessible with all this pressure on her .because i guess she feared that she have to explain things in a way they wanted her to
1535967520448863,30:34,hilton modike,the manner in which she was treated by faith muthambi as a women is embarassing . i cant believe that some women help men to perpetuate patriarchy against womens
1535967707571416,33:41,Black Panther Amen Kuma,OH OH
1535967773187773,34:47,Fritz Faro,Thando lots of posts vacant but unemployment is high?? Eish! Talking of efficiency?
1535967826256978,35:40,Black Panther Amen Kuma,👀 UMM
1535967830950128,35:45,Phineas Motaung,with all this evidence why dont we have these officials being on the dock. We were made to believe that the inquiry wont stop prosecutions but nothing is forthcoming.
1535967883906615,36:38,Black Panther Amen Kuma,SOMETHING BIG SHE IS COOKING
1535967978513434,38:12,Sharing Fam Space,ayikho iphunga yehlathi isizulu sisho njalo kuthen abantu abamnama besenza nje
1535968007720697,38:41,Gambu,A 6 year vacancy on a country with so much unemployment.😒
1535968049847681,39:24,hilton modike,"to.all the womens in this country ,why dont u guys isolate people like muthambi because they are not part of u"
1535968067948992,39:42,Phineas Motaung,I don't say they must be sent to jail but this evidence should be running parallel with evidence before a judge.
1535968128026436,40:42,Phineas Motaung,Remember this evidence is evidence before court yet.
1535968173120254,41:26,Madluphuthu,"I said it on Friday and I'm going to say it again, I sense a lot of anger from Ms. Williams due to the manner in which she was treated. Therefore, I would take her averments with a pinch of salt."
1535968182147821,41:35,Phineas Motaung,No Thando you dont seem to understand.
1535968242885166,42:36,Nicky majiya,I like Me Williams
1535968254180452,42:48,Phineas Motaung,Gupta leaks were enough prima facie evidence and readonable prospects of prosecution.
1535968289210031,43:22,Phineas Motaung,successful prosecution
1535968350869977,44:25,Phineas Motaung,did anyone implicated deny authenticity of allegations
1535968419299011,45:33,Nicky majiya,so detailed
1535968436341379,45:50,Phineas Motaung,the only denial was that Saxonwold could have been a shebeen
1535968523441761,47:17,Nicky majiya,Is she still there at GCIS ?
1535968535725479,47:29,J Ganasan,"the lawyer is so cute. if she was questioning me, i'll tell her everything"
1535968556916856,47:50,Phineas Motaung,No Thando Hawks is the investigating unit not the commission
1535968593360184,48:27,Jp Mubita,@J Ganasan I'm sure you would.....lol
1535968631652404,49:04,J Ganasan,so you were sidelined from your position os DDG - maybe were incompetent
1535968714352660,50:28,hilton modike,@j ganasan .i guess it was fair to let her remain on her position if she was not comperent.the fact that she was acting for this long it tells that she is competent.
1535968753209041,51:07,hilton modike,@j ganasan i thought u could c between the lines that she was treated unfairly.
1535968802582489,51:56,J Ganasan,if she was incompetent - then the minister and DG did the right thing
1535968821663156,52:15,hilton modike,@j ganasan .i think u would have felt much bitter if it wad u .because what was happening to her was unfair .and she was bullied by ur brothers atul's puppets
1535968882058275,53:16,Philani ngcobo,It seems like she is angry 😀😀😀
1535968924221193,53:58,hilton modike,philane u can say that again .i would have felt the same
1535968985241101,54:59,Nicky majiya,they were bullied
1535968986392235,55:00,Madluphuthu,"She loves her power and positions shame. it seems to me that had they given her the nice promotions, she would not be here testifying. She is settling old scores this one."
1535969031261383,55:45,Nicky majiya,Is angry
1535969062663815,56:16,Nicky majiya,crying
1535969069911509,56:23,J Ganasan,typical useless public servant - now claiming stress.
1535969091919359,56:45,BOIKANYO MOLOI,eix so sad
1535969119118590,57:13,Nicky majiya,"very sad, she is human at the end"
1535969120928558,57:15,J Ganasan,tortured - no one touched your body. seems like u had nice meals. too much food in fact
1535969140989400,57:35,hilton modike,j ganasan u r a typical gupta puppets .why dont u ask the guptas to return home
1535969144443816,57:38,Philani ngcobo,Lawyers for the defense will use her anger to ridicule her testimony.
1535969186028284,58:20,J Ganasan,hilton - stop making false accusations. Gupta and Zuma shd be behind bars. But this obese lady should get real
1535969195488928,58:29,Tebza Qmelii Lashad,😂😂
1535969205052396,58:38,Nicky majiya,"when you principled, you get frustrated if work not going according to the book"
1535969233104342,59:07,hilton modike,if ur mom was obesse were u going to say it .who u are to charge how she looks .that tells how stupid u saw her
1535969263903318,59:37,Nomaswazi Hlope,"Yeah, right on J Ganasan when you have nothing of value to add, throw insults. Typical."
1535969275399279,59:49,hilton modike,that tells that u are stupid .since she refused to b a puppet for ur master
1535969283115516,59:56,Nicky majiya,"""this woman"""
1535969287225844,1:00:01,Maimane H. L. Lekwane,"I respect Chairperson of the Commission, he has a heart."
1535969309876236,1:00:23,Philani ngcobo,Yessss this commission is starting to heat up now.
1535969354630399,1:01:08,Maimane H. L. Lekwane,Some comments from the likes of J Ganasan are just pure immoral
1535969359219026,1:01:13,Siphiwe Booi,The State capture did not only damage the Government's monies but it actually emotionally abused our Mothers. It breaks my heart seeing Ms Williams holding back her tears.
1535969361397340,1:01:15,Philani ngcobo,Herman he is highly professional is his job.
1535969379583891,1:01:33,Madluphuthu,Funny how many people here are now assuming that she was a victim just because she says so.
1535969384219388,1:01:37,Maimane H. L. Lekwane,"Yes, he is Philani."
1535969401001473,1:01:55,Nicky majiya,"This is what I observe Booi,"
1535969430847519,1:02:24,Nicky majiya,they tried their best all of them it wasn't easy
1535969437209836,1:02:31,KEITH SINDILE DINABANTU,@hilton modike Spot on! Zuma was correct! That shows there is a lot of corrupt to be revealed ahead of us. This calls for a lifestyle audit for all these corrupt fat cats
1535969455368156,1:02:49,joe nkabinde,this chocking stories we here
1535969510220038,1:03:44,Madluphuthu,people will be surprised when the hear another version of how this Willams lady tormented here staff.
1535969520586967,1:03:54,Miranda Valashiya,she is setting the record straight.
1535969525231682,1:03:59,joe nkabinde,believe me this is unaccepted at all
1535969596148886,1:05:09,Philani ngcobo,"I don't buy that Madluphuthu, no matter how emotional witnesses may be I just need concrete evidence that can help judges to convict corrupt government officials."
1535969602623135,1:05:16,Madluphuthu,why should we just take her word for it? these allegations still need to be tested.
1535969754809554,1:07:48,Madluphuthu,@Philani ngcobo it just shows you how easily people are persuaded. Just shed a few tears and you'll have them eating out of the palm of your hand.
1535969816253093,1:08:50,William Pieters,Will Faith Muthambi come before the commission?
1535969847359799,1:09:21,Amukelani Nelly Mdluli,Yes she has to
1535969865633236,1:09:39,William Pieters,thx cool @Amukelani Mdluli
1535969868961504,1:09:42,Vish Govender,M- It seems u know something?
1535970077664852,1:13:11,Thokwane Dithuge,mutambi people are
1535970180686523,1:14:54,David Masupa,these j z supporters don't cease to amaze me . they will support you even if you kill . they will try to find something to defend the indefeasible
1535970212327955,1:15:26,makhosi nobhatyi,Mutambi was serving her boss
1535970224101582,1:15:37,J Ganasan,those supporting Williams must all be fat lazy public servants too
1535970280560264,1:16:34,William Pieters,I seems straight.
1535970292315225,1:16:45,William Pieters,it
1535970360936304,1:17:55,Elias Nakanyala,tourched?
1535970384427251,1:18:18,Marvel Mushavhela,Can we all block this Ganasan dude - He's got energy in discriminating other folks just because of their skin colour and how they look. It just can be..mxm
1535970411195420,1:18:45,makhosi nobhatyi,J Ganasan this is how Gupta get in government to loot government resources
1535970447744151,1:19:21,Madluphuthu,It turns out that some people here have already pre determined the outcome here. Maybe the commission should just conclude its business cause its seems that we now know what happened.
1535970459973294,1:19:33,J Ganasan,im blocking u Marvel and Makhosi. Ure rude
1535970492349340,1:20:06,Kea Moeng,haibo
1535970578572390,1:21:32,Marvel Mushavhela,I've blocked them already
1535970613847353,1:22:07,Madluphuthu,funny how people are so aggressive towards people who do not agree with them. ey you guys are funny yaz.
1535970646053643,1:22:39,David Masupa,what a courageous human being.
1535970653881336,1:22:48,Ugeshan Chetty,Amandla Miss Williams. Fearless in the face of adversity
1535970679616823,1:23:13,mlungisi lukhozi,Protection for Ma Williams please
1535970755624110,1:24:29,J Ganasan,Thando - ure loss. No skin off my back baby
1535970779995535,1:24:53,TG Swartlane,"There’s zuma faction in this comment section,wow"
1535970780747882,1:24:54,Madluphuthu,childish
1535970828784456,1:25:42,J Ganasan,Ms Williams is no fun to look at
1535970849600639,1:26:03,Ugeshan Chetty,“Bought Champagne”😂😂😂😂
1535970853213367,1:26:07,Siyabonga Gasa,Madluphutu... you are so disappointing with ur defence brigade role which is not goig to earn you anything...there's enough evidence to corroborate Pumla William's testimony...
1535970859270620,1:26:13,William Pieters,rofl
1535970860447487,1:26:14,David Masupa,you are right miss /mrs William. muthambi is the enemy of the people of South Africa as a whole not only South Africa the continent as a whole.
1535970873628898,1:26:27,TG Swartlane,You are right @Thando
1535970949159695,1:27:42,makhosi nobhatyi,Bring it on mama Williams
1535970976179405,1:28:10,David Masupa,very proud of you mama
1535971000065976,1:28:33,Theo Bhengu,Well done Phumla Williams. Expose the scumbags.
1535971032948937,1:29:07,UNscripted,"Let's fight against corruption/irregularities wherever we are. We owe it to our country! Yes, Mama Pumla Williams"
1535971033394493,1:29:07,Ugeshan Chetty,Wow wow Miss William’s on point.
1535971056562120,1:29:30,Regan Brandon,"Its clear that she is exposing corruption, how are people disregarding that? she must carry on speaking in order to expose the truth."
1535971066200768,1:29:40,Amukelani Nelly Mdluli,what did we expect... the ministers who were in replace we obvious in work with the guptas
1535971069544528,1:29:43,Siyabonga Gasa,she has taken an oath..and her testimony will form part of a report and thise accused will have to take in on review Madluputu...this is so so sad bra...get off ur horse...
1535971100249684,1:30:14,Amukelani Nelly Mdluli,corruption has to be uprooted
1535971117620368,1:30:31,David Masupa,absolutely
1535971214106247,1:32:08,makhosi nobhatyi,"Chetty she is well educated and has experience we need from a person, she knows her work very well which ministry put in despute"
1535971242475714,1:32:36,Madluphuthu,"I'm guessing most people here are not familiar with the principle of ""Audi Alteram partem rule"". they just listen to a witness and make a conclusion. Unfortunately, that's not how this work in SA."
1535971257364736,1:32:51,Lethebela Phala,Faith not faithful?
1535971258812525,1:32:52,David Masupa,we can't be so dumb to praise those who steal our hard earned taxes
1535971275188063,1:33:08,tinotenda kaziboni,"Well done South Africa, this is an example to the rest of the world how to address corruption."
1535971296305773,1:33:30,Choruz Vargas,Why are they even fighting a crime is a crime
1535971300331267,1:33:34,Thabo Kganyago,our taxes are been stolen hle banna☹☹☹☹☹☹☹☹☹☹☹🤤🤤🤤🤤🤤🤤🤤🤤🤤
1535971303599272,1:33:37,Kwena Setumo,sure David.
1535971337791635,1:34:11,Amukelani Nelly Mdluli,@madluphutu elaborate for us
1535971355049566,1:34:28,Hardus Schoeman,Whats sad is the apparent lack of respect that our government officials have for citizens/taxpayers intelligence. Thinking that we cant see through what they are doing.
1535971374130701,1:34:48,David Masupa,thanks to those sons and daughters of our beautiful country for their bravery and courage
1535971393892684,1:35:07,Madluphuthu,"..and I'm not praising anybody here, I am just point out that this is just one side of the story. Your utterances are disregarding and disrespectful to the commission."
1535971417701868,1:35:31,Excellent Mavimbela,Thank you Julius Malema for fighting corruption
1535971425023486,1:35:38,Tsepo Motlohi,corruption is evil
1535971441107430,1:35:54,TG Swartlane,"@David Masupa the problem with corruption is that,most of the time people who don’t like such revelations are the ones who benefit one way or the other somehow."
1535971455392588,1:36:09,Thabo Kganyago,"@Hardus Schoeman true dat, thats why we need ppl like this woman"
1535971505624027,1:36:59,Hardus Schoeman,The truth will come out eventually its just sad that it must take so long for us to get back on track as a country 😞
1535971511798507,1:37:05,Amukelani Nelly Mdluli,Malema is not a saint here... he was part of the corruption
1535971520194689,1:37:14,David Masupa,nobody has denied that the guptas received a refund from says . that is just one of many.
1535971536483359,1:37:30,fernando visagie,"This dude is out of order, you have no right to call woman fat, we are looking for justice here and not slander Ganasan"
1535971542702841,1:37:36,David Masupa,ssrs
1535971543073604,1:37:36,tinotenda kaziboni,"Corruption is every where, how many have not received kick backs or can favours through their position/role at work/ church/ other Orgs"
1535971563080429,1:37:56,kenneth mampa,"She really knows her story, is it because she is educated or not. Y Vitjie was struggling?"
1535971570110365,1:38:03,Ena Swart,dis 'n katnes!
1535971577470820,1:38:11,Hardus Schoeman,According to a recent report the CIA warned the South African government about the Guptas's illicit activities as early as 2009!
1535971587437995,1:38:21,David Masupa,so it must just go on
1535971588860961,1:38:22,Mpho Setlolela,This woman has that struggle attitude
1535971605053031,1:38:39,Madluphuthu,"And take into account that Williams is being lead. None of her allegations are being challenged. Surely if she was talking about u, u would want to tell your side of the stroy"
1535971620701693,1:38:54,Frank Kgwedi,i remember jimmy manyi telling us e - toll is not a dream it's reality we have to live with it. I would like to tell him that commision of inquiry is not a dream it's real he will have to explain.
1535971645446253,1:39:18,Nhlanhla Mazibuko,Mr Manyi send a text sms to Ms Williams to tell her what and what not to say...
1535971662033819,1:39:36,Lucky Gumede,ha ha ha He will be called in to oead his evidence as well
1535971701040809,1:40:15,David Masupa,she is ready to be cross examined. are they ready?
1535971771187097,1:41:25,Keitireng MMoipolai,volume please
1535971773352195,1:41:27,Ugeshan Chetty,Interview for a position that Ms Williams never applied for ???????
1535971819395839,1:42:13,Mpho Setlolela,Is procedures followed on her current position ?
1535971907210600,1:43:41,fernando visagie,"Uncle cyril must also come in and give account, how can the dep. president dont have knowledge about what were going on right under his nose for some years."
1535971940871369,1:44:14,Madluphuthu,"Its so annoying when people pre-judge the process. You might think you are being smart by so doing, but its really annoying. Nobody knows the truth yet Not even you on youtube"
1535971944912928,1:44:18,Auti Mjita,including Gwede
1535971945683918,1:44:19,Nozipho Thembeka,Lol Fernando serious
1535971957730652,1:44:31,makhosi nobhatyi,Zuma was president not Cyril
1535971975835688,1:44:49,David Masupa,"the guptas said they only want white waitresses because blacks are not clean enough for their liking, but you keep hearing that they represent radical transformation. for the unclean blacks?"
1535972079965827,1:46:33,TG Swartlane,"@David I was so furious ,we were taken for a ride"
1535972146831961,1:47:40,DALUXOLO DINISO,"HE COULD HAVE BEEN OUT BY NOW,HE WAS RIGHT NOT TO ASKED ANY QUESTION."
1535972185034731,1:48:18,TG Swartlane,Absolutely @Dalu
1535972441593358,1:52:35,Ayanda Manyeku,this women mara is amazing...she knws her story
1535972442243780,1:52:36,kenneth mampa,R u ppl on lunch?
1535972477732279,1:53:11,Pheladi Lamola,faith muthambi banna. yerrr
1535972572853247,1:54:46,NN2017 UTHANDO,That voice is too deep.
1535972870954960,1:59:44,thembisa nxopo,"Honourable Muthambi where is she from and what qualifications she possess, anyone with a clue"
1535972937245369,2:00:51,William Pieters,Faith Muthambi???
1535973055618943,2:02:49,William Pieters,Stay safe Mama Williams.
1535973068166391,2:03:02,Madluphuthu,@thembisa nxopo WELL believe it or not but she is an admitted attorney.
1535973290278381,2:06:44,Sibusiso Nkosi,Thanks Madluphuthu fully agreed they will be surprised indeed
1535973554400612,2:11:08,Peter Rametsi,thank you
1535974279471554,2:23:13,Geraldine Thopps,0
