timestamp,time,author,message
1552305967445968,1:00,Desmond Masilela,Sound please
1552306208039517,5:00,welton paulse,Yor is this now a lip reading session? coz if it is .. i am sure this dude just said something a bout my momma
1552306221075936,5:13,Masbu Mqu,Masbu Gebs
1552306235266019,5:27,Musa Bakiti,i got sound
1552306295433642,6:28,Desmond Masilela,SABC please help us with the sound
1552306311500474,6:44,Susan Thirion,sound is a problem
1552306320900249,6:54,Michael Michael,Sabc icu
1552306625141080,11:58,Thapelo Motabogi,😂😂😂
1552306851276977,15:44,Desmond Masilela,The guy is talking as if his running for something
1552306944627341,17:16,Myka'Al Daud,Fearfontein is making this guy fearful
1552307060101355,19:13,Felix Muyoba,@Desmond Masilela perhaps the guy was warned that since you are leaving eskom and you know what is happening here if you ever expose us we will come for you where ever you are..
1552307120670226,20:14,Desmond Masilela,@Felix Muyoba. 😂😂😂😂😂
1552307144073924,20:36,Felix Muyoba,@Yin Yang i now agree with you on that
1552307174132124,21:06,Zox Alexandreez,where is the sound?
1552307348774011,24:01,Wildthing,sound is on the left ear peace something wrong I can only hear one side.
1552307386193242,24:38,Felix Muyoba,@Yin Yang as soon as he discovered some anomalies at eskom he left..he is an honest citizen..
1552307530046351,27:03,Myka'Al Daud,"Rama was the chairman of MTN when Iran charged the company with corruption.....FNB,Lonmin etc etc"
1552307597275740,28:10,Desmond Masilela,The sound is better now from my side
1552307659841656,29:12,Desmond Masilela,The guy dont even know what to say
1552307717350532,30:09,Nobby's Photography,sound in left speaker only my right ear is getting jealous with no sound
1552307740330856,30:33,Wildthing,ha ha yes
1552307795144203,31:27,Frik Brits,"I think some people here need to reboot their PC's, Some of you are maybe running Windows??"
1552307872808183,32:45,Wildthing,SABC tech will say he must speak over the mic and not from one side only. :)
1552307893641017,33:06,Myka'Al Daud,IEC to investigate anc for bosasa election funding
1552307928270736,33:41,Derek Main,@Myka'Al Daud Don't hold your breath - IEC is compromised
1552307974357725,34:26,Felix Muyoba,@Myka'Al Daud do you think investigation can yield anything?
1552307982569959,34:35,Isihlahla Samabhinca,we are waiting for Zuma's time
1552308024405351,35:17,Myka'Al Daud,"prisoner of hope,just expose the rot.is ppl to choose who they want.knowing the truth"
1552308078837195,36:11,Myka'Al Daud,Truth shall set us free
1552308099922467,36:32,Wildthing,ANC have breached about 5 critical laws which should have them removed from taking part in voting for 8 years. until they clean up there act. and ask Venezuela to keep the MECs visiting them.
1552308150529404,37:22,Felix Muyoba,@Myka'Al Daud if the rural people were eating and drinking at an anc rally with that money from bosasa..do you think they understand that it was illegal? they dont..
1552308159565206,37:33,Myka'Al Daud,PG refuses to be cross examined by Moyane
1552308296208926,39:49,Myka'Al Daud,Is he hiding something or just enjoying his rights?
1552308307949259,40:00,Nelson Musoliwa,Do we want to believe that the entire ANC esp the NEC didn't know that the dealing with bossasa was illegal?
1552308346315228,40:39,Aadil Mohammed,"Why waist state funds on this , BOSASA boss has been charged and arrested Zuptas and cronies still parade free. Stop this farce and lock the lot up or has CR signed a secret document????"
1552308388492248,41:21,Michael Michael,I think those young educated man and woman took advantage of the fact that.the former head of state cant clearly read and understand the writings.even if down on the line we need pardon him.
1552308413745525,41:46,Felix Muyoba,@Nelson Musoliwa they knew..just ignorance..typical of african ruling parties attitude..
1552308415445645,41:48,Musa Bakiti,Let bygone be bygone and start again with EFF .Please freedom fighter beware afrikaaners.
1552308426686767,41:59,ACE MABEKA,...
1552308435279761,42:07,Michael Michael,Yin disagree
1552308444272294,42:17,MIKE DURBAN,Guys....No Pardon for criminals whatsoever.......
1552308477442372,42:50,Aadil Mohammed,Michael there is no excuse if you pardon one you must pardon all. He was clever enough to defraud the state so he is eligible to stand trial and go to jail.
1552308495003404,43:07,Derek Main,"@MIKE LOCK I agree - if we want to stop the rot, we need to punish all guilty parties harshly"
1552308498828984,43:11,Myka'Al Daud,Did we pardon apartheid agents ?
1552308509169322,43:21,MIKE DURBAN,@Musa Bakiti ...reckon u been nbrainwashed Bra
1552308527067661,43:39,Wildthing,I agree to in jail with the keys thrown away.
1552308531644851,43:44,MIKE DURBAN,@Derek Main ....spot on
1552308603553812,44:56,Wildthing,Daud should have locked up Verwoerd but a white guy shot him before that could happen.
1552308604863890,44:57,MIKE DURBAN,No mercy for any of them......SA needs this going forwards
1552308608579393,45:01,Myka'Al Daud,"SA is a forgiving nation,we must nor depart from our culture of ubuntu....."
1552308613235514,45:05,Granny Mokwena,which Mboweni again??
1552308649099679,45:41,Michael Michael,we must forgive him
1552308649523518,45:41,Derek Main,What I would like to know is if we taxpayers are going to be funding the legal defense for any of these criminals. I don't think we should.
1552308658787363,45:51,MIKE DURBAN,"@Myka'Al Daud ,,,sorry Bra...not when it comes to all of this"
1552308665977573,45:59,Musa Bakiti,We must start exporting our criminals to overseas like China export its criminals to Africa.
1552308718250504,46:50,Wildthing,Musa they put a hole in a corrupt persons head in China
1552308731454007,47:04,Myka'Al Daud,"We forgiven sellouts who wrote letters to SB,many lives were lost but we forgave...."
1552308770866815,47:43,Nelson Musoliwa,@Yin it is however difficult to believe that people who fought gallantly against oppression can do such a thing.
1552308807223259,48:20,doctor bonginkosi mnisi,all those who are implicated they must face full might of the law especial high profile leaders from ANC 70% of them are involved we also want forfeit unit
1552308809409260,48:22,Desmond Masilela,"All this corrupt ppl of Eskom, Bosasa @ Gupta must just come and give evidence without being ask to do so."
1552308820432842,48:33,MIKE DURBAN,@Nelson Musoliwa ........brainwashed by the Commies Bra
1552308849999469,49:03,Lucky123 Thwala,is't the same Tito?
1552308876343843,49:28,MIKE DURBAN,@Desmond Masilela ...spot on
1552308919701452,50:12,Musa Bakiti,Pastor Mboro told us on Sunday service that Eugene Terrebranch is missing in heaven.
1552308939702649,50:32,Myka'Al Daud,"We gave apartheid killers 2nd chance,learn from us guys. it was so painful when we forgave n moved on"
1552308956141422,50:49,Myka'Al Daud,forgave
1552309020406545,51:53,Desmond Masilela,@MIKE LOCK. They are all corrupt to the core.
1552309026910468,52:00,MIKE DURBAN,@Myka'Al Daud ..absolute not true
1552309063922150,52:36,Felix Muyoba,"@Yin Yang what homelands, wena?"
1552309073826086,52:46,MIKE DURBAN,@Desmond Masilela ...too true...they all knew what was going on
1552309121256503,53:33,Myka'Al Daud,"Why divide the country,we need unity and grow economy together"
1552309132036273,53:45,Michael Michael,Is this Yin oryt??
1552309153495360,54:05,Desmond Masilela,@MIKE LOCK. Now we keep on wasting time and money for this commission. Why cant they go straight to court and be prosecuted and send them to jail. This is just a wast.
1552309158687533,54:11,Felix Muyoba,@Michael Michael imagine!
1552309173188331,54:26,Nelson Musoliwa,Yang They were suffocated from the start not to develop to certain level by the regime as they were just spoon fed economically.
1552309235504720,55:28,Musa Bakiti,"I knew what was going on but 34% unemployment ,i could't say anything.Lord forgive me."
1552309235864758,55:28,Kobus Erasmus,Julle kan lekker K@K praat hier ne.
1552309277875922,56:10,Derek Main,@Myka'Al Daud Let them come and confess their sins first and then we'll decide if they have revealed all and been truthful
1552309298268676,56:31,Felix Muyoba,hau wena kobus!!!
1552309337458701,57:10,Myka'Al Daud,Moeinie kwaat wies is reraag
1552309364736978,57:36,TheRaz,so sad yin yang
1552309370462795,57:43,Ignatius Kgwete,kobus dit klink jy het branawenkie ge goie bra
1552309416628723,58:29,MIKE DURBAN,@Myka'Al Daud ....No way bra.......can't live in the past...can only live going forwards......criminals Must be punished
1552309450182249,59:03,Felix Muyoba,kobus is still dreaming about those olden days when all privileges were on his side
1552309476693031,59:29,Ignatius Kgwete,haaaa......haaaa...jaaaaaneeeewat
1552309492882584,59:45,Myka'Al Daud,Derek yes lets uproot this corrupt practices but lets vote for justice n dignity for everyone
1552309530830581,1:00:23,Derek Main,Myka'Al - can't argue with you there
1552309537316908,1:00:30,Musa Bakiti,BEE did not work but EFF is going to work
1552309547151966,1:00:40,MIKE DURBAN,@Myka'Al Daud ...they also pardoned ANC Commie comrades.....ne
1552309743037974,1:03:56,MIKE DURBAN,@Musa Bakiti ...forget it Bra....Commies not welcome here in Sa
1552309981922776,1:07:54,Christiaan Kleynhans,I dont have sound on this feed
1552310016274523,1:08:28,Desmond Masilela,Here comes Gupta again
1552310017863655,1:08:30,TheRaz,just got on this live stream so got no idea what they are directly talking about
1552310036265793,1:08:48,TheRaz,@Christiaan Kleynhans sound is working fine for me
1552310101067379,1:09:53,Christiaan Kleynhans,Thanks TheRaz. Then it must be on my side. But my other YouTube videos work well.
1552310101662354,1:09:53,Desmond Masilela,Nothing surprised him. who can she ask because you sitting there
1552310181490689,1:11:14,TheRaz,@Christiaan Kleynhans interesting try refreshing browser and emptying cache. making sure mute is off
1552310445821294,1:15:38,Christiaan Kleynhans,Even restarted. Rest of YouTube is fine.
1552310452288768,1:15:45,Desmond Masilela,No answer
1552310496527076,1:16:29,Musa Bakiti,@Christiaan Kleynhans There is sound in English not Afrikaans
1552310500020142,1:16:32,Desmond Masilela,What is this guy position?
1552310532282008,1:17:05,Desmond Masilela,@Musa Bakiti. 😂😂😂😂😂
1552310599193141,1:18:11,Tich Ziny,"@Desmond Masilela, my question too! Was he captured?"
1552310599691567,1:18:11,Michael Michael,From prison they will re-collect everything
1552310633976891,1:18:46,Michael Michael,He looked guilty
1552310673970404,1:19:26,Mogale Mokoena,@MusaBakiti that respose!😂😂😂
1552310692706562,1:19:45,Desmond Masilela,@Tich Ziny. Because according to my understanding his answering question as if he was a jnr manager. and we dont need ppl like this. we wand the big fish.
1552310745469817,1:20:37,Desmond Masilela,we want
1552310759296725,1:20:51,Sthakathi Khumalo,"Hola hola people, Who is this comrade people? And what was his influence..??"
1552310759422199,1:20:51,Michael Michael,But u can c he is not telling the whole story.bit of lies.
1552310763673163,1:20:56,Musa Bakiti,This guy was right empoly of Eskom till he met with the mighty Guptas
1552310763842341,1:20:56,MIKE DURBAN,Eeeesh....we want the Big Sharks...
1552310800498013,1:21:32,Michael Michael,Ewe Musa.he played a role.
1552310810448407,1:21:43,MIKE DURBAN,Mmmmm......something Fishy here.......
1552310850396545,1:22:22,Desmond Masilela,@Michael Michael. As if someone has threaten him if you says something against me! I will come after your family.
1552310927804094,1:23:40,Musa Bakiti,This mama boy leave him alone .Go and get Jacob
1552310931911564,1:23:43,Michael Michael,he must just tell the truth.by people like him whole country is suffering now.
1552310935442349,1:23:48,Desmond Masilela,@MIKE LOCK. We have 1 BIG fish of Bosasa. we are awaiting one from Eskom and very big one from Zupta brothers
1552310945676194,1:23:58,Tich Ziny,Am inclined to say he is wasting the Commission's time
1552310954506256,1:24:06,TheRaz,He has had a lot of meeting and alot of discussions with people that have not been recorded.
1552310984324301,1:24:36,MIKE DURBAN,Eeeesh....many Big Sharks at play in all of this Bra's
1552311008499336,1:25:01,Michael Michael,this guy
1552311017960439,1:25:10,TheRaz,"""I may have it was not my call"""
1552311025145238,1:25:17,Desmond Masilela,Slowly but surely we getting there.
1552311040816513,1:25:33,Michael Michael,I dont think he is stupid but act like one.
1552311048142175,1:25:40,Desmond Masilela,This guy looks scared really
1552311063634885,1:25:56,Desmond Masilela,I wonder how old is he.
1552311075900369,1:26:08,Tich Ziny,"Eeeesh, definitely captured!"
1552311076359582,1:26:08,Onke Socikwa,He is scared
1552311085147575,1:26:18,Michael Michael,Desmond no he is hiding something
1552311123064157,1:26:55,Desmond Masilela,I wish Adv Maseko was there to dig all that his hiding.
1552311125390737,1:26:58,MIKE DURBAN,She must grill him to tell al...
1552311142150361,1:27:14,Musa Bakiti,Mr Opperman could not recall but this one can recall things
1552311173673942,1:27:46,Desmond Masilela,The jail is waiting for him
1552311182886474,1:27:55,Margareth Waterboer,"Jeez, I just blocked a few talking rubbish"
1552311208528605,1:28:20,Michael Michael,This lady also doing well.but Mr Maleka tooo bright.and I dont know were he comes from.
1552311217456984,1:28:29,Desmond Masilela,I wonder who did you block at this time
1552311226935411,1:28:39,Tich Ziny,"Me thinks he has been to Dubai on holiday, curtesy of the Guptas"
1552311238504711,1:28:50,Magda Seguin,He said this morning he resigned due to being unhappy...he was probably forced to ok that 10 year contract but is scared to say by who
1552311270086182,1:29:22,Lee D. Hendrix,"...He runs things his way without responsibility to the public/black public, sorry."
1552311273816453,1:29:26,Magda Seguin,@Rich Ziny you are speculating
1552311282492535,1:29:34,Lazlovic Red-Eye Masemola,"Being remorseful will be on card, trying ducking and diving wasting resources will come to bite them, they need to sing like Pavarotti Mr Agrizzi"
1552311289397858,1:29:41,Michael Michael,Dont get him.now we must put word into his mouth
1552311320243315,1:30:12,Felix Muyoba,"but if he is lying he will be caught because other witnesses will come expose him..so, he knows it is suicidal to lie and mind you it is under oath"
1552311351214793,1:30:43,Michael Michael,Mr Agrizzi yes we give him our prayers
1552311358035699,1:30:50,TheRaz,"wow, why a ten year contract then aye"
1552311370095256,1:31:03,MIKE DURBAN,Aaaah....bust
1552311375260219,1:31:07,Magda Seguin,Remember he spoke about the coercion and bad atmosphere that even his boss was asked to leave
1552311380574583,1:31:12,Desmond Masilela,They must strip all this ppl who looted our money. They must become hobos .
1552311388102939,1:31:20,Ronnie F,Her questions are putting him a corner.
1552311391720747,1:31:24,Michael Michael,I wish Koko can cam now
1552311432793040,1:32:05,TheRaz,he is so the middle man though. he's taken the fall for his team
1552311438175108,1:32:10,Ronnie F,The main actors need to be brought to book
1552311444766333,1:32:17,Magda Seguin,He also said hierarchy played a huge part at Eskom...The superio
1552311446561767,1:32:19,Musa Bakiti,@Tich Ziny This guy is not the kind of leave South Africa and to enjoy himself somewhere.He is pure Africaaner .He holiday he goes to Orania
1552311475074164,1:32:47,Michael Michael,Mr Majavu stop going to sheheen bcz millions coming on ur way here are criminals.we dont want to loose u.
1552311484026771,1:32:56,Desmond Masilela,😂😂😂 you mean his wiping sweating ryt now??
1552311513374382,1:33:26,Magda Seguin,The executive was controlling and no dissent was tolerated
1552311541132190,1:33:53,Felix Muyoba,"@Musa Bakiti yes, a blerr boer!"
1552311558375620,1:34:10,Magda Seguin,All these people was working in a hostile environment
1552311585685290,1:34:37,MIKE DURBAN,@Felix Muyoba ....now now Bra...
1552311596238421,1:34:48,Michael Michael,Even if u put this guy for ten days u will never ever get proper answers.he is a liar.
1552311597745788,1:34:50,Desmond Masilela,@Yin Yang. Exactly 100%
1552311693301342,1:36:25,Musa Bakiti,Pure boer do aply for passport.They know that to go to Orania Republic you don't need passport.
1552311715347879,1:36:47,Magda Seguin,@Michael Michael these people were controlled by Koko and Molefe
1552311719950129,1:36:52,MIKE DURBAN,@Musa Bakiti ...now now Bra
1552311729469082,1:37:02,Nelson Musoliwa,Think this guy was heavily involved in this illegal operations at Eskom
1552311774922595,1:37:47,Magda Seguin,The captured ones were the Gupta lackeys put there by Zuma
1552311823930686,1:38:36,Magda Seguin,This guy was not high up in the hierarchy...he left because of the rot...li
1552311843531509,1:38:56,TheRaz,what is this guys name?
1552311845389821,1:38:58,Michael Michael,Magda me and u suffer bcz of those 2.pure criminals.jail nothing else.Molefe wz my best on tv.not knowing wt is behind that chair.fool.
1552311880684925,1:39:32,Magda Seguin,The real culprits are in hiding...we are waiting for Koko
1552311902463369,1:39:54,Michael Michael,Koko yes
1552311915441312,1:40:08,Michael Michael,he think he is clever
1552311915812198,1:40:08,Magda Seguin,I suggest you guys read Jacques Pauw's book
1552311930019565,1:40:22,TheRaz,who is Koko?
1552311943934438,1:40:36,Michael Michael,Magda I cant a Ford sorie
1552311993752430,1:41:26,Magda Seguin,@TheRaz You are obviously not in the loop of state capture
1552311996775551,1:41:29,Desmond Masilela,@Magda Seguin. My president keeper
1552311999805905,1:41:32,Musa Bakiti,I for one i trust this Orania guy although i don't like him
1552312000560148,1:41:32,Michael Michael,Razor Koko head of Generation at eskom.acting CEO.he meshed up big time.
1552312033334733,1:42:06,Johnny Cash,✊🏿eff
1552312076015877,1:42:48,Johnny Cash,Come May 19 Eskom will be nationalised ✊🏿eff
1552312093293463,1:43:05,MIKE DURBAN,@Musa Bakiti ....eeeesh Bra...just because he is Afrikaans.......eesh Bra
1552312097959576,1:43:10,Magda Seguin,@Desmond Masilela Yes
1552312116234492,1:43:28,TheRaz,@Magda Seguin I am from Australia but born in South Africa
1552312127909026,1:43:40,Michael Michael,Jonny chat with him
1552312176807431,1:44:29,Desmond Masilela,Who is this Mboweni? Is Tito Mboweni?
1552312183692584,1:44:36,Johnny Cash,Never ever and never again in my lifetime will crooks eat our money ✊🏿eff
1552312187969453,1:44:39,Michael Michael,no
1552312201958759,1:44:55,MIKE DURBAN,The Afrikaaners were one of the cutures that built this City/Country .......think about it
1552312208031750,1:45:00,Michael Michael,worked for eskom
1552312235275554,1:45:27,Nelson Musoliwa,Dismiss this guy he is wasting the comm time
1552312275877888,1:46:07,Wildthing,Mr Cash jump on your horse and ride on the EFF is birnnfrom ANC and a baby version of the ANC.
1552312289485849,1:46:21,Maxinne Mboweni,VUSI Mboweni
1552312293250813,1:46:25,Magda Seguin,"@TheRaz I also live overseasbut I read SA news everyday....a suggestion, read the Daily Maverick and follow SA politics on Twitter"
1552312344069165,1:47:16,Johnny Cash,Come May 19 the eff will eat the anc ✊🏿
1552312344111860,1:47:16,Michael Michael,Mike yes they build it to better their life going will never change the situation we are in now.we have kids we must prepare this country for them ryt??
1552312348443799,1:47:20,Onke Socikwa,Johnny Cash EFF is also implicated so shut up
1552312363268939,1:47:35,Magda Seguin,"SA has excellent investigative journalists,they uncovered and published the Gupta emails"
1552312392378817,1:48:05,Michael Michael,Magda bravo
1552312401181162,1:48:13,Desmond Masilela,He forgot that they asking question. LOL
1552312424369309,1:48:36,Michael Michael,he is tired and boring
1552312442426231,1:48:55,MIKE DURBAN,@ Magda.....where would we be without these brave men and woman....
1552312451951512,1:49:04,TheRaz,I was born in Durban and moved to Australia with my family 18 years ago when i was a kid
1552312462978002,1:49:14,Michael Michael,in the dark
1552312488981927,1:49:41,Wildthing,Musa like making children below the age of 14 years old to hand out papers over the week end very bad.
1552312494803002,1:49:47,Desmond Masilela,@Michael Michael... Noooo his not tired. This is another way of trying to dodge the answer. He think the chair will say you are now excuse.
1552312494884484,1:49:47,Lucky123 Thwala,"the voice of the thief is going down,down."
1552312501963749,1:49:54,Musa Bakiti,Mr Bester your wife is going to leave you now.
1552312514406749,1:50:06,Michael Michael,Raz fine u are one of us.think no load shedding that side
1552312529417780,1:50:22,Lucky123 Thwala,voice
1552312561125196,1:50:53,Magda Seguin,"@MIKE LOCK We are blessed,they are harassed by the EFF and BLF everyday, even threats of rape and murder.If it was not because of their commitment this commission and others would never have happened"
1552312583267010,1:51:15,Solly 12,Who’s this guy people??
1552312611853910,1:51:44,MIKE DURBAN,@Magda Seguin ...spot on
1552312613158488,1:51:45,TheRaz,@Michael Michael yes absolutely no load shedding. Australia does have some high power prices though but if you go with the right energy provider for your area you will save money
1552312632173838,1:52:04,Johnny Cash,Vote ✊🏿economic freedom fighters come May 19
1552312653799658,1:52:25,Wildthing,so no monopoly. you have more than one energy supplier
1552312655706723,1:52:27,TheRaz,isn't it may 8th ?
1552312671059650,1:52:43,Johnny Cash,Free electricity in my lifetime come May 19
1552312679638372,1:52:52,Wildthing,he is EFF knows nothing
1552312703531827,1:53:15,MIKE DURBAN,@Johnny Cash... you will be cashless shortly afterwards Bra
1552312812147137,1:55:04,Magda Seguin,Soweto residents owe Eskom R20 billion
1552312814605394,1:55:06,Musa Bakiti,@Johnny Cash EFF power do not worry about wild michael he won't bite you.
1552312835579139,1:55:27,Magda Seguin,They are part of the problem
1552312854241301,1:55:46,Wildthing,ANC promised a great future that they could not give. and now the EFF I'd feeding off the same people that are now suffering even more caused by ANC. its time to look at reality and build from that.
1552312876728881,1:56:09,Bridgette Kekana,Soweto residents must pay
1552312884000861,1:56:16,MIKE DURBAN,@Magda Seguin .....the culture of entitlement is at play...
1552312894031102,1:56:26,Magda Seguin,I heard a Soweto women say that free electricity is in the ANC Freedom Charter
1552312908233926,1:56:40,Wildthing,everyone that use should pay that is only fair.
1552312951018127,1:57:23,Bridgette Kekana,every body must pay the services
1552312975792209,1:57:48,Magda Seguin,Soweto residents also refused prepaid metres
1552313010379487,1:58:22,Johnny Cash,When we expropriate the land and the banks and even the roads and all monopoly business come May 19 money will be plenty ✊🏿eff
1552313014314075,1:58:26,Wildthing,only people with special cases should be granted power until they can correct that.
1552313064013514,1:59:16,Musa Bakiti,"How can one pay with no job ,no land,no bank that can give loan cause one is black listed"
1552313072069250,1:59:24,MIKE DURBAN,@Johnny Cash ...Gees..Bra...you really have been brainwashed
1552313081791477,1:59:34,Linda Leibach,"Don't know about you all, but I am voting on teh 8th May, not the 19th. I think you are going to be a little late!"
1552313119000032,2:00:10,Johnny Cash,8 May 2019 my CIC will be the new president in my lifetime ✊🏿
1552313129947577,2:00:23,Magda Seguin,Me Hofmeyer acts as if she is in court
1552313131812293,2:00:24,Linda Leibach,Unless something else is happening on the 19th
1552313263836023,2:02:36,makhosi nobhatyi,Eish guys I have out of office for while Zuma’s reply on intelligence reports recommendation he is implicated I wonder why intelligence didn’t investigate anything during his tenure 😳😳😳
1552313268596479,2:02:41,Onke Socikwa,@Sinx 😀😀😀😀😀😀😀
1552313427131966,2:05:19,Desmond Masilela,Jail can assist him to recall everything he forgotten.
1552313448949659,2:05:40,Derek Main,@Johnny Cash How old are you? -50?
1552313502866990,2:06:34,makhosi nobhatyi,"Zizojika izinto Ramaphosa uzophatha ungakhali mntwana nam it is his time to clean up and make Anc and the country dignity has mandated to perform that, also unify ANC and country"
1552313599055480,2:08:10,Magda Seguin,"The SSA even spied on NGOs,created bogus unions at Marikana and infiltrated fees must fall to manipulate the media"
1552313615970661,2:08:28,makhosi nobhatyi,"@magda Seguin I agreed with you, here the evidence from Eskom ,SSA was serving the master"
1552313656199408,2:09:09,Musa Bakiti,Pastor Mboro pray for MR Bester
1552313684542993,2:09:37,Desmond Masilela,Guys can we expect another witness tomorrow?
1552313697277877,2:09:49,Songezo Nqonji,Ijst feel sory for president Ramaphosa because he must do the damage control nw
1552313711719733,2:10:03,Myka'Al Daud,"Ramaphosa didn't clean MTN,FNBSA,LONMIN etc,why must we trust him?"
1552313714197370,2:10:06,Mzalwane Mzala,President Ramaphosa leads the renewal of both the ANC and the state.
1552313717446436,2:10:09,Magda Seguin,"Zuma ruled SA as his own fiefdom,he violated the Consitution and used taxpayers money as his personal kitty"
1552313750701659,2:10:42,Derek Main,Ramaphosa was deputy president while all this was happening - he's implicated
1552313788301298,2:11:20,Myka'Al Daud,He is capitalist in sabbathical leave
1552313790256662,2:11:22,Mzalwane Mzala,Lead us Ramaphosa
1552313833657191,2:12:06,Derek Main,Ramaphosa and the entire ANC are on trial here
1552313840803642,2:12:12,Magda Seguin,Zuma and the SSA even tried to stop Ramaphosa's bid for ANC president.The report is in the public domain...everyone can access it.
