timestamp,time,author,message
1595937537069031,-2:02,Edward Grosvenor,The witness has both Zondo and Hurley around his finger. he is controlling
1595937921053625,4:11,Roy Kisten,they should also have a body language specialist in the commission to see weather this idiot is lying
1595938017962523,5:47,Arthur Dell,Roy Kirtsen we all can see he is lying!!!
1595938090788316,6:59,Marcus Mmola,"The witness knows his story ,why not just charge him in a normal court of law."
1595938418893405,12:28,Martin van der Breggen,I thought this was not going to take long.....Nyathi has verbal dihorrea
1595938457477757,13:06,Arthur Dell,Martin you that 100% right
1595938595254156,15:24,Craig Johnson,"No wonder nothing happens in government, too much kuluma"
1595938799105466,18:48,StarManRSA,"""Everything I did wasn't actually me, it was the institution"""
1595938834177847,19:23,Dominic Przybylski,collective irresponsibility
1595938907107593,20:36,Ernestine Groepies-Larey,witness has an attitude 😡
1595938917764363,20:45,Xolisa Ndevu,this person is arrogant
1595938942051322,21:10,Dominic Przybylski,Sounds like he did no work at all.
1595938977675495,21:46,Richard Masigo,Arrogance won’t work here he must answer
1595938983790993,21:52,Gabisile Mahlangu,So arrogant!
1595938994393244,22:04,Craig Johnson,"As Shaggy once said, ""It wasn't me"""
1595939019141983,22:28,Craven Morehead,Dodging questions and showing arrogance
1595939034896555,22:44,Craven Morehead,Zondo must put him in his place
1595939069308805,23:18,Dominic Przybylski,Gupta
1595939076785531,23:25,Moonchild,@Craven Morehead - hope the syncing is better here 🙂 !
1595939079902486,23:29,Alex Ngoy,THIS MAN HE IS ARROGANT BECAUSE HE HAS GIVEN A CHANCE TO DO SO
1595939094504648,23:43,Craven Morehead,Looks a lot better the enca stream is horrible
1595939124389396,24:14,Craig Johnson,@Kerry van Schalkwyk yes it is. The lies are the same though
1595939163566879,24:52,Dominic Przybylski,This man is acting guilty as sin.
1595939164580386,24:53,Peet Venter,A bit hot under the coller Sir?
1595939207367454,25:36,Gabisile Mahlangu,@Peet Venter Very Hot! 😅😅😅
1595939209143070,25:38,Peet Venter,"scratching you head does not change a lie into the truth, Sir."
1595939215385370,25:44,Bruce Thackwell,what an embarrassment to have a person like this in a senior government post. He has nothing but contempt.
1595939227062144,25:56,Cerebis,The fire pool guy is so arrogant because he knows he will walk Scot free from this whole thing. He is protected by Ace and his gang.
1595939292661327,27:01,Marcus Mmola,"Apologies,but the DCJ does not seem the right person to chair this commission,he is too accommodating to witnesses,waste of time,money!!"
1595939313107432,27:21,StarManRSA,@Marcus Mmola this is not a court of law
1595939361937056,28:12,Peet Venter,clearing your throat so persistently is an indicator of lies. As a police fundi you should know this but
1595939430663721,29:20,Zamile Hina,his style is working for now
1595939432603418,29:22,Dominic Przybylski,@Marcus Mmola It would be such a pleasure to see the judge walk over to witness and give him a snot clap whenever he wastes time or doesn't answer a question properly... afternoon fantasy.
1595939459310223,29:48,Bruce Thackwell,hehe
1595939461347007,29:50,Ghost Mapetla,NO GOAL THIS GOALKEEPER
1595939466027191,29:55,Moonchild,This Nhleko is ducking & diving & Judge Zondo is being too accommodating.
1595939492559262,30:23,Bruce Thackwell,Zondo knows who pays the bills
1595939503503546,30:33,Alvino Theunissen,The Chair protecting Nhleko
1595939523582768,30:53,StarManRSA,@Alvino Theunissen how is Zondo protecting Nhleko?
1595939585141078,31:54,Dominic Przybylski,"Does anyone know who was in the ""reference group""?"
1595939590876070,32:00,Alvino Theunissen,by not letting the ADV completing his questioning and hurrying him up
1595939597389435,32:06,Bruce Thackwell,what a bla bla bla cover up
1595939617684542,32:26,mohapi mphatsoe,I think the chair is doing well in directing the proceedings
1595939624481215,32:34,welton paulse,no guess whose side the chair is on?
1595939626919618,32:35,Moonchild,Deflect all the time!!!
1595939629396502,32:38,Cerebis,Again with the stupid jokes.....eish
1595939632920134,32:42,Craig Johnson,Clearing throat is a sign of not telling the truth as his throat starts tightening up.
1595939646772461,32:56,Craig Johnson,The police service is a joke
1595939648518615,32:58,Alvino Theunissen,Correct @mohapi mphatsoe
1595939664084016,33:13,Moonchild,He's trying to creat rapport between him & Zondo & then pull the wool over his eyes. I sincerely hope Zondo can see through this!!!
1595939676552665,33:25,Cerebis,Zulu to Zulu jokes???
1595939692338817,33:41,Alvino Theunissen,Agree @ Kerry van Schalkwyk
1595939704487793,33:53,Danie Vorster,joking time is gone longtime ago
1595939717073210,34:06,Craven Morehead,What is this chit chat about really?
1595939724803026,34:12,Hein de Wit,Body language says this guy is lying his ears off
1595939769919694,34:58,constantin buzdugan,it's all a parody of truth.....
1595939771080908,34:59,Bruce Thackwell,Never forget the trillions that have been defrauded from the South African Tax payer.
1595939776385212,35:05,Danie Vorster,i can go to the circus
1595939780402040,35:09,farouq,@ Hein de Wit ha ha ha. yep you got that right
1595939785199895,35:14,Moonchild,He continually will not answer the question in a straightforward way!!! This is really irritating now & I'm getting angry.
1595939788991359,35:18,Martin van der Breggen,Time for being civil is over - answer the bloody questions
1595939796279430,35:26,Cerebis,Was his water blessed by the so called Doom guy?
1595939812129220,35:41,Gift Mazibuko,trying to get Nhleko to tell the truth is like trying to draw blood from a stone
1595939820599811,35:49,Alvino Theunissen,@Mohamed...he is not actually intelligent but diverting it
1595939833736726,36:01,Moonchild,@Gift Mazibuko - absolutely agree
1595939839172322,36:07,DMF,"DCJ is very strategic, playing along and it is clear Mr Firepool is lying under oath."
1595939849009386,36:17,constantin buzdugan,they cover each other
1595939851762123,36:20,Bruce Thackwell,trained by the Chinese
1595939855813619,36:24,Sabata Kambule,Principles of ANC compromised the organization. This things could have been avoided should they interrogate their political appointments and the manner in which decisions were made.
1595939862749087,36:31,Martin van der Breggen,And we have not even started on the Secure in Comfort report yet
1595939876373191,36:45,constantin buzdugan,nobody will go to jail
1595939878354712,36:47,mohapi mphatsoe,unprepared
1595939913256335,37:22,constantin buzdugan,lost time and money
1595939915814991,37:25,Bruce Thackwell,Zondo comes across a scared of him
1595939927850606,37:36,Cerebis,Why can this commission not deliver interim reports so that the NPA can start prosecutions?
1595939943123497,37:52,constantin buzdugan,parody of truth....
1595939963864651,38:12,Moonchild,"It's also very frustrating for the evidence leader, Hulley. Every time he tries to lead Nhleko, he gets interrupted by Zondo & Nhleko just diverts & goes off on a tangent!!"
1595939998977235,38:48,constantin buzdugan,zondo is protecting him
1595940010014822,38:59,Dominic Przybylski,@Cerebis It's frustrating. I wonder how Nugent would have handled this commission.
1595940064269463,39:52,Cerebis,@Dominic Przybylski Jip! He would and did issue interim reports in the SARS commission.
1595940126843423,40:55,Alvino Theunissen,"The Media i.e SABC, eNCA need to Scrutinize the Zondo on handling the cases!"
1595940189598116,41:59,Craven Morehead,Lol now he sounds very guilty
1595940239556757,42:48,constantin buzdugan,these characters are paid millions tax money....
1595940320736201,44:10,Malcolm Fredericks,"they all belong to one organisation ,dont trust them"
1595940392005284,45:21,Malcolm Fredericks,"what a comedy,eish"
1595940421917139,45:50,constantin buzdugan,actually it's very sad
1595940423807114,45:52,Bruce Thackwell,lives for lunch
1595940477967011,46:48,Moonchild,You can hear that even Zondo is bored with this long-winded testimony!
1595940492128680,47:01,Syug,Zondo is not a cadre. He is only doing his job albeit lethargically
1595940507161245,47:15,Freddy Mhembere,"Africa guys, Ma1 everyone is now corrupt, why ?"
1595940538955944,47:48,Bophelo Malapela,The nonsense on this platform questioning the integrity of DCJ Zondo because people do not understand legal processes is shocking
1595940564598907,48:13,DTM O,this is just an excuse to waste public money
1595940567866805,48:16,Craven Morehead,More friendly chats
1595940577872411,48:26,Mpotseng Lebentlele,RESPECT ZONDO........he is on top of his game
1595940581782717,48:31,Craven Morehead,Can we get back to work? Really Zondo this is wasting time
1595940588648621,48:37,Moonchild,This is really a comedy of errors! They spent most of the day sorting out the pagination instead of getting on with the testimony! Now they are talking about food!!! I can't anymore.
1595940598678349,48:48,constantin buzdugan,really???
1595940608711669,48:57,Bophelo Malapela,This is a commission not a court
1595940613784542,49:03,Gabisile Mahlangu,"Why is Zondo trying to play nice with this guy, so annoyed!"
1595940621928718,49:10,Moonchild,@Mpotseng Lebentlele - I agree but he needs to be more assertive now & enforce Nhleko to get on with it & answer the questions directly.
1595940640873150,49:30,constantin buzdugan,it's a tactic to get him clear
1595940660828728,49:48,constantin buzdugan,no shame
1595940704612299,50:33,constantin buzdugan,useless to watch further
1595940708640129,50:36,Bophelo Malapela,@Gabisile Mahlangu how would you expect DCJ Zondo to behave next he will be accused of not being fit to be a judge as did Lucky Montana
1595940765348229,51:34,Mpotseng Lebentlele,@Kerry van Schalkwyk I hear you and trust me he is about to corner him i believe
1595940770166803,51:41,constantin buzdugan,"talk ,no action"
1595940795841435,52:04,Dominic Przybylski,Perhaps Zondo should be wearing black leather with chains and a sjambok and give the witness a whipping every now and then.
1595940795885411,52:04,Moonchild,@Mpotseng Lebentlele - hope so 🙏
1595940818539267,52:27,constantin buzdugan,"carefully ,not to upset the witness...."
1595940857746423,53:07,constantin buzdugan,"it's useless,he has no shame"
1595940861851261,53:12,Cerebis,I wonder how many trees this commission has used up with all these files?
1595940869290608,53:18,Bophelo Malapela,@kerry van Schalkwyk you have your own perceptions of how DCJ Zondo should conduct himself care to share
1595940872229239,53:21,Siseko Yeki,this process is not just to punish but to save a state from capture... it should be done accurately to a microscopic levels.
1595940879775042,53:28,constantin buzdugan,sad...
1595940943685076,54:32,Bruce Thackwell,"The land of thieves and reports and cadres , cats out the bag! everybody knows you can run but cant hide!"
1595940977213859,55:06,Dominic Przybylski,Why hide when nobody ever gets prosecuted?
1595941015496240,55:43,albert 2100,lock them away they still the money and try to reconciling. ww want economic freedom . lock these people awy
1595941032742229,56:01,Gray Lawrence,am I the only one that thinks this guy is an idiot?
1595941043535900,56:13,Moonchild,@Bophelo Malapela - I think he needs to be more assertive with Nhleko who has been ducking & diving to avoid answering to the charges.
1595941046913932,56:16,Bruce Thackwell,Just swell up and explode on custard. Nice
1595941067868544,56:37,Siseko Yeki,This process is even better than that of the court of law
1595941089180689,56:58,Bophelo Malapela,@kerry van schalkwyk define assertive
1595941102654940,57:11,Mandy Phillips,@Siseko ... that's exactly why he is giving long winded strange responses
1595941141152336,57:51,Dominic Przybylski,He seems to have avoided doing any work or taking any responsibility at all... Now that's not a crime but surely this kind of person should never be a cabinet minister.
1595941160794549,58:10,Moonchild,"@Bophelo Malapela - if you don't know what assertive means, please look it up in a dictionary. Assertive as opposed to aggressive."
1595941170001077,58:19,litwayi,watching from Namibia
1595941178015323,58:27,Mpotseng Lebentlele,akore ke nulle ka sesotho sa heso lenna hobane le yona ke puo
1595941215966165,59:04,Steven Haihambo,:virtualhug:
1595941316315603,1:00:45,Siseko Yeki,"@Mandy Phillips but all what he says will then be used against him in the court of law... No matter how long is his answer, the meat will be on the record"
1595941361188057,1:01:29,Mpotseng Lebentlele,@Kerry van Schalkwyk it wasn't necessary to patronise @Bophelo Malapela like that.
1595941390117859,1:01:58,Bophelo Malapela,@kerry van schalkwyk from your meltdown I get the distinct impression you have no clue why nhleko is before the commission
1595941391258162,1:01:59,Bruce Thackwell,What law
1595941406643949,1:02:17,Dominic Przybylski,"2nd report indicates a revision of 1st report. Then obvious question is ""Why has the report been revised?"""
1595941410303564,1:02:20,Moonchild,@Bophelo Malapela - not at all. It is merely a question of him guiding this witness to answer the charges succinctly & directly. Nhleko is skirting the issues & we the tax-payers are paying for it.
1595941427770109,1:02:37,Moonchild,@Mpotseng Lebentlele @Bophelo Malapela - I won't dignify those comments with a response.
1595941470574160,1:03:19,Mpotseng Lebentlele,Le ya tena wa tseba
1595941472630614,1:03:20,Michael Holmes,he must just say he doesn't like to read
1595941487331499,1:03:36,Bophelo Malapela,It’s nhlehos own problem is he refuses to answer questions as that might comeback to haunt him
1595941516531035,1:04:05,PETER STAFFEN,MC bride is going to eat him
1595941518319579,1:04:07,Dominic Przybylski,So did you ask that question Mr Nhleko?
1595941586996407,1:05:15,Bruce Thackwell,Bivouacked on the brink of reason
1595941589556299,1:05:18,Bophelo Malapela,Nhleko is here responding to allegations made by McBride against him he does not have to give answers we like
1595941612526395,1:05:41,makhosi nobhatyi,Mr just jumped into the pool coz his master was about to fall
1595941622017379,1:05:50,Mpotseng Lebentlele,@Kerry van Schalkwyk i agree hence its ok to put your argument across and still be respectful.
1595941631444931,1:06:01,Monique Jones,I'm confused. Is this an inquiry or a court proceeding? Has Nhleko been charged with a crime? Humor me please?
1595941646011601,1:06:15,Bophelo Malapela,Let’s watch and learn. The fire pool has no relevance here
1595941651369304,1:06:20,Wendy Greeff,No way can he defend this smoke and mirror decision he took at the time
1595941669634104,1:06:38,Gray Lawrence,yes. impersonating a minister
1595941818967013,1:09:08,Moonchild,"@Mpotseng Lebentlele - agreed & I was not being disrespectful, but if you view it like that, I apologise."
1595941991237220,1:12:00,Monique Jones,@Hubert Maphumulo that's called murder.
1595942013706808,1:12:22,Wendy Greeff,He executed directives from his boss and made reasons as he went along. They were not going to tolerate any resistance to their masterplan
1595942023589969,1:12:31,makhosi nobhatyi,"@Bophelo Malapela McBride won all those allegations, and Dramats as well question would be why he jumped into his decision , he may see that there was an evidence which was not favorable to politicn"
1595942081372638,1:13:30,Connie Du Preez,lost the subject
1595942139487697,1:14:30,Bophelo Malapela,"McBride came to the commission and alleged that this issue of reports and werksmans attorneys was State capture, this is what nhleko must respond to"
1595942177044977,1:15:06,Kevin Simon,All in can conclude at this point is that we deserve better public representatives than this guy. He hardly seems to have applied his mind to these matters while minister.
1595942203911688,1:15:33,Monique Jones,"Does he realize the diff between the truth and his version of the ""truth"""
1595942254343945,1:16:24,Kevin Davis,lol anc get taught from early to lue and deny and the president will do the rest
1595942257999950,1:16:26,Bophelo Malapela,Dramat and Sibiya lost their jobs because of this renditions nonsense. Sibiya last week won his case in labour court & wants his job back
1595942361488693,1:18:10,Wendy Greeff,He knows exactly what is truth and what not but he will never admit his part in the masterplan
1595942460817511,1:19:51,makhosi nobhatyi,"@ Bophelo Malaphela you stated very well, it is when McBride saw there was problematic coz minister was trying to play politics to water all evidence which was after the masters then was to stop"
1595942486648345,1:20:15,MIKE DURBAN,Lie and Deny everything......cause there is just too much at stake for these Commie ANC Cadres.....true ne
1595942491555994,1:20:21,bongile sango,he must stop duck and dive
1595942518937863,1:20:47,Bophelo Malapela,McBride was accused of doctoring the second report he also must answer
1595942546385405,1:21:15,Monique Jones,Isn't it winter down there? DCJ fresh shaved
1595942590659927,1:21:59,Monique Jones,That gas bubble from Nhleko was a lie coming up
1595942595348544,1:22:03,bongile sango,@Bophel McBride is coming next month
1595942628158062,1:22:36,Monique Jones,Hey @Hubert Maphumulo we have Trump here. Absolutely no leadership and no morality
1595942656256470,1:23:05,MIKE DURBAN,My fear is that only the small fish will fry.........they will be the Fall Guys etc....
1595942673075356,1:23:21,Bophelo Malapela,"I am aware, he could not appear yesterday because of his new job as foreign director of SSA"
1595942676469352,1:23:25,Dominic Przybylski,It seems he plans to bore everybody to the point where they no longer ask him any more questions without the danger of dying of old age while in the same room.
1595942693384190,1:23:42,makhosi nobhatyi,"@ Bophelo Malapela McBride will come as he promised but minister must tell truth coz they traumatizes people as we see poor evidence to all cases it’s because of this action by minister, they comproms"
1595942729584248,1:24:18,Wendy Greeff,The Commission will NOT get him to admit to anything. He will duck and dive to frustrate and tire them.
1595942821491513,1:25:51,Alvino Theunissen,Agree both @ Wendy @ Makhosi
1595942826999388,1:25:55,Monique Jones,So what were the renditions that this learned gentleman is speaking of
1595942903316246,1:27:12,Bophelo Malapela,Unlawful operations of allowing Zimbabwe police to kidnap Zimbabweans & take them to Zimbabwe where they were killed
1595942922549513,1:27:31,Venecia Moore,This is the same guy that said Mr Zuma need more money for Nkandla
1595942935210992,1:27:43,Sal SA,Rendition of 3 Zimbabweans back to law authorities in their country
1595942943399970,1:27:51,Dominic Przybylski,"""All conditions for SAA rescue plan have now been met, practitioners announce"" the day after receiving COVID-19 loan from IMF... smells fishy"
1595942956275782,1:28:05,Bophelo Malapela,@venecia Moore he had to sing for his supper
1595942979924822,1:28:28,Monique Jones,"@Sal Abdulla were they ""illegal"" immigrants if I can use that term on the run?"
1595943018384909,1:29:07,Sal SA,Not sure Monique
1595943038029574,1:29:27,Mike Mike,"coruption coruption , coruption more coruption"
1595943091749507,1:30:21,Bophelo Malapela,"@monique’s makeup it does not matter their status in SA, if they were removed without proper processes, it’s unlawful and criminal"
1595943095500303,1:30:26,Moonchild,@Mike Mike - nothing ever seems to change.
1595943103115911,1:30:31,Wendy Greeff,"He is definitely boring Z and all of us, but not fooling anybody"
1595943156142887,1:31:25,Mike Mike,Nothing will change Kerry Sorry...
1595943193468849,1:32:02,Kevin Simon,Calling for clarity did not suit his agenda. Simple.
1595943201408079,1:32:10,Samkelo Matyhila,"By choice or through the system,in SA we're all playing the lottery in one way or another.The Gupta breed politicians have no interest what so ever in restoring integrity within the state departments"
1595943206364395,1:32:16,Dominic Przybylski,He didn't make anything of it because he was sleeping.
1595943216656521,1:32:26,Moonchild,"@Mike Mike - one solution is voting them out of power, but maybe even the elections will be rigged aka Zimbabwe."
1595943265665715,1:33:14,Monique Jones,@Bophelo Malapela true
1595943269711330,1:33:18,Mike Mike,I agree Kerry
1595943378841741,1:35:08,Monique Jones,@Mike Mike @Kerry van Schalkwyk who would you replace them with?
1595943389159679,1:35:17,Dominic Przybylski,"Once majority of people rely on corruption to survive a corrupt government becomes essential to them, therefore will never be voted out unless there is a total collapse."
1595943436805701,1:36:06,Moonchild,"@Monique’s Makeup - that's a bit of a difficult one as no political party is perfect by any means. I think the best option would be a coalition of the DA, Cope, IFP & FF+."
1595943441505270,1:36:10,Tommygun,"New to the stream, whos the bureaucratic gent talking now?"
1595943485631600,1:36:54,Monique Jones,Thanks @Kerry van Schalkwyk
1595943494923840,1:37:04,Cerebis,@Dominic Przybylski Agree! My view is that the total collapse has started and there is no stopping it because of your first comments in your post.
1595943529228075,1:37:38,Monique Jones,Well it's 8:38 am and time to get my Shut Down Day started so I can get back home. Y'all have a great rest of your day! Bye from Texas!
1595943565394505,1:38:14,Mike Mike,cheers monique
1595943568627148,1:38:18,Moonchild,@Monique’s Makeup - bye! All the way from Texas 🙂
1595943582687185,1:38:31,Thulani Bukani,this guy doesnt say anything. typical ANC
1595943584882135,1:38:33,Sal SA,Thomas he's the previous Minister of Police
1595943598209541,1:38:47,Cerebis,He was the fire pool minister Thomas
1595943604893558,1:38:54,Zwai,@Thomas Cleghorn its the guy ho claimed a swimming pool is a Fire Pool
1595943613506513,1:39:02,Moonchild,@Thomas Cleghorn - Nkosanathi Nhleko - firepool minister
1595943623268061,1:39:10,Bophelo Malapela,@pienaar van Wyk do tell
1595943668256731,1:39:57,Sal SA,aka Nathi Nhleko
1595943716526310,1:40:45,Mike Mike,I'm out can't watch this boloooks
1595943752285570,1:41:21,Bophelo Malapela,Ok
1595943804521241,1:42:13,Mpotseng Lebentlele,Yiya eAustralia kaloku xa une problem eMzansi
1595943846974857,1:42:55,Sal SA,And so on....
1595943865649465,1:43:14,Moonchild,@Mpotseng Lebentlele - who are you speaking to? We are all South Africans & are entitled to live in the country of our birth.
1595943934588833,1:44:23,Cerebis,@Mpotseng Lebentlele Go to Australia if you have a problem in South Africa. Why you say this?
1595943935811202,1:44:24,Sal SA,Kerry ignore that guy
1595943956008006,1:44:44,Mpotseng Lebentlele,@Kerry unento To Themba
1595943984224168,1:45:12,Moonchild,"@Sal Abdulla - yes you are right, I just don't like people making negative comments like that, but better to just ignore."
1595944046524178,1:46:15,Sal SA,That's why we lose nillions because peoplehet side tracked. so let's focus on this hearing
1595944064573102,1:46:33,Sal SA,sorry billions
1595944109465886,1:47:17,Mpotseng Lebentlele,Sicela item nathi kaloku
1595944132319240,1:47:40,Mpotseng Lebentlele,Sicela i tea nathi kaloku okanye silinde nje?
1595944175369023,1:48:23,bongile sango,why every time washing hands
1595944213639543,1:49:02,LUTHO MTANDEKI,whats happening now?
1595944215511265,1:49:04,Sal SA,Wee Sanitize my friend
1595944258195847,1:49:47,Cerebis,We can wait and have some tea if we like
1595944263826843,1:49:52,Mpotseng Lebentlele,@LUTHO MTANDEKI lixesha le tea....baya buy after imizuzo elishumi
1595944269268494,1:49:57,Yalezwa Daniels,on regulations Sibongile and we are afraid of corona are you not?
1595944294515053,1:50:23,Bophelo Malapela,Washing of hands is a respectable way of asking to go to the toilet
1595944340313036,1:51:07,Quest,whats going on
1595944361618758,1:51:30,Sal SA,Wee break
1595944423441895,1:52:32,Bophelo Malapela,NP were serious criminals who committed crimes against humanity let’s not even start that discussion
1595944444685790,1:52:52,Cerebis,"@Hubert Maphumulo But Hubert, the Colonial Powers are being invaded by Africans and people of other previous colonies. They are now being colonized."
1595944480978404,1:53:31,MIKE DURBAN,"Geeeez........My heart bleeds for our country......to think..we WERE up there .....with the best in the World...and now......""Cry The Beloved Country""....we have truly...gone backward...what a shame"
1595944536315926,1:54:25,Mpotseng Lebentlele,Thats a thorny subject our grandparents suffered under the NP even before we were born...yimani please ngabo
1595944556628427,1:54:45,Cerebis,@Bophelo Malapela Agree! But the new SA surely has it's fair share of criminals
1595944615182993,1:55:44,greaton Jothi 950,vivin Oliver Iyer post ngorcoil gracelin
1595944620465533,1:55:49,MIKE DURBAN,@Cerebis ...You mean the Commie ANC Cadre's.....
1595944633689163,1:56:03,Bophelo Malapela,@cerebris ANC looting will never come close to the crime committed by NP and their supporters so let’s not have that debate
1595944647182853,1:56:15,Cerebis,@Hubert Maphumulo Jip.....Like the Chinese?
1595944648486855,1:56:16,fana Mlawuli,"stop this charade, absolutely useless enquiry, use these funds towards covid-19 relief"
1595944670797897,1:56:40,MIKE DURBAN,@Bophelo Malapela ...yes...better leave it alone....
1595944676294560,1:56:45,greaton Jothi 950,fund for Tambaram municipal higher secondary school
1595944709284685,1:57:17,Bophelo Malapela,We can lament the thuggery of the ANC without comparing to what we as blacks sufferedunder apartheid
1595944734024289,1:57:43,Mpotseng Lebentlele,"Ayipheli na le break ngoku, kunini? Tolika sisi"
1595944773904628,1:58:23,Sal SA,Will be back shortly
