timestamp,time,author,message
1542878529323683,1:18:08,KEITH SINDILE DINABANTU,BREAKING! Pres. Ramaphosa is expected to announce changes (Reshuffling) later today!
1542878538652961,1:18:17,Quinton Van Den Bergh,"@Sam Vanguard waar it's true we go anywhere to plead our case of the coming""""genocide"""""
1542878556853467,1:18:36,Mkhululi Bushula,Thanks Keith for that info.
1542878572987071,1:18:52,Malusi Zitha,what going on guys i came late
1542878575349480,1:18:54,peter pott,"I mean here is man we ought to view as hero, and yet ""favoritism"" and cadre system got him a job. how many qualified black or white women who applied and we rejected. why? not anc members. reality"
1542878584277167,1:19:02,Quinton Van Den Bergh,@Mkhululi Bushula well if we stole it what did you do didn't you steal it from khoisan and khoi khoi
1542878601452095,1:19:20,Marvel Ramatshela,"I still think this commission might be just another waste of money. our law enforcement agencies are not effective, they might not enforce the recommendations"
1542878605632677,1:19:24,Desmond Masilela,@KEITH SINDILE DINABANTU. Thank you Keith. Do you know what time?
1542878622364776,1:19:41,tererai chipango,biology break
1542878631428203,1:19:50,KEITH SINDILE DINABANTU,"@Desmond Masilela Great man, hope you're great! Hot here in Cape Town. I missed out as i left home late today... I will stay tuned from now on."
1542878643090723,1:20:02,Sindiswa Moolman,At 15h00 @Desmond Masilela
1542878647064201,1:20:06,Mkhululi Bushula,Khoisans are Africans
1542878657903259,1:20:17,KEITH SINDILE DINABANTU,@Desmond Masilela Around 3pm i think
1542878678365615,1:20:36,Sam Vanguard,@Quinton Van Den Bergh ramaphosa faction wants to do gamage control from the fake expose by EFF thugs
1542878678560956,1:20:37,Desmond Masilela,@KEITH SINDILE DINABANTU @Sindiswa Moolman. Thank you so much guys.
1542878682923874,1:20:41,Mkhululi Bushula,That's how u have been distorting history.
1542878741168354,1:21:40,Quinton Van Den Bergh,@Sam Vanguard that guy will soon fall on his sword he is going the Zuma way where have we read that script ooo yes it was written by zuma shame on him !!!
1542878769171510,1:22:07,KEITH SINDILE DINABANTU,"Wonder who's going to be chucked out... Drama king, Malusi gone already"
1542878826502454,1:22:25,Mkhululi Bushula,We will take it back.
1542878848629889,1:22:47,TLC E,the land was taken and was never yours in the first place..
1542878850367734,1:22:49,Sam Vanguard,@Quinton Van Den Bergh yaa the ramaphosa faction is becoming compromised with it's lies
1542878906440027,1:23:45,Sydwell Phakula,i see the SAPS police in uniform are they there for arrest or what?
1542878929209099,1:24:08,Sam Vanguard,"@Tony Everts didn't the zulus,tswana,xhosa capture each other's land?? we never stole it !! it changed hands"
1542878942581577,1:24:21,proxy lean,There's no white genocide in south Africa there is black genocide and we are tired about it
1542878944418594,1:24:23,Desmond Masilela,@Sydwell Phakula. No i think for protection only.
1542878986453006,1:25:05,Quinton Van Den Bergh,@Sam Vanguard lately most black south africans have misintepreted history
1542878999045288,1:25:17,TLC E,most of the afrikaners are still very racist..just not in public....but they have their sokkie braais and then the real people come out....ive experienced it
1542879048000626,1:26:06,Genevieve Pilz,Lol at sokkie braais
1542879062784160,1:26:20,Walter Spatula,"@Simon Collen Mthembu No black genocide either, not even during apartheid"
1542879069821005,1:26:28,lee royal,@Thando Nkutha all im saying is that if we say the world isnt trading with zim shouldnt that apply to the people from zim? we separate the two like the Zimbabwe the country can starve...its land
1542879073453587,1:26:32,TLC E,@Sam Vanguard thats the story of your life....#it wasnt me# never....
1542879111780634,1:27:10,Sydwell Phakula,Truth hurts you know that most white ppl never admit that they do not like black ppl
1542879125567414,1:27:24,KEITH SINDILE DINABANTU,"@Sindiswa Moolman Vacant positions (i.e Gigaba etc) perhaps, a reason for the imminent changes( reshuffle) later today? @Desmond Masilela"
1542879127139757,1:27:25,Houws Houlinou,I don't know if I have the energy for this racist chat today
1542879139306429,1:27:38,Sam Vanguard,@Tony Everts being racist is embedded in black south africans minds
1542879143393459,1:27:42,Genevieve Pilz,The Chinese are very open about their racism so that's refreshing
1542879149280187,1:27:48,Simphiwe Dube,11:35
1542879191160772,1:28:30,lee royal,@Quinton Van Den Bergh your entitled that is why you would say something so stupid
1542879208522227,1:28:47,Sam Vanguard,blacks are the biggest racist race in the world it's like the world evolves around them
1542879245069106,1:29:22,Ziyanda Pamla,tnx Simphiwe andibaz aba basfundekela ngomhlaba ngathi nguMkhonto kodwa sibzy ngabadli mali
1542879247291216,1:29:26,Genevieve Pilz,"@lee royal It's not entitlement. It's a combination of severe stupidity, lack of education, and being raised by parents who hate. There is no cure"
1542879266984028,1:29:45,lee royal,@Sam Vanguard go to Europe why are you in africa? to use our people and live better?
1542879291088950,1:30:09,Quinton Van Den Bergh,@Sam Vanguard lately in S.A its becoming a crime to be white or indian
1542879300215048,1:30:19,TLC E,that what you think....Its a matter of frustration to see how slow things are change...the previlage once still have it...
1542879311818053,1:30:30,TLC E,.Doesnt matter what you say ....that will always be your guys mentality....Until things are rectified....
1542879316122961,1:30:34,TLC E,Change are coming and no matter what friends you seek over the waters...change are coming and there is nothing you can do...And you scared of the change
1542879352076396,1:31:10,Sam Vanguard,@don't blame whites for your own incompetences or so called poverty but blame it on your fake government the ANC
1542879357808837,1:31:16,TLC E,He maybe need to go to Australia...
1542879391759665,1:31:50,Genevieve Pilz,"@Tony Everts They only take actual asylum seekers or people with skills. Sorry, you're stuck with him"
1542879397997097,1:31:56,Quinton Van Den Bergh,@Sam Vanguard i agree ANC has poor policies
1542879399310599,1:31:57,Andrew Mabele,How much does it cost the tax payer for a commission such as this?
1542879475761505,1:33:11,Mkhululi Bushula,The problem with u white folks u don't want to be lead by black ppl u still nostalgic of the apartheid days.
1542879490048522,1:33:25,TLC E,i AGREE
1542879502816674,1:33:35,Sam Vanguard,@Quinton Van Den Bergh most racists think that whites are racist
1542879506436569,1:33:39,Genevieve Pilz,I read SA is going to have really bad power outages over Christmas. True?
1542879532213812,1:33:52,TLC E,THAT NEED TO CHANGE
1542879565558218,1:34:27,Quinton Van Den Bergh,@Sam Vanguard 🤣🤣🤣
1542879636684533,1:35:06,pierre badenhorst,my favourite color is black - but i love vanilla ice cream - whne it comes to humans i dont see color since we are all 99.99999% same geneticaly
1542879697015751,1:35:30,Desmond Masilela,Is this my internet or what. the visual is jamming on my side.
1542879704555538,1:35:47,KEITH SINDILE DINABANTU,Mike Magena in jail? For drugs?? I still cannot believe it!
1542879774870499,1:36:05,Desmond Masilela,SABC please assist the stream keep on scuffing.
1542879783800705,1:36:16,Mkhululi Bushula,No u have a problem to be led by black person.
1542879786674460,1:36:20,Quinton Van Den Bergh,@Sam Vanguard hahahahahaha why would i forget 77 those days life was lekker boet
1542879799090342,1:36:37,Motlatsi Semaswe,this jammimg is frustrating
1542879842396654,1:37:28,KEITH SINDILE DINABANTU,"@Thando Nkutha All is working fine my side, no glitches.. @Mkhululi Bushula"
1542879862856657,1:37:44,Desmond Masilela,@Sne Mdletye. ENCA does. I'm not sure of SABC.
1542879897909768,1:38:24,peter pott,you are using the words presume and fact interchangeable. that is very dangerous Mr Fuzile
1542879902118464,1:38:28,Unathi Notshata,The will be no White President in SA again
1542879923022593,1:38:48,Quinton Van Den Bergh,@Sam Vanguard Ek mis daardie dag
1542879942286169,1:39:03,007 007,unbelievable how this racist is still alive or not in jail where he belongs
1542879969865491,1:39:36,Sabelo Sabelo,call all of them Mr judge
1542880024247369,1:40:30,Sne Mdletye,thanks
1542880032589528,1:40:35,lee royal,@Quinton Van Den Bergh next year if we dont get the land we going to War we coming to your house in sandton @Sam Vanguard you too
1542880039533007,1:40:42,Genevieve Pilz,@Desmond Masilela Without the racism there would be no chat
1542880043251760,1:40:48,Quinton Van Den Bergh,"@Sam Vanguard sommige mense is jaloers op my en jy is wit, hulle sê dit is priveledge"
1542880106314754,1:41:52,peter pott,this is cry baby. He wouldn't have made it on robben island this one. he would have died on the first day
1542880114263657,1:42:00,Genevieve Pilz,@vuyo hlahla did somebody sort out a racist chat?
1542880151519016,1:42:37,zamo Maluka,"THIS GUY LUNGISA IS SMART,HE KNOWS HIS STORY ITS AMAZING PEOPLE ARE SPEAKING FREELY"
1542880170978231,1:42:57,KEITH SINDILE DINABANTU,@zama
1542880182126745,1:43:08,vuyo hlahla,yes we did sort that person
1542880202304463,1:43:28,Desmond Masilela,@Genevieve Pilz. Let me excused myself from this chat of racism.
1542880213323669,1:43:39,KEITH SINDILE DINABANTU,"@zamo Maluka So, so smart! Though, he's part of the treasury furniture LOL"
1542880216312579,1:43:41,Fick Liebenberg,@ Tony you are right... I thing some wight people do have a issue with a Black leader. But it is not all white people. I would support someone like Musi or Obama no problem...
1542880242183131,1:44:06,Genevieve Pilz,@Desmond Masilela apparently eNCA is better? I'll have to see
1542880246333375,1:44:12,Quinton Van Den Bergh,@Sam Vanguard Swart Suid-Afrikaners is meer as baie swartes op die vasteland bevoorreg
1542880342182047,1:45:47,Mkhululi Bushula,@ Fick Liebenberg your choice of leaders is very interesting.
1542880378396721,1:46:21,Mkhululi Bushula,Obama and Maimane lot of similarities.
1542880515784863,1:47:41,Desmond Masilela,Eyyyyyyyy!!!!!!
1542880550668235,1:48:15,vuyo hlahla,not in our life time NO
1542880574683135,1:48:39,Sam Vanguard,@Quinton Van Den Bergh NEXT YEAR WE MAKE SURE ANC is out of the equation yaa i forgot and the 21st century Hitler copy cats EFF
1542880618631324,1:49:19,Mkhululi Bushula,We don't Carr what u say.
1542880641519623,1:49:46,Quinton Van Den Bergh,@Sam Vanguard 🤣😀😀😀😀 21st century hitler copy cats hahahahahahaha
1542880646628931,1:49:51,zamo Maluka,"WATCH THE SPACE NEXT YEAR ,BUSHULA"
1542880660781963,1:50:05,Cain Chunda,two thirds majority to continue to loot with impunity! my vote ain't available
1542880678996087,1:50:24,peter pott,"treasury people truth be told, has been turned into an English class. they are bringing nothing new here. nothing we haven't read of in the scribes or papers. just English words."
1542880727819258,1:51:12,Sam Vanguard,@Quinton Van Den Bergh FF+ and DA better alternatives!! if National PARTY was still there that would have been better than the rst
1542880763499351,1:51:47,Fick Liebenberg,But CR is doing great work right now. I might even vote ANC if they start prosecuting the VBS looters and the Corrupt leaders..
1542880822015228,1:52:06,Sam Vanguard,EFF and ANC want to make S.A ungovernable as they always threaten
1542880874875898,1:53:00,Quinton Van Den Bergh,those protests in mahikeng really shows you how the ANC is compromised
1542880924543529,1:53:13,zamo Maluka,"BEFORE 1994 WHITES WERE LOOTING THUS WHY WE ARE PAYING TAX ,IFREMBER ESCHIEL RHOODIE"
1542880925819068,1:53:15,Cain Chunda,"great work by CR in aiding n abetting WMC, continued plundering, Fireblade applications approved by Luthuli House no respect for the institutions of the state"
1542880935687063,1:53:25,Fick Liebenberg,I would never ever vote FF+ and never ever National Party. I would love to live in a place where people are judged by their actions and their character.
1542880984841651,1:54:06,peter pott,"@liebenberg, great is when he turns McDonald's stores into factories. instead of hiring 25 people in one store, he can hire 250. that's what's is called great"
1542880992240948,1:54:11,Nkululeko Malandela,"hi i also had a meeting with guptas , can u call to enquiry"
1542881000878022,1:54:18,Quinton Van Den Bergh,@Fick Liebenberg by what you say i think you will enable continuity of ANC RUNNING SA INTO GROUND
1542881083342634,1:54:30,Desmond Masilela,my stream just jammed!!! mnx
1542881099387080,1:54:58,Desmond Masilela,Now NO sound
1542881106260769,1:55:00,Moruti Langa,me either. stream jam
1542881106878700,1:55:00,lee royal,@Thando Nkutha Voting for the EFF means we going to fight like it or not
1542881108937102,1:55:02,holylady1000,REFRESH YOUR BROWSER
1542881148658672,1:55:25,Fick Liebenberg,No what I say is if people do the right thing. I will vote for them. a Political party is not a soccer team. You don't stick with them if they keep losing
1542881150319524,1:55:27,Desmond Masilela,Thank you @Thando Nkutha & @holylady1000 . will do so.
1542881182339183,1:56:28,Nkululeko Malandela,EFF is full of corruption
1542881188131219,1:56:31,Quinton Van Den Bergh,@Sam Vanguard EFF is promising us genocide when they govern
1542881200658669,1:56:42,Cain Chunda,thando like to think we're fools n can confuse thuggery by the ANC for rainbow nation. keep chasing the illusion of a rainbow both literally n figuratively while we fight for land justice
1542881213149896,1:56:55,007 007,politics is corruption
1542881223505900,1:57:09,Nelson Musoliwa,@peter you r 100% on point SA is economically misdirected
1542881224448547,1:57:10,Sam Vanguard,@Quinton Van Den Bergh never not under our watch will we allow a bunch of deliquents to govern S.A
1542881252425681,1:57:38,Sam Vanguard,under ANC south africa is going downhill economically
1542881279137833,1:58:02,Sam Vanguard,hungry people are angry people thats ANC playbook to use against whites
1542881294734147,1:58:15,Kevin Davis,please voters Cyril is our only way back to being where we were before that clown zuma took over
1542881309550939,1:58:24,lee royal,@Thando Nkutha dont you think that once the EFF wins the first law would be to remove the white and indian minority 1st
1542881336540486,1:58:28,Houws Houlinou,@lee royal No. They are all talk and no brains
1542881423412832,1:58:51,peter pott,"@1000, exactly"
1542881797599270,1:59:10,Houws Houlinou,@peter pott The best predictor of future behavior is past behaviour
1542881801583135,1:59:36,Unathi Notshata,@Nkululeko Malandela you have nothing against them only assumptions
1542881803083984,1:59:37,Quinton Van Den Bergh,hahahahahahahaha i like it when people say am racist yet forget that the other four fingers are pointing at then funny
1542881819333890,1:59:52,Sam Mabasa,all those people are sgebengus if u vote them
1542882132149518,2:00:21,Desmond Masilela,Guys lets switch to ENCA
1542882213771171,2:00:40,Desmond Masilela,I believe so @KEITH SINDILE DINABANTU. Lets all go to ENCA.
1542882263069830,2:00:46,Sthakathi Khumalo,What have I missed here? Anything new and burning that Fuzile has presented people??
1542882417278043,2:00:55,KEITH SINDILE DINABANTU,"@Desmond Masilela Hay kanti they are advance...tech wise, but they love tea breaks there lol"
1542883140317088,2:02:00,Mkhululi Bushula,it's accounting irregularities or anticompetitive behaviour not corruption a superior race can never be corrupt it's an honest mistake.
1542883517373117,2:02:32,Peter Sant,what is EFF?
1542882882833959,2:03:12,Houws Houlinou,@SABC Digital News You want us all to leave? Just tell us
1542883624546655,2:03:36,Dimakatso Nwandula,"@ThatoM it's uncommon not irregular, but what I've noticed is that when a black person is not corrupt he is then portrayed as corrupt like in the case of the Eff vs Pravin Or Eff Vs Cyril"
1542883697425691,2:03:58,Sthakathi Khumalo,I was listening to Jackson Mthembu trying to spin rubbish.. Cyril Must account admit he lied and face parliamentary might! Khusela Diko has tried spinning but Cyril must account for lying
1542883749342782,2:04:50,Dimakatso Nwandula,"our society accepts and celebrates black corruption, we go to an extent to investigate people for corruption without any proof of wrong doing"
1542883848747465,2:06:01,Dimakatso Nwandula,like Cyril.... one can't make mistakes this days or confuse facts.....He must be corrupt and nothing else
1542883861614066,2:06:38,Thato M,@Gxobilahle KaGandaya @Queen Dimakatso Ngwanduli great observation & reflections thanks.
1542884054717412,2:09:51,Desmond Masilela,Seems like SABC is becoming better now.
1542884168328929,2:11:45,Israel Z Khumalo,"In a corporate, Fuzile is the most insubordinate person ever"
1542884324195902,2:14:20,Mandla Mngomezulu,Yebo @ 15H00 Thando
1542884446932669,2:15:47,Godfrey Mareme,Reshuffle is on the cards. Due to the late Molewa and Gigaba
1542884606025179,2:18:26,Thiza William,Reshuffle is nolonger a rumour but confirmed by the Presidency @15:00
