timestamp,time,author,message
1567765666701291,2:23:33,Rob Nel,"There will never be control of the expanding population, as long as state subsidies, are paid for kids."
1567765685592560,2:23:53,Sani abadiga,hhhh
1567765689710045,2:23:56,ntully cares,Wake up South African's!
1567765699481681,2:24:06,Danie Nilsen,"@Cerebis so do i and it is a pity because we miss the young generations perspective on what they ""see"" or want but the current generation are so set on power and money that we miss seeing it"
1567765711917250,2:24:18,Born free,The government will run out of money
1567765772289900,2:25:19,Boby Terry,bunch of lazy ppl south african citizens
1567765775003943,2:25:22,Sirus TheVirus,@ I Am Free spot on!!
1567765791294140,2:25:38,game palace palace,"@nkutha he is trying to make sense of the situation, you got to love this commissioner, he look like someone who would not take a bribe"
1567765889095400,2:27:17,Cerebis,"@Danie Nilsen My view is the young generation in SA does not even trust the elections. They just refused to register or pitch up to vote, How can they be the future if they just demand. Hard work..No"
1567765927079651,2:27:55,Danie Nilsen,LOL IT IS WHITE MONOPALY CAPITAL but if it is another type of culture like cr or patrick is it the BMC asking
1567766064411966,2:30:12,Wilson Hishono,This lady though 🤔
1567766072209467,2:30:19,Margaret Xulu,can someone please explain to me what is a foreigner
1567766084725234,2:30:32,Cerebis,"In SA the Security Agencies and SAPS are part of the problem....not the solution. Address that so that all citizens, except the criminals, trust them."
1567766175223391,2:32:02,Rob Nel,"@Naomi Campbell , I understand it, to be a person resident in a country, other than his/her country of birth"
1567766235093046,2:33:02,Margaret Xulu,"Thank you @Rob Nel , and Xenophobia"
1567766321535193,2:34:28,Danie Nilsen,i have lived through the mandela area and the anc atrocities against the civilians of the country black and white i am suprized he did not get an oSCAR FOR HIS ROLE AS THE MESAIA he was only madibaact
1567766357949618,2:35:05,Cerebis,Our Education system is really bad and produces mostly unemployable youngster. The other tragedy is the liberation before education regime of the past.
1567766370448043,2:35:18,makhosi nobhatyi,"@Gee Peex1 Mugabe he can not compare himself with Mandela, Madiba was president from 1994 and resigned towards 1997 giving T. Mbeki to go forward, for him rule Zimbabwe for more than 30 years nothing"
1567766374585837,2:35:21,makhosi nobhatyi,Achieve
1567766450670074,2:36:37,Rob Nel,"@Naomi Campbell , Xeno means foreign and phobia, scared of or wary of"
1567766548527047,2:38:16,Patrick Mavimbela,follow it
1567766589640182,2:38:56,Rob Nel,"@Naomi Campbell so if I am scared of Lions, it does not follow, that I must take a weapon, and wipe out the whole Lion ""population"""
1567766628948640,2:39:36,Cerebis,Zimbabwe is such a beautiful and fertile country....past breadbasket of Africa....now a Basket Case.
1567766656336092,2:40:03,Mzalwane Mzala,Equity is the best policy
1567766794377048,2:42:21,Cerebis,"South Africa is not a country, but are 11 nations trying to live together with their own legitimate cultures, languages and faiths. The Rainbow Nation idea is a huge lie."
1567766841014558,2:43:08,Rob Nel,"What is the capital of for instance, Patrice Motsepe and Cyril Ramaphosa called. BMC??"
1567766877562632,2:43:45,Mzalwane Mzala,Which is the true PAC?
1567766890979705,2:43:58,Danie Nilsen,BLACK MONOPALY CAPITAL
1567766949229464,2:44:56,Rob Nel,"@Cerebis , would be better if SA, had 11 states, based on the USA principal"
1567767015912615,2:46:02,Kopz Koape,Rest in peace to Robert Mugabe
1567767030902017,2:46:18,Mzalwane Mzala,How did the media kill the PAC @Gee Peex1?
1567767044191054,2:46:31,Setjhaba Mofokeng,"@UPENDO TALK SHOW TV but the difference is those S Africans in the DRC are the documented and are working ligally in the country, not selling drugs or trafficking people."
1567767051046303,2:46:38,Danie Nilsen,I HAVE THE CORRECT ONE AND IT IS HARD WORK FOR MONEY......HWFM
1567767107438206,2:47:33,Mzalwane Mzala,I stand down
1567767114810517,2:47:41,Cerebis,"@Rob Nel I agree, but in SA that will not be supported because we are a crab nation....As soon as one wants to climb out of the pot being slowly heated up, the other crabs will pulls you right back in"
1567767130867860,2:47:58,Danie Nilsen,ROBERT REST IN PIECES
1567767146437229,2:48:13,Mzalwane Mzala,Sobukhwe said the PAC was not built by the media and it will not be killed by the media.
1567767180897328,2:48:48,Mzalwane Mzala,@Gee Peex1 Familiarise yourself with Sobukhwe
1567767209104924,2:49:16,Danie Nilsen,until Jesus come and ask rober what have you done in My name then the real truth will hit him hard hybo shissa bwana
1567767230795906,2:49:38,Kopz Koape,@Danie Nilsen..Eugene Terreblance can rest in pieces to or he rot in peace
1567767268777672,2:50:16,noko malatji,"zondo ANC controls the organization don't separate party and state then what is the point of having election,the winner controls all the organization, provided that ther do not do ""corruption"""
1567767298459423,2:50:45,Danie Nilsen,@Cerebis just to corect you the pot is full of us frogs no place for crabs ask cr to start another pot for crabs
1567767309370966,2:50:56,Mzalwane Mzala,You are saying he was wrong
1567767383734997,2:52:10,Danie Nilsen,@Kopz Koape you are so right no one will escape the wrath of the Mesaia even you and i will aswer for our deeds
1567767460150436,2:53:27,Mzalwane Mzala,employee of the state
1567767476457897,2:53:43,Danie Nilsen,"i remember gatsha butulezi as the only state,s man who was not afraid of the anc and the also oom botha"
1567767548081311,2:54:55,Danie Nilsen,@Kopz Koape no i am not on anything at the moment still to early but can i ask the same from you bro
1567767570567481,2:55:17,Kopz Koape,@Danie..The its too early to drinking whiskie..The sun is out and its day time and you are drinking whiskie like its water
1567767614531898,2:56:01,Cerebis,"@Danie Nilsen Agree with the frog analogy, but somebody else used the crab one and he was right too."
1567767618708582,2:56:06,Rob Nel,Fine if the Boeing crossed
1567767700599405,2:57:28,Danie Nilsen,@Kopz Koape why would you think i am boozing it up just having an productive conversation with some intelegent people only some ne rember that
1567767743226080,2:58:10,Cerebis,It is 18h00 somewhere in the World......and you can never have enough beacon and whiskey.
1567767763318851,2:58:30,noko malatji,@Mzala then who will implement the policy of the rulling party
1567767790507148,2:58:58,Danie Nilsen,@Cerebis as we the frogpot participants are so called aparheids frogs we only eccept frog in our pot
1567767882997740,3:00:30,Mzalwane Mzala,@Gee Peex1 The PAC always try to find a scapegoat for its problems. They used to accuse people they disagree with within the party they labeled them CIA agents. Today they label them ANC spies.
1567767914230258,3:01:01,Kopz Koape,@Danie who are the intelligent people you are talking to ???I don't see any smart talking to you..How much did u drink vandaag?
1567767940359160,3:01:27,Cerebis,@Danie Nilsen 😂😂🐊🐊😎😎💔💔
1567767942509624,3:01:29,Danie Nilsen,the first haulocast was when the british put boer woman and children in concertation camps to get the boers to surender
1567768002353141,3:02:29,Mzalwane Mzala,"@noko malatji I hope you do understand that the state is bigger than government. For an example, We cannot have all the police becoming members and supporter of one political party."
1567768039145842,3:03:06,Danie Nilsen,that is your prerogitive to think whatever i reconize as inteligence i think cerebis might be of help here
1567768063973565,3:03:32,Mzalwane Mzala,Hahaha @Gee Peex1
1567768084784538,3:03:52,Cerebis,@Yin Yang So have many South Africans.....
1567768144422310,3:04:51,Margaret Xulu,"Reading the meanings of foreign an xenophobia, i fail to understand why our fellow african are then in attack with each other. can someone please explain..."
1567768167326364,3:05:14,Danie Nilsen,as well as @Gee Peex1 and Yin Yan ans a few others but i seem to battle to find your name here sorry
1567768230251819,3:06:18,Grace Titus-Glover,OK
1567768231005091,3:06:18,osm ttt,what about the last question
1567768270922559,3:06:58,makhosi nobhatyi,@ Gee Peex1 apologizing for wat?
1567768277794615,3:07:04,Danie Nilsen,@Yin Yang agreed i will never forget as song as a child sang to us by our zulu nany amakaie was the songs name
1567768299163317,3:07:26,Cerebis,The so called British empire was evil indeed! All over the world they plundered the colonies and brought plenty of misery. They are starting to get their dues as the wheel always turns.
1567768299686764,3:07:27,Setjhaba Mofokeng,"This guys dont understand each other, she has the last question"
1567768346253867,3:08:13,Sheku Sesay,please let me this burning question about the hike in xenophobic attacks on black foreigner of South Africa. What is the SA government doing to curb that now?
1567768356178686,3:08:23,makhosi nobhatyi,Apology to Brian Molefe @ Gee Peex
1567768369979140,3:08:37,Kopz Koape,@Sheku..Nothing as usual
1567768375731350,3:08:43,Mzalwane Mzala,So the report found no direct link between the SABC and Luthuli house.
1567768425786872,3:09:33,Cerebis,Thank you Madala. Go well
1567768693638076,3:14:00,Kopz Koape,@Danie..Whatever you say boet
1567768923464423,3:17:50,Danie Nilsen,sorry i misunder stood i can say we do sing but with music the african nation cand it well without music we call it the african beat
1567771274162689,3:57:01,Luxolo T.D Todolo,They're back from Lunch
1567771275556549,3:57:02,Gen. Qamar javed bajwa,XenoPhobia in SA 😅
1567771384020250,3:58:51,Gen. Qamar javed bajwa,SA becoming Zimbabwe 😓
1567771732065818,4:04:39,Ngoako Jim Makhura,bring back country security powers soldiers and police officers are there doing nothing earning money becoming fats because they don't have jobs to do
1567772670272456,4:20:17,Danie Nilsen,@Ngoako Jim Makhura i agree with you jim all of us will make south africa great not only the anc or others on there own all of us must be willing to do something
1567773159934828,4:28:26,John Fagan,is it finished
1567774009514665,4:42:36,Roscoe Samuels,#neverforgetthestrandlooper
1567774561607357,4:51:48,Abdulkadir Hussein,in humanity RSA NOT upholding responsibility for other black brother on safe ground
1567774738486250,4:54:45,Abdulkadir Hussein,To ask RSA representative what is preventing to save other africans life in RSA ?
1567775349628229,5:04:56,mickey smith,it is over??
1567775508884156,5:07:35,Mbombi,"yes I'm watching the last part also, I had to rewind, today the inquiry ended at 1pm"
1567776344604394,5:21:31,Abdulkadir Hussein,waxaan ugu baaqayaa saraakiisha RSA in aay is garab taagaan ganacsatada somaliyeed ee kunool halkaa
1567777345445590,5:38:12,WAPE NEWS TV,"South Africa remember that the world is watching you for what is going on In your home, though it is quiet."
1567777479542495,5:40:26,The Chosen One Ngarizemo,It seems I am late....
1567778277334502,5:53:44,Family Family,Nigerian's are angry
1567780447825768,6:29:54,Ksa Ksa,if South Africa kill one Nigeria I address Nigeria to kill millions of South Africa too give them their food
1567781077563576,6:40:24,Rooland Theunissen,soldering whoo hoo
