timestamp,time,author,message
1542794718613433,1:59:28,Ashon Singh,asking questions for answers already provided
1542794726251709,1:59:36,Annie Maharaj,100%
1542794726991399,1:59:37,Sthakathi Khumalo,"em D Then he would contradict himself after that CNN interview where he mentions, he has nothing haha"
1542794744168680,1:59:54,Trucker Trucker,PRAVIN HAS ONCE AGAIN ADMITTED THAT HE HAS NO EVIDENCE. HE IS WASTING OUR TIME.
1542794745844509,1:59:55,Thato M,@Aneila Maharaj somebody is touch touchy over political engagements but claims superior logic. Mayibabo!
1542794751696863,2:00:01,Sthakathi Khumalo,Zizoh what are you on about?
1542794772353429,2:00:22,Zizoh,"SHALE UDAKILWE, HAVE U EVER BEEN IN A 2 ROOM HOUSE WITH 12 PEOPLE STAYING WITH NO ONE WORKING?"
1542794774347327,2:00:24,Luxolo Nogobela,can this man give us evidence not the 'dots'
1542794792782971,2:00:42,Ewald Kruger,@Motsamai Shale You one of the few who understand what's happening 😃
1542794793994039,2:00:44,Thato M,"@Motsamai Shale What do you think about Anisha Gordhan, mid 30's and multi millionaire?"
1542794805460202,2:00:55,Ashon Singh,@Luxolo Nogobela i agree.. we need hard and fast facts....
1542794808927335,2:00:58,Sthakathi Khumalo,Pravin though is not helping us!!
1542794809374140,2:00:59,Zizoh,PRAVIN IS HERE TO HELP US CONNECT THE DOTS
1542794815326106,2:01:05,Mhlanguli Dlodlo,@Sthakathi Khumalo aren't his DOTS connecting. I'm starting to think it's bones and not DOTS. I'm so disappointed by PG.
1542794816403151,2:01:06,Annie Maharaj,Thando sorry you are not debatable material. You are apathetic beibng😀
1542794836704889,2:01:26,Lucky Dlamini,Who are you reffering to???
1542794844717545,2:01:34,Ashon Singh,@Thato M Anisha is either corrupt or very smart.... lets wait and see ... lol
1542794858072669,2:01:48,Mhlanguli Dlodlo,"HAYI Pravin, name names when you're asked to name names"
1542794875468370,2:02:05,Thato M,@Ewald Kruger and the rest don't. You guys are amazing
1542794879947914,2:02:10,Themba Bruno Chauke,this guy doesn't have evidence to implicate Zuma
1542794881571655,2:02:11,Andrew Mabele,this pravin is a waste of Oxygen
1542794883235300,2:02:13,Zizoh,"I DONT CARE WHAT PPL THINK, EFF IS THE FUTURE"
1542794883747465,2:02:13,Tshilidzi Madzinge,Who means who....names papa
1542794898116303,2:02:28,Annie Maharaj,They expect him to come out spitting like a snake
1542794906384308,2:02:36,Sthakathi Khumalo,em D I just don't understand why he is not revealing what he has and even bothering to come here and saying he is assisting us!1
1542794920125550,2:02:50,Andrew Mabele,nothing against anyone bcos he benefitted himself this Roti head
1542794920413634,2:02:50,Gxobilahle KaGandaya,"From the info so far, the relationship was broken and I am trying to convince myself that it was not. PG has detailed all the encounters where he was at odds with No1"
1542794931524493,2:03:01,Zizoh,GHORDAN IS WASTING OUR TIE
1542794938486886,2:03:08,Gxobilahle KaGandaya,yet he believe the relationship was OK
1542794943288190,2:03:13,Ashon Singh,@Zizoh i hope not
1542794951004930,2:03:20,Thato M,"@singhashon she will be an exceptional case, to have signed deals while daddy was Fin Min and sits as an EXCO member for Investec. Conveniency is amazing"
1542794952867382,2:03:22,Trucker Trucker,@Zizoh EFF IS NOT THE FUTURE! EFF DEFENDED PRAVIN LAST YEAR AND THEY CHANGING THEIR TUNE LIKE THEY ALWAYS DO. FLIP FLOPPERS!!
1542794954810367,2:03:24,Ewald Kruger,So you assume EVERYBODY does @Thato M​@Ewald Kruger and the rest don't. You guys are amazing 😀 😀 😀
1542794979632766,2:03:49,Sthakathi Khumalo,I love the way you guys are not entertaining this one called Zizo
1542794981722854,2:03:51,Zizoh,"WE THE BLACK MAJORITY, WILL VOTE FOR THEM PAPA"
1542794998068094,2:04:08,dawie botha,why dont you go and look after your goats before your comrades steal it
1542795020364858,2:04:30,Annie Maharaj,YOU forgot MAMpara
1542795023065053,2:04:33,Zizoh,"STHAKATHI, YOU ARE"
1542795026869499,2:04:36,Zizoh,LOL
1542795035920924,2:04:46,Houws Houlinou,@Zizoh Haw you vote for everyone?
1542795038742140,2:04:48,Andrew Mabele,Eff has put amagwala in their place...the man will soon pee in his pants...no childs play.He is contradicting himself
1542795041519494,2:04:51,Thato M,"@Ewald Kruger tell me how Anisha Gordhan can score huge gov contracts through CDC, FFS Refineries, VOX Telecoms,etc while daddy was fin minsters. Explain to me if that is pure business sense or what?"
1542795063432100,2:05:13,Ewald Kruger,Who was in office when what happened 😀 👍 Gordhan
1542795073400681,2:05:23,Zizoh,"YES, IN MY COMMUNITY WE ARE ALL EFF"
1542795097839261,2:05:47,Thato M,@Ewald Kruger Pravin Gordhan & Mcebisi Jonas were the head of National Treasury.
1542795120613925,2:06:10,Andrew Mabele,A principal of a school....want to implicate Governing body about missing funds...he is so clean...himself..we not fools Gordhan
1542795126587561,2:06:16,Houws Houlinou,@Zizoh When you wear an ANC T-shirt everyone will tell you they will vote ANC. That is human nature
1542795128224984,2:06:18,Zizoh,EFF IS THE FUTURE
1542795132202564,2:06:22,Ashon Singh,"Zizoe, sister please..... dont stimulate racism...."
1542795137267933,2:06:27,dawie botha,shame I feeling for your community
1542795156266797,2:06:46,Ashon Singh,we need to be diffrent to Europe and have a beautiful multicultural country
1542795179236299,2:07:09,Zizoh,"RACISM IS A REALITY IN SA, WHY MUST I BE SILENCED. I MUST TALK ABT IT"
1542795184170978,2:07:14,Ewald Kruger,"“Those who are making allegations outside this forum should make them under oath and subject themselves to cross-examination. I am not a commodity for sale and think the Guptas learnt that, too."" ♥♥♥"
1542795204447473,2:07:34,Zizoh,"WHY DO PEOPLE WANT TO DODGE RACISM, ITS A REALITY"
1542795209027163,2:07:38,Thato M,"@Ewald Kruger if you are insinuating that the then President would've sight over all SOE deals, you are reaching and being disingenuous. Board and Exco have approval limits"
1542795235561518,2:08:05,Lucky Dlamini,Three days for this? mayebabo!
1542795244850343,2:08:14,Ashon Singh,"no one is dodging, dont stimulate it... i understand you as promoting racism, and im saying dont"
1542795254754288,2:08:24,Zizoh,THE PERSON WHO WAS RUNNING UP AND DOWN ABT STATE CAPTURE HAS NO EVIDENCE
1542795274668436,2:08:44,Ewald Kruger,@Thato M​@Ewald Kruger Pravin Gordhan & Mcebisi Jonas were the head of National Treasury. 😀 Which planet you arrived from??
1542795284820292,2:08:55,Zizoh,WE MUST TALK ABT RACISM UNTIL ITS RESOLVED. DODGING IT WOT SOLVE IT
1542795290678322,2:09:00,Mhlanguli Dlodlo,"Can PG please name that ""Person"" he mentions was so devastating between 2009 and 2017"
1542795291247364,2:09:01,Sthakathi Khumalo,Eh.... war
1542795309030741,2:09:19,Sthakathi Khumalo,President who? please say the name sir
1542795309298330,2:09:19,Thato M,"@Ewald Kruger hypocritical. We didn't do that for other families. The commissions isn't the be all and end of dealing with the issue. Pravin must be dealt first, politically. EFF is correct!"
1542795313148081,2:09:23,Trucker Trucker,PRAVIN WASTED 3 DAYS ONLY TO TELL THE COMMISSION TO CONNECT THE DOTS!!
1542795319878309,2:09:28,DJ DJ,there we go he has just implicated zuma
1542795326883360,2:09:37,Annie Maharaj,Racism is rife throughout the world
1542795337309474,2:09:47,Ashon Singh,it starts with our kids.... they will resolve it... but we must give our kids a none racial upbringing... the existing racists you cant change them
1542795338459180,2:09:48,Zizoh,"THE NUCLEAR DEAL WAS THE BEST SOLUTION TO OUR PROBLEM, LOOK NOW WE BUYING CANDLES"
1542795343898711,2:09:53,Mhlanguli Dlodlo,"Are there we go, finally one clear answer. So President Zuma please ask Zondo!"
1542795367965432,2:10:18,Sthakathi Khumalo,He must mention name please
1542795368181301,2:10:18,Zizoh,"AS A BOT, I AM PROGRAMMED TO PROMOTE IT"
1542795372987603,2:10:23,Ewald Kruger,@Thato M​@Ewald Kruger if you are insinuating that the then President would've sight over all SOE deals 😀 Tell me why waste your time here if you can't grasp what's being said???
1542795385597373,2:10:35,sakhile mtshali,Pravin is wasting time and the commission's money
1542795386569684,2:10:36,Thato M,"@Ewald Kruger this is a political terrain, Gordhan & the media will not determine rules of engages of were fights / contestations should happen. Bizarre to say the least"
1542795403167689,2:10:53,Ashon Singh,Nuclear..... lol
1542795411945481,2:11:01,Ashon Singh,Julius made money from the Nuclear deal
1542795421833694,2:11:11,Eugenia Ameyaw,Why is this JD spending the valuable time instead serving the nation - putting the puzzle together
1542795439044819,2:11:28,Thato M,@Ewald Kruger just put your points across man and engage. We will name call when we are done on materiality of arguents
1542795440177711,2:11:29,Zizoh,PRAVIN IS A WASTE OF TIME
1542795449844381,2:11:39,Thato M,*arguments
1542795464043194,2:11:54,Mhlanguli Dlodlo,@singhashon have you been listening to the testimony of PG???
1542795467529793,2:11:57,Mpho Mashigo,nuclear deal never happened... still on the desk🙄 and SA is running out of coal
1542795471146559,2:12:01,Nelson Musoliwa,Thando think of evidence and testimony he laid bare how rules were flawed in running the government by the administration he served under. The comm is not gunning for one act by one person
1542795521330934,2:12:51,Thato M,@Ewald Kruger explain the rationale that a political contestation must be taken to the Commission as Gordhan alleges? Please tell me on what basis this should be done
1542795521802292,2:12:51,Ewald Kruger,"@Thato M​@Ewald Kruger just put your points across man and engage 😀 I made my point, you are clearly comatose while listening to Gordhan or lacking the ability to comprehend."
1542795538297807,2:13:08,Edward Buta,"There was a State Capture. The golden question is ""Who are the players of state capture??"""
1542795543722882,2:13:13,Mhlanguli Dlodlo,@singhashon I hope you heard that the nuclear deal never happened!
1542795559574731,2:13:29,Sthakathi Khumalo,including him.. chair what could they have done to prevent it
1542795561278591,2:13:31,Thato M,"@Ewald Kruger and that is supposed to a logical, factual response. I see"
1542795564606027,2:13:34,Trucker Trucker,@Edward Buta ASK PRAVIN.
1542795581335009,2:13:51,Ashon Singh,"em D ,,,, not physically, yes, but financially in the backgroud.....who knows"
1542795608089150,2:14:17,Martin C,jail the thieves
1542795613272662,2:14:22,Mpho Mashigo,"I thought ""State Capture"" was a surecase thing and clear evidence was available that's why Zuma was oust... why are people being asked to come forward with evidence 🤔"
1542795627694415,2:14:37,Thato M,"Key moment, closing remarks. Lets see if he mentions Twitter again"
1542795636329305,2:14:46,Hendrine de Wet,"Can someone, preferably a competant person, just sort out the sound problem, please!"
1542795638477336,2:14:48,Ashon Singh,that will reveal it all @Thato M
1542795650760724,2:15:00,Martin C,yes Pravin is a wizard who sees everything Thando
1542795662925730,2:15:12,Thato M,@Thando Nkutha my point exactly. The entire national spend
1542795675073858,2:15:25,Mhlanguli Dlodlo,"@ singhashon but you have ideas of who made money in the ""DEAL"" WHERE do you get that from so we can also go read it up?"
1542795714456202,2:16:04,Ewald Kruger,"@Thato M​@Ewald Kruger and that is supposed to a logical, factual response. I see 😀 I am afraid it is. The facts are your ignorance and the inability to even follow the most basic of these evidences."
1542795755040251,2:16:45,Thato M,@Ewald Kruger what are you saying? What are you arguing? Say it. Let's engage
1542795767422682,2:16:57,Mpho Mashigo,the media told us that we should march against Zuma... there is clear evidence of state capture... 9 months down the line nothing has happened... was it just propaganda to oust Zuma?
1542795786414632,2:17:15,mbongeni zondi,intrested
1542795796340110,2:17:26,Ashon Singh,i think Pravin is not naming names because if he does.... there is a gun waiting to be offloaded
1542795803299424,2:17:33,Sam Vanguard,this state capture inquiry is a clear sign that ANC will not be governent 2019
1542795809106803,2:17:39,Thato M,"@Ewald Kruger don't tag my responses, just write you points across and we'll engage."
1542795832528767,2:18:02,Ewald Kruger,@Thato M I am interested to listen to Zondo.
1542795838793274,2:18:08,Ashon Singh,lol
1542795854459735,2:18:24,Sam Vanguard,Pravin is a frontman fo the Ramaphosa cabal/faction it's not different from the NKDZ faction/cabal
1542795874331471,2:18:44,Thato M,"@Ewald Kruger great, but I asked you about Anisha GOrdhan and her rise to higher LSM's during daddy tenure as fin minst"
1542795886055449,2:18:56,Zizoh,EFF WILL COME BACK MARCHING IF HE TELLS ALL
1542795895796767,2:19:05,Ashon Singh,lol
1542795907607834,2:19:17,Mpho Mashigo,Pravin Gordan is a criminal... finish en klaar
1542795910588225,2:19:20,Freedom Nkululeko Duma,biggest lie and manipulater must be fired so dat he can be let out the truth
1542795915429194,2:19:25,Hendrine de Wet,"Mpho Mashigo I would imagine that the people who suspected didn't have the necessary proof - only heresay,"
1542795918972015,2:19:28,Sam Vanguard,only those disillusioned will think that this fake inquiry will work no one will be implicated and s.a will continue as business as usual
1542795922657253,2:19:32,Ashon Singh,"sorry, i have a bot running, every time it sees EFF, it responds with lol"
1542795941259233,2:19:51,Nelson Musoliwa,The ANC failed to prevent state looting because it was divided and senior members were directly involved esp the head zuma with guptas. The aim was no more transformation but personal gain
1542795943350403,2:19:53,Hendrine de Wet,"and that the ones who had proof, were either to scared to come forward, knowing what could happen to them, or didn't have the full picture."
1542795948209681,2:19:58,Zizoh,PRAVIN IS THE BIGGEST MANIPULATOR
1542795949473439,2:19:59,Hendrine de Wet,"This whole things reads much like aSteven King novel, but with a list of characters as long as a telephone directory."
1542795968611909,2:20:18,Thato M,How did Gordhan reach the R100bn losses he purported to have caused the country without citing financial flows or atleast one contract?
1542795975122030,2:20:25,K,Pravin is right ^
1542795975387782,2:20:25,Thato M,Was it a thumbsuck?
1542795981042457,2:20:31,Zizoh,"I AM A BOT,"
1542795996473268,2:20:46,Zizoh,I AM HERE TO SHOW U THE TRUTH ABT YOUR COUNTRY
1542796007417823,2:20:57,Sthakathi Khumalo,"I think where Zondo is going Pravin is to say, if you guys new this was going on why did you guys keep quite and asking him to connect dots.."
1542796007745274,2:20:57,Sam Vanguard,pravin should be ashamed to use duplicity to hide his agenda
1542796033275344,2:21:23,Zizoh,INDIANS WERE TRANSPORTED HERE TO SLAVE IN SUGAR CANE FARMS BY WMC
1542796033552256,2:21:23,Ewald Kruger,♥ Zondo 😃
1542796044699830,2:21:34,Maseko Romeo,"@Mpho Mashigo That's what I was thinking about also, why there are no more headlines about the Guptas looting here and there in the news papers now?"
1542796050485146,2:21:40,Walter Spatula,WMC!!!!!! It's been so long.
1542796055979777,2:21:45,Thato M,@Keryn where's proof of his allegations? We must just take his word for it? Unfortunately Anisha Gordhan is heavily involved and he didn't disclose this. His words are empty rhetoric!
1542796074861112,2:22:05,Sam Vanguard,"Pravin is not a hero he is anti-hero,ANC is anit-hero"
1542796091868880,2:22:21,Mpho Mashigo,yey... Pravin fired Dudu Mnyeni for telling the truth in the SAA enquiry... she said Pravin has shares at Bidvest and it's a supplier to SAA making billions a month at SAA
1542796093411368,2:22:23,Wilhelm5381,and the Indians improved their lot considerably since then... per capita they are the wealthiest people in SA despite apartheid.
1542796095482944,2:22:25,Thato M,"@Ewald Kruger I see you are sidestepping. When all else fails, duck!"
1542796119663764,2:22:49,Nelson Musoliwa,But why do not we hear just one instance where Pravin warned or acted against state capture within ANC stages at all. Why is it not because he was also its role player as well
1542796122092084,2:22:52,Walter Spatula,WMC!!!!!!!!
1542796130639472,2:23:00,Thato M,@Wilhelm5381 in your view blacks and Indians were treated the same? Muppet!
1542796151854526,2:23:21,Mhlanguli Dlodlo,The Question was what did he and the ANC do when they discovered state capture. ANSWER is Mantashe's Diagnostic Report a few weeks before the ANC elective conference. So this was all politics
1542796173020437,2:23:43,Lufuno Mudau,that was not the question pravin
1542796178618838,2:23:48,Walter Spatula,WMC!!!!!
1542796194573409,2:24:04,Walter Spatula,wmc?
1542796195862328,2:24:05,Mpho Mashigo,Pravins Nephew has a business that leases planes to SAA... the Same planes that use to be owned by SAA but sold of... wake up people... PG is the State capturer😡😡😡
1542796204983677,2:24:14,Sam Vanguard,Vote ff+ for a prosperous and corrupt free south africa!!
1542796211626721,2:24:21,Wilhelm5381,your mother is a product of WMC... what bull...
1542796224131265,2:24:34,Thato M,ANC must boot him out. He is not a man of integrity! Kettle calling the pot black
1542796224477579,2:24:34,Mhlanguli Dlodlo,@ Lufuno Mudau I think he didn't hear the question lol although we heard it lol
1542796235277381,2:24:45,Sthakathi Khumalo,Thing is Pravin wants to distance himself from the rot of ANC But he too has contributed to State of Capture
1542796238026006,2:24:48,Zizoh,RACISM IS A PRODUCT OF WMC
1542796251183263,2:25:01,Sam Vanguard,this will be the norm if ANC is elected back into power
1542796257414396,2:25:07,Zizoh,"SAM, WE DONT KNOW THAT PARTY, WHAT IS THAT"
1542796259357087,2:25:09,Walter Spatula,The country owes pravin a massive debt of gratitude
1542796269447808,2:25:19,Noelene Goosen,GERMANY IS TOPS👏
1542796291844572,2:25:42,Sam Vanguard,Viva FF+ coalition with D.A
1542796300940826,2:25:50,Ashon Singh,@Mpho Mashigo Floyds brother has shares in 4 companies that provide coal to Eskom.... from the earlier ZUma days
1542796305349549,2:25:55,Zizoh,PRAVIN HAS DONE NOTHING BUT GIVE US A LECTURE
1542796305415702,2:25:55,Thato M,@Walter Spatula for enriching his daughter over millions of people. Afriforum and DA will thank him.
1542796327669307,2:26:17,Mpho Mashigo,futsek Arrest Pravin Gordan mahn he is the one who captured the state😡😡😡 wake up people
1542796340332929,2:26:29,Sam Vanguard,EFF and ANC are fighting each other through populism we know where this has happened and we know that it ends with violence
1542796341203021,2:26:30,Kevin Davis,why don't the blacks purchase black monopoly capital a d brand it
1542796343402089,2:26:32,Walter Spatula,"@Thato M Nope, for standing up to a criminal that could and would have destroyed the country"
1542796346547643,2:26:36,Thato M,"THis is not even a lecture since a lecture is substantiated with facts, this is a soap opera."
1542796371780476,2:27:01,Ashon Singh,@Mpho Mashigo it would be really nice if it was just 1 person who captured ... easier to fix
1542796374717918,2:27:04,Awelani Mukwevho,@ Mpho please bring evidence
1542796376409555,2:27:06,All Truth,EFF is playing games
1542796381892395,2:27:12,Thato M,@Walter Spatula a criminal standing for another criminal. Your logic is amusing!
1542796388479894,2:27:18,Trucker Trucker,Pravin Gordhan endorses Cyril Ramaphosa yet the current president is the most secretive state man we have ever had.
1542796403054237,2:27:33,Walter Spatula,This man's ethics are unquestionable
1542796424018571,2:27:53,Ewald Kruger,"Jesus, what a well-measured response from Gordhan ♥♥♥ The politics of distraction...dispensing of patronage 😃"
1542796459944190,2:28:29,Sam Vanguard,It is political error to think that EFF and ANC can deliver to the masses of south africa
1542796474472743,2:28:44,Nelson Musoliwa,Pravin testimony is not so direct as expected by many; he simply stove to exonerate himself from ANC mudslinging but he shared light on state was incompetently run
1542796477686040,2:28:47,Jaco Pieterse,"Anybody with a brain can see that @Kevin Davis , but the red-goggles are prohibiting them from seeing it"
1542796483469641,2:28:53,Thato M,ANC Intergrity Commission must move with speed to deal and look into the allegations of a multi millionaire daughter.
1542796492448838,2:29:02,Lucky Dlamini,Lack of useful facts and names.
1542796495636859,2:29:05,Zizoh,EFF ARE THE FUTURE
1542796504011396,2:29:14,Mpho Mashigo,"Pravin Gordan gave Ivan Pillay R24mill hand shake at SARS. stole R72bill at SARS... now the want to ""Privatized"" (Steal) SAA..."
1542796504655336,2:29:14,Ashon Singh,lol
1542796506997492,2:29:17,Zizoh,LOOK AT OUR VALUES
1542796514318309,2:29:24,Yousuf Cajee,Diagrams at which compounds?
1542796516119253,2:29:26,Walter Spatula,"@Thato M Fake news, until you or someone else takes it to the commission"
1542796522300424,2:29:32,Martin phiri,EFF it's worse
1542796530408438,2:29:40,Ashon Singh,lol
1542796551776221,2:30:01,Mhlanguli Dlodlo,Can't wait for the cross examination. Hopefully we'll hear more legally useful material and not politics
1542796552022018,2:30:01,Zizoh,PLEASE DONT PRIVATISE
1542796569059471,2:30:18,Wilhelm5381,Vive la difference Notshi...
1542796572407658,2:30:22,Thato M,"@Walter Spatula political contestations aren't fought in a Commission, muppet. It is a political terrain. STOP with these baseless media narrative & think for yourself!"
1542796583635345,2:30:33,Lucky Dlamini,"True, em D."
1542796586030837,2:30:36,Zizoh,"EFF IS THE FUTURE, VOTE FOR A WINNIIN PARTY, NOT A CORRUPT MADALA"
1542796591005664,2:30:41,Ashon Singh,lol
1542796603741177,2:30:53,Ashon Singh,lol
1542796604174339,2:30:54,Nelson Musoliwa,Failing by pravin to share light on his own flaws or weakness on state capture leads one to think that he is here to build his own personal standing in the society
1542796610982519,2:31:01,Zizoh,PRAVIN IS ALSO ADVISING THE COMMISSION
1542796612685183,2:31:02,Thato M,"Under cross examination, Pravin wil see flames"
1542796630144747,2:31:20,Mpho Mashigo,playing victim won't help... Public Protector is investigating you Pravin... you going down...
1542796631248666,2:31:21,Sam Vanguard,pravin your words are rotten as like your integrity
1542796650512304,2:31:40,Lucky Dlamini,"True, Thato."
1542796651139191,2:31:41,Kevin Davis,notshi lol what will the eff do if they lose there tobacco smuggler
1542796657330810,2:31:47,Zizoh,WHY DO PPL VOTE FOR A PARTY WHO STILL HIRES 70+ YEAR OLD PERSON
1542796668584714,2:31:58,Sam Vanguard,EFF and ANC fights simply give FF+ and D.A opportunity to effectively fight corruption
1542796669666400,2:31:59,Mhlanguli Dlodlo,A practical manifestation can simply be named right folks. TELL us who's now attacking the commission? Hey this guy
1542796699243657,2:32:29,Martin phiri,Corruption will never end in this country
1542796704684636,2:32:34,Zizoh,HOW CAN A CLEAR MINDED PERSON VOTE FOR GRANDPA
1542796707749563,2:32:37,Walter Spatula,"@Lesego Pitsoane ""Whiteness"" is not an insult"
1542796708940658,2:32:38,y2k.b0kaa,"Juju o tlo mo tlhasela gore, with this statement 😂😂😂😂😂😂😂"
1542796721742773,2:32:51,Sam Vanguard,it's wrong to associate whiteness with riches
1542796721767113,2:32:51,Thato M,He talking politics in a commission. This won't save him. This is politics boss! You did the same to Zuma. Take it from whence it comes
1542796723636600,2:32:53,Yousuf Cajee,Liberal democracy allows for these things to happen!!! We need an African political dispensation.
1542796733343715,2:33:03,Mpho Mashigo,"why are people scared of PG... this guy is a crook... he was leading this state capture thing but hasn't ""connected the dots yet"""
1542796753811034,2:33:23,Zizoh,DALI MPOFU WILL GRILL THIS GUY
1542796756718970,2:33:26,Curly Dlamini,he speaks what he wants
1542796758640921,2:33:28,Ashon Singh,lol
1542796771087784,2:33:40,Hendrik Botha,😴😴
1542796771092919,2:33:40,Martin phiri,Africa it's the graveyard of corruption
1542796771807617,2:33:41,Thato M,"Gordhan forgets he remains a deployee, from a political party, in a political context."
1542796798101363,2:34:08,Sam Vanguard,ANC is in process of transforming itself to become what ZANUpf is today
1542796801388362,2:34:11,Zizoh,"PRAVIN SAID HE CANT REMEMBER IF HE MET THE GUPTAS, ITS THE RISK OF HIRING OLD MADALAS"
1542796805661993,2:34:15,Sthakathi Khumalo,Is he reading his closing remarks also hebana!
1542796813510667,2:34:23,Mpho Mashigo,PUBLISH ALL SUPPLIER CONTRACTS AND INVOICES AND LETS SEE STATE CAPTURE WENA 😡😡😡
1542796820132357,2:34:29,Thato M,The fact that he is addressing these factional issues here are testament of the balance of forces within the ANC.
1542796826020689,2:34:35,Sam Vanguard,if you vote ANC 2019 you are also an enabler of corruption
1542796846130437,2:34:56,Zizoh,"ANC WONT LEAD NEXT YEAR, JUST FORGET IT"
1542796858588355,2:35:08,Kevin Davis,pravin said he never had a meeting with the guptas that's what he said a d he never has nothing ever changed
1542796867952326,2:35:18,Tando Sinqe,So what must we vote for Sam?
1542796871446609,2:35:21,y2k.b0kaa,cant wait for Dali to question PG
1542796873028359,2:35:23,Sthakathi Khumalo,"What evidence, you've been giving him dots nje"
1542796878135998,2:35:28,Thato M,Branches and provinces won't take this lying down. Especially the aggrieved post Nasrec faction. Chickens will come home to roost
1542796878393010,2:35:28,Mpho Mashigo,You forgot Steinhoff and Bidvest 😡😡😡
1542796882117826,2:35:32,Makwa Choma,Mara ogona motho Otlo votela ANC
1542796882570485,2:35:32,Nelson Musoliwa,What Pravin is saying now he can submitt to the com later as zondo stated mos
1542796894260175,2:35:44,Kevin Davis,notsho do u smoke the eff cigarettes
