timestamp,time,author,message
1535621898193772,2:06:45,Kamogelo Nkosi,Juju malema
1535621898644292,2:06:45,J Ganasan,@Millicent Shozi - traitors? why
1535621911909784,2:06:58,Backs Bogatsu,corruption can not get us anywhere
1535621921799595,2:07:08,Praymore Ncube,Wich group
1535621922905900,2:07:09,Millicent Shozi,J it white monopoly
1535621931991415,2:07:18,Kamogelo Nkosi,The true will come
1535621940209606,2:07:26,Sindiswa Moolman,Who is next???
1535621960544621,2:07:46,Millicent Shozi,Praymore go and pray you will have the answer
1535621975390928,2:08:01,kwado kyei,We needs balance cabinet were President doesn't abuse power.
1535621980084940,2:08:06,Mzalwane Mzala,ANC the hope of our people
1535621999420156,2:08:26,Pheladi Lamola,thank you Mr Maseko
1535622000022799,2:08:26,J Ganasan,@Millicent Shozi - its multi racial
1535622015714320,2:08:41,J Ganasan,@Millicent Shozi - ur racist
1535622029507509,2:08:55,kwado kyei,Im praying that 2019 ANC GETS BELOW 50% Then will see whose the man
1535622031696155,2:08:57,J Ganasan,theres the cute black girl again\
1535622039388453,2:09:06,Millicent Shozi,J but i still fancy u man
1535622040719712,2:09:07,Kamogelo Nkosi,not the hope of batho ANC
1535622044474897,2:09:11,MIKE DURBAN,"Dear Lord.....bless all the brainwashed folks who can""t think for themselves.."
1535622064545124,2:09:30,J Ganasan,@Millicent Shozi - leave ur husband. come with me
1535622070141758,2:09:36,noko yamebetlwa,kyei will never happen ANC will rule forever
1535622085887210,2:09:52,Sylvester Tyhali,Who is next?
1535622091562875,2:09:57,Sylvester Tyhali,What is next?
1535622094054187,2:10:00,Millicent Shozi,J secret lovers still works
1535622113432827,2:10:20,kwado kyei,people like you will die with heart attack @noko yamebetlwa
1535622115175152,2:10:21,Praymore Ncube,yay thus true they need to be killed by synade n even their supporters
1535622132244666,2:10:38,J Ganasan,@Millicent Shozi - ok . but i have to have sex 3 x a day. can u handle it
1535622159620817,2:11:06,Millicent Shozi,J you boring 3 rounds only
1535622160387461,2:11:07,Mzalwane Mzala,The people have proven time and time again that they will not be dictated to when it comes to voting. ANC they vote
1535622170827319,2:11:17,noko yamebetlwa,Ganasan u r out order
1535622177795399,2:11:24,kwado kyei,I remeber 2016 at JHB municipality one woman died of disbeliefs when herman mashaba was elected mayor of Johannesburg@noko yamebetlwa
1535622194233909,2:11:40,J Ganasan,"Milli - at 2 hours a round , I guarantee u wont be able to walk"
1535622197645245,2:11:44,Kamogelo Nkosi,This is down fall for ANC
1535622199369931,2:11:46,thabiso phungula,This is just for public entertainment we never going to see any convictions complete waste of tax payers money
1535622217030067,2:12:03,Mzalwane Mzala,This is the renewal of the ANC
1535622220882819,2:12:07,Orefile Macheoane,@thabiso phungula No one thinks like that
1535622247070196,2:12:33,noko yamebetlwa,kwado she died coz it was the time do die man she was sick
1535622247144518,2:12:33,kwado kyei,They needs to be punished
1535622260118071,2:12:46,Kamogelo Nkosi,They dont i do
1535622279937574,2:13:06,Sylvester Tyhali,@Mzalwane Mzala ANC will never recover so as long as it follows the lead of the immature EFF....into communism
1535622283237148,2:13:09,kwado kyei,"nope dear, ask ANC MEMBERS WILL TELL YOU@noko yamebetlwa"
1535622283601019,2:13:09,Mbongiseni Jonase,"took long for this Zuma man leave, the damage was done"
1535622288600234,2:13:15,Orefile Macheoane,people are happy to hear news and not deal with the nitty gritty
1535622305021594,2:13:31,kwado kyei,Never say Never@noko yamebetlwa
1535622326211089,2:13:52,Orefile Macheoane,If you tell people today that Julius Malema is still an ANC member they will lose their minds.
1535622335632972,2:14:02,Sylvester Tyhali,Communism destroys everything
1535622340570999,2:14:07,thabiso phungula,"how many inquiry have we had but no one was convicted, eskom,life at esidimeni etc"
1535622356982213,2:14:23,J Ganasan,vote DA
1535622363583966,2:14:30,Orefile Macheoane,@thabiso phungula correct
1535622374722043,2:14:41,Bonani Maphini,"So Themba Maseko's testimony is based on rumours,newspaper articles and Twitter DMs"
1535622375080661,2:14:41,noko yamebetlwa,now the President is a Limpopo bloody poi all Limpopo will vote for ANC bra
1535622409339496,2:15:16,noko yamebetlwa,Ganasan DA is party of the killers bra I won't that
1535622424663738,2:15:31,J Ganasan,Democratic Alliance 👍
1535622435012688,2:15:41,Kamogelo Nkosi,Ok vote for ANC
1535622447373072,2:15:54,J Ganasan,only truly multi racial party
1535622468694538,2:16:15,J Ganasan,South Africa for all races
1535622486062248,2:16:32,Mbongiseni Jonase,still believe that ANC will change now that Zuma is gone
1535622491853032,2:16:38,Orefile Macheoane,Haha Limpopo and mpumalanga are the strongholds of anc... KZN is the capital
1535622516117007,2:17:02,J Ganasan,ANC wont change - now another corrupt bastsrd in charge - Cyril
1535622526281532,2:17:13,Kamogelo Nkosi,ANC it must go down bra
1535622526880493,2:17:13,noko yamebetlwa,true Orifile
1535622559195732,2:17:45,Sindiswa Moolman,I believe so too @Mbongiseni Jonase
1535622568907139,2:17:55,Mbongiseni Jonase,no one is more corupt that Zuma bra
1535622575117323,2:18:01,Kamogelo Nkosi,Yes to Limpopo boy juju
1535622615866299,2:18:42,noko yamebetlwa,Ganasan like Helen Zille is most corrupt lady she placed Mmusi maimane at front to gain more vote
1535622625303543,2:18:52,Kamogelo Nkosi,Viva malema true will come
1535622638543964,2:19:05,Orefile Macheoane,Mmusi is just like Obama
1535622668222290,2:19:34,noko yamebetlwa,why can't Zille let Mamaine to be premier of western cape?@Ganasan
1535622694415260,2:20:00,J Ganasan,noko - just chill. vote DA
1535622738992593,2:20:45,noko yamebetlwa,never over my dead body I wnt do that mistake Ganasan never
1535622742203608,2:20:48,J Ganasan,Oh no - the lady lawyer with the bad teeth is back now
1535622743506763,2:20:50,Bonani Maphini,we cant allow big metros like Tshwane to be run but puppets
1535622768220456,2:21:14,J Ganasan,noko - u r racist. DA is a multi racial party
1535622807518913,2:21:54,Orefile Macheoane,"Im happy with the work of DA in Jozi. But Pretoria sis not run properly, purely because of exclusivity"
1535622810997895,2:21:57,Sylvester Tyhali,"Great minds discuss ideas ✍; average minds discuss events 👯; small minds discuss people 🗣. ....The EFF discusses events and people. It believes in Marx's ""historical necessity"""
1535622814194311,2:22:00,J Ganasan,haha - the ugly fat journo is back
1535622814219351,2:22:00,Lowkey Apparel,You again 😂
1535622835056208,2:22:20,J Ganasan,Marx was a fool
1535622839784585,2:22:26,Lowkey Apparel,The bald man again 😂
1535622840443556,2:22:26,Sylvester Tyhali,"The EFF doe not have any ideas, its just gossip in public😂"
1535622849920977,2:22:35,J Ganasan,COmmunism failed everywhere else
1535622892515490,2:23:18,J Ganasan,@stunner - they all bald 🤣
1535622894566600,2:23:21,Jacob Ratone,.
1535622911227903,2:23:37,Bonani Maphini,DA must be removed in Tshwane bcz they r hiring people with no qualification & R12 billion tender corruption
1535622917902778,2:23:44,Zamo Mthethwa,@J Ganasan only people failed to make communism to work because they are greedy. Most people lack humanity
1535622926969775,2:23:53,J Ganasan,noko - thats the most stupid thing Ive heard. every one is valued in DA
1535622970886604,2:24:37,Sylvester Tyhali,"Communism will never work, even with honest people 😂..it is predicated on false assumption about human nature"
1535623003373284,2:25:10,J Ganasan,Chairman and that hottie look pl;eased with themselves
1535623013378830,2:25:19,siphiwe mathibela,We're back
1535623015950419,2:25:22,noko yamebetlwa,hahahaha that won't happen with DA boss for now everyone n be valued let them win u will see their real colours @ Ganasan
1535623019493761,2:25:25,Sylvester Tyhali,Communism is a pie in the sky 😁..Utopia is impossible in the here and the now
1535623053906512,2:26:00,J Ganasan,Communism makes a few people ridiculously wealthy and 99% poor
