timestamp,time,author,message
1548683844915417,1:55:55,Ndikho Mangisa,Agrizzi is the hero few people can do this..
1548683872503433,1:56:23,Viktombi,@Ndikho Mangisa yes Aggiz is a legent
1548683876589160,1:56:27,Viktombi,legend
1548683882683485,1:56:33,Wildthing,brother against brother
1548683891821209,1:56:42,Bongumenzi Nxumalo,"Ndikho Mangisa He is not a hero, disagree!! He contributed to this madness and he must also account."
1548683892993576,1:56:43,P V,he is telling it all freely
1548683899912947,1:56:50,Atlegang Mmeti,hes no legend
1548683923890488,1:57:14,Viktombi,Most people would keep it to the grave
1548683935990811,1:57:26,McLaws Ndinisa,This man is a hero
1548683940694969,1:57:31,Petronella Riegers,At Least we get to the bottom of this sickness
1548683947942872,1:57:38,Eslon Eslon,"@Doom Ruler Nah, True she want us to believe her empty and emotional driven statement that's all"
1548683954623841,1:57:44,McLaws Ndinisa,Would you reject 12 mil a year for 10 years
1548683966196921,1:57:56,Bongumenzi Nxumalo,"He is no hero, he is a whistle blower looking out for his skin.. period!!"
1548683971293010,1:58:01,makhosi nobhatyi,"Gwede Mantashe has to come back here, coz he was scared to speak how or where ANC standing about allegations that were layered"
1548683972855901,1:58:03,Magda Seguin,"He came forward on his own, if he didn't nobody would have known how the ANC"
1548684002811843,1:58:33,Bongumenzi Nxumalo,Magda Seguin but it doesnt make him a hero
1548684019025802,1:58:49,Ndikho Mangisa,But he is the man came in front and is admitted every thing..He aware about the if he is hanging himself.
1548684048241707,1:59:18,Magda Seguin,I am not stupid.Fully aware!
1548684103657018,2:00:14,Magda Seguin,ANC greed messed up the economy
1548684129577936,2:00:39,Ndikho Mangisa,#teg Agrizzi is grizzing and he maen business..
1548684143939400,2:00:54,Eslon Eslon,why should the implicated lawyer be notified? @Bongumenzi
1548684176818120,2:01:27,Bongumenzi Nxumalo,"He has been stealing money with Bosasa but now we have to praise him because he came foward, Never!! This comrade must account and we thank him for coming forward qha"
1548684184270808,2:01:34,Doom Ruler,@McLaws Ndinisa we all a tad judgmental right now but really group... would you say NOOOO to 12 milli a year for 10 years ahahahaha?????
1548684209137891,2:01:58,Magda Seguin,AND all thosehe named MUSTgo to jail
1548684239904989,2:02:30,Risuna Manganyi,hes spilling the beans yes but he's making himself to look like he didnt want to be part of all this...for goodness sake he was doing this for yearsss
1548684247514804,2:02:37,Bongumenzi Nxumalo,"Eslon Eslon to be honest, Agrizzi enjoys protection from the state and here you have a lawyer who is just mentioned. What do we know may happen to him because he holds valuable info"
1548684275513062,2:03:05,Magda Seguin,You mean everybody is corruptable? Speak for yourself
1548684280936274,2:03:11,Doom Ruler,er'body mentioned gotta be held accountable
1548684330029861,2:04:00,Doom Ruler,"@Magda Seguin yes, anyone can be corruptable"
1548684402403147,2:05:12,Doom Ruler,I am sure Agrizzi has looooooads of footage as evidence... super content dude...
1548684414475686,2:05:24,Ndikho Mangisa,How much money this will cost us really guy's.. it's like will take 3 years from now to get bottom of this...
1548684456218249,2:06:06,Doom Ruler,Zondo probably get a milli per hearing
1548684523534201,2:07:13,Ndou Fhati,Zuma was a driver of all shenanigans
1548684590149407,2:08:20,Magda Seguin,@Doom Ruler...I worked hard looking after sick people all my life and live on a small pension.I don't need dirty money...I liv
1548684629521650,2:08:59,jeevan singh,The politians implicated must step down. All Bosasa contract must be terminated. Then the NPA must start prosecuting. All Politicians assets must be seized and held by the state.
1548684650768289,2:09:21,Magda Seguin,Maybe you have a different vibration of what it means to be honest
1548684667653073,2:09:38,Ndou Fhati,ask Guptas and zuma
1548684673837967,2:09:44,Doom Ruler,@Magda Seguin highly respect your life long service and we need more people like you
1548684715743660,2:10:26,MIKE DURBAN,@Jeevan....spot on Bro
1548684720794396,2:10:31,Doom Ruler,@jeevan singh assets GOTTA BE SEIZED !!!
1548684732186305,2:10:42,Magda Seguin,I taught nursing students at Wits and the previous Medunsa I hope they do justice to what service means
1548684752314941,2:11:02,Magda Seguin,@Doom Ruler Thank you
1548684890488386,2:13:20,Doom Ruler,I honestly wonder what is currently going with those implicated... must be a horror fest mentally for 'em
1548684900792152,2:13:31,Ndou Fhati,grizzi ur man amongst men
1548684908696817,2:13:39,Risuna Manganyi,The corrupter and the corruptee.
1548684977066100,2:14:47,Doom Ruler,the irony of receiving correctional service tenders thooough 😂😂😂😂😂
1548684994866477,2:15:05,Bongumenzi Nxumalo,"I think Bosasa contracts must be returned to the state, all its founders to removed and prosecuted because 4000 workers to lose jobs is just not on!!"
1548685051509512,2:16:01,Wesley Mokoena,@Doom Ruler 😂😂😂
1548685097216330,2:16:47,Ndou Fhati,ANC must clean corrupt people in order 2 survive
1548685098114029,2:16:48,Eslon Eslon,So you're worried about the implicated lawyer safety or? @Bongumenzi
1548685122421302,2:17:12,Dr Langa Langa,why it have to come out know
1548685123626404,2:17:13,makhosi nobhatyi,Nxumalo do you know how much they get paid? We don’t care loosing jobs it’s fine we are about to save country
1548685167071706,2:17:57,Doom Ruler,implicated lawyer or not!!! Sing Agrizzi SING!!!
1548685175880148,2:18:06,Doom Ruler,all implicated must fall
1548685177243652,2:18:07,Dr Langa Langa,how much is he gonna be paid for this
1548685195312218,2:18:25,Kcius gaba,this agrizzi guy.....!!!
1548685274012402,2:19:43,Doom Ruler,"I mean people are at work as we speak, working their buts off... some of em wont even see what 200K in cash looks till the day they depart from earth... average households survive off R3500 p/m"
1548685281745802,2:19:51,Doom Ruler,sooo ALL implicated MUST FALL
1548685300839173,2:20:11,Doom Ruler,R3500 p/m for 8 stomachs
1548685303511943,2:20:13,jeevan singh,wow he stole money from Bosasa.
1548685337870885,2:20:48,Doom Ruler,@jeevan singh plot ain't never getting less than thicker here
1548685363063581,2:21:13,Vusumzi Ngcoza,liar
1548685388827895,2:21:39,jeevan singh,Doom Ruler. Now there's a twist in the tale.
1548685391052210,2:21:41,makhosi nobhatyi,That’s peanut
1548685391398801,2:21:41,Magda Seguin,@Jeevan Singh you are not listening
1548685434315915,2:22:24,Vuyokazi Kadalie,Who is next on the stand?
1548685449043502,2:22:39,jeevan singh,Magda meaning
1548685454740075,2:22:45,Eslon Eslon,There must be a serious and robust sensitization of society not to vote for the ANC at all bcos of all this mess@Ndou Fhati ...bcos ANC will never clean itself up properly
1548685456557474,2:22:46,Bongumenzi Nxumalo,"Eslon Eslon Not even, I was just saying he must becareful when he mentions peoples name.. it may pose risk on their lives"
1548685497176475,2:23:27,Magda Seguin,Meaning you are so speculating...all this will be tested in a court of law
1548685509624658,2:23:39,John Wilson,"Did he say try and finish this year , did i hear right"
1548685541169257,2:24:11,Bongumenzi Nxumalo,makhosi nobhatyi I understand what you mean.. but 4000 workers is too much and you know its hard to find a job today!!
1548685558720734,2:24:29,jeevan singh,Magda. I know that. we all know that.
1548685574206216,2:24:44,Wildthing,The public should demand action taken as it is let know to the enquiry.
1548685578173987,2:24:48,Bongumenzi Nxumalo,"These guys are wating time, we could have continued with Agrizzi yazi"
1548685580759217,2:24:51,Magda Seguin,"Most people have short memories, all those who took bribes was stealing taxpayers money...tender fraud"
1548685598849795,2:25:09,makhosi nobhatyi,Our money brother is gone R500 billion
1548685710166567,2:27:00,jeevan singh,Magda. The evidence appears overwhelming. so the authorities needs to act on the evidence and make the charges and arrests.
