timestamp,time,author,message
1562227621727874,6:09,makhosi nobhatyi,😃😂😂😂 translation again 🙆🏻‍♀️🙆🏻‍♀️🙆🏻‍♀️ lies
1562227636477736,6:24,stephen raubenheimer,lol
1562227639449215,6:27,Derick Mampuru,Is he interpreting is Tswana or Zulu
1562227645774193,6:33,Cassius Mngomezulu,Molweni
1562227647556069,6:35,makhosi nobhatyi,Same interpreter of yesterday
1562227650933051,6:38,Thami Ngwenya,kunzima
1562227657301387,6:45,Bruce Andrew,The new tactic to delay the enivitable.
1562227660213162,6:48,Bruce Andrew,Tswana
1562227665500327,6:53,Cassius Mngomezulu,This guys are playing here
1562227667319239,6:55,Prudence Mokoena,😂 there we go again😂😂
1562227682433977,7:10,Zola Pinda,gives them time lokuxoka
1562227704809515,7:32,Sinethemba Sakuba,these guys can speak English man this is Madness
1562227724385823,7:52,Thapelo Motabogi,something is wrong here
1562227730290572,7:59,Sinethemba Sakuba,that's what their exactly trying to do
1562227733391186,8:01,Bruce Andrew,I don't know why South Africans put up with the nonsense that we do.
1562227735451382,8:03,Petro Forsyth,Sure the judge knows Tswana
1562227777290323,8:45,Sinethemba Sakuba,Check the smirk on the that guys face
1562227806534856,9:15,Derick Mampuru,"okay,. let's hear Mnisi interpreting in Tswana ⏳⏳"
1562227810952792,9:19,Phillip Cwazibe,Yesterday's interpreter (isiZulu) spoke poor isiZulu.
1562227829916030,9:37,Anne M.,"@Thulani Bukani It makes one think, doesn't it?"
1562227830331147,9:37,Zola Pinda,these are goverment for working there for years and conduct business in English.
1562227838634877,9:46,Thapelo Motabogi,😂😂😂😂
1562227853411088,10:00,Derick Mampuru,@Phillip Cwazibe isn't he the same person
1562227866761134,10:15,Millicent Shozi,haibo
1562227872486039,10:20,Zola Pinda,gvt officials
1562227876273654,10:24,carnoth ngomane,"People have a right articulate themselves in a language of their comfort, otherwise SA is a free country"
1562227882039145,10:29,Robert Russell,Next we gonna have the sign language dude from Madibas funeral
1562227915735572,11:03,Phillip Cwazibe,@Derick Mampuru looks like. Money making?
1562227954835129,11:42,Zamuxolo Mbangcolo,He responds before interpretation.😂😂😂
1562227955732767,11:43,Sinethemba Sakuba,he can hear English but cant speak hahahahahahahahha
1562227971460114,11:59,Thulani Bukani,he's answering English nje lomjita
1562227977679990,12:05,Derick Mampuru,"probably 🤷🏾‍♂️🤷🏾‍♂️ @Phillip Cwazibe, I'm just wondering who pays him, the government or the witness"
1562227987740739,12:16,Lukhanyo Makahla,"its gonna be boring today,"
1562227990916605,12:19,makhosi nobhatyi,Much better in tswana translation
1562228002693610,12:30,Joburg CEB Lion,"This is not play ground, everyone must use language that they're comfortable with. Let's recognise all our languages."
1562228013708575,12:41,Anne M.,@Derick Mampuru The Commission pays the interpreter
1562228014994699,12:43,Lukhanyo Makahla,why this dude answering in English?
1562228050457361,13:18,Derick Mampuru,"@Makhosi nobhatyi it's still early, let's wait lol"
1562228090765942,13:58,Phillip Cwazibe,@ Derick Mampuru. It is the Tax payer.
1562228100457900,14:08,Derick Mampuru,"@Anne M. and it's our money that's paying him, so basically we're paying for someone to delay the process 🙆🏽‍♂️"
1562228103585095,14:11,Prudence Mokoena,He looks so much like yesterday's witness😯
1562228118337588,14:26,Robert Russell,To welcome Tswana speaking foreign visitors to the country
1562228120303677,14:28,Thabo Nejelele,He's right to testify in language he feel comfortable.
1562228124959173,14:32,Anne M.,@Derick Mampuru Correct
1562228141236578,14:49,makhosi nobhatyi,@Derick mampuru how can these guys represent us but not feeling comfortable to speak English
1562228145803121,14:53,Derick Mampuru,"@Prudence Mokoena 😂 you're so right, they look alike"
1562228152359623,15:00,Sinethemba Sakuba,but gets commands at work in English hahahaha
1562228152501436,15:00,Norman Zwane,Spoken well per this intepreter our languages are just beautiful. I'm enjoying the seTswana guy.
1562228203890887,15:51,R hunter,🤐😴💩
1562228222383653,16:10,Zizamele Zukulu,mna xa sekubizwe mna ndifuna umntu translate ngesi mpondo ulwimi lwam endiluxelayo
1562228229553132,16:17,Aniceth De Missamou,The guy is responding in English. It's a ploy for avoid stating much. They are soldiers and work for the Gov not in a Base so how do they run the Gov business with foreigners dignitaries?
1562228260540214,16:48,Phillip Cwazibe,@Makosi Nobhatyi Ambassador yonke.
1562228292712590,17:20,lucas chokoe,I wish all tertiary education institutions can ask us prefered language to write exams
1562228294799069,17:22,Millicent Shozi,im learning
1562228303696060,17:31,Derick Mampuru,"in as much as he has the right to get an interpreter, they're trying to delay and reveal less"
1562228320470679,17:48,Lorna Kavanagh,why is he using an interpreter? isn't he an official?
1562228332053963,18:00,sam Mokobane,"Zuma games, the interpreters!"
1562228356804097,18:24,carnoth ngomane,even some state leader do use interpreters so stop criticizing the witness
1562228364781044,18:32,Skipper Motabogi,Setswana translator on point👊👊👊
1562228370087444,18:37,Aniceth De Missamou,"So he can read email and respond to them with foreigners dignitaries but can't express himself in English at an enquiry? These soldiers, wow."
1562228382782855,18:51,Norman Zwane,"@Sinethemba Sakuba The language of office work is usually easy to deal with over time but for most people court language remains foreign. Unless you are exceptionally fluent, it helps to translate"
1562228389904383,18:57,Lorna Kavanagh,shem ...
1562228414278721,19:22,Eleanor Diplock,This is going to be a looooooong day!! This guy works in government dept but cannot speak English!?!? Eish!!!
1562228414388252,19:22,Moshoeu Mabusela,Do they involve interpreter services in their meetings also?
1562228419211980,19:27,Millicent Shozi,mzansi for sure
1562228454628623,20:02,Aniceth De Missamou,"These are soldiers and everything to them is ""War"" and all tactics are permissible to win"
1562228457834730,20:05,Robert Russell,It's the new game plan.... use interpreters so that when Zuma appears on the 15th.... they will run out of time before the 19th because of this tactic and he will not answer all the questions
1562228462850908,20:10,Thami Ngwenya,Ke tsotsi ye just by looking
1562228470456902,20:18,Phillip Cwazibe,@ Aniceth De Missamou he is much comfortable with English
1562228471113738,20:19,lucas chokoe,Chinese ...and Rassians.....when they adress media they will use their language
1562228480512306,20:28,Norman Zwane,"@Sinethemba Sakuba If you understand English, it buys you extra time to think through your answer before blurting out an answer you may regret. You hear the question twice at least."
1562228489039439,20:36,carnoth ngomane,"@Norman Zwane well said, most people here dont understand the purpose an interpreter"
1562228501360661,20:49,makhosi nobhatyi,"@Philip Cwazibe I am so surprised becoz asiwutholi umsebenzi uma siwufuna xa singakwazi uthetha English, they have qualifications I doubt"
1562228515960980,21:03,Molly Dhlamini,"Translation helps as English is not our first language and we first think in our african languages before we can answer in English, I urge people to refer to the research done by the current VC of UCT"
1562228532653854,21:20,Phumla Setlhoke,Lamatoliki are doing it purposely.This is the introduction preparing for Mr Zuma not to look foolish during his turn
1562228547470912,21:35,Zola Pinda,they are playing games. they spoke English when allowing the Guptas to land their aircrafts.
1562228560186846,21:47,Jabulile Mazwane,thanks Molly
1562228569663840,21:57,Nherera Karls,Still currently holding but English dololololo
1562228572953905,22:01,Molly Dhlamini,"All courts use translation if needed, it’s not something new"
1562228580985813,22:09,Thami Ngwenya,Molly how are you
1562228591306430,22:18,Ibo Thabo,why no video feed?
1562228594173029,22:21,Robert Russell,@carnoth ngomane so would it be ok for Zuma to use an interpreter when he appears?
1562228605839718,22:34,Wildthing,video is on
1562228607468574,22:36,MCEBISI MBUSI,dom
1562228629100132,22:56,Phillip Cwazibe,@ Phumla Setlhoke it does seem so.
1562228631320344,22:59,Thapelo Motabogi,"these guys speaking in their language they are just wasting our time,they hear english well"
1562228632903604,23:00,Ibo Thabo,to me video is off
1562228638269023,23:05,Thabo Nejelele,ubaba will testify in zulu.
1562228639194038,23:07,Norman Zwane,@Aniceth De Missamou Home language is a right we all have to truly express ourselves. I may work in English but court is not work
1562228643130738,23:10,lesego gareth,The Setswana interpreter ... quality !
1562228649217720,23:16,Paul Mufhadi,what tactic is he applying? Can he not express himself in English?
1562228661595856,23:29,Molly Dhlamini,Ask any white person in South
1562228671897799,23:39,carnoth ngomane,"@Robert Russell absolutely, he has a right to do so,"
1562228673577489,23:41,Elijah Ratswele,"Otsheri ke Justice ka sebele, no place to hide"
1562228701171866,24:09,Ibo Thabo,now i got it
1562228719600086,24:28,Thapelo Motabogi,"he's not speaking setswana well,he's using other english words"
1562228729209489,24:37,Lukhanyo Makahla,"lol the interpreter, it's not easy to interpret hey."
1562228734390093,24:42,Robert Russell,Yes it's his right.... but he understands and speaks Engilsh better than most @carnoth ngomane
1562228740759403,24:49,Phillip Cwazibe,The interpreter 🚮
1562228770484978,25:18,Joyful Technologies,volume on this guy PLEASE
1562228776049081,25:24,Molly Dhlamini,"There is something called multilingualism , that is why he is mixing the languages-"
1562228785228212,25:33,Elijah Ratswele,"A man embarrassing himself in front of the whole nation, by trying to act smart"
1562228805071872,25:53,makhosi nobhatyi,These guys holding these positions must make space for us coz something is not right here
1562228823215428,26:10,carnoth ngomane,@Robert Russell true that but for articulation purposes he can choose the language of his comfort
1562228830213151,26:18,Thapelo Motabogi,😂😂😂😂
1562228863791059,26:51,Siboleke Mhlana,the guy was testifying in Zulu yesterday but yenye language today🤔... I think this guy understands English and can speak it very well
1562228872463839,27:00,Thapelo Motabogi,ke o o araba ka sekgowa
1562228885284000,27:13,Elijah Ratswele,He will tell the truth no matter what
1562228885442859,27:13,Wildthing,it's not the same guy
1562228888707439,27:16,Thapelo Motabogi,😂😂😂😂
1562228897723774,27:25,MCEBISI MBUSI,Woow
1562228946088937,28:13,Robert Russell,I will put my house on it that Zuma will use a translator just to waste time and money as well as frustrate the commission
1562228961915840,28:29,Joburg CEB Lion,"Believe there is no delay tactics. Language is very important. Let's ignore the language, lets listen the points/evidence. Liar is liar irrespective of language"
1562228980840358,28:48,Kuthula Majola,​He were able to prepare verbal notes but he can't express him self in English
1562229003087669,29:10,Ashne Hesselberg,Give this guy a chance before criticizing him. We haven’t even heard his evidence yet!!
1562229003548030,29:11,clive oconnell,All diplomatic languages are in French or English. All visas are in English. His testimony is in English
1562229033840821,29:41,Aniceth De Missamou,@makhosi nobhatyi you're right. The you needs to invade the ANC so they can take over. Was there a translator while he was assisting the Indians?
1562229051057713,29:58,Phillip Cwazibe,@ Thami Ngwenya indeed
1562229065216624,30:13,makhosi nobhatyi,"Kolwana is back in the country, he will take stand if also decides to lied sorry for him he must go to jail"
1562229119664483,31:08,clive oconnell,Guptas didn’t need translators just 💰💰
1562229129507409,31:17,Aniceth De Missamou,"The guy just spoke English as the translator is slow. I, myself have used a translator to avoid paying a traffic fine in court and I got away with. Just the truth"
1562229133949100,31:22,cassim suleman,y not producing note verbale..had enough time to prepare
1562229152107864,31:40,Molly Dhlamini,"The ANC is for all language speakers , not only the Zulus, please read the constitution of the ANC"
1562229168095521,31:55,makhosi nobhatyi,@Aniceth De missamou hey I don’t think so people like these it is easy to be bribed
1562229179206816,32:06,Thami Ngwenya,Judge is taking over leading to save time
1562229193352644,32:21,Derek Main,@Molly Dhlamini The ANC is for looters and thieves - no matter what language they speak.
1562229211250931,32:39,Norman Zwane,@Aniceth De Missamou The constitutional recognition of our home languages was to ensure that the principle of equality before the law is not slanted to favour the dominant. Just accept it.
1562229213847186,32:41,MCEBISI MBUSI,he looks know nothing about his work...what is his academics?
1562229217830355,32:45,Molly Dhlamini,Derek Main that is not true
1562229225552784,32:54,Deon February,"People stop nagging about the ""fact"" that the witness can speak English - he is allowed to speak the language of his choice. When YOUR future depend on the facts you share, YOU have that right too."
1562229234088165,33:02,Caroline Hawanga,Me and the blocking button again
1562229237201541,33:05,Nwazs Media,"@Thapelo Motabogi exactly my point it a waste of time, he'll take the whole delivering his testimony"
1562229240649920,33:08,Nelson Musoliwa,The witness leader is seemingly new or intern
1562229242278252,33:10,makhosi nobhatyi,Why do you accept ordinary people to be applied there
1562229253338898,33:21,Thami Ngwenya,Derek you starting now
1562229265822834,33:33,Robert Russell,@Molly Dhlamini.... The DCJ Zondo is also Zulu so why does he not use a translator then..... English is clearly note his mother tongue
1562229302094918,34:09,Derek Main,@Molly Dhlamini It's been proven over and over again. More of that will come out here at the commission.
1562229370380435,35:18,Molly Dhlamini,Derek Main do you understand the definition of a thief?
1562229400609638,35:48,Derek Main,@Molly Dhlamini I think so - someone who takes what does not belong to them.
1562229454367603,36:42,Robert Russell,I'll answer that for Derek..... it's spelt ANC
1562229466557161,36:54,Wildthing,ha ha
1562229499967279,37:27,Phillip Cwazibe,Derek Main ​@Molly Dhlamini I think so - someone who takes what does not belong to them without owners permission/consent.
1562229501641179,37:29,Pedro Daniel Pfaff,So sad.So very sad.The shame I feel is unbareable.Unbareable is the shame i feel
1562229505151126,37:32,Molly Dhlamini,"Derek Main , you must contextualise who is the thief in South Africa. The definition is not divorced to the context"
1562229506854095,37:34,Bongani Ntuli,Robert Russel come on the judge uses english sir in court what is your urgument ?
1562229519439498,37:47,Norman Zwane,@Deon February I think we dealing with folks who have no idea how frustrating it is to be misunderstood. You get spoken to in a language that is secondary to your instinct to protect yourself.
1562229545848863,38:13,Deon February,My Note Verbal : This will be a loooooong day for the Judge.
1562229560825088,38:29,Magda Seguin,@I Am Free that is fake news
1562229597078062,39:04,Phillip Cwazibe,@ Yose Human What have we done as a nation of Zulus.
1562229597534887,39:05,Derek Main,@Molly Dhlamini All ANC deployees seem to be thieves. That is not to say they are the only thieves but the is looting of public funds by ANC cadres at all levels of government.
1562229616205175,39:24,makhosi nobhatyi,Does something like this happen b4 or is it just something new? Why would you broke the protocol?
1562229639267394,39:46,frederick Mashavhela,this guy is interfering to me he understands English very well but soon he will spill the Beans
1562229691244161,40:39,Ibo Thabo,@I Am Free so what?
1562229696722635,40:44,Magda Seguin,Nice to you too @I Am Free
1562229698668975,40:46,Michael Michael,he can speak English.usile qha
1562229715874965,41:03,Molly Dhlamini,"Derek Main, that is a sweeping statement and it’s not true. I challenge you to analyze a capitalist system and the role of the state in a capitalist system and the class that the state serves there"
1562229733876114,41:22,KEITH SINDILE DINABANTU,"Oh gosh, i was about to ask where is the interpreter with a nice roaring voice?"
1562229752599824,41:40,Ibo Thabo,why shall he speak english? this is not england
1562229753796419,41:42,Norman Zwane,"@Ibo Thabo @I Am Free is a troll don't go down that line, it's a rabbit hole."
1562229756030854,41:44,cassim suleman,we got bigger than zuma...ace magashule..watc this space
1562229788869411,42:16,Ibo Thabo,@Norman Zwane THANK YOU
1562229789680573,42:17,KEITH SINDILE DINABANTU,Jaguar Ftype kind of a roaring voice...
1562229789945329,42:17,Michael Michael,can u hear him now
1562229827945294,42:55,carnoth ngomane,will the evidence be different if he was speaking in English?
1562229835405444,43:03,Derek Main,@Molly Dhlamini Are you saying the ANC cadres have not been stealing public funds?
1562229846970389,43:14,Molly Dhlamini,Spot on Ibo Thabo- our people need to emancipate themselves in their minds- it’s urgent and crucial
1562229892319622,44:00,MCEBISI MBUSI,anc robberies
1562229904520027,44:12,Norman Zwane,The big players in the ANC used these small guys and then let them hang out to dry.
1562229907781727,44:15,Robert Russell,IMHO @Derek Main .... they stole more than most
1562229910855412,44:18,Moshoeu Mabusela,"@Yose Human. your love or hatred for zulus is noted. say something different, for progress."
1562229942207325,44:50,Derek Main,@Molly Dhlamini Please explain what the relationship between capitalist system and state have to do with stealing public funds.
1562229974911331,45:22,Derek Main,@Robert Russell At every possible opportunity.
1562229976706933,45:24,Thulani Bukani,I'm thinking of blocking Yose. always Zulu this and Zulu that. come on bra. We are dealing with Waterkloof here
1562229983363522,45:30,Molly Dhlamini,Just study that and then we can talk- use class analysis as you do it
1562230007794230,45:55,KEITH SINDILE DINABANTU,I like this young looking evidence leader. But i am missing my favourite Ms September big time
1562230008566096,45:56,Derek Main,@Molly Dhlamini Sounds like a cop-out to me.
1562230012613967,46:00,Sthakathi Khumalo,"This commission is slowly becoming a circus, I am gonna come speaking mandarin now"
1562230014021773,46:02,Norman Zwane,"@Molly Dhlamini @Yose Human @I Am Free are trolls, be careful you'll waste the whole day"
1562230056410917,46:44,Derek Main,@Molly Dhlamini Why don't you answer the question - do you deny that ANC cadres have been stealing public funds?
1562230082459238,47:10,Thulani Bukani,You are the tribalist Yose mfondini
1562230099502040,47:27,Michael Michael,Correct Alam
1562230110928854,47:38,Ibo Thabo,"@Molly Dhlamini I am with you 100% and I must warn that no nation ever in history developed by using a borrowed tongue, so those thinking we will by using European tongues they are blinds fools."
1562230129873076,47:57,Sthakathi Khumalo,"I feel for this child leading the evidence, you don't even know whether your leading is key but these translations shame"
1562230174582046,48:42,Ndivhuwoo ndivhu,yooooooo😂
1562230192351399,49:00,KEITH SINDILE DINABANTU,"@Thulani Bukani LOL. Yose is firing missiles and bombs at what he/she calls ""Zulus."" I only know black South Africans with their first language being Zulu."
1562230194621015,49:03,Norman Zwane,@Tikvah Olam Its not a crime to ask for translation. It is equally not a crime to understand English as well. None is exclusive. I know a lot of people who can conduct a conversation better in both
1562230198175051,49:06,Molly Dhlamini,"Ibo Thabo, true that. The VC Of UCT did a study of learning Mathematics in a multilingual medium and her findings was that it brings more positive results."
1562230198329995,49:06,Phumla Setlhoke,"DP is very smart these people they don't know who they dealing with. DP got what he wanted for now, this man is now free to contradict himself"
1562230202976650,49:10,Michael Michael,Yose are u waried about the country or with Zulu speaking people??
1562230218256366,49:26,Robert Russell,@Ibo Thabo.... same argument as yesterday that someone posted.... how about America and the Red Indians.... guess that is not a big enough success story for you
1562230225972578,49:33,Dominic Przybylski,International language of communication should not be a 1st language of any country. It should be done in an international 2nd language like Esperanto.
1562230251865072,50:00,KEITH SINDILE DINABANTU,@Michael Michael LOL...Yose is worried about Zulu speaking.... i stopped entertaining this months ago
1562230268381685,50:16,carnoth ngomane,Lets learn to love and appreciate our languages and remember speaking english fluently doesnt mean you are intelligent
1562230273255774,50:21,mike molefe,"Hahahaha, this guy is speaking english mos!!"
1562230280224671,50:29,KEITH SINDILE DINABANTU,@Dominic Przybylski Agreed.
1562230283120575,50:30,Thapelo Motabogi,😂😂😂😂
1562230295822657,50:44,Thapelo Motabogi,"i said it,he's wasting our time"
1562230299648003,50:48,Phillip Cwazibe,Irritant is repeating what has been said in English.
1562230299820797,50:48,Derek Main,@Molly Dhlamini Still waiting....
1562230302536788,50:50,Michael Michael,Yose can u suggest any solution ???
1562230315570478,51:03,KEITH SINDILE DINABANTU,@mike molefe Time wasting tactics here lol
1562230335067772,51:22,funicanz,Are we still translating?
1562230340158721,51:28,funicanz,Morning my people.
1562230345780024,51:34,Michael Michael,no
1562230348993033,51:37,KEITH SINDILE DINABANTU,@funicanz Hi mntase
1562230362866941,51:51,mandla motsoeneng,he can speak english 😎🤷
1562230369648326,51:57,Ndivhuwoo ndivhu,No need for interpretor here.... The Guy is speaking English 🤣🤣
1562230370743011,51:58,KEITH SINDILE DINABANTU,LOL
1562230416271361,52:43,funicanz,"@Keith Sindile Edinabantu, ndifike late ke namhlanje mtakwethu. 😗😗"
1562230419090452,52:46,KEITH SINDILE DINABANTU,@Yose Human aRE you on Twitter or....Facebook ?
1562230423810174,52:52,Solomon Koko,I have stopped my support for ANC after the landing of that aircraft. I remember Zuma telling us that only clever ones will question that. That s when I realised that I was following a bloody fool.
1562230423815857,52:52,Solomon Koko,I have stopped my support for ANC after the landing of that aircraft. I remember Zuma telling us that only clever ones will question that. That s when I realised that I was following a bloody fool.
1562230440911834,53:08,KEITH SINDILE DINABANTU,"@funicanz Ndiyabona nam, ubuphi?"
1562230465584667,53:33,Thulani Bukani,Yes @Solomon and ANC hasnt changed much since then
1562230498946597,54:07,makhosi nobhatyi,They are all running away to the fact to jeopardize the meaningful of the report
1562230512514476,54:20,KEITH SINDILE DINABANTU,"@funicanz Had to first do some minor service early morning, it was 6 degrees....and i didn't finish cause i was slow...frozen."
1562230536126885,54:44,KEITH SINDILE DINABANTU,Had to rush and work on my career stuff also
1562230566817003,55:14,Norman Zwane,Most folk do not know what WHITE PRIVILEGE IS: White privilege is expecting that all people should converse only in your language and to then suspect use of another language as being evasive.
1562230583144612,55:31,Robert Russell,YOH and also writes in English
1562230617437678,56:05,Sofia Sofia,Writes in English but can't understand ???? Am I understanding this correct ?
1562230651257116,56:40,KEITH SINDILE DINABANTU,"@Solomon Koko Same here, and in 2014, i ensured he doesn't get my vote. Some of us woke up early hey"
1562230661070572,56:48,Robert Russell,Apparently so @Sofia Sofia
1562230675331874,57:03,Dominic Przybylski,"What is zulu for ""ambassador"" and ""personal assistant""?"
1562230718185580,57:45,Sofia Sofia,@Robert Russell THIS IS A JOKE !
1562230742952330,58:11,Norman Zwane,@Sofia Sofia You did not. He said he prefers to respond in his home language - any problem there? He never said he does not understand English. He made a constitution allowed choice.
1562230777326864,58:45,clive oconnell,@Norman Zwane Nowhere in this big world 🌍 will I find signs at airports or road signs in Zulu
1562230785409007,58:53,Robert Russell,It's just getting the commission ready for when Zuma is here @Sofia Sofia
1562230802954000,59:10,Tshepo Monakedi,The interpreter is in a mood 😃
1562230806741086,59:14,carnoth ngomane,@Sofia Sofia SO IT WOULDNT BE A JOKE IF HE WAS GIVING EVIDENCE IN ENGLISH
1562230822999373,59:30,Dominic Przybylski,I have the privilege of perceiving myself as an individual rather than as a skin colour. I guess that's probably seen as white privilege.
1562230828748955,59:37,Sofia Sofia,"@Norman Zwane - BUT WHY ? When he was being corrupt did he want to do it in his ""Home Language""?"
1562230883138322,1:00:30,Yolo More,Mr note verbal
1562230908635952,1:00:57,Waterbearer,“Your ship”🤩
1562230914041793,1:01:01,funicanz,"@Keith Sindile Dinabantu, had to run some errands before going to work. Let's just say mom refuses to take Gautrain to the airport. She still insist, I take her, park, and check her in."
1562230914726569,1:01:02,Sofia Sofia,@carnoth ngomane you should get the point ! I see you nearing the racist card there ! not going to happen my friend !
1562230919654628,1:01:07,Norman Zwane,"@clive oconnell Geez!! Are you an expert at stating the obvious or you just being thick? Where else in the world big as it is, is Zulu spoken? Get a life man."
1562230923905698,1:01:12,joe nkabinde,its very painful to see or leseaon
