timestamp,time,author,message
1548677453022037,9:23,jeevan singh,wow what
1548677458702350,9:29,FRANS SEBOLA,U can say that again....Woooow
1548677483827932,9:54,Stephan Dolk,Just conne ed.
1548677503476972,10:13,Stephan Dolk,wow what. Just connected
1548677503593001,10:13,Ewald Kruger,Just missed that! What happened guys?
1548677575387084,11:26,adam october,what you do in the dark shall come to light
1548677581757875,11:31,Mfazozo Mthethwa,yaaaa neh dudu myeni u a corrupt really like u father
1548677592180335,11:42,S Mhlabase Msibi-Gordon,the rot runs so deep in South Africa
1548677632597709,12:23,Mfazozo Mthethwa,Zuma dudu myeni Zuma
1548677777132959,14:47,Prescott Smith's Fly Fishing Academy,watching from The Bahamas
1548677888672645,16:39,Themba Zulu,"Anywhere where corruption is discussed, you 120% that zuma's name will be mentioned...yhoo mabasale bemphumuza okhokho bakhe, aphumule. this is too much."
1548677899215479,16:49,S Mhlabase Msibi-Gordon,"i'm in Hanoi, Vietnam. so embarrassing when my friends see this.. but i hear this happens here too"
1548677935311203,17:25,Prescott Smith's Fly Fishing Academy,I hope South Africans vote out the ANC so they can have to true economic INDEPENDENCE . get their land and control of their MINERAL RESOURCES
1548677981332253,18:11,Michael Michael,Prescot no ways
1548678024423066,18:54,Jack Sparrow,@Prescott Smith​ mineral resources aren't in big demand nowadays
1548678077653942,19:48,Peter Sant,Zuma was just a demon came to sell our country
1548678098776885,20:09,S Mhlabase Msibi-Gordon,jack sparrow what do you think the demand for land is?
1548678152992221,21:03,Jack Sparrow,"@S Mhlabase Msibi-Gordon demand for land is high, but nobody is going to get their own little piece, like they imagine"
1548678186085233,21:36,Peter Sant,we can't blame ANC by giving a person an opportunity to serve his people.yet changed to be corrupt
1548678238438634,22:29,Prescott Smith's Fly Fishing Academy,"Michael Michael well the root is the same we face here. the COLONIAL structures means they only gave you political INDEPENDENCE, while they buy the politicians by funding your elections."
1548678256106216,22:46,Kabamba Chipulu,theres a smoking gun....
1548678317101324,23:47,Mollo Booi,"nono @ Peter Sant, the rot didn't start with Zuma. Zuma just ate with different people then they exposed him.."
1548678356513356,24:27,Prescott Smith's Fly Fishing Academy,"Jack sparrow The U.S., Europe and now China all suck the mineral resources from all throughout Africa, while they prop up corrupt politicians and maintain the economic apartheid system"
1548678388777985,24:59,S Mhlabase Msibi-Gordon,but Peter Sant it is members of the anc who either perpetuated or turned blind eye on corruption. they have been entrusted by the majority of south africans yet they betray
1548678426087246,25:36,Jack Sparrow,@Prescott Smith with the price of resources at the momeny there's no point in taking it out of the ground
1548678466401430,26:16,Lusalobe Kabamba,This is scary. it appears that the country was not only captured by the Guptas
1548678590568867,28:21,Ramasodi Sekgothe,The guptas are just a fraction of the corruption that took place during jacob's reign. Bosasa is corrupt.
1548678606303250,28:36,Prescott Smith's Fly Fishing Academy,"Jack sparrow MINERAL RESOURCES comes in many forms. it's not just gold, diamond, copper or platinum. Africa and blacks all over the world will never be truly Free unless apartheid truly ends."
1548678626781427,28:57,Kids Collie,Lol Dudu sent text messages to ENCA about todays testimony
1548678682911373,29:53,Jack Sparrow,@Prescott Smith who in the world is truly free?
1548678735095465,30:45,Prescott Smith's Fly Fishing Academy,"When South Africans vote vote out this level of corruption and take control of the their land, it means blacks all over the world can truly be free. Berlin Conference was all about LAND & MINERALS"
1548678787115380,31:37,Usuthu Deep,I LIKE IT MR AGRIZZI BUT YOU ALSO YOU MUST GO DOWN WITH THEM
1548678826821262,32:17,Kids Collie,"@Thando Nkutha ""For the record I have never had a meeting at Bosasa offices with Gavin. We went as a delegation to the prawn plant. It was an official visut. This man is lying"""
1548678839820306,32:30,Kids Collie,*visit
1548678842829960,32:33,Prescott Smith's Fly Fishing Academy,Jack sparrow I am quite sure you fully understand the history of Africa and Europe. They are all through Africa only because of Land and mineral RESOURCES.
1548678843405760,32:33,Jeff Towell,Blacks are in control Prescott in South Africa. This level of corruption was voted in under a free and fair vote.
1548678945706606,34:16,makhosi nobhatyi,🤦‍♀️😃😃😀
1548678949689963,34:20,jeevan singh,The ANC must fall come next election. only idiots will vote them into poor.
1548678966603624,34:37,Desmond Masilela,Zuma now......!!!!!
1548678974902353,34:45,Prescott Smith's Fly Fishing Academy,"Jeff towell blacks are not in CONTROL in South Africa, where I live in The Bahamas is no different. political INDEPENDENCE ONLY with puppet politicians. Throughout The Caribbean is the same."
1548679003112198,35:13,Risuna Manganyi,yhuuuu
1548679014348611,35:24,Zolani Mnqika,😎
1548679023987959,35:34,Mzwanele shange,Ramaphosa us going to clean this cowntry..... viva ANC 75% of the electorate viva ✊
1548679081053120,36:31,Jeff Towell,"Prescott, I cannot speak for the Bahamas. There is however, no claim in South Afirca or by any independent electoral committee that the ANC is in power without a majority black vote."
1548679108315422,36:58,Jack Sparrow,"@Prescott Smith I'd love to see the end of the ANC, but the political will to get rid of them isn't there"
1548679111644238,37:02,Mzwanele shange,ANC must pull a zanupf on all those who doubt it...... unleash the soldiers and whip them 😊
1548679137465622,37:27,Kids Collie,@nichol shange what soldiers? hahaha
1548679138953468,37:29,Zolani Mnqika,Unendaba lomfo😂😂😂
1548679153467721,37:43,Dan Bourne Yeshurun,Yayy back
1548679154338327,37:44,Mzwanele shange,whip them ANC whip them✊✊✊✊✊✊✊
1548679194422908,38:24,"Ike, Mashaba",ANC must take 5 years break it will come back disciplined
1548679221062706,38:51,Thulani Bukani,It’s getting real now!!!
1548679226504472,38:57,Temezulu Tshabalala,ANC will never loose governance of this country to the opposition but will surrender to the opposition.
1548679256429036,39:26,Prescott Smith's Fly Fishing Academy,"Jeff towell , I have studied this system all over the globe. most of the mineral resources on Earth are in Africa. The COLONIAL status quo only gives you political INDEPENDENCE."
1548679267869589,39:38,Mzwanele shange,minister of defense should unleash soldiers on the people who registered to vote other parties than the ANC.... those need a whipping hard! ✊
1548679290693559,40:01,Dan Bourne Yeshurun,Dudu Myeni already responded..
1548679295409159,40:05,Jack Sparrow,@nichol shange you may notice that nobody's taking your bait...
1548679302829415,40:13,MIKE DURBAN,Hehehe...die poppa gaan nou dance...
1548679309323550,40:18,Dan Bourne Yeshurun,lol send me
1548679321692797,40:32,"Ike, Mashaba",@Thando Nkutha this has been order of the day
1548679325989694,40:36,Dan Bourne Yeshurun,send meat #mamaaction
1548679349216884,40:59,Mzwanele shange,it's no bait but a direct statement to comrades who are here on YouTube in millions....
1548679393139748,41:43,Jack Sparrow,"@nichol shange millions, or 1325. Either way"
1548679402419911,41:53,Prescott Smith's Fly Fishing Academy,Jack sparrow beleive you me I am speaking truly from a neutral point all the way from The Bahamas. we are faced with the same economic apartheid system.
1548679417204607,42:07,MIKE DURBAN,@Nichol...hehee...you brainwashed my Bra..
1548679502338884,43:32,Dan Bourne Yeshurun,thuma ukudla
1548679504933601,43:35,Bongumenzi Nxumalo,Bullet proof lols
1548679515543891,43:46,Chima Ramukhesa,😂
1548679544552019,44:15,Jack Sparrow,"@Prescott Smith you call it economic apartheid, but it's just the power of capital - like marx described 150 years ago. Nothing has changed"
1548679556557460,44:26,Njabulo Khuzwayo,Guys can anyone get us drinks I can't move
1548679567401511,44:37,Chima Ramukhesa,@goolamv you can say that again🙆🏽‍♂️
1548679569787276,44:40,Thabang M,😉Bullet proof
1548679570187559,44:40,Jeff Towell,"Prescott, you're welcome to your conspiracy theories. I do not support the ANC but accept that they have majority support. You get what you vote for - no one else to blame."
1548679774062398,48:04,Viwe NGELE-NGELE,I think his drinking hot staff
1548679809581389,48:39,Vogue Ham,when wilp je talk about ramphoria shady deals? fake commission
1548679817607977,48:48,Sanele Ntshangase,@goolam he's moving his assets for dure.
1548679827611314,48:58,Thabang M,He's definitely watching
1548679829945903,49:00,Viwe NGELE-NGELE,his on medication also
1548679854972376,49:25,MIKE DURBAN,Dubai...??????
1548679898801265,50:08,"Ike, Mashaba",Baba is in the centre of debacle
1548679936346767,50:46,MIKE DURBAN,Also for Jacob and Co...
1548679982564536,51:33,Hilda Monama,dont thnk so he wont cme struu mnx
1548679990129235,51:40,"Ike, Mashaba",Baba must come and answer for himself
1548679999130704,51:49,Mzwanele shange,Agrizzi is a stounch criminal.. a shady character of note..... whose word shouldn't be taken at face value. one has to apply themselves carefully listening to him.
1548680031778267,52:22,Eslon Eslon,The biggest mistake the ANC made which am sure they are regretting now was to make Jacob Zuma president
1548680053415634,52:43,MIKE DURBAN,@Nichol....the law courts will decide.....
1548680100917465,53:31,Dan Bourne Yeshurun,lol refute 10 years of damning evidence
1548680109763029,53:40,jeevan singh,Zuma is the downfall of the ANC.
1548680116981176,53:47,Amanda Bentsile,@Eslon Eslon thats true because it's all because of him sebuchitheka bugayiwe
1548680131176238,54:01,Jack Sparrow,@jeevan singh is captured
1548680162586973,54:33,S Mhlabase Msibi-Gordon,but Agrizzi has at not point disputed being in it. he'shere because he is a whistle-blower. he will have his day in criminal court
1548680186517889,54:56,Mzwanele shange,in the olden days underground this con job would have been dealt with....vrry early
1548680190699513,55:01,Amanda Bentsile,When looks the other side what/who is he looking at?
1548680196102382,55:06,MIKE DURBAN,Guys......the truth will always prevail......doesn't matter how long it take.......the long arm of the law etc etc..
1548680248077288,55:58,Mzwanele shange,what a criminal this Agrizzi is.....
1548680273028990,56:23,Bridgette Kekana,yes Mike Lock
1548680299401294,56:49,Kids Collie,@nichol shange Dudu is that you?
1548680312216288,57:02,Tumiso Makgolane,those implicated should be arrested
1548680327490432,57:17,Eslon Eslon,They remove Thambo Mbeki simply bcos they all wanted to steal but things are now badly backfiring and the image of the party completely damaged
1548680392008826,58:22,Pumla Mtyeku,Spot on...@Elson Elson👏
1548680422396088,58:52,Pumla Mtyeku,Thabo!
1548680437108968,59:07,Bridgette Kekana,spot on
1548680443952018,59:14,Billy Mathibela,completely damaged
1548680470440679,59:40,Eslon Eslon,whoever vote for the ANC after hearing all this damming revelations will be voting to further corruption and they will make fool of themselves
1548680501505622,1:00:12,Bridgette Kekana,we are no longer fools
1548680510078220,1:00:20,Phillip Khomo,k
1548680527542259,1:00:38,Billy Mathibela,i never vote for anc
1548680541651782,1:00:52,Itumeleng Mokoena,VIVA ANC VIVA!!!
1548680546003600,1:00:56,Itumeleng Mokoena,ANC
1548680547724335,1:00:58,Itumeleng Mokoena,ANC
1548680549137694,1:00:59,jack frost,DA all the way!
1548680549665604,1:01:00,Itumeleng Mokoena,ANC
1548680564291576,1:01:14,Phillip Khomo,why
1548680592481220,1:01:42,Itumeleng Mokoena,"In your dream Jack, DA will never govern"
1548680618897074,1:02:09,Mzwanele shange,viva ANC viva.......
1548680642117786,1:02:32,Bongumenzi Nxumalo,Regie Regie!!
1548680642242971,1:02:32,jeevan singh,DA WILL GOVERN
1548680643272480,1:02:33,jack frost,WP a province that actually works 😃
1548680660597560,1:02:50,Phillip Khomo,I think need to know politic
1548680664916280,1:02:55,Itumeleng Mokoena,Amandla!!! Cde Nicholas
1548680667425311,1:02:57,Bongumenzi Nxumalo,Ben 10 kaNomvula Reggie wabantwana
1548680677542133,1:03:08,James Tyamzashe,Reggie Malema said it
1548680678128908,1:03:08,Ewald Kruger,Let me block @Itumeleng Mokoena. He has a runny tummy
1548680705121163,1:03:35,Ntsikelelo Macingwana,.
1548680719389768,1:03:49,Julia Ndudula,Nomvula like them young 😂😂
1548680746657727,1:04:16,Amanda Bentsile,A whole lot of ppl did not register meaning they wont vote so ANC must not even begin to cheat this time thier image has been tainted DA keyona bayiqhubeke iphuphe ..EFF izawuvoutelwa ngoNzipho
1548680747029768,1:04:17,Mogamat Allie,dudu is playing race card ...calling agressi is bitter racist...shame dudu
1548680765391118,1:04:35,Itumeleng Mokoena,LOL @Ewald
1548680846584159,1:05:57,Kids Collie,@Ewald Kruger Hahaha
1548680910027664,1:07:00,Bonolo Easy Masomeng,Are we having Zuma's fan base here?
1548680921640609,1:07:11,Phillip Khomo,where on earth on party run the country. mean yes there opposition
1548680923549167,1:07:13,makhosi nobhatyi,Am worried about life of this guy
1548680933407813,1:07:23,Eslon Eslon,"Bottom line this whole corruption was initiated, facilitated and enabled by the ANC and the Jacob Zuma cabals period"
1548680975289897,1:08:05,MIKE DURBAN,@Eslon....spot on.
1548681004903104,1:08:35,makhosi nobhatyi,Fooled us as ANC members put this party into this kaka
1548681006498315,1:08:36,MIKE DURBAN,Now they going Down.....
1548681021897755,1:08:52,Viwe NGELE-NGELE,sad reality is that ANC will still win elections even after all this things wow
1548681048211928,1:09:18,Amanda Bentsile,Guys cela ubuza iBosasa owonawona msebenzi weNkapani kwakuyintoni besides bribery
1548681106087711,1:10:16,Viwe NGELE-NGELE,@Amanda lamandoda ebesenza yonke into uyaweva phofu from building to consulting olindela kwa Home affairs
1548681115291431,1:10:25,Gregory Libera,Did BOSASA design the Commission's background logo displaying the funny smiley face wearing the SA Flag as a hat?
1548681131276673,1:10:41,Samuel Mompati,Reggie Nkabinde has been( Agrrized)Exposed
1548681132107993,1:10:42,James Tyamzashe,just wish these was live on sabc cause some off the people who vote for anc don't have dstv
1548681178658678,1:11:29,Eslon Eslon,Is there any other political parties politicians so far being largely implicated far more the ANC ones in this commission?
1548681179015263,1:11:29,Bongumenzi Nxumalo,Amanda Bentsile; They wanted to sequence a state capture where they would distribute major corporate deals to themselves. Bribes were their primary vehicle
1548681186933144,1:11:37,FRANS SEBOLA,Bosasa is a cleaning/catering and security company
1548681188519137,1:11:38,Viwe NGELE-NGELE,"@Amanda uyeva thy even do pools, cameras, painting lol uyeva anything"
1548681239175689,1:12:29,makhosi nobhatyi,"I am starting feel pain and shame for the sitting president that’s why they were against mr Ramaphosa knowing that he is going to throw them to prison, we will vote for you mr president, bossasa was"
1548681252099884,1:12:42,makhosi nobhatyi,Blackmail you
1548681277787645,1:13:08,Hendrine de Wet,"What is wrong with Agrizzi today. He's not answering the questions asked, he rambles on about things off point. Did he not do his home work this weekend? Did some of Watsons bragging rub off on hm?"
1548681279245868,1:13:09,Bongumenzi Nxumalo,makhosi nobhatyi But the president son has contracts with Bosasa what do you mean??
1548681290630674,1:13:21,Viwe NGELE-NGELE,@Makhosi useza uMr Ramakaka wakho naye apha relax take a chill 💊
1548681400588753,1:15:10,makhosi nobhatyi,Guys don’t you see these guys play their ball seeing nkosazana had no chance to win so they send bossasa
1548681437850280,1:15:48,Viwe NGELE-NGELE,@Makhosi what r you saying
1548681445206473,1:15:55,makhosi nobhatyi,Ramaphosa has nothing to do in this crime
1548681499659184,1:16:49,Viwe NGELE-NGELE,@Makhosi relax Mr Ramakaka got R500k from Bosasa
1548681503358784,1:16:53,Sibusiso Madondo,##cough##
1548681525152340,1:17:15,Eslon Eslon,The Malema ANC youth league must be blamed for removing an innocent Thambo and giving South Africa a crook president(Jacob Zuma)
1548681543675297,1:17:34,Risuna Manganyi,well the BEE issue is the norm.
1548681555156411,1:17:45,nelushi vhahangwele,elson elson I second that
1548681560503398,1:17:50,Viwe NGELE-NGELE,@Ancyl was used thy took advantage of poor kids marn
1548681574337560,1:18:04,MIKE DURBAN,@Elson...that exactly was the plan....
1548681586285918,1:18:16,nelushi vhahangwele,BEE ...
1548681605914934,1:18:35,Risuna Manganyi,the camera crews have been paid. hahaha
1548681607274470,1:18:37,Bongumenzi Nxumalo,he hides haha
1548681627153969,1:18:57,Samuel Mompati,Dudu Myeni should come to the commission and defend her self.... as simple as that she cannot defend herself only on media statements only.
1548681644083790,1:19:14,Bongumenzi Nxumalo,He hides again
1548681644782848,1:19:14,what?,lol
1548681667668693,1:19:37,MIKE DURBAN,BEE is Bad Economic Empowerment.....that is a fact..
1548681685789815,1:19:56,nelushi vhahangwele,MIKE LOCK you are right
1548681688264487,1:19:58,Wildthing,who ducked down.
1548681708837482,1:20:19,makhosi nobhatyi,"Malema didn’t send Zuma to do wat he pleases when malema and vavi immediately turns against Zuma , they were fire because duduzane father has sweet tongue to be heard"
1548681721558883,1:20:32,jeevan singh,Malema is the one who got Zuma appointed as the President and Malema is the one who got him removed. mmm Who is running the ANC.
1548681759065407,1:21:09,nelushi vhahangwele,malema is running the ANC indirectly #fact
1548681836176978,1:22:26,myname is love,what's this about?
1548681886573107,1:23:16,Njabulo Khuzwayo,Myname where do you live this the biggest thing right now in SA😔
1548681892916024,1:23:23,MIKE DURBAN,Heard Malematjie is softening up with jacob...
1548681932475024,1:24:02,myname is love,I'm in the states dear.. I'm trying to get up to speed on current event's..
1548681937743607,1:24:08,makhosi nobhatyi,"This guy came as a surprise to Zuma, he didn’t know 😃😃😀 now we see how it all started"
1548681990771912,1:25:01,makhosi nobhatyi,Pay back the money Zuma where is R250m?
1548682009618839,1:25:19,Dan Bourne Yeshurun,Lol Afriforum wants in on the WMC
1548682024251826,1:25:34,MIKE DURBAN,Maybe R250 Billion......
1548682029279862,1:25:39,Dan Bourne Yeshurun,Antarctic cold
1548682031247595,1:25:41,roberto wilco,Its in dubaii or spent
1548682039861081,1:25:50,Bongumenzi Nxumalo,Agrizzi is weird today
1548682058104351,1:26:08,Bongumenzi Nxumalo,he say decrease air con and then feels hot
1548682064129447,1:26:14,myname is love,my grand daughter is Sudanese and also trying to keep eyes open on South Africa
1548682079949449,1:26:30,pretty selogadi,haahaa he is feeling hot...Agrizz Bp is high
1548682120553443,1:27:10,Carol Trehearn,He looks exhausted poor man
1548682121507482,1:27:11,makhosi nobhatyi,@Grant Wikinson we will go and fetch it
1548682163968352,1:27:54,Julia Ndudula,He looks drained today
1548682168566021,1:27:58,Olack Foods,haahahaha Carol Treheam poor man?
1548682198190664,1:28:28,Eslon Eslon,Thambo Mbeki was removed bcos he warned the ANC to be careful of making JZ the president bcos of the pending arms deals case against him at that time
1548682204131248,1:28:34,makhosi nobhatyi,They will kill this poor man am being serious worried does security last longer?
1548682227185118,1:28:57,myname is love,Land grabs i see now.. Hoshuwa jijabo
1548682268633919,1:29:39,Jeremy P,makhosi eish thats the truth. im sure they have hitmen allover the place gunning for the contract on his head. and by the sounds of it Bossassa can affprd such
1548682279125573,1:29:49,Makho Theo,Cyril seems to be Awfully quite Of the proceedings
1548682310515247,1:30:21,Terence Makgalo,what do you want Cyril to do @Makho Theo
1548682332774391,1:30:43,myname is love,i hear Russia owns Zimbabwe now true?
1548682355083446,1:31:05,Makho Theo,He’s in Charge/ His the legal Gavin
1548682405277161,1:31:55,jeevan singh,Money grabbing done. now land grabbing begins. Then kiikking out of the country will begin. Get prepared now.
1548682419039021,1:32:09,Viwe NGELE-NGELE,@myname is love when did thy buy Zimbabwe
1548682443680330,1:32:34,myname is love,selling rights to Russia and china.. what could possibly go wrong...
1548682445540032,1:32:36,jeevan singh,last week
1548682482509574,1:33:13,Zolani Mnqika,Yho
1548682507947434,1:33:38,myname is love,i have seen many video's about it let me find one..i believe it was broadcast when the internet came back online
1548682532024703,1:34:02,myname is love,in Zimbabwe
1548682624236510,1:35:34,makhosi nobhatyi,Hey guys we need to review partnership of bricks
1548682639931733,1:35:50,Makho Theo,Well said
1548682684279721,1:36:34,jeevan singh,Zuma got a recording contract. his first song with Dudu goes like this. I'm dancing in the dark. With you between my arms. PERFECT. 🤣🤣🤣🕺
1548682698947076,1:36:49,myname is love,all Boers go to the US embassy and seek asylum please
1548682744241540,1:37:34,MIKE DURBAN,Reckon the Marines are coming......
1548682762836054,1:37:53,Makho Theo,We need food 🥘 shelter 🏡 and largest concern is Education (Relative 🐝📚💭☑️)🗺
1548682816988051,1:38:47,myname is love,11 Dog's Incorporated has a video about Putin and ZiMbabwe
1548682820009760,1:38:50,MIKE DURBAN,Thumbs up fUncle Donaldor
1548682828415178,1:38:58,makhosi nobhatyi,"Bricks makes me worried, that is why he didn’t want to step down said he firstly wanted to host bricks, lied want to take his share 😀😃😃😃"
1548682840239880,1:39:10,myname is love,@MikeLock yes they are
1548682911448958,1:40:21,myname is love,President Trump signed a anti genocide bill 2 weeks ago
1548682937829502,1:40:48,MIKE DURBAN,Uncle Don is a hero .....
1548682945760962,1:40:56,makhosi nobhatyi,Agrizzi after this testimony he must leave this country
1548682980982177,1:41:31,Doom Ruler,@myname is love Trump will probably deny that he signed that soon
1548682998957521,1:41:49,makhosi nobhatyi,Even Pretorious and Commissioner is not safe
1548683003731999,1:41:54,Doom Ruler,wow Agrizzles its still on the stizzle today
1548683035204951,1:42:25,myname is love,@MikeLock google search. the bill and what he has said about the Boers
1548683074813466,1:43:05,myname is love,@DoomRuler i highly doubt that dear
1548683202089660,1:45:12,makhosi nobhatyi,Zuma foundation must investigated
1548683220013791,1:45:30,myname is love,@DoomRuler yes it did.. and it happened to my native American ancestors
1548683236912862,1:45:47,MIKE DURBAN,@Makhosi....spot on
1548683254651047,1:46:04,Doom Ruler,"Uhm... out of respect, that's not what some in-depth documentaries say ..."
1548683281954156,1:46:32,Eslon Eslon,"Eish this Agrizzi is really brilliant, now he's even exposing the company attorney here my goodness"
1548683321474227,1:47:11,Doom Ruler,Agrizzi needs a Red Bull
1548683330941212,1:47:21,myname is love,I really don't care what other's have said. I know the truth.
1548683348654710,1:47:38,mrp,oak needs to loose some weight
1548683351056688,1:47:41,Zolani Mnqika,"He need Bells "" Give that man a Bells"""
1548683372642500,1:48:02,mrp,looks like he needs a big mac and coke
1548683397160986,1:48:27,Bongumenzi Nxumalo,"Agrizzi must becareful because his testimony may put the others who are involved in danger!! This thing is really dangerous, people die!! Its all fun and games until a life of another is gone"
1548683408661473,1:48:38,Emmanuel Phaladi,this guy is a joke
1548683428316894,1:48:58,Makho Theo,RainyDays 🌧 cloud ☁️ storage intel Database
1548683455234952,1:49:25,mrp,looks like he needs a pizza
1548683505995890,1:50:16,Makho Theo,Debonairs : 😷 lip mean Nathi
1548683511864799,1:50:22,MIKE DURBAN,@ Emmanual.......wait till the guilty give testimony.....then you see huge jokes
1548683548871922,1:50:59,Wildthing,watch over the course of this enquiry how he will lose weight. He will be a skinny man at the end.
1548683550164397,1:51:00,mrp,looks like cant wait to tuck into dinner
1548683563558608,1:51:14,Makho Theo,ill 🤒 🤧 😷
1548683574326173,1:51:24,Mapfumo Muleya,Agrizzi
1548683597624183,1:51:48,Doom Ruler,@Bongumenzi Nxumalo why must he be careful? the truth should never have a caution when it comes to our state
1548683629657368,1:52:20,Ewald Kruger,People who say stupid things like you without any reasons? @Emmanuel Phaladi ​this guy is a joke
1548683634025696,1:52:24,Eslon Eslon,"I'm not impressed by Dudu Myeni respond, playing a race card will not help. we're dealing with serious allegations here. Bring us factual backed counter evidence, there's no time for emotions please"
1548683669112292,1:52:59,Gregory Libera,He has diabetes! That's why he carries weight.
1548683671765324,1:53:02,Doom Ruler,Nah @Eslon Eslon dudu needs to take a seat
1548683676140579,1:53:06,Makho Theo,Dr Smith
1548683686863032,1:53:17,Makho Theo,The Government
1548683690092256,1:53:20,Makho Theo,Wiser
1548683707839644,1:53:38,zizile ndzilongwana,Dudu Myeni Zuma...#eff prez
1548683711825660,1:53:41,Bongumenzi Nxumalo,"Doom Ruler for me the example of the lawyer he was implicating now about towing the line, who knows what may happen? I am just hoping Agrizzi notified him as friend that he may make mention."
1548683713281318,1:53:42,Bongumenzi Nxumalo,Hence my comment to tread carefully.
1548683742449534,1:54:12,Makho Theo,Let’s discuss the proceedings
1548683759617681,1:54:30,Makho Theo,Legal issues
1548683807004379,1:55:17,Makho Theo,DueRes
