timestamp,time,author,message
1565878625970133,2:13:24,Dominic Przybylski,I paid architect to build my house. He makes basic plans for free and only gets paid for design when the house is built.
1565878641282221,2:13:39,Granny Mokwena,heyiii these fancy words
1565878653608353,2:13:52,Tito 2000,Not really .. we had a wedding in mind
1565878665216161,2:14:03,Ewald Kruger,"The latter! @Liz Profe â€‹is this guy playing around now , or just not bright at all?"
1565878665945203,2:14:04,Remembrance Chimeri,pririminaly study...
1565878674699048,2:14:13,Dumza Maswana,Stop right there Buyiswa... Let's not compare apartheid... You wouldn't even know how much was spent by government...
1565878680110987,2:14:19,Buyiswa Mnyani,if CR is to work with dem white pops I don't giv a fudge for as long there is going to be a change. Companies are not employing this is a sad state of affairs in the county.
1565878681085555,2:14:20,Manfred Nkonki,ohkay @Buyiswa Mnyani
1565878683063856,2:14:21,Liz Profe,"trying to be clever, he does not have a clue, t"
1565878691251496,2:14:29,Lorraine Naidoo,in the white government I had no high school
1565878708038435,2:14:46,Christopher Eddy,why are they still talking about dairy? is it because milk is white? kappa123
1565878725931335,2:15:04,Dumza Maswana,Christopher ðŸ¤£ðŸ¤£ðŸ¤£ðŸ¤£ðŸ¤£
1565878727765675,2:15:06,Mbombi,"yea this business plan is not for a house ppl, so your camparism doesn't make sense, compare apples with apples"
1565878749239694,2:15:27,Bev Stevens,sorry but is it R17m or R70m?
1565878749647993,2:15:27,Liz Profe,so much stolen moneyðŸ˜¢
1565878750804442,2:15:28,Christy,Oke is excited for mining as well. Maybe his next venture
1565878756123635,2:15:34,Dominic Przybylski,Government knows the country is going to collapse so they just grabbing as much as they can while there is still something left.
1565878761030450,2:15:39,carnoth ngomane,@Ewald Kruger these guys are smart but they have to act stupid to cover their rubbish
1565878766262684,2:15:44,Buyiswa Mnyani,@Dumza Maswana I knew I will get this but thiz piplz are not maknng it easy for me to clap hands for them. I know I shouldn't but be truthful nawe what re they doing?
1565878784156802,2:16:02,Charlene Botha,"No my man, R17 million for assessment and plans.....really"
1565878795603777,2:16:14,John Fagan,DRILLED
1565878804583906,2:16:23,Liz Profe,advocate you are spot on!!!
1565878807065530,2:16:25,Salmaan Abrahams,best thng i have heard thusfar
1565878807636512,2:16:26,Buyiswa Mnyani,@Dumza Maswana accept my apology for upsetting you.
1565878819987659,2:16:38,Sthakathi Khumalo,Disagree Advocate.. dreams are always sponsored nje
1565878824589885,2:16:42,Salmaan Abrahams,Tax payers money!!!!!!
1565878830190074,2:16:48,Nceba Duma,This is regreession... black ppl accounting on issues of land? For how long? Bring back our land...
1565878850924851,2:17:09,Lorraine Naidoo,Judge is to soft
1565878851646177,2:17:09,Lorna Kavanagh,Nice set of teeth !!!
1565878855388842,2:17:13,Sthakathi Khumalo,Industry to industry these things are considerable
1565878866879441,2:17:25,Granny Mokwena,the pure disrespect of taxpayers money by these so called officials is sickening to say the least!!!
1565878868813606,2:17:27,Dumza Maswana,"Lol I'm not upset Buyiswa, I just wanted you to think again. We wouldn't even have this platform under apartheid"
1565878887246720,2:17:45,Kevin Simon,"Zuma, Zwane at al had no idea that the state's income is limited. Why was the State working and paying for private sector plans?"
1565878896537422,2:17:55,barbara broadbent,why does judge keep preempting him??
1565878907782312,2:18:06,Mbombi,no the judge is fair. remember this in not a court it's enqiry
1565878924637620,2:18:22,NoeARK,"i disagree with Advocate, projects or enterprises starts as a dream or a concept and you have to spend money to develop that into a implemantable plan. we can argue on costs"
1565878928824205,2:18:27,Remembrance Chimeri,"@Abel Matshidiso lol true. The guy seems smart to some extent, but he has to be honest"
1565878930301960,2:18:28,Lorraine Naidoo,lee you right
1565878932550413,2:18:31,carnoth ngomane,why dont you survey before you build or drill
1565878953727838,2:18:52,Charlene Botha,"I'd like to see those plans, hope it's available to Commission"
1565878960743476,2:18:58,Nceba Duma,What's taxpayers' money?
1565878966945299,2:19:05,Buyiswa Mnyani,"@Dumza Maswana I now, I'm just upset that we got liberated, pipl died for it and you have such pipl who are insensitive towards the fight for us to be here today."
1565878972869805,2:19:10,Sthakathi Khumalo,"Lorna Kavanagh These things are tricky, sometimes you finish planning and then drought kicks in.. a whole lot of factors"
1565878973035775,2:19:11,Sandile Mkhonto,@carnoth ngomane Survey will also cost you money anyway
1565878977031308,2:19:16,Thandi Lekeba,Zoned
1565878988560984,2:19:26,Kevin Simon,But the strategic partner contributed NOTHING!!!
1565878992570319,2:19:30,Dominic Przybylski,@Charlene Botha Yes please. Can a newspaper publish those plans please.
1565879019969965,2:19:57,Mbombi,lol Advocate is lying she knew the time all along lol
1565879045423994,2:20:23,M Mok,done
1565879047709755,2:20:25,Buyiswa Mnyani,@Dumza Maswana I think we weren't ready or had plan to take over or something went wrong somewhere to find ourselves in this position. but what I know GREED is the enemy of progress.
1565879049082245,2:20:27,Lourens De Jager,it was a holiday for free !
1565879049798191,2:20:27,Christy,Zondo asking the right questions!
1565879061934159,2:20:40,carnoth ngomane,"@Sandile Mkhonto you are correct but you can build and survey later , makes no sense"
1565879073201926,2:20:51,Kevin Simon,Can we please bring back the death penalty for corruption. Please....Please. like China. Our trading partner.
1565879074648538,2:20:53,NoeARK,"@Thami Nobela, yes she was aware, she is just having too much funðŸ¤£ðŸ¤£ðŸ¤£"
1565879089679396,2:21:07,Robert Russell,DCJ .....kick him in the balls
1565879114373518,2:21:33,Dominic Przybylski,This not only happening with Estina and FS. It's probably happening throughout the country.
1565879124471235,2:21:42,Lorraine Naidoo,Roberts yes kick him out lies lies nd lies
1565879140317473,2:21:58,barbara broadbent,absolutely was Lourens De Jager!!
1565879153856624,2:22:12,Cerebis,All I hear now from this guy is Blablabla
1565879157677039,2:22:16,Christy,He choked on his lies
1565879167849639,2:22:26,Kevin Simon,Clueless clowns.
1565879170129152,2:22:28,Dominic Przybylski,"""The model we were looking at we did not have."" What?"
1565879170932774,2:22:29,makhosi nobhatyi,So you choose India
1565879179321681,2:22:38,Mbombi,"Mr Thabethe go and rest you were not ready for this day, please come back stronger tomorrow, up your game, these ppl want to eat you alive lol"
1565879183971997,2:22:41,Nceba Duma,Ningabachathi laðŸ‘Ž
1565879184427525,2:22:42,Zuko Nodada,"But Mr. Thabethe you were not the one to develop these plans, why then it was you that went to India?"
1565879188195521,2:22:46,Lorraine Naidoo,Hybo who did you asked in SA
1565879235568300,2:23:33,Lorna Kavanagh,"Estina was in the project in name only ... they brought no money. expertise, or value to this whole debacle. got paid billions?"
1565879238598674,2:23:36,Lorraine Naidoo,he is protecting all the Zuma faction
1565879268256630,2:24:06,Madhesh Loksewa,India diside well for JMU kasmir
1565879293157647,2:24:31,Lorraine Naidoo,Hi Baba go nd rest come back tomorrow ðŸ¤£ðŸ¤£ðŸ¤£ðŸ˜‚
1565879302583201,2:24:40,Mbombi,"yes Mr Thabethe is following orders, he will be rewarded for do so ðŸ˜ƒ"
1565879303176939,2:24:41,Zuko Nodada,@goolamv he is doing the latter
1565879303916013,2:24:42,Kevin Simon,Problem with listening to these witnesses are that they are covering their arses. I really struggles to follow their logic which they cling too.
1565879323395860,2:25:01,Lourens De Jager,you did research and saw they milk buffalo's. so you went there on holiday
1565879333749959,2:25:12,Cerebis,ðŸ¤¡ðŸ¤¡ðŸ¤¡ðŸ˜±ðŸ˜±ðŸ˜°ðŸ˜¨
1565879344366764,2:25:22,barbara broadbent,"thats because there is no logic, its all bull"
1565879345681070,2:25:23,Thandi Lekeba,Imagine Thabethe being your boss. Having to pretend to take him seriously
1565879382824994,2:26:01,Lorraine Naidoo,Eish this men really messed up
1565879420496077,2:26:39,Andrew Mutlwatsi,wen are they Goin to jail to pay
1565879436161319,2:26:54,Welcome Kamogelo,isn't it dat if u buy smthng u first inquire if wht u are buying is suitable for wht u wnt to use it for? plz help guyz I think I'm becoming dumðŸ™‰
1565879454159556,2:27:12,Mbombi,"I heard enough for today, chat to you tomorrow"
1565879486645592,2:27:44,Christy,Can we continue with these lies tomorrow?
1565879499889867,2:27:58,Wesley M,he has no Shame. coming here and tell us lies.
1565879511233797,2:28:09,Lorraine Naidoo,Let all S.A tax payers go to Lethuli house nd ask them to step down
1565879512289706,2:28:10,Ewald Kruger,Where is the DESKTOP investigation results and WHO did that??
1565879512469724,2:28:10,Lourens De Jager,why did you get a plan of 17mil if you went there ?
1565879514353145,2:28:13,Dominic Przybylski,This would be hillarious commedy if it wasn't bankrupting us.
1565879519537691,2:28:17,Cerebis,"Nonsense! If a company tenders, they carry the cost of doing so."
1565879531189524,2:28:30,Pastor J.J,If I have to Pray for every lie this man said I will be up the entire night.
1565879539925081,2:28:38,aurelia nqeto,yehla moyo yingcwele
1565879544176465,2:28:42,TG Swartlane,@Christy you are tired?see you tomorrow neh
1565879548985009,2:28:47,Kevin Simon,They got the cart before the horse. Zwane and Ace had taken the decision and these guys were used to create some semblance of due process after the fact. Very obviously did not work. Gaps too big.
1565879568818923,2:29:07,Lorraine Naidoo,Take a shot boss .sleep nd come tommorr
1565879605156981,2:29:42,carnoth ngomane,Be ready for more desktop lies tomorrow guys
1565879641379219,2:30:20,Christy,@TG Swartlane Sho bud. See you tomorrow in the next episode of more protocol lies
1565879668513192,2:30:47,TG Swartlane,"great, hahhahahahah"
1565879685422169,2:31:03,Cerebis,Time to finish my last 1/4 of the whiskey bottle? So sad
1565879724712617,2:31:42,Salmaan Abrahams,i just have to restate it : 17000 000 ( for a plan)
