timestamp,time,author,message
1562582709247170,2:40:54,Lorna Kavanagh,it is not rocket science to know that anybody can just land at an airforce base airport!!! tTry it in America or Britain and you will get shot down or fighter jets will escourt you out of the country
1562582719617376,2:41:04,Magda Seguin,"""something like that"""
1562582726059994,2:41:10,Zola Pinda,Hè looks guilty as charged.
1562582736672393,2:41:21,Yvonne Morudu,this man don't recall anything he is lying
1562582765706097,2:41:50,Danie Nilsen,wiggling an jiggeling he is in the frog pot lol
1562582780950455,2:42:05,Zola Pinda,He should have been fired but was awarded
1562582808327915,2:42:32,Sindiswa Moolman,Yes @Zola Pinda
1562582809525359,2:42:34,peter pott,"@lorna, you are wrong. AFB is a very highly secure place. problem with this commission is start, this session and last week session should have been handled by astute military lawyer. we have them"
1562582820305981,2:42:45,Comrade Jason,when do we get a Zondo statue? this ou is awesome
1562582828342063,2:42:53,Magda Seguin,This witness is ultimately responsible for what happened on Zumas orders
1562582861256616,2:43:25,Wildthing,This guy lies without blinking thatbnbis an ANC skill
1562582876910204,2:43:41,Dominic Przybylski,Blame PA?
1562582898944723,2:44:03,Wildthing,I mean the Bad ANC members. I an hoping the good take over the ANC.
1562582903600109,2:44:08,Thami Ngwenya,Check my lawyer Miss Hofmeyer at constitutional court
1562582917121267,2:44:21,Comrade Jason,Bring in the PA! don't let him throw her under the bus!
1562582933205775,2:44:37,peter pott,😬😬😬😬. I will cross the trenches with koloane. listen to how he spins this case noe
1562582937130139,2:44:42,Danie Nilsen,he has a serious amnesia problem should get medical attention
1562582938069892,2:44:43,Jay,@michael wild please delete the spam bots here
1562582945751334,2:44:50,Magda Seguin,"The witness who headed the air traffic control explained what happens,he is lying through his teeth"
1562582947898088,2:44:52,Sindiswa Moolman,What a liar. Hope the PA will come and defend herself
1562582968127416,2:45:13,Wensislus Qhali,@Comrade Jason: Definitely
1562582975075772,2:45:20,Nyasimi Geoffrey,we need the PA to testify
1562582979177549,2:45:23,Lorna Kavanagh,peter pott ... i know the airforce base is restricted but these people just allowed the plane to land without proper clearance.
1562583008253752,2:45:53,Comrade Jason,I wish this chat had authority! the PA would be here 3 minutes ago 😁😁😁
1562583016342708,2:46:01,peter pott,"@moolman, the problem the PA will have is that the email was from her and we don't have recorded audio of phone call."
1562583020925564,2:46:06,Magda Seguin,"Deny,deny,deny...Zuma strategy"
1562583034081525,2:46:18,Zola Pinda,He looks like he has enjoyed lots of Indian curry dishes.
1562583036829896,2:46:21,Gilbert Matsunyane,"Bruce Koloane is a spin doctor par excellence, these fellow can tell you 2016 is next year and have guards to justify that"
1562583037289697,2:46:22,Dominic Przybylski,Who is the PA. Is she still alive?
1562583045328539,2:46:30,Sindiswa Moolman,Exactly @Thando Nkutha
1562583045538720,2:46:30,Cerebis,"Looking at most of these witnesses, South Africa has a huge problem with AMNESIA?"
1562583059323359,2:46:44,Anthony Ramasike,long talk...the guilty is always afraid
1562583066371377,2:46:51,Wildthing,Judge Zonda will corner him soon.
1562583089060903,2:47:13,Peet Venter,@Thando Nkutha No sense in continuing the debate on this platform.
1562583104753343,2:47:29,Zola Pinda,Yes Zondo will corner him soon.
1562583114979201,2:47:39,clive oconnell,Tell her what todo again
1562583115316863,2:47:40,Danie Nilsen,@Cerebis what was that i do not recolect please clarifi
1562583115948069,2:47:40,thembela makoe,This guy looks very frightened and he came with a very defensive attitude. Guilt is written all over his face 🤔
1562583123200609,2:47:47,Anthony Ramasike,true ..now we know who did it
1562583125305717,2:47:49,Biyela Zamokuhle,Lol Zola you making me laugh
1562583131147781,2:47:56,Thamsanqa Nomayela,Zuma destroyed many courageous leaders.
1562583133287305,2:47:58,Wensislus Qhali,Yerrrre this guy can talk nonsense😂😂😂😂😂😂
1562583134068028,2:47:59,Magda Seguin,The SA public is being taken for idiots
1562583139309102,2:48:04,MJ,Lorna Kavanagh ; yes our Air Force is asleep!
1562583139575522,2:48:04,Dominic Przybylski,We need Hoffmeyer but she's probably preparing for JZ.
1562583154185752,2:48:18,fikile mbokodi,please chair make sure next week we have hofmeyer when zuma is here please
1562583178737277,2:48:43,Wensislus Qhali,HOFMEYR!!!
1562583181024482,2:48:45,peter pott,"@lorna, question no one is asking, is that who covered the fees, also what reward did they all get. all were rewarded. military fellow who spoke isizulu rank was pushed up, listen now. ambassador !!!!"
1562583189838177,2:48:54,Anthony Ramasike,@qhali..u a rite totall bullshit
1562583204618148,2:49:09,Magda Seguin,@Tikvah Olam you are right
1562583252487786,2:49:57,Yvonne Morudu,he is lying
1562583255167726,2:50:00,Sindiswa Moolman,This man is lying under oath
1562583255600161,2:50:00,Diwi The Doer,This guy is a bloody liar
1562583270236849,2:50:15,Magda Seguin,2.9k people watching now
1562583270405978,2:50:15,peter pott,"@thando, no . it's misunderstanding☺☺☺"
1562583286148523,2:50:30,carnoth ngomane,Now he wanna hide behind the pa
1562583287933153,2:50:32,Ishaad Mohammed,too much misunderstanding for such intelligent men.
1562583299061432,2:50:44,Slindile Ngcobo,"2,956 watching now"
1562583306161262,2:50:51,Dominic Przybylski,I'm not the one who ....... standard response from person who get's all his work/responsibility is done by PA or consultant.
1562583309232458,2:50:54,Cerebis,@Danie Nilsen When did you testify before Judge Zondo? I must have missed it?
1562583323134289,2:51:08,Sindiswa Moolman,He must be recalled immediately. He doesn’t deserve to represent our country
1562583336678306,2:51:21,Danie Nilsen,give him a small piece of land and 1 cow for protrcting the corrupt anc
1562583343045849,2:51:27,Magda Seguin,Just like Zindzi
1562583361440025,2:51:46,Anthony Ramasike,@moolman..he must..agree with u
1562583369897981,2:51:54,Magda Seguin,Out of 57 million
1562583372539712,2:51:57,Sindiswa Moolman,I agree @Magda Seguin
1562583373707490,2:51:58,Comrade Jason,"""personal assistant"" is about to become a synonym for ""the witness that brought down the Zuptas"""
1562583388681096,2:52:13,peter pott,"@moolman, then we have to recall all of them then."
1562583397829995,2:52:22,Siya Dilimeni,AMBASSADOR SAMUEL L JACKSON
1562583399603050,2:52:24,Danie Nilsen,yesterday as it was sunday and sabc do not work sundays you missed it
1562583423858171,2:52:48,Dominic Przybylski,It was JZ's PA who is responsible for state capture.
1562583431175556,2:52:55,Magda Seguin,I never saw a witness being so defensive
1562583436775632,2:53:01,Nyathi TC,Wow... I seriously feel like we are being taken for granted as the youth of this generation.
1562583452890159,2:53:17,Sindiswa Moolman,I agree to that too @peter pott. They were all appointed by the former no 1
1562583479460672,2:53:44,Thamsanqa Nomayela,"Zuma approved the landing, Ambassador was used as the scapegoat."
1562583491843392,2:53:56,Magda Seguin,My heart bleeds for the youth...57% unemployment. Their futures are being hijacked
1562583533802852,2:54:38,Dominic Przybylski,Postmaster was rewarded by being promoted as ambassador of the most fun country in Europe.
1562583570120542,2:55:14,Kgoshi Phala Makgoropane Phala III,we plead with the commission and the president to please send whoever implicated in this commission to jail...and pay back all our money stolen by them.
1562583583474915,2:55:28,Magda Seguin,Nothing about what the Guptas said at that meeting that number one gave permission
1562583618492492,2:56:03,Nqobile Ndimande,gd day 57% unemployment is cause by neighboring countries and open boarders.
1562583652117787,2:56:36,Magda Seguin,"@Tikvah Olam 27% is the overall unemployment rate,57% of which are the youth.Check on StatsSA.I have the document"
1562583678352758,2:57:03,peter pott,"@ndimande, haikhona ndimande. let's not start xenophobia"
1562583679056049,2:57:04,MJ,Nqobile Ndimande; Totally agreed!
1562583710235855,2:57:34,Khwesta Mdliva,true ndimande
1562583718657763,2:57:43,Wildthing,a wedding is planned 1 to 2 years before the date. many new about it.
1562583719921402,2:57:44,Diana Sekatane,we are sitting on a ticking time bomb caused by the youth unemployment.
1562583724122784,2:57:48,Magda Seguin,"I only state official credible statistics,its not my opinion but evidenced based"
1562583726182235,2:57:51,MUSA HLUNGWANI,Where’s adv Maleka?
1562583729899510,2:57:54,Marts King,Yes let's heart
1562583740700003,2:58:05,Martin Ogbu,cure st
1562583762989886,2:58:27,Sindiswa Moolman,Painful truth @nqobile ndimande
1562583778464200,2:58:43,Wildthing,why not have the wedding I Durdan near Phoenix
1562583785230408,2:58:50,Magda Seguin,He knows all the details but deny responsibility
1562583838175820,2:59:42,Khwesta Mdliva,hahahaha @wild
1562583875835802,3:00:20,peter pott,"foreigners got nothing to do with unemployment. decision making is. instead of factories we built malls, instead of factories, we open a McDonald's at every location"
1562583881132144,3:00:26,Wildthing,later
1562583908356076,3:00:53,Danie Nilsen,what gets my goat and this goat is mine and not stolen is that a big thing is made of this get zuma in here get watson in here get ramaphosa in here so what i a saying stop playing small fish big ones
1562583973244006,3:01:58,Nyathi TC,A wedding? I really don't understand the corruption of our government officials. Mmmm... I really feel that there are a lot of details that are kept in the dark for the public.
