timestamp,time,author,message
1597838131353507,-5:12,Askar Niko02,u half i m half in that company only in rusdia . no any position for any one .
1597838164728845,-4:38,Askar Niko02,u country half n i m half in that company .
1597838371230876,-1:12,Askar Niko02,u want to give whom not my business
1597838409040680,-0:34,Askar Niko02,u approve my meetion bomb 100 % from russia . share half fou n u country .
1597838752166185,4:57,Askar Niko02,u give approve letter from u court to russia 100 % millty from rusdia will bomb on mafia country n they dlave country .
1597838754233410,4:59,Dominic Przybylski,Gosh - restarted so soon after lunch!
1597838808567972,5:53,Barbara Sattler,humming sound!!!
1597838958915265,8:24,Askar Niko02,my all 2036 president law must approve all .
1597838975206527,8:41,Peet Venter,Here starts the throat clearing...
1597839037916422,9:44,Dominic Przybylski,"While we on this two year talk shop about corruption Hundreds of millions paid out for PPE to ""businesses"" in Gauteng, with no background, formed only after lockdown began!"
1597839070268089,10:17,Barbara Sattler,Produce pay slips for all the employees of these companies.
1597839111109648,10:57,Dominic Przybylski,Many don't have websites or phone numbers.
1597839137475981,11:24,Joshua Borias,""" NO FULL DISCLOSURE """
1597839226876351,12:52,TheQueen V,where my peeps
1597839262629326,13:28,Dominic Przybylski,"Read ""Gauteng’s Covid-19 Expenditure Disclosure Report adds murk to troubled waters"" on Daily Maverick."
1597839281851895,13:48,Anne M.,Here 😃 @Valencia J
1597839367887895,15:14,Dominic Przybylski,"This commission is a classic case of ""fiddling while Rome burns""."
1597839376673484,15:21,Teunis van Ree,🙋🏻‍♂️
1597839412967413,15:59,zip reeper,endless procession of stooges wallowing in moolah
1597839521601095,17:46,TheQueen V,hello @teunis and @rip
1597839542827741,18:08,Sal SA,Hi guys
1597839543410701,18:09,zip reeper,hi valencia
1597839578776881,18:45,TheQueen V,how are you @zip
1597839589937050,18:56,zip reeper,this zondo commission wont change anything!
1597839597235199,19:04,HALO,He is a thief. Done.
1597839606776244,19:12,mathys botha,they haven't untill today removed a
1597839607342657,19:12,Mosima Kgomo,We are trying to apply for tenders and got rejected but tenders are given to politicians children
1597839633071538,19:39,zip reeper,"valencia, better now i see you!"
1597839651152998,19:56,zip reeper,miss julies
1597839661321665,20:07,Abel Matshidiso,@Mosima Kgomo o opile kgomo lonaka nkgonne
1597839679734010,20:25,mathys botha,they haven't until today removed any of the as asbestos
1597839684066725,20:29,zip reeper,cyril does not care about costs!
1597839686767280,20:32,Karen Naidoo,"why is it then when people win tenders, these people actually don't do the job... #pushthe"
1597839699295403,20:45,Dominic Przybylski,"The hundreds of millions and staff for this commission should be transferred to NPA. We need arrests trials and convictions, not a report with recommendations which will be ignored."
1597839717942508,21:03,TheQueen V,@kgomo yes if you are not connected then you won't get any piece of the pie
1597839718776329,21:04,Bonang Sithole,by now I would have paid back R100million
1597839727866555,21:14,TheQueen V,@zip😍😍😍😍
1597839733464955,21:20,Karen Naidoo,SA should change tender process and do proper due diligence
1597839746255352,21:32,zip reeper,cyril doesnt want arrests. he loves corruption
1597839794668576,22:21,zip reeper,thats why we have this talk shop
1597839815461888,22:40,Barbara Sattler,raise the price and sub contract. Easy peasy
1597839842655420,23:08,Teunis van Ree,they all do it
1597839842717796,23:08,Joshua Borias,""" TENDERS R AN ' UNBILICAL CORD' 4 CORRUPTION"""
1597839850115104,23:16,Sal SA,But he testified earlier they did not have expertise to do the job so he ew they were going to sub contract
1597839861839264,23:29,zip reeper,pistorius knows nothing about business. everyone sub contracts
1597839867287774,23:33,Dominic Przybylski,SA government is already bankrupt. Cannot operate without borrowing billions. Cannot borrow forever.
1597839906608824,24:13,zip reeper,"dominic, they dont care about tomorrow"
1597839917286127,24:24,Sal SA,Big words for a relatively simple project
1597839972963674,25:19,Mosima Kgomo,The blame is not Mr president. The people he is working with are selfish and not thinking for the economy. Not everything should be hold accountable to Mr president
1597839980276821,25:27,ALTA,hi there
1597839981312604,25:28,Dominic Przybylski,"What did Cyril do to prevent corruption when he was deputy president? How could he have been ""shocked"" when it seems that everyone else in the country knew more about what was happening than he did?"
1597839998768401,25:44,Mashudu Matshira,"is not true that president like corruption but their are stakeholders such as NPA,AND HACKS,IS NOT THE PRESENT TO ARREST PEOPLE WHO ARE DOING CORRUPTION UNTIL PROVEN GUILTY BY THE LAW"
1597840017236916,26:03,Bonang Sithole,@canis you are 100% correct
1597840046417843,26:33,Lekgothoane Lesetja,"@makhosi nobhatyi Zuma was always saying that while working with them, he''s president he will always want to come clean in front of the nation"
1597840048144173,26:34,Karen Naidoo,"there is no Moral compass ... these fat cats, take food out off the poor mans table"
1597840113264224,27:39,Karen Naidoo,a 20% profit... wow...
1597840137735475,28:04,Russell Allen,Richmond Virginia
1597840153203551,28:20,Russell Allen,Richmond 🎥
1597840167289001,28:32,Rory Lee Farnham,Cyril was a disaster as Deputy Pres. He was appointed to look after Eskom. What did he do ? Show me one portfolio where he added value. You will search forever.
1597840234762535,29:40,makhosi nobhatyi,"@ Lekgothoane Lesetja I know that the old man never be honest in the first place he enjoys his party majority to defend him in parliament when he faces tough question, NPA, hawks n police was Nt mvng"
1597840237910782,29:43,Mosima Kgomo,As much as the power is given to Mr president h shouldn’t be the only one responsible for misuse of funds. Funds are transferred to different departments and that’s where selfish become selfish
1597840266005149,30:11,Mashudu Matshira,president is not above law to arrest the thief
1597840275170849,30:21,Dominic Przybylski,Competitive bidding is a farce when the government only asks for bids from people who are not competitive.
1597840284930538,30:31,Karen Naidoo,"how to get away with Corruption.. ""I did know"" ,"
1597840311458723,30:57,Tommygun,@Dominic Przybylski Spot on re bidding
1597840316667583,31:02,Karen Naidoo,oops didnt know
1597840332209193,31:19,Sal SA,Blame the dead! You are an active partner man
1597840359898124,31:45,TheQueen V,"anc is done, even today when zandile gumede was sworn in. Showed middle finger to SA"
1597840363286945,31:49,Mohamed Mia,Thugs galore
1597840376526761,32:02,Mr Green,non compliance = compliance ?
1597840385356648,32:11,zip reeper,affirmative action buzz on sound
1597840402643747,32:29,Pablo Chavez,Santa Cruz CA USA judge Kim baskett using Terrorist weapon electric Radiation waves report DC FBI
1597840420547114,32:46,Joshua Borias,"""ERROR IN NEGOTIO ( DELIBERATE MISLEADING INFO ON TRUE NATURE OF FACTS)"""
1597840421387128,32:47,Teunis van Ree,Gotcha on the SLA 😁
1597840421785258,32:48,makhosi nobhatyi,"@ Lekgothoane Lesetja President Ramaphosa few weeks ago signed declaration of agreement to arrest corrupt officials so we will see more arrests, wait n see even Magashule will face his music he may"
1597840424477712,32:51,Pablo Chavez,report to Donald j Trump Santa Cruz CA USA judge Kim baskett using Terrorist weapon electric Radiation waves report DC FBI
1597840437074496,33:04,Sibusiso Cilo,"what did he achieve, really?"
1597840446042517,33:12,Mohamed Mia,@craig yes they looted and enriched their families
1597840449972432,33:16,Craig Johnson,Have a read
1597840464164044,33:30,Karen Naidoo,maybe contracts should be written in all the official languages.. maybe they will understand what words mean
1597840479807172,33:46,Dominic Przybylski,"@Craig Johnson what did he achieve other than a permanent place at the head of the BEE queue, thus becoming a billionaire while the people he pretends to care about get nothing."
1597840481487907,33:48,zip reeper,"cyril bribed his way into office with r1bn, thats what he achieved"
1597840493452129,33:59,Mohamed Mia,@craig don’t believe and fall for their bs
1597840505988414,34:12,Karen Naidoo,they have the capacity but we'll subcontract.. push the buck
1597840530726167,34:37,Tommygun,"whats with the Judges dance of seven veils with his face mask? Its up and down like a yoyo, why bother?"
1597840531258080,34:37,Sal SA,Misrepresentation
1597840536078838,34:42,Peter Lukas,Let he pay all the money back
1597840540796342,34:46,Mohamed Mia,@craig yes don’t forget marikana
1597840546935506,34:53,Dominic Przybylski,He did nothing to prevent corruption like he did nothing to prevent a violent end to the Marikana strike.
1597840569628182,35:16,Mosima Kgomo,How come you have capacity but subcontractor. Why don’t tenders be given to people who are capable
1597840586106855,35:31,Mohamed Mia,@craig CR has no b.....s
1597840590786754,35:37,Agusta Loesch,@Dominic quite correct
1597840612173773,35:57,волгоград & Rico Fukkery,smoke it
1597840734208133,38:02,Gina deW,He's lying ...
1597840744410151,38:10,makhosi nobhatyi,"@Zip reeper no you are having wrong coz it is public how they fundraise money but Zuma faction doesn’t want to be investigated how they found money too, surely our money was used n channel 2 their"
1597840781674892,38:48,Nondumiso Soko,this man is lying...
1597840783410041,38:50,Mosima Kgomo,I suggest they stop this tenders as most politicians are very rich because of them. Now being a politician is not about serving but quick wealth
1597840785700205,38:52,Mohamed Mia,All these bald headed skelms
1597840792053310,38:57,Herb Tuck,Donald TRUMP has the same IQ as Jacob ZUMA
1597840815809785,39:21,Craig Johnson,All I can say is that Marikana is an unsolved crime of 34 black lives that still don't matter. A real crime against humanity. BLM??? 8 years later ANC??
1597840817809664,39:23,Tommygun,Wonder if Edwin Sodi is another ANC voting socialist?
1597840817905506,39:23,Dominic Przybylski,Being a politician is about serving politicians.
1597840823364519,39:28,Mohamed Mia,Like I said 🤣
1597840825471138,39:31,Nondumiso Soko,why do this politicians get tenders in the first place..
1597840888152463,40:35,Sal SA,Lying
1597840892323490,40:39,Dominic Przybylski,@Ndumieh Mokoena because they have access to tax money.
1597840913481187,40:58,thabiso mngadi,dead men tell no stories
1597840921786505,41:07,Mosima Kgomo,"How didn’t you know your partner is subcontracting you’re lying Sir, tell the truth"
1597840936494942,41:22,Sibusiso Cilo,"capitalism is a game of unfair advantages,"
1597840952831066,41:38,Sal SA,Badger him more DCJ - its taxpayers money that was stolen
1597840953251311,41:39,Craig Johnson,Thats why he is no longer with us
1597840962912565,41:49,Mosima Kgomo,When filling documents there is a part to disclose that or you didn’t read your documents before submitting Sir
1597840980015107,42:06,Peter Lukas,he got a short and quick answer
1597841002368590,42:28,Teunis van Ree,Shifting blame on a deceased partner. Dirty 😱
1597841051064269,43:16,Mosima Kgomo,Stop telling about Mr who talk at your matter at hand Sir
1597841062649178,43:30,Deon Leeuw,"mphambane is dead, he cant speak for himself, you are lying wena Sodi!"
1597841076195741,43:43,Dominic Przybylski,Capitalism is a game of competition where the people who do the job best are the winners. Communism is a game without competion where everyone is a loser i.e. equal.
1597841090931147,43:57,Tumi Tumi,"why should you tender for the job that you don,t know how to do it, after wards subcontract"
1597841107781325,44:14,Michael Ghelakis,You know it could be done for les because you made so much in Gauteng
1597841113243568,44:19,Nicolas Cocolas,Ok so now he's an innocent little angel
1597841114168229,44:20,Peter Lukas,You done it already
1597841120790462,44:26,Craig Johnson,@Tumi Tumi its called fraud and corruption
1597841135444840,44:41,Anne M.,Throw a dead man under the bus ....... Nice one!
1597841146575222,44:52,Sal SA,You were an active partner- no getting away with misrepresentation
1597841150175899,44:56,Tumi Tumi,true
1597841159058913,45:05,Mosima Kgomo,Why do you submit for tender without resources
1597841166733976,45:13,Craig Johnson,@LowJack187 ESKOM prime example
1597841166768179,45:13,zip reeper,"tumi, hes the rainmaker, others do the work"
1597841186542683,45:31,Sibusiso Cilo,"U're right, that's why slavery & colonialism provided the most beautiful start."
1597841191465692,45:37,Mosima Kgomo,"What was your disclose on your tender documents , who approved such information"
1597841210714521,45:56,zip reeper,"mosima, u win the contract, then u subcontract and pocket the profit"
1597841215432027,46:00,Craig Johnson,@Sibusiso Cilo slavery where?
1597841238381550,46:22,Mohamed Mia,Soul Rest In Peace 🤣
1597841238666523,46:23,Sibusiso Cilo,All around the world
1597841258128316,46:44,Teunis van Ree,First thing they do after winning a tender is to buy expensive cars
1597841271306080,46:57,Alan White,"Suprised he not in parliament or a minister - smooth talker,,,,,,"
1597841280178561,47:06,Sal SA,Team of engineers wow
1597841296212888,47:21,Agusta Loesch,😂😂😂
1597841328809090,47:55,Nondumiso Soko,C
1597841329129208,47:55,Matheko Mpe,Shifting the goal posts and painting himself with glory.
1597841339430041,48:05,Sal SA,@Alan more money to be made as a tenderpreneur
1597841357175682,48:22,Tumi Tumi,"All this guy,s can lie right in our face,s."
1597841358424474,48:24,Mosima Kgomo,How much did you pay for your tender to be approved
1597841392074623,48:59,zip reeper,"mosima, u pay r20m"
1597841395413605,49:01,Sibusiso Cilo,Did u know that corruption can be drastically reduced in SA?
1597841408132372,49:14,Wesley M,the US is just as corrupt
1597841441056949,49:46,Nondumiso Soko,he speaks his lies confidently.....
1597841444573492,49:50,Craig Johnson,Lets test the math
1597841451832571,49:57,Sihle N,at least he tried
1597841452961361,49:58,Mohamed Mia,Qualified thugs
1597841476465258,50:21,Mohamed Mia,He is in prayer
1597841506882716,50:53,Wesley M,Ndumieh Mokoena lol!!
1597841541150977,51:26,Tumi Tumi,You can ask his friend Vivien Natasen how much did pay for his tenders to be approved?
1597841547349653,51:33,Sibusiso Cilo,"Treasury could be defaulted to approve all procurement projects, after vetting all parties."
1597841593703828,52:19,Mthuthuzeli Ntlanyana,"I just woke up,hangover, whts happening here?"
1597841618020925,52:44,Teunis van Ree,But there should be a quantity surveyor/cost accountant on the project team!
1597841627142489,52:53,Sibusiso Cilo,"All procurement projects, including @ local government level."
1597841656148572,53:23,Takalani Ramokopelwa,dia boa
1597841667554963,53:33,Sibusiso Cilo,Better late then never
1597841700044684,54:06,siphosethu lokwe,who is this Guy?
1597841708428990,54:14,Tumi Tumi,All SAA MONEY WAS TAKEN AWAY
1597841710001229,54:16,Sihle N,the guy is a liar 💥🤨
1597841732823687,54:39,Sal SA,@Dominic employ more qualified staff and adequate controls to expedite process
1597841733468765,54:39,Dominic Przybylski,@Sibusiso Cilo We simply cannot survive if we assume that everybody outside of treasury cannot be trusted. Unfortunately that does seem to be the case.
1597841781573124,55:27,zip reeper,"sipho, one or other connected cadre"
1597841782266217,55:27,Mr Green,🤣That's correct
1597841819016556,56:04,Sal SA,@Dominic unfortunately we must start with that assumption
1597841819864215,56:05,thabiso mngadi,here we ģo.are u listening to this mr zwane
1597841845323451,56:31,Elton Josea,loosen the tie
1597841870259378,56:56,Sibusiso Cilo,"Our biggest problem is that, government acts as if it presides in a federal government system. Where province's & local districts have autonomy."
1597841884611368,57:10,Nondumiso Soko,he can't remember such a huge amount 🙄🙄🙄🙄🙆‍♀️🙆‍♀️
1597841897950444,57:23,The Truth,Spot on Sibusiso
1597841909729450,57:36,dominic mabe,there thief
1597841929690482,57:55,Dominic Przybylski,@Sal SA Unfortunately it cannot work in a competitive global economy. The only way to get rid of corruption is to embrace a free market where people who are incompetent are allowed to fail.
1597841973521229,58:40,Nondumiso Soko,what also annoys me about South Africa is that the public protector is very useless....
1597841976764373,58:42,Sibusiso Cilo,Problem is corruption has become too powerful.
1597842005331659,59:11,Sal SA,@Dominic its working in other economies
1597842011018121,59:16,Dominic Przybylski,SAA is a classic example. This government is spending billions on a failure which will continue to fail.
1597842021601954,59:27,zip reeper,"ndumieh, mkhwebane is hobbled by the crooked anc"
1597842080865904,1:00:27,Sal SA,@Dominic other private airlines have collapsed even in SA
1597842097356687,1:00:43,Thabang Kgautle,Eh lol
1597842098951477,1:00:46,Dominic Przybylski,Billions more disappearing into all the other SOEs just because they cannot accept that their method of operation is a total failure.
1597842118669933,1:01:05,Thabang Kgautle,Businessman visiting a business partner without a laptop lol
1597842142524529,1:01:28,Nondumiso Soko,"this man knows nothing it was all about money for him he doesn't go through documents because he ""assumes "" we talking millions here and you just gon assume 😑"
1597842147782031,1:01:34,Sibusiso Cilo,"If treasury were to be given oversight, 1. Treasury would be responsible for all transactions since they are custodians finance. 2. If something goes wrong, u are only dealing with 3 or people."
1597842165824386,1:01:51,zip reeper,"dominic, gordhan is a fakir mesmerising cyril"
1597842166813318,1:01:52,Nicolas Cocolas,Families should be super proud of these Crooks
1597842172817004,1:01:58,Mthuthuzeli Ntlanyana,"tata Zondo and his commission of inquiry into state capture won't stop corruption, not in SA"
1597842204008190,1:02:30,lmao,hi
1597842213325768,1:02:40,zip reeper,pretorous cant snare this smooth shyster
1597842217482502,1:02:44,Dominic Przybylski,"""3 people"" in control of trillions every year... How will that work?"
1597842237104230,1:03:02,Sal SA,@@Dominic then u strengthen risk management and internal audit
1597842281919439,1:03:48,Sibusiso Cilo,"What we need is a brave leader, who will try something different. If it fails, it fails, atleast something was done."
1597842285413276,1:03:51,Dominic Przybylski,Centrally controlled economies don't survive.
1597842287811891,1:03:54,zip reeper,zondo report headed for file 13
1597842297674078,1:04:03,Mthuthuzeli Ntlanyana,"let me go get few drinks, byeeee everyone, power just went off here n east London"
1597842301721149,1:04:08,Teunis van Ree,Detailed questioning is necessary but biring
1597842309307943,1:04:15,The Truth,"This guy will probably end up behind bars. But whats sad, it end's at the level of such ppl. The real crooks like the premier, government officials who were cooked this tender, will walk"
1597842325026479,1:04:30,Teunis van Ree,boring
1597842332069290,1:04:37,Sibongile Maputi,"I feel sorry for this poor guy. Cornered like this. Yhoooo, having to confirm the payments"
1597842335279399,1:04:41,zip reeper,bye mthuthe
1597842336657002,1:04:42,Sibusiso Cilo,It's either that or Zim
1597842342889770,1:04:48,Sal SA,@Dominic restructure the procurement vetting in Treasury into various sectors with industry specialists
1597842364616560,1:05:10,Nondumiso Soko,OK wrap it up and arrest this croook....
1597842389205612,1:05:35,Teunis van Ree,He knew what he was doing and isn't the biggest skelm in the story
1597842393391782,1:05:38,zip reeper,this crook already has new contracts
1597842399868702,1:05:45,Martin van der Breggen,Here comes Zuma cough
1597842405348862,1:05:51,Karen Naidoo,revenue less cost = profit... is that profit not subject to tax? 28% or are BBBEE exempt?
1597842407856048,1:05:53,Dominic Przybylski,@Sal SA What's wrong with letting the economy operate according to supply and demand?
1597842418437034,1:06:03,Nondumiso Soko,NEGLIGENCE NEGLIGENCE!!!!!
1597842455840234,1:06:42,Mike Jones,This one's slicker than snot!!
1597842456437316,1:06:42,Jenny Whitewaves,why are the owners of the company doing the spread sheet . that's junior work IF all is above board
1597842472694631,1:06:57,Teunis van Ree,@Dominic because S&D was manipukated
1597842491071248,1:07:16,Teunis van Ree,ll
1597842492959798,1:07:18,mafuta,Yip @Mike Jones as smooth as his shiny pip
1597842505173774,1:07:30,Martin van der Breggen,"@jenny, creative accounting"
1597842513335888,1:07:39,Sal SA,@Dominic state infrastructure centralized
1597842518118725,1:07:44,Karen Naidoo,The word Democracy hold no meaning in this land.. Maybe Mockery
1597842549555976,1:08:15,mathys botha,this man is as slippery as a wet snoek
1597842587945204,1:08:54,Jenny Whitewaves,That's why the bosses had to do it Same as keeping two sets of books one for the tax man one true
1597842589266133,1:08:55,Samuel Skosana,Dont insult the snoek!
1597842605379949,1:09:11,Dominic Przybylski,"Instead of giving somebody an RDP house, rather give them enough money to to choose who builds their house for them. Why give the money to corrupt tenderpreneurs who don't care about cost or quality?"
1597842702959336,1:10:48,Jenny Whitewaves,"Sorry R600,000"
1597842764838394,1:11:50,Derek Auret,What he does not realise is that seasoned advocates like Pretorius never ask questions that they do not already know the answer to.
1597842775878718,1:12:01,Sthakathi Khumalo,"Been listening to this one since. Clever thieves sound exactly like this one. well spoken, respectful and lots of corruption hidden"
1597842777481421,1:12:03,Sal SA,Not yet @Jenny as far as I'm aware
1597842821459173,1:12:47,watson mutanga,This man is not as smart as some on this platform perceive him to be. He talks too much. Remember that the details he is availing will be analysed at a later stage. Self-implication risk is high.
1597842827174154,1:12:52,Derek Auret,Pretorius' face speaks of utmost derision for the answers bein g given by this witness.
1597842856944887,1:13:22,Jenny Whitewaves,Want to get to that and the intials AM and others
1597842872237436,1:13:38,Dominic Przybylski,It's only in movies where the criminals look sinister and ugly. The successful ones are excellent at pretending they are honest and reliable.
1597842890507904,1:13:56,Sal SA,Yes @Loe
1597842960383239,1:15:06,Thabang Kgautle,This guy is a liar lol
1597842975564732,1:15:21,Sal SA,Wow R86m profit- feeding frenzy!
1597843004907730,1:15:51,Jenny Whitewaves,But it was on your computer
1597843007160856,1:15:53,Nondumiso Soko,the state capture is just gossip and waste of money I hope this looter get arrested because he's giving nothing....
1597843022397847,1:16:09,Mbuso Ndlovu,@Sal SA 86m!!!!!!!!!!!!!!!!!!!!!!!!!!
1597843026388610,1:16:11,Sal SA,Exactly @Low
1597843091672225,1:17:18,Immanuel,What work did he perform that would warrant a whooping R86m😳😳😳😳😳
1597843094899698,1:17:20,Angelo Doubel,😂😂😂
1597843098065538,1:17:24,Anovuyo Mbande,"Adv. Paul Pretorius, SC"
1597843110422920,1:17:37,Elton Josea,chair intervene plz this guy is acting smart
1597843118932728,1:17:45,Sal SA,Forensic @Low
1597843173947873,1:18:39,Sal SA,Nothing except attend meetings @Immanuel
1597843216144293,1:19:22,Angelo Doubel,gauteng 100 million + free state 86 million 😱😱😱 profit in 6 month's
1597843244997873,1:19:50,Craig Johnson,STOLEN FUNDS
1597843260403668,1:20:06,Sal SA,Balance disappeared DCJ
1597843261155985,1:20:07,Nondumiso Soko,he continues to blame the dead💀
1597843286516282,1:20:32,Craig Johnson,SARS is going to lap this up
1597843293325361,1:20:39,Craig Johnson,Yeah youre a thief
1597843301304403,1:20:47,Abel Matshidiso,is Mr Pretorius finally pinning him down
1597843312581336,1:20:58,Sal SA,Now he knows what costs were going to be
1597843342778460,1:21:28,Elton Josea,nail him on the cost to business he was well aware of who was paid
1597843343616060,1:21:29,Angelo Doubel,"30 million was paid for ""Kick backs"""
1597843357259690,1:21:43,Craig Johnson,"44 000 000 to do the job, 211 000 000 profit. Smells fishy"
1597843374613444,1:22:00,Craig Johnson,A thief
1597843379907612,1:22:05,Sibusiso Cilo,"Amend constitution with regards to treasury, if there's some small procurement project in small rural town of Durnacol. 1. Alert treasury 2. Forward reasoning for expenditure 3. Publish upon approval"
1597843416278669,1:22:42,Dominic Przybylski,@Craig Johnson 255 million to do the job. 211 million profit.
1597843439073115,1:23:05,TheQueen V,imagine taking in a contract not knowing what your profit will be😂😂😂laughable
1597843467207003,1:23:33,Sibusiso Cilo,"4. Forward all bidder details (CKs, banking details, registered premises)"
1597843479907424,1:23:46,Abel Matshidiso,was d spreadsheet deleted frm his computer and never checked with his partner how it looks like
1597843509285891,1:24:15,Dominic Przybylski,Profit is so huge that 20 or 30 million missing was not something worth worrying about. Standard BEE procedure.
1597843526703950,1:24:33,Sal SA,@Valencia the cost was so low that it was not pertinent in arriving at the profit.
1597843537267802,1:24:43,watson mutanga,Selling the sun to buy a candle.
1597843568778683,1:25:14,Angelo Doubel,kick backs
1597843576325625,1:25:21,Dominic Przybylski,Paying the price of the sun for a candle.
1597843585463820,1:25:30,Sal SA,Exactly
