timestamp,time,author,message
1561120759485031,-3:07,Grace Kunene Kunene,🙇🙇🙇
1561120794757851,-2:32,PETER STAFFEN,what is happening
1561120970040619,0:13,ELTA BOSHARD,"Commission resumes right after lunch break adjournment, we are continuing with Ms Kutlwano's testimony reporting on the department's version on the agreement"
1561121188908535,3:51,funicanz,"The commission doesn't have that ""thing' on FRIDAY. I have been lost since they started and now that they are back, I still cannot follow. Aiy, happy weekend my people. Monday is another day."
1561121194615956,3:58,Bernard Matolino,who is testifying? what was her role and where? just got released from real work not looting state coffers!
1561121226082514,4:28,Anne M.,"Chief Financial Officer at the Department of Community Safety and Transport, North West Government"
1561121242511665,4:45,Anne M.,Ms Kutlwano Phatudi
1561121244699106,4:47,funicanz,"CFO at the Department of Community Safety and Transport, North West Government, Ms Kutlwano Phatudi."
1561121353452208,6:36,Bernard Matolino,thanks guys. so today its NW in the fray. this disease covered the whole country. no one is safe from this flu!!! corruption virus
1561121449892068,8:13,funicanz,"@Lex Luger , you have summarized it to the core."
1561121476469298,8:39,Pheladi Lamola,I can't hear a thing
1561121481323461,8:43,peter pott,will western cape also come to light since bosasa is also have contracts there?
1561121499996283,9:03,Kay Kay,So Zuma want to play his delay tactics with the commission like he has been doing with the courts
1561121540233569,9:42,Born free,Wow if we do any government work we only get paid a year later. In the private geotechnical Sector and this common practice kills the private Industry.
1561121551414011,9:54,Anne M.,"@Kay Kay Of course, a leopard doesn't change it's spots."
1561121627309656,11:10,peter pott,"ah ah , prof mokgoro is also involved? Gee!!!! who doesn't have skeletons in closet?"
1561121680664803,12:02,Thulani Bukani,the rain preceding the cold front just landed in cape town. it's gonna be heavy rains tonight in the mother city
1561121688130013,12:11,Born free,I am aware of many small to medium businesses that have folded because Government takes forever to pay for services rendered.
1561121717475096,12:40,Anne M.,@Pastor JJ Pastor JJ Don't say that around Adv Hofmeyr 😃
1561121764782141,13:28,Anne M.,"@Thulani Bukani Yes, first the wind and now the rain. Going to be a tough night for a lot of people."
1561121852499240,14:55,peter pott,This transcript is gonna be a mess.
1561121936372893,16:19,Bafana Mlangeni,Can someone in charge of sound please look into it...can’t hear anything.
1561121968832133,16:52,Anne M.,Use the @SABC Digital News tag and ask them to sort it out.
1561121989547877,17:12,Margareth Waterboer,"@ Peter Pott. I can't recall Western Cape involved in BOSASA corruption. BOSASA merely used or bought their Fencing company, but corruption was not an issue.. It was a company that suited BOSASA"
1561122028424838,17:51,peter pott,"eish Prof mokgoro, no wonder he can't speak ill of Supra. comrades in arms"
1561122079143696,18:41,peter pott,anything bosasa must be brought under microscope
1561122117386533,19:20,Margareth Waterboer,But the evidence never revealed corruption in this issue..
1561122129039857,19:31,peter pott,he is the one who wrote this letter they discussing
1561122152909048,19:55,makhosi nobhatyi,Lot of corruption here
1561122154280179,19:57,Diana Sekatane,from one corrupt comrades to another corrupt one. kuzoba lit.
1561122156430229,19:59,Margareth Waterboer,"I listened carefully, because I was really interested to hear who in WC was corrupt"
1561122179659695,20:23,Norman Zwane,"I think you'll all be deeply offended that we past the stage of even trying to find anyone clean within the ANC. I suggest it's like any brotherhood, if you don't sign up for the thieving you left out"
1561122223809397,21:06,Derek Main,Yes - corrupt to the core
1561122281217387,22:03,Sj Kk,Corruption exist
1561122322440624,22:44,Norman Zwane,"With respect to anyone in the ANC or with family in there, THAT is how it seems to me. You can only stay in if you are similarly tainted or are willing to 'look the other way' when things happen."
1561122374334200,23:37,Derek Main,The ANC cadres are as thick as thieves.
1561122386471599,23:48,Derek Main,All in it together.
1561122412001899,24:14,Norman Zwane,@Derek Main It's like looking into the heart of darkness and trying too find a virgin in a brothel
1561122418358511,24:21,Born free,Yes just like a pack of Hyenas
1561122453914049,24:56,Born free,Infact they are Hyenas
1561122553314590,26:36,Derek Main,It's something that was known by most thinking SAfns long before this commission. Only the ANC voters couldn't see it.
1561122650360596,28:13,peter pott,say comrade phatudi
1561122667670875,28:30,Norman Zwane,"As a constitutional democracy we must waste time and money to give crooks an opportunity to defend themselves, If only we had a despot and flush this whole crowd out. This is nonsense!"
1561122689444411,28:52,peter pott,we got a very astute deputy chief justice here SA
1561122690830224,28:53,nhlanhla nkosi,ayeye
1561122718193788,29:20,makhosi nobhatyi,Difficult question to answer patudi
1561122720426133,29:22,Norman Zwane,@nhlanhla nkosi Kwavele kwashuba
1561122721143235,29:23,Anne M.,@peter pott Yes we do
1561122806899481,30:49,Khaya Nomoyi,She is hiding something.Maybe I am wrong.
1561122823988164,31:06,Norman Zwane,@Derek Main From your mouth to the mouth of the gods! Line them all up & Fire!!!
1561122889815043,32:13,Born free,Yes I think she is contradicting herself as she states she knew there was something wrong with the Invoice but she paid it anyway.
1561122899660561,32:22,Mduduzi Thabede,The DCJ has sharp brains... for lack of a better word
1561123138465182,36:21,Born free,It was servicing Luthuli House
1561123146066658,36:28,peter pott,she is prepared. Only now before the judge she realise what a mess she got herself involved in
1561123204045045,37:26,Margareth Waterboer,The judge is the only bright mind in this part of the inquiry today..
1561123214291099,37:37,Norman Zwane,@Born free You kill me. The most truth is told in jest.
1561123228568571,37:51,peter pott,"make no mistake, this people are highly qualified. Only greed got hold of them. easy and quick money"
1561123271019872,38:33,Bernard Matolino,"@Margareth Waterboer You are so right!!! Cry the Beloved ""Cowntry""!!"
1561123275474884,38:38,Margareth Waterboer,Exactly @peter Pott.. GREED
1561123319335560,39:21,Norman Zwane,"@peter pott You may be right about the qualification, but she is not doing the Alumni any favours with this performance on the stand."
1561123326443672,39:29,Mduduzi Thabede,That’s harsh Norman...
1561123332566444,39:34,Margareth Waterboer,"Yep, @Pastor. JJ..."
1561123337739568,39:40,peter pott,"you are right, look at inventors of apartheid. highly qualified, but not intelligent. I agree"
1561123351873707,39:54,Khaya Nomoyi,This advocate is soft with her thats why the chair keeps on interupting to get clarity.This witness will be bad under cross-examination.
1561123355515654,39:58,Mduduzi Thabede,But I agree 😀
1561123479944170,42:02,Tsepang R,"To be brutally honest, Ms Buthelezi is a very poor evidence leader"
1561123482921143,42:05,Norman Zwane,@Mduduzi Thabede To the greater world these peeps tend to be the standard for how the rest of our kids are judged. I am sorry that she is so slow but how did she get ahead of better kids?
1561123534088177,42:56,Diana Sekatane,@Peter pott the inventers of apartheid were intelligent look at their beneficiaries they are well of.
1561123541366801,43:04,Norman Zwane,@Tsepang Ranneileng You get the kind of lawyer you pay for.
1561123563821245,43:26,Margareth Waterboer,She's been poor every time she was leading.. She doesn't probe..only asks obvious questions as paperwork reveals..
1561123594703507,43:57,Khaya Nomoyi,Tsepang you are right.Something is not right with her performance.
1561123616736673,44:19,Bernard Matolino,@peter pott Never underestimate the intelligence of apartheid thugs. those guys were smart. You dont keep such a system running when you are daft
1561123647786317,44:50,Hannes Prinsloo,the corrupt peoples lawyers gonna take all the lootet money then nothing left of tax payers money
1561123694803088,45:37,Tsepang R,massive downgrade from Hofmeyr so I disagree @Norman Zwane. Its got nothing to do with money. How did she even make it to the team
1561123706162559,45:48,Derek Main,@Hannes Prinsloo If the ANC cadres don't manage to steal it first.
1561123754751012,46:37,Derek Main,@Pastor JJ Pastor JJ .. and politicians.
1561123800452020,47:23,Thulani Bukani,@Lex Luger you should check a video of Louis Theroux interviewing Eugene Terreblanche. the guy was very very very far from smart or intelligent
1561123800936137,47:24,peter pott,apartheid is the system that in return could have resulted in huge death of a certain minority population . holding back from revolt by majority shouldn't be confused with stupidity
1561123802113810,47:25,Mduduzi Thabede,She always start slow but I guess it’s because her witness is not up to the task I guess...
1561123810890080,47:34,Derek Main,🤣
1561123849522316,48:12,Anne M.,"If you can believe IOL, ""On Thursday, one of the sources said: ""Baba (as Zuma is affectionately called) will be appearing before Zondo. He was advised against speaking, but he will speak"""
1561123859691666,48:22,Thulani Bukani,well said Peter
1561123954669173,49:57,Derek Main,@Anne M. Nope - don't believe a word IOL says - Iqbal has an agenda.
1561124003585117,50:46,Norman Zwane,That was a mistake ?????
1561124020472038,51:02,Bernard Matolino,@Thulani Bukani No. Terreblanche was just a later day buffoon. We are talking of architects here.
1561124078313323,52:00,ziyanda cele,does this lady have any info
1561124079592238,52:02,Mduduzi Thabede,"Norman I’m with you, most truths are told in jest..."
1561124188928046,53:51,peter pott,This is an unfair question
1561124218552534,54:21,Khaya Nomoyi,"There it is,I knew."
1561124229044611,54:31,ziyanda cele,boaring its like she is scared
1561124312505366,55:55,Norman Zwane,"@Khaya Nomoyi Like I said, the peeling now commences"
1561124341230384,56:24,peter pott,speak in setswana mama$😀😀ho thata fano
1561124374052834,56:56,Khaya Nomoyi,"Zwane, you were right.This woman is hiding a lot I can assure you."
1561124383953369,57:06,M aXe,ayeye this seat is hot!!!!
1561124432570427,57:55,Bernard Matolino,"@peter pott It's not a language issue. When you are hiding something, even in your mother tongue you cease to make sense."
1561124449627914,58:12,peter pott,"wait up until zuma speak in deep zulu, to confuse journalists in the house☺☺☺☺"
1561124562059065,1:00:05,Mduduzi Thabede,Where have you heard of exco i.e political heads taking a a decision or recommendations as to whom a tender must be awarded...
1561124593548778,1:00:36,makhosi nobhatyi,R50 million must come back
1561124624017706,1:01:05,Derek Main,Whatever happened to lifestyle audits for public officials?
1561124635700198,1:01:18,Pitso Mosetlhe,Supra must also come to the commission
1561124711964632,1:02:14,Margareth Waterboer,Translators will be made available...Zondo said so time ago for any other language used at the commission.. As these things are always done..
1561124812808279,1:03:54,peter pott,"and like in Oscars case, first few days argument will be translators using wrong words."
1561124882353324,1:05:04,carnoth ngomane,@makhosi nobhatyi soon he will be talking to the media before they even ask him to come and testify
1561124901917451,1:05:23,peter pott,"example, we got stuck for nearly five minutes, over the word compelled from the previous witness. so translation is not that easy. it's not only words, but content of what was said"
1561125142390106,1:09:23,Magda Seguin,Is anyone also suffering from Commission fatigue?
1561125149078777,1:09:30,Anne M.,@Pastor JJ Pastor JJ I thought you were also on a break because idiot's spam is still here.
1561125168886795,1:09:51,Magda Seguin,"I stopped commenting a long time ago,not worth it"
1561125197912223,1:10:20,Anne M.,@Magda Seguin It can be quite depressing at times. I like to watch some Trevor Noah to lift my spirits.
1561125217335471,1:10:38,Magda Seguin,I see my buddies are here all the time too
1561125218152079,1:10:39,Keith Hadden,Are we done for today?
1561125224996590,1:10:46,Anne M.,Go Pastor!
1561125266629942,1:11:27,Magda Seguin,"I watch animal videos,The DODO is my favourite"
1561125281012572,1:11:42,Anne M.,"Yes, that's a cool channel"
1561125298299283,1:12:00,Magda Seguin,@Anne.M what do you think of SONA?
1561125391653586,1:13:33,Anne M.,"I wasn't able to listen to all of it last night, so I still have to catch up with about half of it. Actions speak louder than words, so we'll see."
1561125410219212,1:13:51,Magda Seguin,We had a 5 plus earthquake here in Western France
1561125425490310,1:14:06,Anne M.,Any damage at your place?
1561125458851307,1:14:40,Magda Seguin,"No,I am in Paris in the north,luckily there were no deaths"
1561125489815521,1:15:11,Magda Seguin,These ladies are colour coded!
1561125528864894,1:15:50,Magda Seguin,Thank you Pastor JJ Pastor JJ 🙏
1561125590131847,1:16:51,Bongani Sondlo,dumelang..
1561125639218697,1:17:40,Magda Seguin,"I really feel for the DCJ and his team,they have a mammoth task"
1561125690020767,1:18:31,Derek Main,@Anne M. Yes - that's what's supposed to happen but we all know it doesn't. They get away with a slap on the wrist if caught out. Audits would lay bare the fact that they must be corrupt.
1561125753060511,1:19:34,Bongani Sondlo,"Ke gone ke gorogang, ke solofela ke sa fosa go le gontsi..."
1561125789588394,1:20:10,Mzalwane Mzala,This is getting complicated
1561125939117554,1:22:41,Anne M.,Ms Tlatsana definitely does not want to be at the commission.
1561125962079758,1:23:02,Magda Seguin,@Anne M its obvious
1561125972248276,1:23:13,Wilson Hishono,I like the way how this lady is leading the proceedings ...no blunders unlike the previous...shes has done her home work very well
1561125999793233,1:23:41,Wilson Hishono,somehow shes grilling them
1561126115947191,1:25:37,Magda Seguin,Som people despise Afrikaans but still use it everyday
1561126146142384,1:26:06,Magda Seguin,Lesufi is leading the pack against Afrikaans
1561126204156138,1:27:05,Magda Seguin,He is a racist
1561126250367477,1:27:52,Magda Seguin,"Racism will be the downfall of SA,Zindzi is a disgrace but she got a slap on the hand"
1561126350585951,1:29:31,Magda Seguin,ANC and EFF...divide and rule
1561126428823610,1:30:50,Anne M.,@goolamv Where did you see that the commission is sitting tomorrow?
1561126445365100,1:31:06,G. Christopher Gaotime,@Goolamy: start at what time tomorrow
1561126518749069,1:32:19,Anne M.,"Okay, I must have missed it."
1561126525951453,1:32:27,nuts King,SAA IS BANKRUPT. NO BANK WILL GIVE SAA ANYMORE MONEY.
1561126548676019,1:32:50,G. Christopher Gaotime,"@ Goolamy, thanx for the info...."
1561126570148403,1:33:11,Kearabetswe Ntsane,did Zuma appear today?
1561126627000552,1:34:07,nuts King,SA is Junk status
1561126635797537,1:34:17,Mzalwane Mzala,It's getting messy
1561126637469855,1:34:18,Magda Seguin,While most of the Zuma/Gupta acolytes are still in the SOEs they will cause havoc together with the Unions.CR didn't even mention disbundling of Eskom in his SONA as he previously promised
1561126638427514,1:34:19,kagiso lerumo,"SAA, ESKOM, SA POSTOFFICE are finished. Now we are going for Reserve bank."
1561126669892823,1:34:51,Mzalwane Mzala,She is a professional
1561126670601063,1:34:52,Kearabetswe Ntsane,@goolamv thanks
1561126673380856,1:34:55,Anne M.,@Kearabetswe Ntsane No such luck. He's supposed to attend 15 - 19 July
1561126674958150,1:34:56,Magda Seguin,He buckled under pressure from the Unions to appease the Zuma faction in parliament
1561126686215121,1:35:07,Bongani Sondlo,this is koroneka.. her self..
1561126737886447,1:35:59,nuts King,BBBEE IS A RACIST POLICY
1561126745199358,1:36:05,Magda Seguin,Zuma was at court supporting his son in Bloem yesterday
1561126794747300,1:36:56,Bernard Matolino,"SOMEONE, Am I dreaming????🤔"
1561126808259679,1:37:09,Tsepang R,typical tenderpreneur
1561126813273157,1:37:14,Kearabetswe Ntsane,how did the trial go?
1561126817511061,1:37:18,nuts King,PENSION FUNDS WILL BE LOOTED
1561126836512442,1:37:37,Magda Seguin,It was deferred to Sept I think
1561126871953170,1:38:13,Kearabetswe Ntsane,hmmm the won't be a conviction there I bet
1561126896498324,1:38:38,Magda Seguin,Foes this lady have lawyers? She seems not to understand a contract
1561126923373637,1:39:04,Magda Seguin,*does
1561126931107611,1:39:13,Naledzani Mashau,The lady is a hustler
1561126947921253,1:39:29,Magda Seguin,Buy documents
1561126969932583,1:39:51,Magda Seguin,It was rebutted by other experts
1561126973224795,1:39:54,Bernard Matolino,Blessed🤣🤣🤣🤣😋😋😋😋
1561126998299286,1:40:20,Grace Kunene Kunene,😂😂😂😂😂😂
1561127038935809,1:41:00,Bernard Matolino,I am NOT Blessed🤗
1561127041316328,1:41:02,P T,This is amusing stuff so a defunct company with 3 employees amd zero experience except delivering meat is given a tender to facilitate immigration and transit administration of passengers
1561127056600226,1:41:18,Naledzani Mashau,"She's a street hustler, you mess with her you are in for it"
1561127092049818,1:41:53,Diana Sekatane,"this tender system must be abolished it is safe haven for a lot of corruption, because here there is no business or specialization."
1561127140920692,1:42:42,Magda Seguin,"Red flag,if I was her I would have smelt a rat with a gmail address doing government contracts"
1561127141578908,1:42:43,Anne M.,@Diana Sekatane What's the alternative?
1561127160847706,1:43:02,Ben Cole,Koroneka will show state capture and mafia style gangsterism in action. Stealing by stealth a law abiding citizen's business to give it to the political gangsters.
1561127185295029,1:43:26,Magda Seguin,One can easily access government tenders on their website and the relevant email info to send it to
1561127210563286,1:43:52,Diana Sekatane,government companies because people don't have jobs.
1561127272310157,1:44:54,Magda Seguin,"Supra is one of the Premier Team with Ace,this smacks of corruption of the highest order"
1561127337466960,1:45:58,Magda Seguin,@Ben Cole totally correct
1561127364005821,1:46:25,Bongie Bubble,She is much smarter then this its all part of her plan just to be on the safe side. A gmail account ? lame explanation by her so called business associate. Tender tendencies
1561127369484534,1:46:31,nuts King,INVESTORS ARE PULLING OUT OF SOUTH AFRICA
1561127399347982,1:46:59,makhosi nobhatyi,Supra Mahumapelo is implicated deeply
1561127428754247,1:47:30,Magda Seguin,She specifically mentioned Supra...listen
1561127472996170,1:48:14,Bongie Bubble,Indeed Supra had been mentioned
1561127482798903,1:48:23,makhosi nobhatyi,@Goolamv wait we are still in the beginning
1561127488093481,1:48:29,Magda Seguin,Supra is now a chairman of a parliamentary committee
1561127527665571,1:49:09,Magda Seguin,"Mark my words,note it down,they are houng to get rid of CR"
1561127550388643,1:49:31,Magda Seguin,*going
1561127553183252,1:49:34,makhosi nobhatyi,He will be fired wait magda Seguin
1561127555169545,1:49:36,Kearabetswe Ntsane,thisla
1561127566075598,1:49:48,Kearabetswe Ntsane,this lady is a hustler
1561127628551041,1:50:50,Anne M.,@makhosi nobhatyi Who is going to get fired?
1561127635066387,1:50:56,fuzile dazana,im lost what is this madam trying to say
1561127675475625,1:51:37,Magda Seguin,Shortlisted maybe but judging that Frolivk is also there among others tells you that they are regrouping
1561127718807081,1:52:20,Mzalwane Mzala,We need to follow the evidence and not speed before it.
1561127747007986,1:52:49,Magda Seguin,If you see what Supra did in the NW your hair will stand on end...the health infrastructure is totally destroyed...that's just one example
1561127764137226,1:53:05,makhosi nobhatyi,"@ Anne M Supra Mahumapelo, now commissions is getting hot and hot next months more evidence will be revealed, especially that implicates them directly, email will come back soon to be tabled"
1561127776992267,1:53:18,Mzalwane Mzala,Brian Tebogo Van Wyk has been heavily implicated by more than one witness so far.
1561127777074916,1:53:18,Ben Cole,I like this witness. Painful to see how she was set up and how her dreams were usurped by crooks.
1561127779345601,1:53:20,Magda Seguin,The defunct Gupta health mobile unit that did zilch comes to mind
1561127847732997,1:54:30,Magda Seguin,The entire world can see that the SA population is paralysed by corrupt politicians
1561127890180120,1:55:11,carnoth ngomane,@goolamv there's no smoke without fire
1561127891742507,1:55:13,Magda Seguin,@goolamv...check out the Gupta health mobile unit story for starters
1561127939070900,1:56:01,Magda Seguin,Or read up investigative publications of the premier league
1561127985953504,1:56:46,Mzalwane Mzala,@carnoth ngomane I stopped using that saying after I experienced being a victing of a story that was manufactured about me.
1561127995426435,1:56:57,Mzalwane Mzala,Victim
1561128025632875,1:57:26,Magda Seguin,"I know the inside story remember I worked closely with the NDOH,I was on a few stakeholder committees for 10 years.I went to Pta regularly for meetings"
1561128046025683,1:57:47,carnoth ngomane,@Mzalwane Mzala i get you but its usually the case
1561128131770884,1:59:14,Kearabetswe Ntsane,the Chair is enjoying this
1561128182173400,2:00:04,Magda Seguin,There is also the new ambulances that never went on the road while people had no services...
1561128210922030,2:00:32,Ben Cole,So am I enjoying this witness.
1561128318804697,2:02:20,Ben Cole,One of the few who brings laughter by an otherwise somber affair.
1561128318973333,2:02:20,Lebogang Moepeng,she does not want to take the fall for others
1561128330018680,2:02:31,Magda Seguin,NW was put on administration
1561128339406439,2:02:40,Mzalwane Mzala,Exactly
1561128368020182,2:03:10,fuzile dazana,she is agrizing now
1561128386882791,2:03:27,Magda Seguin,Zuma still has all his allies firmly in place including the PP
1561128430017681,2:04:11,Ben Cole,"Van Wyk, a great enabler of corruption. Takeover by stealth. What a dark soul."
1561128500549233,2:05:22,Magda Seguin,"I think when the prosecutions start SAs will be so traumatised,at present they are in denial thanks to the EFF who diverted the commissions work with the land issue"
1561128609425570,2:07:11,Magda Seguin,"They say SAs must become entrepreneurs but they get sucked in by corrupt politicians,this lady started out with the best intentions to uplift her village"
1561128686417397,2:08:27,Danie Nilsen,"i am baffeld by the scope of this state capture enquiry are we as a country already bankrupt this is scary out of the fact that this goverment just got another 5 years to continue with this crap,"
1561128696618450,2:08:37,Danie Nilsen,"how can voters be so naive as to vote in the corupters again, or are they so used to this type of governance"
1561128734939877,2:09:16,Magda Seguin,What a mafia style invasion of her CC
1561128775822524,2:09:56,Danie Nilsen,who is next Boswell and wilky siecus
1561128785210076,2:10:06,Danie Nilsen,sircus
1561128798722312,2:10:19,Mzalwane Mzala,I supported PP Madonsela and I give the same support to PP Mkhwebane. The review process is a sound one.
1561128831245245,2:10:52,Magda Seguin,"Nepotism, yet politicians enable their families."
1561128843159257,2:11:04,Danie Nilsen,ty i just got in an heard the last witness shame she were abused
1561128853109436,2:11:14,Magda Seguin,This breaks my heart
1561128987312219,2:13:29,Magda Seguin,@Ben Cole maybe he thought this will never be revealed
1561129230138869,2:17:32,Victor,This is nonsense deal
1561129252282129,2:17:54,Magda Seguin,@Victor it's called corruption
1561129380260471,2:20:01,Tsepang R,life partner?? I'm confused..
1561129381481073,2:20:02,Khaya Nomoyi,These witnesses sometimes they are really moving this commission at a snail pace.
1561129442688126,2:21:04,Anne M.,@Tsepang Ranneileng Van Wyk is gay and his life partner is a man
1561129463557902,2:21:25,Danie Nilsen,Eish !
1561129481150064,2:21:42,Some guy,😶
1561129517962396,2:22:18,Magda Seguin,The DCJ must get everything on the table as it will go on record for the courts...a snails pace is better to get the details than to rush and they go to court unprepared
1561129523688605,2:22:25,Born free,They are gay lovers
1561129529545723,2:22:31,Anne M.,"No, don't feel stupid"
1561129535744471,2:22:36,Mzalwane Mzala,No chair
1561129548414716,2:22:50,fuzile dazana,no. no no
1561129570295175,2:23:12,Mzalwane Mzala,Zondo is precise
1561129572793230,2:23:14,Magda Seguin,"I picked it up immediately, I didn't know he is gay but I understood"
1561129573170760,2:23:14,Some guy,even gays were exercising state capture😨
1561129599908551,2:23:41,Danie Nilsen,they were bending for friends lol
1561129602001349,2:23:43,Mzalwane Mzala,@Some guy 😁😁
1561129654104234,2:24:35,Magda Seguin,SA Express was grounded due to all the mismanagement
1561129665933974,2:24:46,Mzalwane Mzala,I think she is the original owner of Koroneka @Thando Nkutha
1561129666752220,2:24:47,Anne M.,Hello@Thando Nkutha. Ms Babadi Tlatsana
1561129713706506,2:25:34,Helen Laing,"manipulation is a form of abuse, this lady has been manipulated by a master of corruption"
1561129741094251,2:26:03,Diana Sekatane,"Greed knows no gender, colour or whatever."
1561129784581143,2:26:45,Danie Nilsen,"this type of ""busness"" is normal in africa saam eet en saam steel"
1561129793550972,2:26:54,Magda Seguin,"SAA and SA Express must be sold,there is nothing there"
