timestamp,time,author,message
1551183157631318,1:43,Desmond Masilela,"Are you guys still on lunch?"""
1551183203775316,2:29,Mfundo Veerasamy,are we live again?
1551183217101723,2:42,martin mupunga,yes dear
1551183224020985,2:49,Robert Maleke Motala,i wonder
1551183289437419,3:54,Eugene,lunch? I don't have lunch I don't even have a job. I'm white
1551183380891272,5:26,Desmond Masilela,We are not talking about race or what so ever here. The discussion is about Eskom
1551183402692588,5:47,Joel Mzayidume,@Eugene Fourie at least you have wifi. many more unemployed blacks are unemployed...what's your problem
1551183458726593,6:44,Eugene,maybe they should stand at a free hot spot like I am
1551183472190346,6:57,Myka'Al Daud,"Q papers ready, u ll b writing yr test @ 16H30,hope u uses lunch time 4 revision"
1551183492333512,7:18,Desmond Masilela,I'm about to block 1 guy here.
1551183537061892,8:02,Joel Mzayidume,"@Eugene Fourie regardless, you're not alone...many more black people are unemployed so don't come and present your case as if you're unemployed because you're white"
1551183538064354,8:03,Eugene,and who might that be?
1551183561416578,8:27,Desmond Masilela,Wait you will see who might be.
1551183569193090,8:35,Eugene,I am unemployed because I am white it's true
1551183607414302,9:13,Joel Mzayidume,ok. so what. you're boring
1551183629079222,9:34,Eugene,atleast I'm entertaining you
1551183633781327,9:39,Desmond Masilela,So what????
1551183668489402,10:14,Fils de l'homme,Hello to all my bantu
1551183681717737,10:27,Fils de l'homme,Hello to all the caucasians
1551183695454413,10:41,Fils de l'homme,hello to all the Hottentots
1551183700106623,10:46,LINDAN SIBIYA,I want icecream. it so hot this month
1551183707221054,10:52,Fils de l'homme,Hello to all the Coolies
1551183728956425,11:14,Fils de l'homme,Let us VOTE for the FREEDOM of the TRANSVAAL
1551183788478965,12:14,Joel Mzayidume,@Fils de l'homme pls go to Orania where you're welcome
1551183816266519,12:41,LINDAN SIBIYA,whose white hear now ? i am 3 decade no white person in this planet unless on Game of Throne
1551183821377241,12:46,Smod Zid,"Fils.... He wants the Transvaal, but he lacks basic manners"
1551183847683580,13:13,Fils de l'homme,The Bantus were treated well in the TRANSVAAL
1551183849831712,13:15,Risto Ndaumbwa,Namibia is ready to buy Northern Cape
1551183892492682,13:58,Fils de l'homme,The Bantus have messed up South AFrica
1551183911042274,14:16,Fils de l'homme,Let us VOTE for the FREEDOM of the TRANSVAAL
1551183986404806,15:32,Myka'Al Daud,White? Orania ? blah blah blah!!!!
1551183986775879,15:32,Swwetvenom Capone,Eliminate all the scourges of our land
1551184032876973,16:18,Fils de l'homme,@Swwetvenom Capone no genocide
1551184094476213,17:20,Fils de l'homme,Let us VOTE for the FREEDOM of the TRANSVAAL
1551184154327146,18:20,Christian W,Guys block the trolls
1551184160449717,18:26,Christian W,its the same troll accounts back again
1551184175090891,18:41,Fils de l'homme,@Eugene Fourie The caucasians should not kill the Bantus
1551184182928889,18:48,Swwetvenom Capone,"It isn’t genocide, it’s healing anytime you don’t get rid of the whole virus it grows again, and transforms, no genocide though only healing 🙌🏿🙏🏿🙏🏿😇"
1551184199859808,19:05,Christian W,"Fils always goes on about bantus, he is just race baiting, block him"
1551184213382148,19:19,Myka'Al Daud,Orania and white supremacy will only exist under ANC watch
1551184237569914,19:42,Fils de l'homme,"@Christian W I am just making my case about the FREEDOM of the TRANSVAAL, why do u want to infringe my freedom of expression"
1551184280575343,20:26,Fils de l'homme,@Eugene Fourie The caucasian has a job to protect the bantu
1551184314262328,20:59,Smod Zid,@eugenefourie Your url will be tracked and you will be questioned on your mosquito claim. This is serious
1551184330816920,21:16,Christian W,just ignore the trolls
1551184331656784,21:17,Eugene,and who protects the Caucasian?
1551184331873176,21:17,Desmond Masilela,Before
1551184343947563,21:29,Christian W,they are paid to distract us
1551184357493283,21:43,Christian W,they are also paid to frame a fake naritive
1551184357898874,21:43,Fils de l'homme,"@Eugene Fourie, The Caucasian is the master group"
1551184378708956,22:04,Fils de l'homme,@Eugene Fourie the caucasian has shapped the world
1551184382057248,22:07,Eugene,It's not my mosquitos I just know about the plan and I'm willing to share
1551184397057556,22:22,Desmond Masilela,"Lets not ignore them, rather block them. @Christian W"
1551184412520080,22:38,Fils de l'homme,@Eugene Fourie share please
1551184459457268,23:25,Robert Russell,@Eugene Fourie ....go have another joint...
1551184468132527,23:33,Eugene,1 mosquito kills 1 person in 1 hour. they can't kill more then 1
1551184481463319,23:46,Smod Zid,@eugenefourie Share with the hawks today!
1551184498528309,24:04,Christian W,@Desmond Masilela block or ignore
1551184528689077,24:33,Robert Russell,@Smod Zid ..... he is as high as a Hawk.....
1551184536045476,24:41,Fils de l'homme,"@Eugene Fourie that is a pipe dream, the bantus have developped immunities to mosquitos"
1551184552707115,24:58,Desmond Masilela,@Christian W. Block. Fourie is blocked i'm glad im not gonna see his comment.
1551184623865087,26:09,Smod Zid,delusional..... but cant be ignored. You know people in SA bring back prople fron their dead
1551184639607479,26:25,Eugene,These are not normal mosquitoes. They are locked away the people walkes through 5 sealed rooms to get to them
1551184676287849,27:01,jeevan singh,smod i am one of them
1551184716028604,27:41,Smod Zid,one of what
1551184728775134,27:55,jeevan singh,dead
1551184804855250,29:10,Smod Zid,oh HI.. Hows it on the other side? Were you on the left or right of the dead world?
1551184885820757,30:31,jeevan singh,no sides there.
1551184892471542,30:38,Eugene,I know they are going to release the killer mosquitoes in South of Europe and send them to the north side in 2050 that would actually be the 3rd launch of the killer mosquitoes.
1551184939218639,31:25,Nhlanhla Nsele,so it remains unsaid that this evidence leader has been very clear...very prepared!
1551185048092737,33:13,Michael Leopoldt,8 ta
1551185223678523,36:09,Eugene,The mosquitoes lay egs inside of the human body they can produce like a 100 000 mosquitoes per person. They don't need water like othe mosquitoes to breed
1551185344991509,38:10,Eugene,So if you see someone who died of a killer mosquitoe it's best to leave the body and just run because you might be next
1551185385220988,38:51,luzuko masoka,when is agrizzi coming back i miss him
1551185459436735,40:05,Jane .Blamire,hahahaha
1551185470029518,40:15,Michael Michael,Luzuku me too.wait for mrs Miyeni
1551185545658904,41:31,Jane .Blamire,oooh yes. that will be popcorn stuff....it wasnt me syndrome
1551185551349402,41:37,luzuko masoka,noted Michael also Jiba
1551185833534246,46:19,Myka'Al Daud,Mr Koko what did u do to PG?
1551185938610811,48:04,Dabula Bongile,ziyawala!!!
1551186077370035,50:23,Andre Gerber,@Thando acting general manager primary energy div
1551186124148624,51:10,Pheladi Lamola,Do the people who do the testing receive the samples from the mines or do they go themselves to get them personally?
1551186152533055,51:37,Eugene,does anyone want to see some racist emoji's?
1551186255210236,53:21,Desmond Masilela,Wow!!!! bomb shell
1551186273720243,53:39,Born free,Koko has a coconut for a brain.
1551186398865580,55:44,welton paulse,Guys in ESKOM operated like a MAFIA
1551186454756356,56:40,Israel Guambe,"its disappointing for S,A,P to trustees ANC,Lida's."
1551186460536123,56:46,luzuko masoka,i like white people
1551186503450071,57:28,Joel Mzayidume,koko has a lot of explaining to do
1551186575083989,58:40,Eugene,BEE and Affirmative action is why I am unemployed. We are also the only country that has affirmative action for the majority of the country.
1551186589432529,58:55,Felix Muyoba,@welton paulse true..it was a playground for thieves
1551186617771682,59:23,sikhumbuzo crispen sibanda,@Joel Mzayidume he dosent need to explain but simple go to jail
1551186641488303,59:47,Andre Gerber,Koko is quiet today. just defending yesterdays allegations
1551186676573537,1:00:22,Derek Main,@Thando Nkutha Yeah - ask him that and then put him in the other one
1551186737938614,1:01:24,John-Basel Ioannou,"the problem for koko is that he can't lie under pressure he stutters a lot,like he did on carte blanche."
1551186756452419,1:01:42,John-Basel Ioannou,koko will be easy pickings
1551186817425103,1:02:42,makhosi nobhatyi,Where is masutha and cele please send arrests
1551186847546860,1:03:12,Pheladi Lamola,"Wow, you don't play @Derek Main"
1551186850093967,1:03:15,Eugene,BEE is not there to empower blacks economically but to destroy white economics it's really backwards thinking.
1551186852603683,1:03:18,Anne M.,@Thando Nkutha 😂
1551186938832763,1:04:45,Lwandile Radebe,koko strait to jail please
1551186953806160,1:04:59,rohan barnard,SGS- Sibeko Gold Systems 😂😂😂
1551187097201137,1:07:22,rohan barnard,Who is the witness?
1551187099784597,1:07:25,sikhumbuzo crispen sibanda,@Lwandile Radebe l suggest prison exchange programmes with Zimbabwe for him to go to a prison called Chikurubi
1551187153182404,1:08:19,makhosi nobhatyi,@ Thando Nkutha 😃😃😀😀 hey you have a point
1551187220779001,1:09:26,Anne M.,@rohan barnard Acting General Manager of one of the divisions at Eskom
1551187240946379,1:09:46,makhosi nobhatyi,"They are all busy now figured out what they are going to say, might put everything to mr rit"
1551187260889313,1:10:06,Felix Muyoba,@rohan barnard a technologist by profession..
1551187418945257,1:12:45,Anne M.,"@Thando Nkutha With such a high unemployment rate in South Africa, it's difficult for whistle-blowers to come forward. They fear for their jobs."
1551187423672176,1:12:49,Derek Main,@Pheladi Lamola The time for playing with these criminals is over. We should do what they do in Saudi Arabia to thieves and chop off a hand
1551187438405810,1:13:04,Eugene,The dumb ones would be highly intelligent compared to the smart people in South Africa.
1551187444115762,1:13:09,rohan barnard,Thanks @Anne M. & @Felix Muyoba
1551187510876744,1:14:16,Sthakathi Khumalo,"The danger into accepting one version of a testimony is that you may miss the relevance of the other!! Until Koko, Molefe and Ngubane come confirm all of these shenanigans!! For now I listen carefully"
1551187567479137,1:15:13,Derek Main,@Sthakathi Khumalo They will not confirm these allegations - they will lie through their teeth as they always have
1551187623369997,1:16:08,John-Basel Ioannou,"because of koko,molefe and Ngubane eskom his holding the country at ransom"
1551187642839112,1:16:28,Sthakathi Khumalo,v Which make it difficult for me to accept this one version as the truth.. I want people in the field or central to give me evidence/corroborate as opposed to theories
1551187646677930,1:16:32,sikhumbuzo crispen sibanda,@Derek Main with straight faces🤣🤣🤣
1551187666114935,1:16:51,Anne M.,@Derek Main Or develop amnesia when they come before the commission
1551187667966266,1:16:53,PETER STAFFEN,Thando Nkutha and Molefe
1551187701251348,1:17:27,Sthakathi Khumalo,So in your views people which version should we take? and if so why?
1551187770879338,1:18:36,Derek Main,@Sthakathi Khumalo What do these people testifying against the looters have to gain - nothing. Whereas the looters have every reason to lie
1551187772119444,1:18:37,Christian W,"@Thando Nkutha yes but they decided to become corrupt, they were not forced"
1551187776067171,1:18:41,Anne M.,"@Sthakathi Khumalo The commission investigators have checked all the affidavits, and there are a lot of compromising e-mails between the previous Eskom management."
1551187885304572,1:20:31,Hons Uju,"So like, 1 day should we be so lucky, all this must happen once again in a court of law? Why do we have these inquiries ?? Why isnt this just done in court?"
1551187886503229,1:20:32,Michael Michael,Hope in ten years time we will really c new south africa.free of greedy people free of corruption.
1551187917134528,1:21:02,John-Basel Ioannou,this adv is giving facts with confirmation
1551187974619884,1:22:00,Sthakathi Khumalo,"Anne M. Compromising as they are these emails, my issue then is, through Kokos cabal, eskom was efficient but now .. a new board is put in place but no results.."
1551187977149225,1:22:02,Christian W,"@Thando Nkutha that is where the judges need to decide, we do not have the intellectual capacity to make such judgements"
1551187994652098,1:22:20,Samuel Bagraim,MARIKANA
1551188001363497,1:22:26,Samuel Bagraim,/MARIKANAMARIKA
1551188022479274,1:22:48,Michael Michael,khumalo with kokos.
1551188037771266,1:23:03,Derek Main,"@Sthakathi Khumalo That's because these thieves messed up Eskom so much, no board can fix it in a hurry"
1551188064584846,1:23:30,Michael Michael,Derek correct
1551188097842052,1:24:03,makhosi nobhatyi,"@Thando Nkutha an educated man ruined graduates and destroying them by putting money, look at their career is in mess now, these people sold out our struggle to the few blaming whites 🤷🏾‍♀️"
1551188117239389,1:24:22,Christian W,hopefully the tribunal will speed that up
1551188166604253,1:25:11,Christian W,@makhosi nobhatyi where does the whites come into play here? you are just race baiting
1551188198077868,1:25:43,Andre Gerber,@ Sthakathi Khumalo They cooked the books and lied. Eskom was basically bankrupt since 2015
1551188204732335,1:25:50,makhosi nobhatyi,There is no way we should blame whites we have authority to change South Africa but our leadership were busy enriching themselves 🤦‍♀️
1551188217555171,1:26:03,Christian W,I agree that they are a embarrassment for black people
1551188237814729,1:26:23,John-Basel Ioannou,"there's another reason y,the guptas pushed up the dollar,export of coal"
1551188258138419,1:26:44,Christian W,black people should be outraged as there people represent them and thus should be shining examples of excellence
1551188293584639,1:27:19,Jane .Blamire,Where do you start to fix this mess???
1551188307869910,1:27:33,Christian W,there are such amazing black people but these corrupt people make their name bad
1551188353218421,1:28:19,Andre Gerber,As a South African I would not say embarrassment foe black people but embarrassment for South Africans
1551188355820454,1:28:21,Pheladi Lamola,We are outraged @Christian W but our voices are not heard because we're not politically connected.
1551188367378963,1:28:32,makhosi nobhatyi,"@Christian w my apologies I was trying to reveal something here these people who are implicated here always come to media criticize whites knowing that they are beneficiaries ,"
1551188389664696,1:28:55,Christian W,What is interesting with watching so many of these inquiries is the body language of people who appear sincere and honest vs those with hidden agendas and who are clearly dishonest
1551188432504514,1:29:38,Christian W,"@Pheladi Lamola I can understand that, but there are voices of reason, they inspired me especially during the zuma must fall"
1551188462397650,1:30:08,Christian W,@makhosi nobhatyi ok
1551188475592757,1:30:21,Jane .Blamire,Yes Christian and notice that the innocent dont refer to their files so much cos they are telling truths
1551188477797516,1:30:23,Derek Main,@Jane .Blamire Another way we can start to fix this mess is to vote wisely in May
1551188484193103,1:30:30,Lwandile Radebe,no wonder Guptas ran away...... they were milking our country.... mara why anc sold us out
1551188523512621,1:31:08,Jane .Blamire,The choices are worrying Derek
1551188541191515,1:31:26,Derek Main,@Lwandile Radebe Because for the ANC it's always been about self-enrichment and stuff the people
1551188547281234,1:31:33,Sthakathi Khumalo,"Andre Gerber I hear you, then what are we doing on this commission if we not gonna find anything.. since the books are manipulated. Because for me, this inquiry then becomes useless.."
1551188553877134,1:31:39,makhosi nobhatyi,"@Thando Nkutha President appointed another arm of investigators to investigate funds we lost, look what these thieves do blames president that is bringing back scorpion coz scared they will be arrestd"
1551188576850833,1:32:02,Andre Gerber,Yes Derek all must think hard before their X
1551188577184134,1:32:02,Singi Mathebula,and they have or will host R100m wedding in Dubai. cry our beloved mzanzi
1551188604751291,1:32:30,Felix Muyoba,@Lwandile Radebe they took us for granted..that we are stupid and we will not detect their deception..they were wrong!!
1551188670178314,1:33:35,Sthakathi Khumalo,"The Eskom saga for me, is just two cooperate indices (clever blacks like Koko vs IPPS).. BOTH THESE INDICES WANT TO MILK STATE MONEY!! IF THEY ARE BOTH FOUND NOT CONSISTENT, THEY MUST ALL BE REMOVED!"
1551188687314710,1:33:52,Christian W,"@Thando Nkutha i read it ""properly"" my interpretation was just out."
1551188698081605,1:34:03,John-Basel Ioannou,so theoretically the guptas caused load shedding
1551188709465559,1:34:15,Felix Muyoba,"@Sthakathi Khumalo how can you call a thief clever, wena?"
1551188726182975,1:34:31,Derek Main,@Sthakathi Khumalo We need IPPs - it's the only way forward
1551188743346477,1:34:48,makhosi nobhatyi,It is Gupta did load shedding
1551188748144040,1:34:53,Anne M.,"@John-Basel Ioannou Yes, and costing this country billions in losses in the process"
1551188772723452,1:35:17,Andre Gerber,Commissions are here to figure out the amount and who is responsible then only the law steps in
1551188779495973,1:35:25,Singi Mathebula,President mudt move fast and arrest these thugs before they remove him at the NGC
1551188786145839,1:35:31,M T,China is already in - Taking over Eskom
1551188831965060,1:36:17,Sthakathi Khumalo,Felix Muyoba- I hear he is a clever black.. and Derek Main 40 year contracts are just capture at its highest points. If they are kept they must be given one year contracts haha
1551188887391056,1:37:13,John-Basel Ioannou,"anne.m I heard for every stage it the equivalent of a billion per stage.eg stage 2 =R2billion,stage 3 =R3billion and so on.Thats per day"
1551188890775025,1:37:15,Christian W,"zuma said once that ""this corruption is a western thing"" I think that what he said is that he does not accept the western definition of the word."
1551188892745689,1:37:17,Christian W,"He was referring to ""the african way"" which is that you need to pay me to do what you need me to do even if it is my job."
