timestamp,time,author,message
1561134558303279,3:46:19,j b,"she's a candidate for money laundering, the way she does business."
1561134559126220,3:46:20,Margareth Waterboer,"And I appreciate the streaming, because I can't always watch live, BUT don't want to miss out.. I watch late evenings and even weekends..."
1561134615149039,3:47:16,Some guy,tl tl tl tl😂
1561134615438879,3:47:16,Danie Nilsen,FOR ME THE BEST ONE IS NOW GAUTENG there 20 hijackingd 44 house brakinns murder every 4 hrs a murder black on black 1 everu week white on white stealing milk outside cafey ever day
1561134634415430,3:47:35,solomon khalushi,fronting at its best
1561134641979027,3:47:42,Chalwe Mwansa,@Tikvah Olam she is trying to put up a complete show
1561134683663577,3:48:24,Mzalwane Mzala,You're a big boss now!
1561134720420983,3:49:00,Some guy,she probably has a royce rolls. hiding it at home
1561134724694233,3:49:05,j b,another reason for free education
1561134738476813,3:49:20,Danie Nilsen,the judge is smiling he is enjoying this witness lying herself right into polsmoor for many years to come
1561134773423989,3:49:54,Chalwe Mwansa,ya this woman has jail calling
1561134844635880,3:51:05,Daniella Morgan,contradicting?? earlier she didnt' know
1561134848374874,3:51:10,Justice M Medzani,😱
1561134872266357,3:51:34,Mzalwane Mzala,African women are being used in these contracts.
1561134918577444,3:52:19,Zola Pinda,R 8m in 2 weeks after signing the contract.
1561134921116387,3:52:22,Hamaya 916,hi from Sacramento California
1561134927905925,3:52:29,Margareth Waterboer,"I so much wanted to believe this lady, but now my trust is GONE.. Something is rotten in the State of Denmark..."
1561134942904848,3:52:43,solomon khalushi,that's how crooks work
1561134944299947,3:52:45,Daniella Morgan,how did the bank not pick this up
1561134948143815,3:52:49,Danie Nilsen,she can deliver chicken for the watsons i think agrizzi should know he must check his black book
1561134971405400,3:53:13,Francois Cape Town,"Nobody gets ""used"" without knowing at least something isn't right..."
1561134981061406,3:53:22,Anne M.,"@goolamv She had registered for a tender and Van Wyk needed a ""clean"" business to channel the money"
1561135026174271,3:54:06,Zola Pinda,This woman is not a baby.
1561135061860060,3:54:43,Danie Nilsen,and bells
1561135089133203,3:55:10,Hamaya 916,How are you pastor Jj pastor jj
1561135105592587,3:55:26,Danie Nilsen,and i was thirsty and he was chasing me and the iesh was melting
1561135223789810,3:57:25,Some guy,thetha isiXhosa Mmama
1561135232459042,3:57:33,Danie Nilsen,no! it was apartheid
1561135243020578,3:57:44,Some guy,"dont do ""hong hong hong"""
1561135281113058,3:58:21,Zola Pinda,"This is far enough, can't these looters be arrested now and transported from jail to the commission ? Where are the Hawks"
1561135298293041,3:58:39,Some guy,lol
1561135310454160,3:58:51,Daniella Morgan,if someone uses my R200 to repair the airport I would object. they took R2million!!!!
1561135339288036,3:59:20,Mzalwane Mzala,@Some guy Ngubani othe uyasazi isiXhosa lomama?
1561135348886752,3:59:30,Daniella Morgan,did they buy the airport
1561135368173236,3:59:49,Some guy,exactly
1561135433616982,4:00:54,Mzalwane Mzala,Umama was just happy to receive the money
1561135446777257,4:01:08,Some guy,@Pastor JJ Pastor JJ u said u dont live too far from DCJ. where do yall live?
1561135462886370,4:01:23,MIKE DURBAN,Passing the Buck......I reckon.......
1561135474829502,4:01:35,Mzalwane Mzala,Definition of fronting!
1561135485833740,4:01:47,Danie Nilsen,odendaalsrus a MAGASHULE HIVE
1561135486304973,4:01:47,Kevin Simon,She is effectively pleading guilty to money laundering.
1561135512745502,4:02:14,Some guy,thats right. Id be happy too lol. Especially with Millions.... u dont ask too much. just take the money
1561135550771440,4:02:51,Zola Pinda,money coming fast in the account
1561135560059389,4:03:01,Chalwe Mwansa,i pit this woman......
1561135576451897,4:03:16,Francois Cape Town,"Chair : Stop being nice to her, and call a spade a spade..."
1561135584810021,4:03:25,MIKE DURBAN,I certainly don't.....
1561135586099158,4:03:26,Chalwe Mwansa,she was enjoying money coming fast fast has she put it
1561135601647717,4:03:42,Zola Pinda,money coming in nicely
1561135617361274,4:03:57,Danie Nilsen,DOES SHE PITY HUNGRY POEPLE WITH OUT JOBS AND HAVE TO WSTEAL TO PUT FOOD ON THE TABLE
1561135625324144,4:04:05,MIKE DURBAN,Eeeeesh...but it was happening Toooo fast...eesh
1561135630323793,4:04:11,Danie Nilsen,PEOPLE SORRY
1561135640371517,4:04:22,Kevin Simon,RET at its best!!!!
1561135648500704,4:04:29,Zola Pinda,Relax money coming in quick
1561135656066485,4:04:36,Mzalwane Mzala,truth is coming out
1561135665982589,4:04:46,Some guy,lol wats wrong with CJ now..... getting emotional lol
1561135678939941,4:05:00,Mr Q,RET RET RET ... Zuma supporters Lol
1561135680442500,4:05:01,Chalwe Mwansa,relax relax relax......she was busy enjoying
1561135692596478,4:05:13,Mzalwane Mzala,She was captured by Brian Tebogo van Wyk
1561135706648985,4:05:27,MIKE DURBAN,Eeeesh...she has All the excuses lined up already........very crafty one this.....
1561135710890943,4:05:31,Margareth Waterboer,"Sitting at home and getting millions ...nope, something is WRONG! People tell me how my company is doing and I know NOTHING! Now, the woman scenario comes in.. Tsk"
1561135717133638,4:05:38,Some guy,I fully understand this woman and the position she was in. It makes perfect sense. Im not saying she did well. Im saying I understand where she was
1561135726011637,4:05:47,Kevin Simon,"Wait for it, ""I didn't know""!"
1561135731788612,4:05:53,Sihle Charlie Nxumalo,.
1561135736212996,4:05:57,Mzalwane Mzala,I also understand her situation
1561135751148273,4:06:12,Mr Q,foward nge RET...lol
1561135790276615,4:06:51,Francois Cape Town,Running out of excuses
1561135815266251,4:07:15,Some guy,lol thats right. Before the chicken come home to roost u would have thought of an exit plan LOL
1561135847110550,4:07:48,Zola Pinda,"movement and finance, don't worry"
1561135871397118,4:08:11,Kevin Simon,Relax
1561135880299731,4:08:21,Some guy,"or at least be a great lair. Like Zuma, whose a master of truth manipulation.... with all due respect to Msholozi"
1561135883541432,4:08:24,Chalwe Mwansa,i anticipated money will be moving at the fast rate. she was only told she will be getting just a commission for using her name/company
1561135896071949,4:08:36,MIKE DURBAN,People...it.s stealing from the tax payer........your money....think
1561135898564583,4:08:39,Margareth Waterboer,Now she's rambling...
1561135906797043,4:08:47,Whyton Nyirenda,This lady was being used too much.But she knew that something was somehow wrong. She got something out of all this
1561135936672190,4:09:17,Chalwe Mwansa,@MIKE LOCK jail smelling for her
1561136013030185,4:10:33,solomon khalushi,she was fooled by Van wyk
1561136014525251,4:10:35,Mzalwane Mzala,She was a white man
1561136027599301,4:10:48,Some guy,hahahaha
1561136036890522,4:10:58,MIKE DURBAN,@Chalwe Mwansa ....Please Lord....them All that are guilty face huge jail time....Please Lord...
1561136056114889,4:11:17,Margareth Waterboer,"No, Van Wyk and SHE were fooling the SA.."
1561136059436861,4:11:20,Daniella Morgan,🤣🤣🤣🤣🤣🤣🤣
1561136093418440,4:11:54,Trymore Moyo,"he he he mr van Wyk said, miss hofmeyer must put it to her that she is lying. she is a thief just like all of the them."
1561136098667854,4:12:00,Some guy,story time 😃
1561136121573819,4:12:22,Some guy,i wish chief justice could tell more stories
1561136145136802,4:12:45,Mzalwane Mzala,I also won a case at work for a guy who was disciplined for being overheard saying mlungu.
1561136211529076,4:13:52,MIKE DURBAN,Freedom of speech...is what it is.....
1561136212342450,4:13:53,Some guy,@Mzalwane Mzala oh boy. Is it a crime to say that word in the work place or were they just exaggerating.
1561136307893222,4:15:28,Some guy,lol
1561136326804068,4:15:47,Kevin Simon,"As long as there was some funds left for her for doing nothing, any flimsy explanation would do. She had to listen to Brian as she had no idea how the funds would continue flowing without Brian."
1561136341212157,4:16:02,Chalwe Mwansa,2 million going out of the bank is little thing.....these guys where living in laxury
1561136375681320,4:16:36,MIKE DURBAN,You can call me anything you like.....I 'll just tell you to go play in the traffic...heheh
1561136385915357,4:16:46,Whyton Nyirenda,They told her to relax and do all the transactions through her company bank account and then leave something for her as payment. It was all well orchestrated
1561136447831452,4:17:48,Some guy,lol they should have brought them wine.... its friday for goodness sake.
1561136455906322,4:17:56,Kevin Simon,CEO for rent
1561136514073555,4:18:55,Mzalwane Mzala,This case is opening eyes about one other form of corruption by senior managers.
1561136527446679,4:19:08,Chalwe Mwansa,"500,000/800'000*100=6%"
1561136528007621,4:19:09,Kevin Simon,Declared as divend. No divend witholding tax company to company.
1561136554809893,4:19:35,Alyson Kessel,What kind of car does she drive
1561136565210451,4:19:45,Some guy,royce rolls
1561136595845256,4:20:16,Alyson Kessel,I think she knew a lot more than she’s letting on
1561136602827089,4:20:24,Margareth Waterboer,And she can give banking details WHILE DRIVING! Judge Judy would say: now you're making it up as you go along..
1561136619430420,4:20:41,Mzalwane Mzala,is it not seven in SA yet?
1561136626061450,4:20:46,MIKE DURBAN,Same car as Jacob....heheheh
1561136647403807,4:21:09,Alyson Kessel,Hehheh
1561136648214490,4:21:09,Anne M.,"Yup, it's 19:03"
1561136661248117,4:21:22,Daniella Morgan,that payment from one business account to another business account is irregular.
1561136685018765,4:21:45,Margareth Waterboer,"She doesn't look up now... No, sorry, I don't believe her anymore..."
1561136687515423,4:21:48,Mzalwane Mzala,I thought they were going to stop at 19h00. It is 18h04 here
1561136717557852,4:22:18,MIKE DURBAN,SA Bra........
1561136768510578,4:23:09,Anne M.,@Pastor JJ Pastor JJ 😂
1561136790379620,4:23:31,Anne M.,"I'm a night owl, don't like early mornings"
1561136826289386,4:24:07,Anne M.,"Yup, the wind is blowing big time"
1561136845124345,4:24:26,Anne M.,Storm weather and also snow
1561136852096120,4:24:33,Mzalwane Mzala,So they are not making a mistake about Saturday
1561136894725301,4:25:15,MIKE DURBAN,This advocate is sharp...i like her a lot
1561136912673795,4:25:33,Mzalwane Mzala,Zondo means business now
1561136938063975,4:25:58,Tsepang R,Ms Hofmeyr is the epitome of reason and articulation😍
1561136975420797,4:26:36,MIKE DURBAN,@Tsepang Ranneileng ...I conclude.....
1561136987077580,4:26:47,Some guy,class dismissed. dont forget to do ur homework guys.
1561137014097291,4:27:14,MIKE DURBAN,Oh no...it's Friday......beer time..
1561137058725209,4:28:00,Some guy,"LOL oh thats right. Beer, then home work."
1561138534887827,4:52:35,Danie Nilsen,CHOW
1561138780089789,4:56:41,KEITH SINDILE DINABANTU,..
1561142724736881,6:02:25,Sikelela Prince,SA my country I love
