timestamp,time,author,message
1542787615425720,1:05,Cordelia Mabena,morning
1542787623650375,1:13,Future Seokotsa,Third of the Gordan lecture
1542787692825760,2:23,Aza Bam,bn
1542787842174952,4:52,Frans Phala,"he looks tired, or perhaps he is shaken by malema's statement...?"
1542787869375837,5:19,Marvel Ramatshela,what now SABC??
1542787893116247,5:43,Egbert Mkoko,what???
1542787969497326,6:59,benjamin Maluleke manyunyu,"he is shaken by malema, the arrogance he displayed yesterday is gone"
1542788070580991,8:41,fiks Bodyfiks,"Hayi I dont think he is shaken, this guy is very composed and confidant about his story"
1542788103295059,9:13,Frans Phala,"eff is playing mind games on him, they didn't share any info until he took the stand."
1542788119341026,9:29,Ibutho Khumbane,I never seen him shaken at all
1542788131425635,9:41,Yoliswa Jebe,"He is not shaken at all, the guy know his story"
1542788147537729,9:57,Diketso Moyo,Third and last day for PG in the hot seat haven't heard anything I have never heard before
1542788156846409,10:07,Peter Sant,guys Malema is confused he went to court when PG was fired now he is against pg
1542788160830113,10:11,Bruce Andrew,EFF have nothing meaningful to say or to contribute to the debate. Most of the comments in the last two days have been mindless
1542788188366322,10:38,Thato M,"He wouldn't appear shaken obviously, but the matter has got to him & his family at large. For the first time. It is eating him - no doubt"
1542788197838146,10:48,Yoliswa Jebe,if they have anything tangible they must bring it to the commission
1542788229444886,11:19,benjamin Maluleke manyunyu,Gordhan must clarifies the allegations that he was involved in fund raising for the Zuma's re-election in 2012 &we all know that the Gupta funded the campaign
1542788231043098,11:21,Nyiko Given Zitha,"Real thugs are committed to their duty, he will never be shaken perhaps he already knew every question coming"
1542788242957121,11:33,Robert 1,this is boring.
1542788285673446,12:16,Houws Houlinou,"""How can Pravin be part of the corrupt ANC and not be rotten himself? Why do you say the ANC is corrupt and then say Pravin and Cyril are different? They are the same,"" Malema said"
1542788286066019,12:16,Zeno of Elea,The commission is an opportunity for the EFF to put their evidence on record. They should bring it to the deputy chief justice.
1542788288752358,12:19,Houws Houlinou,THIS while Julius was part of the corrupt ANC? He must think we are dumb
1542788291352405,12:21,Thato M,"His family has been portrayed as holier than thou, this matter has shaken not only him, but his family and business acquaintances. No sane individual wouldn't be affected negatively."
1542788391238832,14:01,PETER STAFFEN,they wont they rather stand outside and grandstand he never produce the facts
1542788392127091,14:02,THABISO MOGORU,since gordan touch sars ...malema know the true that is the reason the fighting the guy
1542788416723928,14:27,Thato M,"Even his inner circle comrades are shook. His defense has only been the WMC media. they know Julius has dirt on him, shared by the very faction Gordhan & Ramaphosa are fighting within the ANC"
1542788433459356,14:43,Mogamat Allie,it is boring because it is using alot of taxpayers money..every body involved should be prosecuted
1542788447251570,14:57,THABISO MOGORU,that is true
1542788462783116,15:13,peter pott,then what was wrong with this IMC? PG is really having problems with black leadership really
1542788463547907,15:13,Zeno of Elea,Too much conjecture about who knows what. The truth will prevail. Bring all/any evidence to the commission.
1542788475059181,15:25,Leshope Gerald,This commission is more like a chat room of friends.
1542788511362346,16:01,Zeno of Elea,Do you believe that the deputy chief justice is bias?
1542788539919062,16:30,Nelson Musoliwa,Juju is a confused and inexperience politician if Floyd must not be involved with Brian saga why Cr be involved with ANC corruption if not proven. He tjatjarag too much
1542788563849873,16:54,Leshope Gerald,My screen went black
1542788567298612,16:57,Thato M,"When acusations were levelled against some family members no commissions were established but were instead labelled thugs without evidence. Enter Gordhan, people must come under oath. Very rich"
1542788570700963,17:01,Houws Houlinou,SABC go and borrow a little bit of money from China and sort yourself out. This live feed is horrible
1542788572215590,17:02,Mthobisi Zuma,kangaroo court indeed
1542788613380258,17:43,Zeno of Elea,Kangaroo court? So what is our best mechanism to come to the truth?
1542788619680306,17:50,Johnny James,Nugent Commission is effective period.
1542788624788011,17:55,mbongeni zondi,someone please speak to ANDILE from BLF to stop this thing
1542788649668623,18:20,THABISO MOGORU,pg is fighting
1542788649783536,18:20,Thato M,"So this Commission lead investigator provided pro bono legal services to Adrian Lackay, Gordhan spokesperson, who is also from SARS with him. Interesting what this unfolding in this State of Capture"
1542788653757605,18:24,Leshope Gerald,Paraffin Kortaan must come out clean.
1542788654951647,18:25,Frans Phala,zuma and bathabile did say should any member of the anc reveal his\her dirty laundry they will reveal their dirty laundry
1542788663907749,18:34,Sthakathi Khumalo,The commission reminds me of Malume Joshua Doors interview with CNN saying he doesn't have evidence but jiki jiki 2018 he knows something!!
1542788665712846,18:36,Lucky Dlamini,lack of competition leaves us with this rubbish live feed.
1542788692475117,19:03,Zeno of Elea,@Thato M did justice Zondo not address this?
1542788700157361,19:10,Aidan Bain,the feed is BAD agreed
1542788714759143,19:25,Sthakathi Khumalo,Lucky Dlamini Sunday times stream is clear hey and lacks stop start sequences
1542788733761466,19:44,THABISO MOGORU,PG FIGHT AGAINST THE EVIL OF ZUMA
1542788745324920,19:55,Lucky Dlamini,PG tries very hard not say anything positive about JZ.
1542788751056316,20:01,THABISO MOGORU,NUCLEAR DEAL
1542788755825938,20:06,Leshope Gerald,Is this old white AH the one who helped adrian lackay pro bono
1542788762310909,20:12,Wesley M,@Neslon i agree with you.
1542788770258293,20:20,THABISO MOGORU,ZUMA IS BAD
1542788780552866,20:30,Aidan Bain,"amazes me that everybody is coming out now, shows you how scared they were of zuma"
1542788787291551,20:37,Zeno of Elea,@Leshope Gerald did Justice Zondo not address this?
1542788787704494,20:38,Sthakathi Khumalo,"He admitted on CNN, he has no evidence against Zuma!!"
1542788794124892,20:44,Frans Phala,ANC is bad
1542788819140512,21:09,Leshope Gerald,The whole ANC is rotten to the core
1542788822156865,21:12,Thato M,"@Zeno of Elea it was wholly inadequate response one would expect from a Deputy Chief Justice, 2nd in command of the highest court in our land, the final arbiter of our law."
1542788822967566,21:13,Aidan Bain,i dont think there is one part that is great
1542788835167350,21:25,Zeno of Elea,@Sthakathi Khumalo I think he said he has no smoking gun. Not no evidence.
1542788851031960,21:41,THABISO MOGORU,ZUMA WAS WORST THING HAPPENED TO US
1542788871304873,22:01,Sthakathi Khumalo,Zeno of Elea meaning??
1542788872620622,22:02,Aidan Bain,@THABISO MOGORU i agree with you
1542788876309566,22:06,Leshope Gerald,Can anyone inform us why is this commosion being held at Tiso Black star building?
1542788886289790,22:16,Houws Houlinou,@Zeno of Elea The fact that Zuma and the Guptas got rid of him illustrate to me that he was unwilling to cooperate with them
1542788894441469,22:24,Frans Phala,the anc is divided into two parties within itself
1542788905090487,22:35,Wesley M,"The ANC does not deserve the countries vote anymore. Our problem is, we do not have anybody else to vote for. who do we vote for???????"
1542788905102161,22:35,Prescott Smith's Fly Fishing Academy,They are asking him a bunch of easy questions. What a joke. corruption to the core.
1542788910409722,22:40,Aidan Bain,one snake two heads
1542788911041917,22:41,Zeno of Elea,@Thato M How should he have responded? He said he has reviewed what he has been given and ruled accordingly. He said if there is more info he will readdress.
1542788941222975,23:11,Thato M,@Zeno of Elea Zondo's response on the matter will draw him unnecessary criticism. Zondo took sides of the lead investigator without allowing the complainant to fully ventilate their concerns
1542788959440962,23:29,Prescott Smith's Fly Fishing Academy,blacks all over the world are paying attention to what is happening in South Africa and the continent.
1542788986041387,23:56,Lucky Dlamini,He tries to teach Judge Zondo some English too.
1542788990978306,24:01,Get Up Stand Up South Africa,"The Sun 🌞 does not hide behind the Clouds ⛅️ forever someday it will come out , just like the truth, we need to make SA better"
1542788993295449,24:03,Zeno of Elea,@Thato M that is not true. He ruled after getting both sides and said he will reconsider if more evidence is brought forth.
1542788996739786,24:06,Nelson Musoliwa,Pravin seem to be avoiding to be cross examined by not implicating anyone but state affairs as they were.He is economical with the truth thus far until proven otherwise
1542789003962026,24:14,Singi Mathebula,The devil you know is better than the devil you do not know. I vote ANC.
1542789006906320,24:17,Thato M,"@Zeno of Elea our Constitution requires evidence to be led on both sides of the plaintiff and defendant, what Zondo did was tea party with this lead investigator"
1542789012128526,24:22,Sthakathi Khumalo,Prescott Smith and what are white people doing??? Continuing with colonizing the continent??
1542789032067023,24:42,Kabelo Mohlamme,@Prescott Smith who are blacks?
1542789034549217,24:44,benjamin Maluleke manyunyu,the mandate of Gordhan is to tries all by means to implicate JZ and this strategy is not going to work since judiciary inquiry relies on the principle of res ipsa loquitor.
1542789041275419,24:51,Thato M,"@Zeno of Elea which evidence was led, what evidence did Adv Pretorius supply?"
1542789043532894,24:53,Sthakathi Khumalo,You cant implicate people with smoke guns hebana!
1542789046374680,24:56,Zeno of Elea,@Thato M this is not a court case. It is an inquiry. Findings from this might lead to legal action
1542789058320292,25:08,Aidan Bain,"when you look at how the parties act , i am in the belief that they have lost reality of south africans,"
1542789061808608,25:12,THABISO MOGORU,PG FACTION IN THE ANC WANT TO DO THE RIGHT THING
1542789063351897,25:13,Aidan Bain,"they act and speak about the country as if it was ten years ago , the parties are more racist themselves than the normal man on the street"
1542789069024534,25:19,Wesley M,the ANC is broken into pieces. But who do we vote for????
1542789075508926,25:25,Thato M,@Zeno of Elea what are you saying? An inquiry is a rugby game to you
1542789076061346,25:26,peter pott,"the presidency , differs from zwane statement. lol. Pravin remain quite, because he doesn't want to give fmr president credit.☺☺"
1542789090162294,25:40,dave east,guys we need to do research before we listen to people
1542789099653115,25:49,Zeno of Elea,@Thato M I do not follow - re the ref to rugby
1542789135489357,26:25,Khalid Mather,"so there is some truth to the whole Defending the capitalist agenda, although race has no part in it apart from dominance"
1542789151459999,26:41,Thato M,"@Zeno of Elea I also do not follow your logic on the legalities (oaths, etc) surrounding an Inquiry you claim aren't based on statutes?"
1542789182650880,27:12,Sthakathi Khumalo,"This state capture report, why cant Queen Thuli bring her side of evidence really??"
1542789182946477,27:12,dave east,guys the IMF has warned against expropriation of land without compensation.
1542789199751635,27:30,Thato M,"This man is pap, energy is down, tone is soft. He's taken a toll"
1542789204145469,27:34,Zeno of Elea,@Thato M this is an inquiry. Kind of like a grand jury in the states or other inquiries around the world. The investigate if there are grounds for legal action.
1542789224021982,27:54,Sthakathi Khumalo,dave east IMF must go to sleep we are expropriating land
1542789253583849,28:24,Zeno of Elea,"@Thato M If there are grounds to bring charges, then the defendants can have evidence leads"
1542789269294589,28:39,dave east,the IMF is a white institution that lends money and is against land expropriation in South Africa
1542789273952500,28:44,Thato M,"@Zeno of Elea thanks for the unsolicited legal treatise. Make your point then, these matters you raise aren't in dispute"
1542789324127171,29:32,Zeno of Elea,@Thato M I am trying to understand your position. Are you saying this is not a legitimate process?
1542789326826927,29:37,Khalid Mather,"exactly @dave east , the IMF are publicly announcing their influence, with the ultimate aim for SA to require a loan from them"
1542789403275251,30:53,Frans Phala,"is it possible that pravin testimony is the same story, the cross examining is rehassed for the answer given compared to the other witnesses who took the stand ?"
1542789436571997,31:27,Thato M,"@Zeno of Elea going circles. I was simply pointing out his hypocrisy in dealing with those alleged to have done wrong & how media runs with that narrative, without affording others the same treatment"
1542789444534784,31:34,Sthakathi Khumalo,"Frans Phala Intresting point, I have a strong feeling that may be exact hmm"
1542789464679584,31:54,dave east,yes Khalid
1542789482238583,32:12,Zeno of Elea,@Thato M I see. I misunderstood you then. I thought you had a problem with the process. Sorry
1542789490037486,32:20,Thato M,"Mpofu will take him to taks, esp on the SARs rogue unit."
1542789500174734,32:30,Lucky Dlamini,Just wondering how Solly Mapaila st al plan to defend PG if they are not standing against BLF and EFF publicly.
1542789500936613,32:31,Thato M,@Zeno of Elea no stress.
1542789522970544,32:53,Aidan Bain,i wonder if the KPMG report will ring some truth regarding sars
1542789534698044,33:05,Aidan Bain,pity we wont see it
1542789573568086,33:43,dave east,a group named the free market found ation was founded in 1975 by 6 white men has said expropriation of land without compensation should not go forward
1542789586360262,33:56,THABISO MOGORU,PG FIGHT AGAINST NUCLEAR DEAL...…..
1542789602448843,34:12,Singi Mathebula,"IMF is the way to go, no two ways about it😭 . our economy is in ICU. what do you expect if corruption thrive in all sectors of government!!"
1542789603625150,34:13,Thato M,@dave east wow..
1542789652859131,35:03,Mthobisi Zuma,why he's on nene issue we already know that he must tell us his own testimony
1542789656073914,35:06,Aidan Bain,here it comes
1542789658105730,35:08,Sthakathi Khumalo,"Thando Nkutha I saw that, angithi they play golf together"
1542789711487399,36:01,Sthakathi Khumalo,"Mthobisi Zuma Nxamalala akanabo ubufakazi lomlisa, washo kuCNN and angazi uzokwenzani lapha"
1542789728331917,36:18,Joel Mkunqwana,Gordhan now goes into the heart of Zwane' shenanigans - the man should have long been in orange uniform by now....
1542789738748459,36:29,Thato M,This man is on his way out. He will prove to costly for the ANC in the upcoming elections. His daughter Anisha and uncle Ketso Gordhan business dealings will be his albatross.
1542789759162613,36:49,dave east,another group called AFROBAROMETER founded by 2 white men takes surveys has said South Africans dont want land
1542789793912916,37:24,Peter Sant,I m not expecting any Zuma surname to support this zone I comm
1542789797010277,37:27,Aidan Bain,why is there still classified information???
1542789821156618,37:51,Joel Mkunqwana,"Manufactured facts that have no substance - you are now clinging on straws chief by implicating his family on feeble claims.....shameless, aint you are?"
1542789822149019,37:52,Thato M,He knows branches and structures of the ANC will be meeting to deal decisively with these matters and calling for the ANC Intergrity commission to investigate while he recuses himself. Days numbered
1542789841477791,38:11,ntlhari manganyi,Countries nearby countries must be ready to help should our approach to land issue fail
1542789849605808,38:20,Qiniso Brown,the opposition is cracking the ANC soon or later they will be on the president
1542789866911136,38:37,Sthakathi Khumalo,"Thando Nkutha​ Battle of two factions bro, this one is dangerous because it is here to mislead us into debts and exaustinglast of our minerals"
1542789891711012,39:01,Aidan Bain,ANC broke south africa
1542789917618378,39:27,dave east,the land issue is going to fail. african eomen are not voting for the EFF...malema said so
1542789938136208,39:48,dave east,WOMEN
1542789941979146,39:51,Frans Phala,"@Thando Nkutha he is leading the question of the commission, revisit the nuclear deal he has the minutes and the commission has the declassified minutes, but you might have a point."
1542789957646202,40:07,Nelson Musoliwa,Guys is ANC UNITY calls real seen zuma filing affidavits in court to oppose cr decision on moyane
1542789977184328,40:27,Thato M,"The pace of his speech is telling. Remember this is the chief witness, as dubbed by the media. He should be excited to nail the wrong doers, but he seems to want public sympathy"
1542789998222459,40:48,Thato M,@Aidan Bain your forefather broke Africa
1542790003856391,40:54,Sthakathi Khumalo,Even Baba ka Andile Ramaphosa lols
1542790054133000,41:44,Knight Wolves United FC,PG admit that he was a sponsor to Guptas circulating TENDAS TO GUPTAS
1542790061355633,41:51,Thato M,"Anisha Gordhan, Andile Ramaphosa doing business with the State while their dads are in cabinet. Conflict? What conflict, Ethics, what ethics?"
1542790068652171,41:58,Aidan Bain,my forfather and the ANC - But we need to move on and US fix the past
1542790095723421,42:25,Sthakathi Khumalo,"Who is testifying after Joshua Jamnadas, mr dots in connections and malfeasance??"
1542790110534014,42:40,dave east,guys im advising you please do not listen to any of these surveys
1542790132749690,43:03,Zeno of Elea,@dave east what surveys?
1542790144763788,43:15,Frans Phala,huh
1542790163814015,43:34,Thato M,"@Aidan Bain we move forward in our terms. We inherited a broken system under the guise of a rainbow nation, subjecting majority to crumbs of the economy, stuck in townships & taxis. System flawed"
1542790164501438,43:34,Khalid Mather,he from the future
1542790213906392,44:24,Obaid Ally,lots of EFF and ANC paid trolls here
1542790220183273,44:30,Knight Wolves United FC,PG admit that he was a sponsor to Guptas circulating TENDAS TO GUPTAS crime #2 circulating Tendas to Guptas of #1 failed to disclose the 66 emails TO Nana
1542790258524955,45:08,Zeno of Elea,@Obaid Ally agreed! but my sincere hope is that Zodo can help us get to the truth.
1542790273419760,45:23,Sthakathi Khumalo,"There are trolls here, tell us what evidence this PG has lead either than maybes"
1542790290731224,45:41,dave east,zeno look at AFROBAROMETER i have made a video about them. they are founded by 2 white men and are going around saying south africans dont want land
1542790301539208,45:51,Thato M,"DCD Group which Anisha Gordhan sits on the board provides services to Kusile, Medupi and Ingula Power. Interesting Pravin would mention these without any hint of irony"
1542790303475888,45:53,Knight Wolves United FC,"Guptas were influential in Eskom, and other state enterprise"
1542790307368219,45:57,Obaid Ally,expected mentality of ANC and EFF supporters. thick as bricks
1542790309309031,45:59,Mhlanguli Dlodlo,"WOW so there was NO NUCLEAR DEAL, just Cabinet pre-approval pending the funding model finalization. So how do people/MEDIA arrive at a nuclear 'DEAL'"
1542790345378370,46:35,Speckled Trim,Anyone been to Pelindaba lately?
1542790358018541,46:48,Knight Wolves United FC,PMG is also involved in this Fraud
1542790382418692,47:12,Obaid Ally,they just so f'ing dumb. why did Zuma supporters conceive children ever?
1542790404492378,47:34,Sthakathi Khumalo,Pretorius and Jamnadas are confusing Zondo...!!
1542790462342843,48:32,Thato M,@Louis Eloff no why? I see JSE top 40 & all share index & seeing lilly white boards and Exco's
1542790487490817,48:57,Knight Wolves United FC,But despite that THE GUPTAS handled the state well FOR J Zuma other wise this could be the disaster
1542790492371622,49:02,Thato M,@Thando Nkutha 😀 what ar ethey saying?
1542790500808964,49:10,Speckled Trim,Pelindaba where the pigeons have 2 heads
1542790512227891,49:20,Sthakathi Khumalo,"Molefe was smart, learnt their skills and fight back at them the same haha!!"
1542790514318505,49:22,Speckled Trim,Nuclear area
1542790522779442,49:33,Thato M,@Knight Wolves United FC what are you on about?
1542790535997291,49:46,Thato M,@Louis Eloff what about it?
1542790552840249,50:03,Speckled Trim,have u been there lately? lol
1542790596835369,50:47,Lucky Dlamini,Wouldn't credit Molefe without mentioning Manuel and Ramos? whew!
1542790597380862,50:47,Thato M,@Louis Eloff I can arrange a drone to go there in the next hour or so.
1542790607375582,50:57,Knight Wolves United FC,While the Guptas were in state they took some of the money to sponsor they business through PG i.e Trillion and others
1542790611304087,51:01,Speckled Trim,Why you think Hartbeespoort dam is dying?
1542790611606837,51:02,Dams daily motivations Madamalala,Hi pravin are you here again
1542790633626912,51:23,Speckled Trim,Nee man you need to send something biological
1542790666567930,51:56,Speckled Trim,why do people always tag me man sies
1542790677921139,52:07,Thato M,"Let it die, we need a new dam with an African name. We don't know who Haartees is."
1542790679661214,52:09,Aidan Bain,PART OF THE STRUGGLE !?? HAHAHAH
1542790688689857,52:18,Speckled Trim,😂😂😂
1542790694876736,52:25,Knight Wolves United FC,This conclude everything you need to know about PG that Guptas gave him some allowance and ASSETS
1542790731478913,53:01,Percy letsoalo,The commission does not have the teeth to bite therefore this process is a waste of state resource and taxpayers money. Let's allow the law enforcement agencies to execute their mandate.
1542790735431839,53:05,dave east,guys this advocate is close to pravin i just researched it malema is right
1542790739608378,53:09,Speckled Trim,The water is connected underground. once its contaminated a name change wont fix anything
1542790800538666,54:10,Mhlanguli Dlodlo,Molefe knew something about Nuclear funding. He was clearly targeted. So sad the country missed out on a 9.6 megawatt electricity plant. It would have paid itself out over 20-30 years
1542790812123064,54:22,Knight Wolves United FC,But otherwise they have improved South Azania economy during their reign in government state
1542790812802587,54:23,peter pott,"challenge is that setting up nuclear will take bread of the table of minority coal mine owners, who are fighting even this day in courts for price manipulation"
1542790878782942,55:29,Knight Wolves United FC,2010 has bring lot of corruption in STATE
1542790895899470,55:46,peter pott,"but he was not in cabinet on 9 December 2018, he can't speak on its behalf"
1542790901394957,55:51,Malusi Zitha,PG is really not giving the deep details as to the events that took place
1542790930015198,56:20,Knight Wolves United FC,Tendas issued fraudly in 2010
1542790932790922,56:23,Speckled Trim,South Africa will industrialize further because of joblessness. Factory workers and unions are here to stay.
1542790939040766,56:29,Trucker Trucker,Molefe should apply to question Pravin and to give testimony. His view on nuclear is interesting. Pravin says Molefe could be right because he was schooled by Manuel & Ramos😂.
1542790962204232,56:52,Thato M,"@Louis Eloff will lead to a mass exodus, leading properties to being sold without a demand thereby reducing the prices & allowing new owners. Then deal with the dam when demographics have improved"
1542790982316772,57:11,Khalid Mather,"How could it be self funding though , thats the only thing, I have become much more open to Nuclear, but not through Gupta"
1542791007219069,57:37,Mogamat Allie,this is a waste of time....TRC .....da wil com
1542791040599508,58:10,Speckled Trim,There's a lot of health concerns in that area. just Google it you will see. nuclear damage cant be fixed
1542791043094513,58:13,Thato M,"Gordhan is talking about fear when cabinet memebrs, SACP & COSATU were hurling insults to the then Pres in their various platforms. This guys is playing"
1542791047209523,58:17,Zeno of Elea,@Trucker I guess that is one view.
1542791048370408,58:18,peter pott,"@nkutha, PG is addressing press conference here in the last three days"
1542791051109025,58:21,Mhlanguli Dlodlo,"If there were no funding models finalised for the nuclear build, where did Nene get the strong idea that it was unaffordable. Molefe seemed to think some kind of PPP could work."
1542791069385206,58:39,Siala Lucky,PG just stop wasting people time😏😏✋
1542791074020707,58:44,Thato M,@Louis Eloff so what needs to happen then?
1542791090160275,59:00,peter pott,"@em D, great question"
1542791110706312,59:20,Sthakathi Khumalo,"ANC should have sacked Pravin long time ago, he is double tongued this one!"
1542791112566783,59:22,Speckled Trim,Declassify and expose the truth to the public.
1542791113838972,59:24,Khalid Mather,@em D but that would mean we should allow a private company to build a nuclear power station here and sell that power to the state...(grand scheme)
1542791117728254,59:28,Jomoh Khanyile,PG really is waisting our time😏
1542791140578128,59:50,Nelson Musoliwa,You 100% correct Thando
1542791164730434,1:00:15,Thato M,@Louis Eloff 😀😀😀 you are joking.
1542791168409669,1:00:18,Khalid Mather,"@Thando Nkutha I think we are getting close to a hydrogen energy matrix soon too, that could be better than Nuclear. SA is one of the best locations for Power Fuels"
