timestamp,time,author,message
1542873652873585,-2:58,Lolos Mccall,.
1542873790800474,-0:41,Caroline Hawanga,It's 10:2 can we start please
1542873845935621,0:05,g k,honour to the Honest people
1542873863301763,0:22,Joseph Thobejane,gud morning guys
1542873884679173,0:43,Ken Mojela,Morning mense
1542873908226206,1:07,Ken Mojela,Fuzile is here to testify indeed
1542873926711801,1:26,FredBKevin,Morning
1542874038094197,3:17,Lolos Mccall,morning
1542874056955082,3:36,Edward Buta,Morning everyone
1542874084477781,4:03,Diketso Moyo,Morning
1542874098283052,4:17,Makwa Choma,morning
1542874177641027,5:37,Mathapelo Seopela,Morning
1542874232765017,6:32,Lennox Langa,Morning
1542874233967843,6:33,Yoliswa Jebe,Morning
1542874237775582,6:37,Hester Ferrezuelo,morning all. looking forward to today's revelations
1542874250336335,6:50,nhlanhla nkosi,guten morgen
1542874250570327,6:50,Leagilwe Magasa,Morning all
1542874259162357,6:58,bhekisisac mbhamali,Morning
1542874266682216,7:06,Gideon A Vele,Mr Fuzile testimony sounds very interesting
1542874278520049,7:18,delphin yvon Moukouma Mboussi,Bonjour
1542874287125812,7:26,Yoliswa Jebe,Screen went blank
1542874291029398,7:30,makhosi nobhatyi,Zuma and malema did something why it goes off
1542874305854364,7:45,Paki Dlomo,Kuzoba🔥🔥🔥🔥
1542874313256635,7:52,Edward Buta,"@Vele very interesting testimony, he talks the facts"
1542874314616434,7:53,Andre' Van Zyl,enca is on
1542874318133637,7:57,g k,Eskom black out
1542874385747829,9:04,Mr Q,Avuxeni
1542874457010698,10:16,Peter du Plessis,why does this lawyer look so skelm?
1542874615451916,12:54,Desmond Masilela,Morning guys
1542874627353604,13:06,Lolos Mccall,DCJ experienced
1542874648534753,13:28,Nelson Musoliwa,He is just so knowledgeable and strong minded and alerted brain. INTELLIGENT BEING indeed
1542874658656875,13:38,Desmond Masilela,Black Friday
1542874660247449,13:39,Muziwakhe Skhosana,mxm
1542874668026800,13:47,Anje ntsipho Rori,look confident Mr Fuzile will see when go
1542874677736016,13:56,Desmond Masilela,SABC black Friday!!!!
1542874739932035,14:59,holylady1000,SOUND PLS
1542874791174731,15:50,mlungisi lukhozi,awu what happening now
1542874824997004,16:24,holylady1000,POOR SIGNAL
1542874855980420,16:55,Cyril Tapile,@Nelson Musolwa he is indeed an intelligent and principled guy. He is well equipped
1542874891085016,17:30,Sne Mdletye,SABC is disappointing me...
1542874920127423,17:59,holylady1000,"not just you, the whole nation"
1542874965849265,18:45,Mr Q,5 min adjournment
1542874975064183,18:54,Mary Freeme,lost sound on enca as well
1542875003520022,19:23,Mr Q,they have adjourned.. no lost sound
1542875026721163,19:46,holylady1000,"no, there's some glitches"
1542875038753348,19:58,Mr Q,NO
1542875074225192,20:33,Mr Q,You came late thats why.. you didnt hear what was planned
1542875083938574,20:43,Rouha Rouha,"No sound during break. listen please,don't just view"
1542875124477561,21:24,holylady1000,OOOOOooooops!!!! my bad
1542875206353107,22:45,holylady1000,soundddddddddddddddddddddddddd
1542875217568288,22:57,Desmond Masilela,SABC sound please
1542875219597955,22:59,Yoliswa Jebe,sound please
1542875228137948,23:07,holylady1000,and u guys thought i was cray cray
1542875289520011,24:08,holylady1000,SABC stop it!!!!!
1542875300401059,24:19,Nelson Musoliwa,Lots to learn about economic matters from Fuzile testimony appeal to all to listen attentively and jot some words down for later scrutiny for future reference
1542875309164715,24:28,MIKE DURBAN,Mmmmm.....i wonder ANC/EFF ...ghost in the machine....
1542875352913671,25:12,samuel molope,who is going to be accountable and sent to jail after all done
1542875354548036,25:14,peter pott,give us the numbers let's hear
1542875389404290,25:48,holylady1000,All involved are headed to prison
1542875432003869,26:31,Quinton Van Den Bergh,@samuel molope no one will be sent to jail this is an ANC hoax
1542875449165778,26:48,peter pott,it is a market uncertainty. Rand went horribly high a few ago.explain that to us then.
1542875532762843,28:11,holylady1000,9 billion rands a week borrowed????
1542875549169750,28:28,Quinton Van Den Bergh,@peter pott Rand has been tumbling
1542875571906376,28:51,peter pott,"strange to hear it from him, because he works for the bank found to be guilty of currency manipulation."
1542875584264860,29:03,Edward Buta,Brilliant in explanations!
1542875600219531,29:19,Bibby AGOUTANGNI,brilliant
1542875653908291,30:13,Sam Vanguard,@Quinton Van Den Bergh Quinton boet hw was jy
1542875677094128,30:36,peter pott,"you are both anc deployees, and political appointees."
1542875683362539,30:42,Slindile Ngcobo,eNCA back on line
1542875707420746,31:06,tererai chipango,whats the name of the lawyer
1542875731374068,31:30,peter pott,adv maleka
1542875738665177,31:38,MASIPA ITUMELENG,Adv Maleka
1542875881651976,34:01,tererai chipango,thanks hes very methodical in his approach
1542875930247757,34:49,bernard ntaote,"Maleka and Pretorius are astood lawyers, razer blades"
1542875946980400,35:06,holylady1000,very aunthetic
1542875975416214,35:34,Sam Vanguard,@Quinton Van Den Bergh Het jy gehoor wat EFF-mikrofoonmuis gister gesê het
1542875975795523,35:35,Blaze 613,Ramaphosa to announce cabinet reshuffle at 3PM
1542875996399250,35:55,holylady1000,Blaze are you for real?
1542875996447679,35:55,lee royal,who this guy asking these questions he looks sounds Zimbabwean
1542876013269468,36:12,Blaze 613,"yip, true"
1542876034173898,36:33,Blaze 613,not a midnight shuffle lol
1542876037545041,36:36,holylady1000,"is it going to be live here, do you know?"
1542876051685757,36:51,holylady1000,lol
1542876071236479,37:10,peter pott,"problems with comrades like this is bringing emotions into politics. you gain power today, you loose it tomorrow. reality of politics. power shift"
1542876072281633,37:11,Blaze 613,saw it on enca
1542876074849073,37:14,Michael Myers,lee royal so what you didnt ask about the white man paul
1542876080245551,37:19,Quinton Van Den Bergh,"@Sam Vanguard daardie idioot wil 'n burgeroorlog uitloop in Suid-Afrika, ek het hier met 'n paar broers gesels en hulle is nie gelukkig met daardie dwaas nie"
1542876093959063,37:33,Sindiswa Moolman,There will be a cabinet reshuffle at 15h00 this afternoon. Things have really changed. No more midnight resuffles
1542876100967717,37:40,holylady1000,they should not take it personal
1542876127537097,38:06,holylady1000,"when the music ends, you must leave the stage"
1542876129813594,38:09,The Xilaman,Enca has better visuals
1542876142002813,38:20,Simphiwe Dube,@lee royal did you ask about Pretorius?
1542876149514610,38:28,Sne Mdletye,it is personal if it affects ones career... screw comradeship
1542876183525865,39:02,Sam Vanguard,"@Quinton Van Den Bergh Hy beskuldig ANC van korrupsie, maar hy is korrup. Hy vergeet wat hy gedoen het in Limpopo. Ons sal sy fuckery ontbloot."
1542876200304858,39:19,Simphiwe Dube,@lee royal he (Adv Maleka) is south African anyway
1542876221923710,39:41,peter pott,"@1000, ,and sad they do. when an unlearned boy from nkandla deed his subtle campaign to presidency, they were sleeping. boom!!! he becomes president and realize his their boss. ☺☺"
1542876224711821,39:44,lee royal,@Michael Mpagi @Simphiwe Dube guys apologies i was just asking
1542876291563700,40:50,Quinton Van Den Bergh,@Sam Vanguard Ek het gister met Heinrich gepraat dat hy sê sy ouens is op die proef as hulle probeer om na die land se eksppropiasieprobleem te slaan
1542876336951851,41:35,Michael Myers,lee royal we should never attack our own people for the white man to benefit
1542876367266897,42:06,holylady1000,"peter your tone is very condescending, i do not like it."
1542876386556406,42:25,peter pott,"have you noticed no one so far, came and said: chair this has caused us to be behind on building 5,6 or 10 schools, or clinics. instead they are fighting over nuclear, coal or trains. No one!!"
1542876469711734,43:49,lee royal,@Thando Nkutha i was just thinking what do the Zimbabweans have to do with South African matters thats all
1542876541715461,45:00,peter pott,"@1000. it's not. they must admit, that we the people entrusted them to guard the gate by our votes. but none of them did that. they are here playing victims. they are ANC cadres. why not recall pres?"
1542876549798186,45:09,Quinton Van Den Bergh,@Sam Vanguard do you think this inquiry will bear anything other than more looting by ANC
1542876604194401,46:03,Sam Vanguard,@Quinton Van Den Bergh naaa boet ANC is rotten this is a cover up by the ramaphosa faction to cover they're own tracks
1542876633794525,46:32,Sthakathi Khumalo,State Capture has been a CCMA rebellion of disgruntled employees!!
1542876639949246,46:39,Michael Myers,lee royal why do indians and whites who are less then 15 percent run the country
1542876657858356,46:56,holylady1000,"so as he reshuffles this evening, he must remember to mention his name, is that what you are suggeting peter? hahahahahahahahaha"
1542876675700371,47:14,holylady1000,all should step down!
1542876686392115,47:25,Nelson Musoliwa,Fuzile was trying to be professional and attempting to allays the nation and international fears about nene dismissal but gupta minister has non of this
1542876714203675,47:52,peter pott,"all we have been listening to do far, is ANC internal politics. those who list polokwane and mangaung, this is their turn to blame the outst leadership."
1542876730545586,48:09,Quinton Van Den Bergh,@Sam Vanguard waar ANC will never arrest itself from looting S.A infact the ramaphosa faction is happy to blind the average south african
1542876764897524,48:44,Mhlanguli Dlodlo,@Sthakathi Khumalo CCMA hearing lol. I'm getting the same sense. I particularly remember feeling the same way about Ms Phumla Williams' testimony
1542876772266123,48:51,lee royal,@Michael Mpagi dont worry we getting the land back soon...
1542876773972211,48:53,Simphiwe Dube,"Adv Maleka is the best evidence leader, Pretorius let PG off the hook in most cases"
1542876801392170,49:20,Mkhuseli Freddie,@peter pott I agree with you. We are caught in ANC factional battles and the commission is used as a mechanism to fight opponents
1542876808203336,49:27,peter pott,"@musoliwa, he was saving his job. hence he can now say, they are no longer my bosses. they think nothing of the poor"
1542876814867329,49:34,Sam Vanguard,@Quinton Van Den Bergh my only fear is EFF rhetoric lately it has been divisive in it's agendas
1542876819202601,49:38,Sophia Maholela,"Simphiwe, Adv Maleka is the best shame, I agree with you"
1542876835224038,49:54,lee royal,@Thando Nkutha i was just asking thats all...making sure nothing wrong with asking
1542876842623894,50:01,holylady1000,"it's always about the ANC, it has never been about us"
1542876851683455,50:10,Sthakathi Khumalo,"em D Exactly bro, its just a waste of our time now. I just feel for Zondos credibility here because he really has nothing to work on"
1542876861869693,50:21,holylady1000,we vote because we feel bad for the ANC
1542876862757684,50:22,Michael Myers,hope so to lee
1542876875083889,50:34,Quinton Van Den Bergh,@Sam Vanguard EFF should never taste power 2019 they will turn S.A into zimbabwe remember zimbabwe in 2002?
1542876886361589,50:45,holylady1000,We listen to news because we want to know if the ANC HAS STOPPED BEING CORRUPT OR NOT
1542876925218835,51:24,holylady1000,everything in SA revolves around ANC
1542876946908941,51:45,Michael Myers,Zimbabwe is fine. white people just dont want to lose their wealth
1542876965145947,52:04,Sam Vanguard,@Quinton Van Den Bergh yaaa you can say that many times EFF and its's big brother ANC should be out by 2019 we no longer need such threats to our democracy
1542876971665237,52:10,Sydwell Phakula,Morning guys
1542877002261358,52:41,Quinton Van Den Bergh,@Michael Mpagi have you ever been to zimbabwe??
1542877015702053,52:55,Nelson Musoliwa,@peter protocol are protocol as set out to preserve the institution integrity of course protecting one job is a secondary issue against the national issue
1542877033457965,53:12,peter pott,"@van see bergh, that said, but EFF sees a vacuum here and like in many politics, they use it to the full. because they now if anc wins, it's gonna be further uphill. hence revelations of anc cadres"
1542877034804545,53:13,Speckled Trim,Any news on any important arrests?
1542877076172612,53:55,Not Your Business,RAMAPHOSA TO ANNOUNCE CABINET RESHUFFLE AT 3PM 🙄
1542877093977608,54:13,Sydwell Phakula,"That will never happened, some could have been arrested already"
1542877112348505,54:29,peter pott,"@musoliwa, gave me a case number of any charges fuzile opened at hawks or police station reporting wrong doing?"
1542877128046082,54:47,peter pott,*give
1542877182292259,55:41,Mkhululi Bushula,@Sam Vanguard u talk about threat to our democracy but u comfortable under the apartheid regime which was autocratic it nature.
1542877202477674,56:01,Quinton Van Den Bergh,@Sam Vanguard i am with you on that one this side we going for FF+ and DA western cape we own it
1542877224785078,56:24,Paul K.,just wasting of taxpayer money
1542877228203011,56:27,RaiSMM,"lies, Zimbabwe is NOT fine, and yes, Im in Zimbabwe"
1542877232326182,56:31,peter pott,maleka is auditioning here for Wilson B Nkosi job on metro fm here☺☺
1542877239313196,56:38,holylady1000,GUPTAS invited him lol
1542877258899505,56:57,holylady1000,told ya!!!
1542877264862971,57:03,lee royal,@Thando Nkutha white people in SA hire people from zim while we have a high youth unemployment rate and then we south africans are considered lazy...im just for empowering black south africans first
1542877266930330,57:05,Sydwell Phakula,SA should learn to take hash decision & arrest all the corrupt people
1542877271300868,57:10,Nelson Musoliwa,Am lost where u r now what charges@peter
1542877273879513,57:13,Thapelo Motabogi,😂😂😂
1542877276935613,57:16,Unathi Notshata,How come people say EFF will turn South Africa to Zimbabwean situation but the same EFF expose all the ANC shananigans
1542877299728208,57:39,Sam Vanguard,@Mkhululi Bushula at least under apartheid property rights were protected now ANC wants to destroy S.A
1542877313744812,57:52,holylady1000,Lungisa is now lying
1542877322218972,58:01,Sydwell Phakula,"Nissan CEO in jail now so, what is the problem in SA"
1542877325045167,58:04,Speckled Trim,"I think they design this process to delay justice and spend more money, then appeals, more time more money, still no arrests. No functional NPA, spineless parliament, SAPS cant do much."
1542877326260450,58:05,holylady1000,he know who this indian person was
1542877336732595,58:15,Mkhululi Bushula,Are u talking white property.
1542877364236909,58:43,Michael Myers,black south africans and black people globally are in a recession
1542877367221782,58:46,Sydwell Phakula,Who is funding the Zondo commission?
1542877379562552,58:58,Mkhululi Bushula,Bcs black ppl didn't own any property under apartheid
1542877384858519,59:04,KEITH SINDILE DINABANTU,"@Louis Eloff My fellow citizens, a Commission is not a court of law... it''s ""raison d' etre"" is for us, to hear what happened, and thereafter, make recommendations! Its suffice to say, lets wait"
1542877387478736,59:06,Marvel Ramatshela,Zuma wouldn't mess up if he didn't have support from ANC
1542877389670612,59:08,Speckled Trim,"Parliament lied during votes of no confidence, otherwise why are we in this position today?"
1542877393736700,59:13,Atriaan Russo,Unathi Notshata: power corrupts; absolute power corrupts absolutely
1542877411398612,59:30,peter pott,"@musiliwa, I am asking all this goodie goodie people now, whom we voted for, can they tell if they ever reported this perceived wrong doing"
1542877413942091,59:33,Michael Myers,ziimbabwe is fine if anyone tell u different theyre lying
1542877435041573,59:54,Simphiwe Dube,@holylady1000 I think hes lying too. Looking at how intelligent he is theres no way he cant remember who invited him
1542877435848412,59:55,Sam Vanguard,@Quinton Van Den Bergh yaa i can relate also to that we thought ANC under Mandela would be willing to protect our private property but now we see they wanna destroy it
1542877440272934,59:59,Speckled Trim,like the PP's recommendations that were thought to be non-binding while more billions were stolen. there's probably more new capture taking place right now
1542877456233597,1:00:15,Sydwell Phakula,All Parliamentarians are pathetic lairs
1542877460063566,1:00:19,Joseph Thobejane,@sidwel is your tax funding zondo commission
1542877466434331,1:00:25,Marvel Ramatshela,"R56 billions wasted by government departments, latest report by AG"
1542877468815577,1:00:28,Speckled Trim,Lied under oath by default
1542877478550797,1:00:37,holylady1000,his body language changed immediately they asked him that question
1542877486254702,1:00:45,Mhlanguli Dlodlo,"Please chair ask him a little bit more how Mr Godongwana knew and could pre-empt what was to happen, including the identities of the advisors etc"
1542877526155009,1:01:25,Speckled Trim,He looks like he is trying to convince them with his eyes
1542877531410931,1:01:30,KEITH SINDILE DINABANTU,"@Mkhululi Bushula No, thats not true! I know families here in Cape Town, who have owned house since 1979, (better quality than RDP) current), with massive yards."
1542877562425330,1:02:01,peter pott,"there is the problem. one person is given authority. pride, and easily bribery can ensue. only one person to convince. government must change this. 5, or more people must share responsibility"
1542877568191953,1:02:06,Mkhululi Bushula,@Sam Vanguard black ppl did not own property under the apartheid regime.
1542877577644082,1:02:16,holylady1000,and why would a random person would raom around parliament
1542877587086274,1:02:26,Speckled Trim,why is he mumbling now?
1542877601400418,1:02:40,Nelson Musoliwa,@Peter ohoo it was not easy as it was a cumulative and perceived actions by the looters which appears to be systematic. I may be wrong.
1542877618346011,1:02:57,Simphiwe Dube,Who was the Indian guy Lungile??
1542877631031117,1:03:10,peter pott,subtle racism or prejudice against Indians here
1542877636166724,1:03:15,Sam Vanguard,@Quinton Van Den Bergh we should continue our community awareness campaigns against EFF and ANC dangers
1542877645188460,1:03:24,lee royal,Zimbabwe as a country may not be trading with the world however the Zimbabwean people are fine they are working in SA and other countries
1542877663250071,1:03:42,KEITH SINDILE DINABANTU,"@Mkhululi Bushula Perhaps, we can say - blacks were deprived of economic opportunities and also, to own massive pieces of land...But we can't say not even a single black owned property during that era"
1542877670070385,1:03:49,Paul K.,which community are you going to canvass?
1542877672071569,1:03:51,Murungi Matred,"cool, well"
1542877691730379,1:04:11,Sthakathi Khumalo,This is one just reciting poetry! Who is next after this one??
1542877691939859,1:04:11,Murungi Matred,well done!
1542877712403393,1:04:31,Mkhululi Bushula,@Sindile Dinabantu are u refering to those native yards.
1542877717654190,1:04:36,Nelson Musoliwa,Zondo may ask Fuzile how the supposed guy knew him
1542877720183110,1:04:39,Desmond Masilela,Well done my man
1542877741193242,1:05:00,holylady1000,"hahahahaha ""am working for the gov"" and you do not know your colleague"
1542877746262563,1:05:05,Mkhululi Bushula,U call that property.
1542877748753009,1:05:07,Tafadzwa Matutu,Hapana chatiri kuvha isu
1542877756829285,1:05:16,Unathi Notshata,@Sam Vanguard i will continue with the community awareness against DA and ANC
1542877768386680,1:05:27,Quinton Van Den Bergh,@Sam Vanguard yaa i agree this side we conduct them on sundays so that our brothers and sisters are well informed
1542877770438007,1:05:29,Sydwell Phakula,When are they arresting in the latest discovery & stop deceiving us here?????
1542877820702973,1:06:20,peter pott,"@musoliwa, that's exactly my point earlier. Yesterday he told years in treasury and how learned is he, and yet He is fooled that easily. we need to change the way we vote, this party politics no OK"
1542877828385923,1:06:27,Sthakathi Khumalo,You see his boss is Trevor Manuel!1
1542877851805789,1:06:50,Sam Vanguard,@Quinton Van Den Bergh we are intensifying our combat training and fire arms training initiatives we have seen that EFF and ANC want to try the zimbabwe road which always ends badly
1542877867063878,1:07:06,Desmond Masilela,Zondo takes more than 4 min to ask just one question.
1542877880946266,1:07:20,Mhlanguli Dlodlo,Was it not predictable that Des was going to bring the same advisors he had whip on the of Finance and of the Economic Transformation in parliament. Any one in the ANC would have known that
1542877892136496,1:07:31,lee royal,the South African youth are unskilled most of them work in call centers ...Our education system hasn't changed since the so called rainbow nation change happened @Thando Nkutha
1542877894516021,1:07:33,Sindiswa Moolman,So you are counting @Desmond Masilela
1542877904270271,1:07:42,welle ntshibongo,these pipo are very cautious of the words they utter which means they are just acting....wast of our country's time and money really
1542877912873338,1:07:52,Quinton Van Den Bergh,@Sam Vanguard if you study the zimbabwe case you will find that the government lied to the people for the sake of colonial revenge
1542877925905945,1:08:05,Desmond Masilela,@sing
1542877938617610,1:08:17,Desmond Masilela,@Sindiswa Moolman. LOL NO.
1542877944022088,1:08:23,Unathi Notshata,@Sam Vanguard we are not scared of you guys with your guns
1542877982106993,1:09:01,Sam Vanguard,@Quinton Van Den Bergh mmmm that scenario reminds me of how i should always be prepared if the worst hits S.A which is a genocide
1542878016868712,1:09:36,peter pott,"here is another weakness. how does a political appointee like Fuzile, appoint people at Treasury. with no Human resources backround?"
1542878043180086,1:10:02,Genevieve Pilz,@Sam Vanguard Asking Israel for rifles again?
1542878044941249,1:10:04,Quinton Van Den Bergh,@Sam Vanguard Malema and his counterparts want destroy us but that will be very hard boet i tell you very hard
1542878059204058,1:10:18,Mthobisi Zuma,Zimbabweans are skilled right thats why ur country is in shambles and all of you ran away to crowd us here in SA
1542878074066100,1:10:32,Mkhululi Bushula,@Sam Vanguard why did u run to your big brother Donald Trump if u are so prepared for any combat.
1542878107446166,1:11:06,Sam Vanguard,@Genevieve Pilz we don't need israel for protection let alone trump or our european brothers
1542878120083778,1:11:19,Genevieve Pilz,@Mkhululi Bushula He's going to farm in the snow in Russia for ten rubles
1542878127016991,1:11:26,lee royal,"@Thando Nkutha i see your a pan africanist however we need to solve our problem first, white people hire foreign nationals thats a fact while our people are not enriched"
1542878133747036,1:11:33,nhlanhla nkosi,stick to the topic mense
1542878144372178,1:11:43,Sam Vanguard,@Mkhululi Bushula that was making the issue international as it is and your were warned
1542878146242964,1:11:45,holylady1000,Zuma messed up the country and his fellow countrymen
1542878182609790,1:12:21,Genevieve Pilz,@Sam Vanguard Men and firearms are limited surely but I guess we'll see. Hope the verbal violence in this chat in general doesn't go anywhere
1542878187428628,1:12:26,welle ntshibongo,so far this process is a waste of time untill there is someone taken to jail
1542878198423369,1:12:37,Conrad Hoffman,Who is doing the sub titles ?Thamsanqa
1542878207689954,1:12:46,Mkhululi Bushula,@Sam Vanguard but u said didn't need any protection.
1542878208198520,1:12:47,Quinton Van Den Bergh,@Sam Vanguard preparation is the best boet we will stand our ground defending our families friends and property
1542878239949783,1:13:19,Thulani Bukani,You boys are hilarious😂😂😂
1542878252928619,1:13:32,peter pott,"@1000, interpreted other way. that statement is giving fmr president Zuma credit. because we say he fooled men and women with degrees, doctorates, etc etc"
1542878262885920,1:13:42,Mkhululi Bushula,U are suffering swart gevaar syndrome.
1542878268005336,1:13:47,Quinton Van Den Bergh,@Genevieve Pilz do you think we will let you kill us i assure we are prepared we waiting@have you ever been in a war??
1542878309638954,1:14:28,holylady1000,but he did Peter. Power is everything
1542878309785940,1:14:28,Desmond Masilela,Eish this man is divulging some points here. Lets wait for the bombs.
1542878330355877,1:14:49,Sam Vanguard,@Mkhululi Bushula we are well protected armed and ready to die fighting against any aggression on our community
1542878366186919,1:15:25,Mkhululi Bushula,If u prepared u should not be globetrotting spreading lies.
1542878376172824,1:15:35,KEITH SINDILE DINABANTU,@Desmond Masilela How has he been since they started this morning?
1542878411849530,1:16:10,welle ntshibongo,many of US are responding with reverse apartheid manner
1542878424447265,1:16:23,peter pott,"@1000, well said. that's the power shift we see here. this is new in our country. sad that no one immediately cross examine all witness here. this commission would have last for short period"
1542878448095298,1:16:47,Sam Vanguard,@Mkhululi Bushula afriforum or any of our sister organisations have every right to go anywhere in world to highlight our case
1542878498315291,1:17:37,lee royal,we are suffering because white people chose not to trade with zim however the zim ppl are still working in SA now that affects us...the white people are using them in our own country @Thando Nkutha
1542878507228908,1:17:46,Mkhululi Bushula,Your case of defending stolen land.
1542878509631529,1:17:48,Desmond Masilela,@KEITH SINDILE DINABANTU. Morning Keith. His divulging some booms and I see his still continuing where left yesterday. Through your help i now understand what type of this man he is.
