timestamp,time,author,message
1542791181877170,1:00:32,Thato M,@Thando Nkutha absolutely
1542791204341371,1:00:54,Sthakathi Khumalo,"I wonder why SANs are anti Nuclear energy, there are a wide range of benefits here, among others; reduction of carbon footprints i.e fossil fuels, raw material use and transport etc."
1542791205801202,1:00:55,Sthakathi Khumalo,"Apart from difficulties in managing nuclear waste and terrorist friendly, this could easily reduce the stress on oil and other fuel intakes.. We could even eliminate cost plus mines."
1542791208879491,1:00:59,Lucky Dlamini,"He told the Judge to connect the ""DOTS"" Lol🐵"
1542791209709924,1:00:59,Speckled Trim,"Haha, I wish i was. anyway, nothing will be done 🤔"
1542791238234359,1:01:28,Mhlanguli Dlodlo,"@ Khalid Mather the UK is building more nuclear plants with South Korean companies, EDF of France and CGN of China. Its very possible"
1542791278084983,1:02:08,Thato M,The London trip were he was recalled
1542791279871626,1:02:10,Knight Wolves United FC,We thank the Guptas for thanking over the J Zuma admin(for he was Ghost) but we regret THE FRAUD DONE BY THEM TO THE STATE TO BENEFIT THEMSELVES THROUGH PG
1542791285958407,1:02:16,Khalid Mather,"@Sthakathi Khumalo in the new stations there is no considerations for even weaponizing the waste, because its not uranium. The waste can even be converted to other forms of energy nowawdays."
1542791288309100,1:02:18,Kevin Davis,khumalo you shud.get a job in the London palladium telling jokes
1542791302059695,1:02:32,Desmond Masilela,Here come the truth
1542791311716645,1:02:41,Khalid Mather,"Oil , coal and gas must be cancelled asap to save the world, forget South Africa"
1542791311990078,1:02:42,Knight Wolves United FC,We thank the Guptas for tAking over the J Zuma admin(for he was Ghost) but we regret THE FRAUD DONE BY THEM TO THE STATE TO BENEFIT THEMSELVES THROUGH PG
1542791357731111,1:03:27,Kevin Davis,those guptas owned Jacob and his son and even his wives
1542791393041153,1:04:02,Thato M,We have the massive coal reserves. Which countries / economies have the highest Co2 emissions?
1542791396350666,1:04:06,peter pott,"secret forces drafting ""memorandum""."
1542791402886508,1:04:12,Kevin Davis,even the youngest wife that's why she is pregnant lol
1542791446630805,1:04:56,Aidan Bain,I See the anc splitting
1542791456404748,1:05:06,Thato M,@Kevin Davis same way Anisha Gordhan is owned by Stephen Koseff
1542791461713430,1:05:11,Kevin Davis,this is Zuma s highlight the intelligence report lol
1542791465256117,1:05:15,Sthakathi Khumalo,"Khalid Mather Just think of this in the long run, countries are running on nuclear together with solar and wind. waste is a small fraction for now."
1542791473325378,1:05:23,Knight Wolves United FC,May the peace of ALLAH be with you
1542791481415965,1:05:31,Blackpoison Bp,I'm just worried about the DCJ coz he seems to tbe agreeing with whatever Gordhan is saying🤔
1542791503418974,1:05:53,Kevin Davis,thato lol take your evidence to the commission all of it all zero pages of it
1542791506981604,1:05:56,THABISO MOGORU,MALEMA HIS CORRUPT
1542791519199199,1:06:09,Thato M,"Gordhan reallly likes Twitter, his opening remarks were Twitter observations"
1542791519581099,1:06:09,Sthakathi Khumalo,Blackpoison Bp Pretorius and Joshua confusing him!!
1542791526166166,1:06:16,Jomoh Khanyile,So PG and His close friends were the only one clean the rest were corrupt
1542791530953564,1:06:21,Trucker Trucker,LOL IS THIS GUY BRINGING INTELLIGENCE REPORTS FROM TWITTER? IS HE SERIOUS?
1542791551415363,1:06:41,Freddy Ngoma,atleast the truth will come out
1542791573873665,1:07:03,Kevin Davis,trucker zuma has a opportunity to cross examine but he wont
1542791574672049,1:07:04,Bongumenzi Nxumalo,"He is such a coward, speak of baba because he plays chess directly"
1542791583696098,1:07:14,peter pott,"@trucker, there he said it😀😀😀😀😀😀"
1542791586662351,1:07:16,Thato M,"@Kevin Davis not until you submit yours. Wait not until Gordhan provides something concrete to the commission, not he said, I said lectures"
1542791599670845,1:07:29,Mhlanguli Dlodlo,"Folks there is no Intelligence report that is TWO pages, this is very shameful from the minister and the SACP"
1542791600109659,1:07:30,Filemon Namweya,Viva President of United of Africa Commarand Julius Malema
1542791610267964,1:07:40,Kevin Davis,zuma will only say after all this nobody implicates me at all so I am not worriers
1542791620092878,1:07:50,Trucker Trucker,@Kevin Davis ZUMA DOES NOT HAVE TIME FOR GAMES. HE WILL COME WHEN INCRIMINATING EVIDENCE IS PRESENTED.
1542791649849953,1:08:19,peter pott,I am embarrassed by minister pravin gordhan
1542791659122857,1:08:29,Kevin Davis,thato lol you are dead the emails the intelligence report and all the meetings will all be unchallenged trust me
1542791692420552,1:09:02,Fusi Senkie,really
1542791724238238,1:09:34,Kevin Davis,all the witnesses are lying lol even all the money he received from Roy Moodley he says was a gift that he forgot about lol
1542791768391056,1:10:18,peter pott,"Yes, president ramaphosa said in the press statement"
1542791791304532,1:10:41,Kevin Davis,thato if a tone believes they are false and even a large amount of minister said they are true they are entirely to give evid2nce with there version but wait for it
1542791800724375,1:10:50,Singi Mathebula,malema calls pravin a dog. pravin has never spoken bad about malema at least in public. who is fooling who ?
1542791824859238,1:11:14,THABISO MOGORU,THAT IS TRUE
1542791826224571,1:11:16,Fafa Ngobeni,malema
1542791828822384,1:11:18,Thato M,"@Kevin Davis what is a tone, which Minister said they were true?"
1542791831545788,1:11:21,Kevin Davis,nobody I repeat nobody besides the guptas have said so and the guptas are refugees lol
1542791847955027,1:11:37,Sthakathi Khumalo,Gordhan has smurk on his face and its really annoying
1542791850790657,1:11:40,Dams daily motivations Madamalala,malema looted Limpopo Finances through his ill contracts with ANC when he was ANC youth league President till SARS dealt with him now we cnt say malema is Smart
1542791852036862,1:11:41,Trucker Trucker,LOL DID THIS WHITE GUY REALLY CALL THIS EVIDENCE?
1542791859800383,1:11:50,Mosimanegape Michael,i didn't realize thiefs can take so long to go jail i think two or three for testifying for corruption is enough but this noooo
1542791861812843,1:11:52,Kevin Davis,as tube get hold of saa
1542791872240336,1:12:02,Mdu Mduduzi,viva EFF
1542791900977357,1:12:30,Walter Spatula,WMC! Claim your R5 airtime!
1542791901928941,1:12:31,Thato M,@Kevin Davis Don''t understand anything you are saying
1542791903285188,1:12:33,Sthakathi Khumalo,"Male said, you beat the Dog until the owner comes lols.. meaning they are onto him"
1542791927620185,1:12:57,Peter Sant,malema can not be taken serious.
1542791942660981,1:13:12,Jomoh Khanyile,kanti yini lo madala ayikhumbulayo
1542791963723198,1:13:33,Mosimanegape Michael,i respect Eff if was not juju this not be done
1542791971383526,1:13:41,Thato M,@Peter Sant I don't expect any white person
1542791972760966,1:13:42,Kevin Davis,ok let's start the emails directly implicating nene he has admitted he me the guptas and the ses van royces emails not to mention zwane has never denied a d the top boy Brian Moore said he was
1542791982415395,1:13:52,Kevin Davis,at a sheen lol
1542792008523266,1:14:18,Kevin Davis,thato u must be eff if you don't understand lol
1542792014875074,1:14:24,Jomoh Khanyile,@Thando Nkutha u are so true😁
1542792017591908,1:14:27,Sthakathi Khumalo,"Ae ay ay, Kevin like really"
1542792022343867,1:14:32,Mosimanegape Michael,i agree thando
1542792032866329,1:14:42,Walter Spatula,@Thato M I don't expect the spanish inquisition
1542792055818395,1:15:05,Kevin Davis,tone means discovered e mails
1542792057765688,1:15:07,Trucker Trucker,"""The way #PravinGordhan does business with the state through his daughter is deplorable. If he were any of the African leaders, he would have been declared CORRUPT"" - Mbuyiseni Ndlozi"
1542792057888759,1:15:07,Thato M,"@Kevin Davis time wasting. I'll tell you fro free, none of the emails you are basing your thesis on will be used by Zondo. A commission cannot legally use leaked & unauthenticated emails."
1542792084635706,1:15:34,Thato M,@Kevin Davis therefore your argument and rationale falls flat.
1542792087051521,1:15:37,Trucker Trucker,Over 8 departments already confirm to have given Pravin’s companies tenders since 2009 when he was Finance Minister.
1542792118243918,1:16:08,Peter Sant,@Tharp M only knowledge you have is white
1542792138496039,1:16:28,david jacobs,so were going to court when the commision wraps up?
1542792152406834,1:16:42,Thato M,@Peter Sant were you meant to tag me or nah?
1542792153354223,1:16:43,Kevin Davis,thato but if one reads out the emails and the person or persona mentioned in the emails say they are not true then they have every opportunity to give there side and cross examining the reader however
1542792169850745,1:17:00,Mosimanegape Michael,zondo he is wasting time and gov resources wen this will end let the thief rot in jail finish
1542792171444160,1:17:01,david jacobs,I think this should have been dealt with in court
1542792187168904,1:17:17,Kevin Davis,if nobody does then the material.is regarded as correct hope that explains that
1542792196599713,1:17:26,Mosimanegape Michael,yes
1542792207730351,1:17:38,Peter Sant,@Thato m yes
1542792208415167,1:17:38,Thato M,@Kevin Davis you are still on emails. Chief. You need professional help.
1542792225102643,1:17:55,Thato M,"@Peter Sant ok, what were you sayinh?"
1542792235571986,1:18:05,Kevin Davis,David that is the next step ita to allow the npa and the hawks to arrest these clowns
1542792236409838,1:18:06,Walter Spatula,@Trucker gets his news from twitter
1542792267498823,1:18:37,Trucker Trucker,"@Walter Spatula Ja, so?"
1542792268361133,1:18:38,Thato M,@Walter Spatula 😀😀😀 evidently
1542792268760690,1:18:38,Kevin Davis,thato lol if I had a lower IQ I would be your friend lol
1542792310153869,1:19:20,Kevin Davis,thato tell me why does all south African ladies wear wigs that what I want to know
1542792312844713,1:19:23,Walter Spatula,@trucker Twitter is just a bunch of your friends sending you stuff they know you want to hear. It's not a news source.
1542792331928941,1:19:42,Trucker Trucker,"@Thato M I would rather get news from Twitter than ENCA. Also, i'm just like Pravin, he discusses Twitter intelligence reports at the commission."
1542792338884488,1:19:49,Peter Sant,@Thato m why always you attack white people?
1542792363994600,1:20:14,Trucker Trucker,@Walter Spatula Give me the real sources and stop wasting my time.
1542792367228334,1:20:17,Thato M,"@Kevin Davis no you wouldn't be, because my ""low IQ"" friends know you cannot use illegally obtained material to legally convict or prove somebody wrong."
1542792374878104,1:20:25,Siala Lucky,can't they just do tea what what while addressing waste of time
1542792391882477,1:20:41,Adrian Fry,"Probably too late but at least all the Cadres chicken's are coming home to roost. Never in recent history has so much dirty laundry been put out to air. I'm enjoying all the ""popcorn moments"" 🍿"
1542792409110453,1:20:59,Walter Spatula,@Thando Nkutha Horsesh!t. Twitter is the source of much fake news. Ask Trumpstix.
1542792439108641,1:21:29,Trucker Trucker,@Walter Spatula Stop running your mouth and give us the real sources.
1542792447066790,1:21:37,Walter Spatula,@Thando Nkutha Then you will forever be misinformed
1542792456879063,1:21:45,Mhlanguli Dlodlo,This commission is a COURT OF PUBLIC OPINION. It is serving it's intended purpose. That's why a whole full grown minister can wave a two page fake Intel Report in front of a judge. Its so shameful
1542792470863356,1:22:00,Walter Spatula,@Trucker There are no real sources for fake news. That's why it's fake...
1542792476125048,1:22:06,Thato M,"@Peter Sant becacuse you are here claiming moral superiority when the banking, financial, retail, mining sector & entire economy has benefiting Caucasians since 1652."
1542792502722457,1:22:32,Walter Spatula,@Thando Nkutha You mean BFLF?
1542792512033760,1:22:42,Suchu Pillay,going back 200years there is enough wealth inthe country to steer 56million south africans ...if not we must nationalise...just look at on financial inst
1542792555993563,1:23:26,Walter Spatula,"@Trucker What can I say? You poke out your eyes, you go blind"
1542792623712165,1:24:33,Thato M,"@Adrian Fry dirt = Anisha Gordhan, Andile Ramaphosa, Ketso Gordhan"
1542792663335922,1:25:13,Walter Spatula,"@Thando Nkutha Twitter is an echo chamber that reinforces your own world view, whatever that is"
1542792665131634,1:25:15,Trucker Trucker,"@Walter Spatula LOL you're proving to be even more pathetic. When you have nothing to offer to a conversation you turn to metaphors without offering any facts. I repeat, pathetic."
1542792688179551,1:25:37,Abaadung Joshua Asiaka,malema is right the dog must be hate until the owner come out
1542792692762034,1:25:42,Zizoh,im back baba
1542792697932371,1:25:48,Zizoh,where are my comrades
1542792729621105,1:26:19,Zizoh,COMRADES
1542792736064634,1:26:25,Thato M,That clown Adv Motau is there as well. These jokes write themselves
1542792746211392,1:26:35,Info Eict,Who is the lady with dreadlocks?
1542792761576191,1:26:51,Thato M,Did Zondo have coffee or a dop of whisky?
1542792764288296,1:26:54,Zizoh,THESE PPL ARE WASTING OUR MONEY WHILST ESKOM IS BUSY SWITCHING LIGHTS OFF AS HEY PLEASE
1542792785983608,1:27:16,Suchu Pillay,one financial institution disputes disclosure to event of death...like in the old days the indian population were subject to GTT test or goodbye to cover...
1542792799328387,1:27:29,Zizoh,EFF IS THE FUTURE
1542792807772831,1:27:37,Info Eict,Who is the lady with dreadlocks? Wearing black shirt?
1542792823831781,1:27:54,Abaadung Joshua Asiaka,yes eff is the future
1542792835685857,1:28:05,Thato M,@Info Eict Vytjie Mentor 😀😀😀
1542792841096558,1:28:11,Luxolo Nogobela,Pravin Gordhan is aCROOK
1542792868624120,1:28:38,Info Eict,NOOO Maan @Thato M
1542792876314402,1:28:46,Hendrik Botha,EFF OFF
1542792884092269,1:28:54,Info Eict,Who is the lady with dreadlocks? Wearing black shirt?
1542792890864680,1:29:01,Zizoh,"EFF IS THE FUTURE OF OUR LIFE,"
1542792906732216,1:29:16,Zizoh,EFF IS THE FUTURE
1542792930827310,1:29:40,Samson Masilo,The Truth Must Come Out!!! We going to take them down 1-by-1
1542792944869540,1:29:55,Thato M,"@Hendrik Botha I am not EFF, but you don't come here with that racist Afriforum tone"
1542792961757756,1:30:11,Zizoh,"HATE HIM OR LOVE HIM, HE IS THE FUTURE"
1542792990877019,1:30:41,Zizoh,HENDRICK MUST NOT BE HERE TO PROVOKE US
1542792994456203,1:30:44,Thato M,I want Malema to deal decisively this crook names Joshua Doore
1542793099644910,1:32:29,Mahlasela Kilson,@Thato M how can Malema deal with them while he is also crook like them he just push his agenda but using the people of mzansi if he wants to deal with them he must go to Zondo commision finish
1542793147645122,1:33:17,Thato M,@Mahlasela Kilson same way he has been dealing with all other politicla figures. Not rocket science.
1542793152990662,1:33:23,Mr Q,just by laughing you are racist these days..
1542793162759036,1:33:32,Zizoh,"HE IS NOT USING ME, I MADE A DECISION TO SUPPORT EFF"
1542793170839710,1:33:41,Thato M,@Mr Q Passop!
1542793186580307,1:33:56,muwanga soul roy,am watching from uganda
1542793190098321,1:34:00,Mahlasela Kilson,@Thato M who did he deal with fro example
1542793195861614,1:34:05,Zizoh,SO WHY ARE THEY STILL IN THEIR POSITIONS
1542793209444243,1:34:19,Thato M,@Thando Nkutha true that. Even on the Mining Charter he is dithering
1542793214427807,1:34:24,Trevor mokobake,All white people are excused from commenting here.. They need to go form their own commission and discuss how they gonna return the land.
1542793227952391,1:34:38,Wilhelm5381,Why doesn't the EFF gotothe commission and make their allegations under oath and with evidence?
1542793235887514,1:34:45,Thato M,@Mahlasela Kilson hayibo. U phuma phi kanti wena
1542793237030347,1:34:46,Zizoh,"TREVOR, YOU ARE SPOT ONN"
1542793246215469,1:34:56,Wilhelm5381,Answer: because they know they are lying.
1542793246467105,1:34:56,Samson Masilo,"Mahlasela CIC has made it clear for the intention to testify in the Zondo Commission, and i think he can do that without any fear, favour or prejudice"
1542793251450538,1:35:01,muwanga soul roy,who is the vice president of south africa? am watching from uganda
1542793262519698,1:35:12,Thato M,@Trevor mokobake power
1542793267032456,1:35:17,Walter Spatula,@Trevor mokobake I don't have any land
1542793279487563,1:35:29,Thato M,@muwanga soul roy DD Mabusa
1542793282529379,1:35:32,Mahlasela Kilson,@Thato M i am from mzansi
1542793355518176,1:36:45,Thato M,@Mahlasela Kilson which radio station adn TV news program do you watch / listen to
1542793377683963,1:37:07,Zizoh,"WE KEEP ATTACKING BLACK POLITICIANS, KPMG CONTINUE BUSINESS AS USUAL"
1542793407506253,1:37:37,Thato M,It is these white owned media that messes people's consciousness
1542793413880214,1:37:44,Walter Spatula,WILL THE @ZIZOH BOT STOP SHOUTING?!
1542793470672353,1:38:40,Mahlasela Kilson,"@Thato M cnn, thobela fm, sabc, just dont ask me the question just tell me who Malema deald with over corruption the i will understand"
1542793479315037,1:38:49,Zizoh,"WATER, PLEASE LET ME BE"
1542793490489868,1:39:00,Zizoh,"WATER, I HAVE ROLE TO PLAY HERE"
1542793511349433,1:39:21,Thato M,@Mahlasela Kilson CNN? Did you ever hear Malema talk about ANN7 just an example
1542793530423042,1:39:40,Zizoh,"WATER, JULIUS IS THE BEST"
1542793531929647,1:39:41,Mahlasela Kilson,@Thato M no
1542793551043703,1:40:00,Walter Spatula,Julius is the beast
1542793558966016,1:40:09,Thato M,@Zizoh speak your mind. Don't cower to any man's opinion especially
1542793590077269,1:40:40,Thato M,@Mahlasela Kilson then me and you cannot be friends. Goodbye.
1542793600909577,1:40:51,Walter Spatula,But you'd do well to cower to a woman's opinion...
1542793629765035,1:41:19,Thato M,@Walter Spatula o wa reng na?
1542793678602645,1:42:08,Mhlanguli Dlodlo,Does anyone know of an instance where PG ran for public office or contested an election? Please enlighten us!
1542793682272834,1:42:12,Walter Spatula,Here's a distraction. WMC!!!!!
1542793708155823,1:42:38,Thato M,"That's how I test whether somebody is black or white, you have whites hiding behind black names. If they are white I go full frontal. But if they are black, I engage in brotherly way"
1542793745554997,1:43:15,Thato M,"I may disagree with a black person on politics (EFF, ANC, etc) but they remain my brothers and sisters. White people, I have no time for"
1542793808448843,1:44:18,dave east,right thato m
1542793810491037,1:44:20,Zizoh,WMC IS THE BIGGEST ENEMY OF OUR LIVES; WMC MUST GO
1542793814992350,1:44:25,Thato M,"@Thando Nkutha I do, all the time. I am saying I don;t like arguing with a fellow black brother like they are my chief enemies, so to speak"
1542793818000422,1:44:28,Huhu Bongani,But to be honest all politicians are corrupt. they are allowed to sell one another to gain some political power. It is important for all of us to have a say to put our country in a right direction.
1542793852587958,1:45:02,Thato M,@Thando Nkutha Frantz Fanon: Blacks can't be racist.
1542793865501023,1:45:15,Walter Spatula,@Thato M Do you want some dip to go with that racist chip on your shoulder?
1542793871476904,1:45:21,Luxolo Nogobela,@Thando Nkutha blacks could never be racist wena
1542793891366076,1:45:41,Thishan Naicker,@that I.
1542793916463830,1:46:06,Thato M,@Walter Spatula articulate your points properly so we can engage better.
1542793924181557,1:46:14,Zizoh,THERE ARE PPL WHO WANT US TO ALL SUCCUMB TO THE UTOPIAN WAY OF THINKING
1542793947202563,1:46:37,Thishan Naicker,you guys dont seem to understand what is racist!
1542793970616895,1:47:00,Zizoh,I AM A BOT AND I AM HERE TO PUSH A CERTAIN NARRATIVE
1542793999310162,1:47:29,Walter Spatula,@Thishan Naicker Saaadly they don't
1542794006076590,1:47:36,Zizoh,"THISHAN, PLEASE STAY OUT OF THIS. THIS IS BETWEEN BLACK AND WHITE"
1542794008521710,1:47:38,Lucky Dlamini,I was honestly expecting more from Min PG at this inquiry.
1542794019081439,1:47:49,sne gama,EFFs. work look at him now
1542794050107252,1:48:20,Nelson Musoliwa,Zuma didnt like to follow rules but to instruct what he already agreed with his own gupta circle so anyone who calls for rules will be removed. In essence zuma was incompetence
1542794061437462,1:48:31,Thato M,@Thishan Naicker you don;t seem to understand racism in context of South Africa and Africa as a whole. You have a bookish approach to understanding racism in the African context.
1542794075653312,1:48:45,Thishan Naicker,@zizoh.....the comments or commission of inquiry??
1542794079325985,1:48:49,Zizoh,JESUS WOULD NEVER LIKE WHAT HE SEE'S WHEN HE SEE'S HOW MUCH LAND WMC HAS AND THE BLACK HAS
1542794092194694,1:49:02,Walter Spatula,WMC!!!!!
1542794098195316,1:49:08,Mhlanguli Dlodlo,@Lucky Dlamini please help me to breakdown this testimony. Many fools here who just can't focus lol.
1542794098715992,1:49:08,Thato M,@Thishan Naicker you are the same people who argue BBBEE is racist? Ahem
1542794109766252,1:49:19,Zizoh,"ZUMA IS ORGANIC, HE DOESNT FOLLOW RULES"
1542794137566812,1:49:47,Zizoh,YES WATER
1542794150006400,1:50:00,Thishan Naicker,@thato M ......racism is all over the world not only in SA.....
1542794150640767,1:50:00,Walter Spatula,"@Zizoh Umm, organic things follow the rules of chemistry"
1542794170826790,1:50:20,Thato M,@Thishan Naicker Dar! Now that is a revelation
1542794194172285,1:50:44,Zizoh,"YES, ZUMA ONLY FOLLOWED THOSE RULES. NOT THE RULES OF WMC"
1542794201955875,1:50:52,Walter Spatula,WMC!!!!!!!
1542794203444710,1:50:53,dawie botha,zuma doesnt have brains and so it seems of eff
1542794207392308,1:50:55,Andrew Mabele,The phamacist(Gordhan) still going in circles....
1542794221129961,1:51:11,Zizoh,YES WMC
1542794224322525,1:51:14,Wilhelm5381,the WMC narrative is simplistic nonsense
1542794226187158,1:51:16,Thato M,@Thando Nkutha you can't quote a dictionary to the exclusion of lived daily realities of how racism manifests itself
1542794236904997,1:51:27,Thato M,@Wilhelm5381 so are you.
1542794243676474,1:51:33,Walter Spatula,WMC!!!!! Three prizes in as many minutes
1542794247083319,1:51:37,Zizoh,I LIKE ALL RACE GROUPS BUT I DONT LIKE WMC
1542794255422281,1:51:45,Martin C,blacks need land . Tthe government had a perfectly operational SARS to deliver it . Zuma destroyed SARS
1542794313297281,1:52:43,Zizoh,JESUS WILL NEVER LIKE SUCH INJUSTICE
1542794321337031,1:52:51,Ewald Kruger,😀 You must be so jealous that you are not as intelligent and gifted as Gordhan nhe @Andrew Mabele​The phamacist(Gordhan) still going in circles....
1542794350291963,1:53:20,Thato M,"I am an African first. All settler minorities come last. In America blacks born there are referred to as African Americans, why do we call European descendants as African?"
1542794373105297,1:53:43,Thato M,My FIRST love is Africans from Cape to Cairo
1542794374157287,1:53:44,Heat Heat,"still brain wash, there no white Jesus's to save us."
1542794374966017,1:53:45,anton a,How about you refrain from spewing your racial vomit on this chat
1542794418108442,1:54:28,Annie Maharaj,"he sound miserable , i think he just hates himself too much"
1542794423966437,1:54:34,Thato M,@anton arjunan how about you tell all listed companies in the JSE who fail to transform their comp 24 yrs in?
1542794428442181,1:54:38,Nelson Musoliwa,Anyone who will reason that zuma was competent must ask why he paid back about R7m for nkandla saga. He cant even read economic indicators;can understand rating agencies etc
1542794433683360,1:54:43,Sthakathi Khumalo,"So vele vele, this was gonna be mother of all evidence but yet again.. he has offered dots and nothing but dots!!"
1542794446184503,1:54:56,Thato M,@Aneila Maharaj 😀😀
1542794446599604,1:54:56,Andrew Mabele,@Ewald why are you having itchy balls when i say he is a pharmacist?
1542794472197495,1:55:22,Trucker Trucker,😀🤣😀 IS THIS GUY REALLY PRESENTING GUPTA LEAKS FROM THE MEDIA AS EVIDENCE?
1542794480792874,1:55:30,Thato M,@Thando Nkutha its an assumption my brother. But I forgive you
1542794490028094,1:55:40,Zizoh,WMC IS CONTROLLING U
1542794504402570,1:55:54,Annie Maharaj,"You wasting your time with this guy, it will take a bit of panel beating to make him understand😀"
1542794515668533,1:56:05,Ewald Kruger,😀 @Andrew Mabele​@Ewald why are you having itchy balls when i say he is a pharmacist? Why is him being a pharmacist pulling your wire??
1542794521890072,1:56:12,Mhlanguli Dlodlo,Why doesn't he just say it outright that 'YES I HAVE EVIDENCE OF ZUMA being corrupt.
1542794524859819,1:56:14,Trucker Trucker,DO YOU HAVE ANY EVIDENCE OR NOT PRAVIN. DON'T TELL US WHAT YOU HAVE A BETTER GRASP OF.
1542794532362184,1:56:22,Lucky Dlamini,Avoiding the CNN's Amanpour question lol!
1542794535840088,1:56:26,Andrew Mabele,😀😀😀😀
1542794543661459,1:56:33,Zizoh,"STHAKATHI, WHY DO U WANT PPL TO SUCCUMB TO YOUR WAY OF THINKING"
1542794545384064,1:56:35,Thato M,@Aneila Maharaj Gordhan's brass band is here for the lullabies.
1542794569425769,1:56:59,Walter Spatula,bro hugs
1542794601853845,1:57:32,Zizoh,"HE CANT SAY HE HAS EVIDENCE ON ZUMA, BECAUSE ALSO ZUMA HAS EVIDENCE"
1542794648416869,1:58:18,Annie Maharaj,"NO ,pathetic comprehension who much work to make you understand"
1542794648419969,1:58:18,Ashon Singh,i think Julius and SHivambo are all directly implicated... but he is bringing it out very sensatively
1542794706152375,1:59:16,Motsamai Shale,"t looks like some people are threatened that if Pravin continues to be in SOEs,they might arrive there and find taps closed as he is a no nonsense kind of guy"
