timestamp,time,author,message
1562235961955809,2:25:09,Nate P,@Makhosi... yip BNP was signing everything without reading at all... you goto just gasp at the disrespect to proper process. I call it the Gupta effect....
1562235978439555,2:25:26,Millicent Shozi,@goolamv im proud EFF
1562236000695176,2:25:48,funicanz,"@Thando, he is IGNORANT, he's IGNORANCE is INTENTIONAL, Malema that is."
1562236054970998,2:26:42,Nelson Musoliwa,Pathetic that seasoned officials suddenly got confused with system they are accustomed to. The only problem here was Zuma; Tony said they are his guests mos
1562236059538995,2:26:47,watson mutanga,"The main issue confronting majority of people around the world is financial illiteracy, which is why people become corrupt. They don’t understand how money works. In my opinion financial literacy ..."
1562236104929370,2:27:31,Norman Zwane,@Robert Russell I vote you to chair this commission. we would have a one line finding:ALL GOVERNMENT EMPLOYEES MUST SPEAK ENGLISH.
1562236105964338,2:27:32,Sofia Sofia,My question was why could these people not land at O.R T ?
1562236129055455,2:27:56,Moahi Hlapolosa,It's disappointing we have to be exposed to this level of incompetence from our army
1562236137167919,2:28:05,Nate P,"@Ibo, that's the truth, the debt that the USA sits on and the euro is a ticking time bomb. with China buying these debt bonds..... for us to stay sage we have to peg the rand with our gold."
1562236179364528,2:28:47,Dominic Przybylski,"@watson mutanga Same as people who 'hate' capitalism yet know nothing about it, have never even read ""The Wealth of Nations"" by Adam Smith which is its foundation."
1562236190926107,2:28:58,Sindiswa Moolman,It may survive because of those who are on the other side of the law love it @goolamv. These ppl vote the EFF because they feel protected.
1562236234878081,2:29:42,Shadrack N,protected by EFF?
1562236246838272,2:29:54,Robert Russell,@Norman Zwane...thank you for your vote of confidence.... however the official language of the ANC is LIES not English
1562236257720622,2:30:06,Millicent Shozi,yes
1562236285769971,2:30:33,makhosi nobhatyi,I like wat I heard here
1562236288144006,2:30:35,Anne M.,@Sofia Sofia Because their request for a plane side reception was denied.
1562236290165247,2:30:37,Nate P,"@I am free, that's the best, gold, silver and bit coin....."
1562236309491055,2:30:57,Norman Zwane,@Robert Russell Talking of commission
1562236324931517,2:31:12,Millicent Shozi,where is this Anderson. come answer for yourself
1562236346150275,2:31:34,Nate P,"@thando, I agree"
1562236407262827,2:32:35,Sindiswa Moolman,"Yes... the Party supports invading the land, thrashing businesses they don’t support like HnM. That is criminality."
1562236427721001,2:32:55,watson mutanga,"Oh, and nation building lessons are required. Capitalism and urbanisation are borrowed concepts to our peoples. We won’t find the required awareness and knowledge though academic textbooks or religion"
1562236447844177,2:33:15,Ibo Thabo,"@Nathaniel Perumal Since 1971, its official that the US dollar is not guaranteed by intrinsic, since the days of Richard Nixon the dollar is only guaranteed by the well-known dishonest US government."
1562236458993608,2:33:26,Dominic Przybylski,"EFF is the party of luxury - Moet Chandon, Breitling watches etc."
1562236511619924,2:34:19,Norman Zwane,@Dominic Przybylski Why do you say that?
1562236515128579,2:34:22,sanele songelwa,everyone needs to look on point when amongst other people
1562236520606140,2:34:28,KEITH SINDILE DINABANTU,@Glorify Gumede True my bro...serious not far from truth. Imagine those guys being subjected to the like of Maleka or Hofmyer legal language and end up messing around. They would be laughed at.lol
1562236534421315,2:34:42,Nelson Musoliwa,Mtishi influenced Van Zyl to sign the approval knowing that it is wrong and he took advantage that Zyl was new person at the post
1562236541773961,2:34:50,kaapstad18,Who is giving evidence now?
1562236550185471,2:34:58,KEITH SINDILE DINABANTU,@Glorify Gumede I would be laughing as well ... i must admit
1562236565113528,2:35:12,Dominic Przybylski,@Norman Zwane I've been reading about what was found in their garbage at Camps Bay during SONA.
1562236598740537,2:35:46,Tito 2000,The DCJ is so quiet today.............🤔
1562236623784025,2:36:11,Wildthing,he is shocked
1562236628005655,2:36:16,Norman Zwane,@Dominic Przybylski That defines the prty or the leaders tendencies or there is no difference between the two for you?
1562236639633222,2:36:27,KEITH SINDILE DINABANTU,So @Glorify Gumede They were at liberty or it was their constitutional right to make it easy or smooth as possible for them. Clever move i think
1562236640167759,2:36:27,Millicent Shozi,@dominic beggars do that you must be one
1562236667532906,2:36:55,Nelson Musoliwa,Breach of security codes at a national key point is tantamount to treason.
1562236669022503,2:36:57,Dominic Przybylski,@Norman Zwane It defines their lack of integrity.
1562236713840909,2:37:41,Nyasimi Geoffrey,Now Just a point of question WHAT BUSINESS DO THIS GROUP OF INDIANS MESSING IN SOUTH SOUTH AFRICA>
1562236731215096,2:37:59,Millicent Shozi,looking for integrity in a rubbish bin
1562236745411012,2:38:13,Jeffrey Kangara,"@nelson musoliwa, its treason finish and klaar"
1562236751524714,2:38:19,Ibo Thabo,@Nathaniel Perumal so as we are discussing on the inquiry that some commanders or persons in the military or elsewhere should know their jobs and do it well our ANC-NEC and the Mboweni shall know well
1562236753013555,2:38:21,Sofia Sofia,That's @Anne M. ❤
1562236763450182,2:38:31,Nyasimi Geoffrey,hahahah looking for integrity in rubbish bin hahahhahahah you can find unused condoms
1562236804789957,2:39:12,Wildthing,what about 280 or more passengers not going through customs.
1562236814101373,2:39:22,Millicent Shozi,"so you think you found one, well done @dominic"
1562236888047507,2:40:35,Nate P,"@Ibo, agreed. I have to say that I am impressed the witness."
1562236889283013,2:40:36,KEITH SINDILE DINABANTU,"@Dominic Przybylski Didnt or haven't read the article yet, but she ( Marianne) sent me a whatsapp link via last night or yesterday, yet to read this LOL"
1562236958572012,2:41:47,watson mutanga,"You can hate a certain group of people along race lines, but if they have been the contributors to creating wealth in your country, you need to be tactical and diplomatic when addressing imbalances."
1562237064340638,2:43:32,Waterbearer,Anyone know what eventually happened to Anderson? Did she also get an Ambassadorial post?
1562237066607811,2:43:34,Zama Kubheka,hello ppl...who is the criminal today?
1562237085883439,2:43:53,Wildthing,Things that are not part of this enquiry
1562237140656352,2:44:48,Moahi Hlapolosa,People got rewards for landing the guptas
1562237171335918,2:45:19,Neville Watson,A lot of incompetent cadres running the show
1562237191352965,2:45:38,Robert Russell,I think that after 3 years of bullshit disciplinary hearings... she eventual retired @Noluthando Gosa
1562237193088268,2:45:40,Sindiswa Moolman,From us... tax payers @Moahi Hlapolos?
1562237218084820,2:46:06,John Tamang,😊
1562237232931418,2:46:21,Waterbearer,Thanks @Robert Russell
1562237261806246,2:46:49,Moahi Hlapolosa,Sindiswa thats the sad part
1562237268424728,2:46:56,makhosi nobhatyi,Zuma compromise SA for his self enrichment and friends
1562237269899804,2:46:57,Phillip Cwazibe,"Wonder whether Guptas were not seeing themselves as State President, Prime Minister and Minister of Defense Force."
1562237286868182,2:47:14,Wildthing,Type things about this enquiry. otherwise go open your own web site and view your points there. this is about Judge Zonda and State capture
1562237304815298,2:47:33,Millicent Shozi,for lunch im going to parktown commission of inquiry to have my share in the buffet
1562237337394901,2:48:05,Moahi Hlapolosa,They are now ranked higher in the army
1562237413976777,2:49:21,Anne M.,@Phillip Cwazibe I think the Guptas were quite happy to sit behind JZ and others and reap the benefits of tenders and other stuff.
1562237427463399,2:49:35,Norman Zwane,"t@Millicent Shozi I you see Adv. September, tell her she has fans in this chat stream. Quite a few guys are crushed on her."
1562237443081163,2:49:51,Robert Russell,And his home language is not ENGLISH.... impressive
1562237446395035,2:49:54,Sindiswa Moolman,I wonder Zuma and the Tony&Atul talk about when they speak now...What threats are they making against him and does Zuma tell them?
1562237500799860,2:50:47,Wildthing,Thando dont bring race into it. I place anyone on time out if they go off topic. like thousands of sites for XXX. stop crying and stay on topic.
1562237534472093,2:51:23,Moahi Hlapolosa,This army tires Zondo hence the extended lunch
1562237560454068,2:51:48,Anne M.,"Acting Director General of Department of Military Veterans, Lt Gen. Derrick Mbuyiselo Mgwebi"
