timestamp,time,author,message
1565870906146713,4:45,ernest seikano,mmmmmmhhhhh go buzy
1565870976476980,5:56,Nkosingiphile Nkosing,hey guys'
1565870986977910,6:05,Phillip Kamanga,kkkkkk
1565870991325148,6:09,Vusumuzi Sibanda,let's go
1565871936005937,21:54,makhosi nobhatyi,Every time will come here unprepared and make an excuse
1565872001804808,23:00,carnoth ngomane,they deliberately want to prolong the proceedings
1565872184675985,26:03,Rakatsinyane Tsolo,"magashule""s instructions to Thabethe to delay the commission,dirty tricks from former premier"
1565872230281337,26:48,Stephen Togara,..
1565872284925574,27:43,KEITH SINDILE DINABANTU,@I Am Free ðŸ˜˜
1565872319100483,28:17,Born free,ðŸ˜‚ðŸ˜‚ðŸ˜‚ðŸ¤£ðŸ¤£India = The Guptas
1565872345571982,28:44,Kabelo Katjedi,"This guys r so old bt their lies,i just feel sorry for the women they r married to.Nothing coming their mouth is 2 b trusted"
1565872348258701,28:46,KEITH SINDILE DINABANTU,@I Am Free ðŸ˜‚
1565872376008572,29:14,Nicholas Musanga,WHAT CAN I SAY....
1565872381155955,29:19,Norman Zwane,There was a desk top research!! by Thabethe himself? Heyi siyashaywa la!
1565872420531827,29:59,Norman Zwane,Why do people call googling a research?
1565872432182341,30:10,Mbuso Ndlovu,@ Norman you are right
1565872434305024,30:12,KEITH SINDILE DINABANTU,"wAS meant to be laughing at what you @I Am Free, said about Zuma"
1565872444540982,30:22,Solomon Koko,Indian interest
1565872484579761,31:03,KEITH SINDILE DINABANTU,I am not that Free @I Am Free ...busy though
1565872489594959,31:09,vas Michaelides,"hmmm, india might be ana interesting place, but we are in africa at the moment"
1565872496364209,31:16,Jabu Nhlanhla,eshe koko
1565872497479555,31:17,Nicholas Musanga,I;M NOT GETTING THE WORDS..
1565872511334048,31:31,vas Michaelides,excuse me *an
1565872522340419,31:41,vas Michaelides,"typographical, error"
1565872532799376,31:50,KEITH SINDILE DINABANTU,@I Am Free Ya'll seem to be seriously free @I Am Free ... like Zuma
1565872549618201,32:08,vas Michaelides,doesnt he live at Nkandla these days?
1565872560203162,32:18,babette fagan,His laugh was evil
1565872560206931,32:18,Litha Wakes,Mr Thabethe did the Research Personally ðŸ˜ƒ
1565872576457829,32:35,vas Michaelides,are u sure ?
1565872589722763,32:49,Mary Jane Mokgohloa,ya neh
1565872591797646,32:50,vas Michaelides,maybe it was just the accent he was laughing in
1565872607739249,33:06,vas Michaelides,"the dialect, is that what its called?"
1565872617209429,33:16,Kabelo Katjedi,"Imagine this guy doing research,this is a joke.He cnt even stick to 1 statement,trying to confuse everyone"
1565872632253846,33:30,vas Michaelides,i get comphused easily maybe that is the problem
1565872636412706,33:34,PeterPete,i love chat
1565872650493801,33:48,fikile mbokodi,he will confuse the research lol
1565872652523738,33:51,vas Michaelides,speaking of which i need to get some cat food
1565872680894818,34:19,vas Michaelides,or maybe he was just confused by it and it was made like that deliberately
1565872682159481,34:20,vas Michaelides,ðŸ˜ž
1565872699861529,34:38,vas Michaelides,"but because of years of studying and failing to undesrtand why its just accepting it, that was the problem with the old ways"
1565872702012970,34:40,Christopher Eddy,"get yourself a sandwich, you're not a cat"
1565872704261327,34:42,vas Michaelides,apart from many other resaons
1565872712785918,34:51,Solomon Koko,"Botswana was an ideal place or Argentina, but Zuptas are found in India. This guy is a biological liar (bloody spy)"
1565872720955037,34:59,vas Michaelides,uh ah bread bloats me it has to be gluten free
1565872720985327,34:59,Isaac Phumudzo,Gauteng joburg lol
1565872734791566,35:13,Lourens De Jager,all this research and the cows died because off hunger ?
1565872745348515,35:23,Christopher Eddy,well i don't think they do gluten free cat food
1565872753914596,35:32,Lee D. Hendrix,"...Goofy daft religions are failed mental states to separate people as cattle without selfworth. No one is born in herds, but are so.. with individuality."
1565872779453055,35:58,Charlene Botha,"SA has huge dairy farms and factories for products thereof, with numerous laboratories for testing, so how and why India selected very questionable ?"
1565872806915135,36:25,Rakatsinyane Tsolo,"This guy is defending magashule,zwane n gupta brothers"
1565872827090540,36:46,fikile mbokodi,yes zondo my man
1565872877950135,37:36,Comfort Masaka,He googled research ðŸ˜‚ðŸ˜‚ðŸ˜‚
1565872952352659,38:51,PeterPete,they should blame the milk for this
1565872956524056,38:55,Simon Mosiane,paraaz
1565872958339227,38:57,Lourens De Jager,know nothing about milking a cow.... but knows alot about milking a country dry
1565872960723067,38:59,Solomon Koko,Is it I or WE
1565872983748838,39:22,Kabelo Katjedi,"Its so funny how people still making noise abt land a ,it is clear that poliicians will use the same 2 loot our money.Dpt of agriculture its worse dnt even c why still exist,tax money wasted 4 nothing"
1565873029185695,40:08,PeterPete,tbis is were tax is going to stupid meetings
1565873110494533,41:29,vas Michaelides,"im a vegan vegatarian, i only eat vegetables that dont have seeds"
1565873139990353,41:58,vas Michaelides,i dont like imported ones they are too important for me
1565873149559090,42:08,vas Michaelides,maybe..
1565873163915220,42:22,Tito 2000,Here we go........
1565873183023833,42:41,vas Michaelides,?
1565873210627698,43:08,vas Michaelides,prove it
1565873262398746,44:00,vas Michaelides,some things are just numbers
1565873278092855,44:17,danie schoeman,The net is closing on this witness Trying to save Ace and his cronies
1565873282235602,44:21,vas Michaelides,"and others are important but numbers are only important together, thats what makes them numbers , and not digits"
1565873338152687,45:16,vas Michaelides,lies
1565873339408981,45:17,PeterPete,shouldnt they be happy that theirs milk production where they need it
1565873348929847,45:27,vas Michaelides,the statistic was off by 10%
1565873351691824,45:30,fikile mbokodi,she doesnot want distruction
1565873424451854,46:43,Anne M.,They have to sort out the microphones
1565873429489752,46:48,Ndidendavela Nam Bathembu Mgudlwa,sabotage
1565873439165363,46:57,fikile mbokodi,this technicians they messing things up
1565873474984427,47:33,Madelein R,ðŸ˜‚ðŸ˜‚ðŸ˜‚ðŸ˜‚
1565873475856124,47:34,PeterPete,microphone gate confirmed
1565873476023739,47:34,phahlana sammitto,Baffalo Milk and Cattlel Milk are the same ?E banna SATA FRIKAðŸ™Š
1565873499137272,47:58,serole magopa,the biggest enablers of poverty are our own people. sad
1565873513294087,48:12,Madelein R,Never knew you could drink baffalo milk
1565873514131405,48:13,vas Michaelides,just gone to get a cup of coffee
1565873516054250,48:15,PeterPete,sad
1565873517599834,48:17,vas Michaelides,see u just now
1565873518184325,48:17,vas Michaelides,brb
1565873525758780,48:24,KEITH SINDILE DINABANTU,@Charlene Botha LOL... Obviously there will be corruption if those billions will be handled by politicians ...like Ace
1565873526874344,48:25,vas Michaelides,ðŸ˜ƒ brb
1565873528309535,48:26,vas Michaelides,afk
1565873549173670,48:48,Ewald Kruger,ðŸ˜€ ðŸ˜€ ðŸ˜€ well-said @Lourens De Jager â€‹ know nothing about milking a cow.... but knows alot about milking a country dry
1565873562658548,49:01,Pastor J.J,@Madelein Huxtable I am told that Buffalo milk is drinkable.
1565873569155015,49:07,Norman Zwane,So the model was based on collecting milk from Buffalo's not cattle.
1565873577584994,49:16,Madelein R,Maybe they kept the Buffalo for biltong
1565873596910891,49:35,makhosi nobhatyi,I hope and wish all women and men of this country would come forward with information that would save us
1565873605527981,49:45,Mbuso Ndlovu,BUFALLO MILK ??
1565873621575192,50:00,KEITH SINDILE DINABANTU,"@Charlene Botha But i heard my sister, that the private company and municipalities will be the ones handling the entire think, not politicians"
1565873629712373,50:08,Vukile Martin,milk zuptas if you can
1565873633563569,50:11,PeterPete,cx
1565873642491142,50:20,fikile mbokodi,so we eat baffalo milk now
1565873647157921,50:25,Remembrance Chimeri,then they experience difficulties when his methodology was being interogated
1565873653859221,50:32,Norman Zwane,@Pastor J Turns out in SA we prefer cattle milk rather than buffalo.
1565873666658664,50:45,Pastor J.J,true
1565873667679703,50:46,Lourens De Jager,indian buffalo milk ? probably tastes like curry lol
1565873679348608,50:57,John Fagan,LOL
1565873708809291,51:27,KEITH SINDILE DINABANTU,@Vukile Martin Zupta cattle all dead now.... forget about milking
1565873737269343,51:55,Pastor J.J,@I Am Free All of us know that it was not the real reason they went there. Right?
1565873742906905,52:02,Madelein R,"Yes, the cattle starved - very sad"
1565873750388705,52:09,Mandla58,How long do they take to fix the sound
1565873753387452,52:12,Charlene Botha,"Wish they would ask question why India and not local , continuously creating jobs overseas, spending tax money in India and China, forgot about South Africans, our general knowledge far superior"
1565873806162677,53:05,KEITH SINDILE DINABANTU,"@Madelein Huxtable So said. Funny all dead before the eyes of Guptas, from India, where a cattle are treated with respect"
1565873807264224,53:06,Apexhost Pty Ltd,"Clueless witness, clueless evidence leader, clueless Commission. This time, the commission is not making sense..."
1565873811316760,53:09,Kabelo Katjedi,"He must sleep in a car,he wasted petrol for nothing.They should tell him where 2 buy kota 4 the night,no dinner for him."
1565873816983594,53:15,Madelein R,"@Charlene Botha , I really don't know. I also get very upset that they always has to go overseas and import things, if we can do it ourselves"
1565873860818342,53:59,carnoth ngomane,"@Charlene Botha i doubt there was a single job created even in India, i was just a scheme for looting in the name of job creation"
1565873867734661,54:07,KEITH SINDILE DINABANTU,@Charlene Botha lol. Guptas were your president....dictating where to go
1565873873931383,54:12,vas Michaelides,k.
1565873880566536,54:19,Kabelo Katjedi,"We gonna breach it ,they should bear that in mind"
1565873883410580,54:21,KEITH SINDILE DINABANTU,India and Dubai was the distination @Charlene Botha
1565873962237552,55:40,Kabelo Katjedi,I dnt wanna hear anything about electricity increase for 5 years or else i will use it 4 free.
1565873998520377,56:16,KEITH SINDILE DINABANTU,"@Madelein Huxtable Guess we should blame most, Zuma. He destroyed your nation!"
1565874110875125,58:09,Robert Russell,@I Am Free ....because Zuma stole the other 3%
1565874143619289,58:42,KEITH SINDILE DINABANTU,"Yes @I Am Free , GDP was so solid...and the economy was starting to leak jobs all over ... I respect Mr Mbeki from that end"
1565874177816358,59:16,Kapn Krunch,dont you guys get depressed thinking about all of this
1565874178908502,59:17,Steven Lindsey,please
1565874184151491,59:22,Kabelo Katjedi,"The whole ANC government caused us,its high time we do whats best for us and brings changes.Look now what free t shirts and free meal at Ellis park did 2 us"
1565874202969420,59:41,KEITH SINDILE DINABANTU,@I Am Free Zuma took the economy from 3.8% down to 0%
1565874206868852,59:46,KEITH SINDILE DINABANTU,Not a joke
1565874225320691,1:00:03,KEITH SINDILE DINABANTU,@I Am Free LOL
1565874242119408,1:00:21,John Fagan,Desk Top
1565874244252332,1:00:23,John Fagan,ok
1565874259799527,1:00:38,Robert Russell,Eish <30%
1565874264628733,1:00:43,fikile mbokodi,he did answer shame
1565874286731387,1:01:05,KEITH SINDILE DINABANTU,@I Am Free But Mbeki NEVER seem to have phuza thursday face like Ace and Bathabile
1565874390016238,1:02:48,Wanachi,just googles USA is the highest milk producer followed by India
1565874402739428,1:03:01,Tsepang R,Well he asked us to google so I did. The largest milk producer is the USA Mr Thabethe
1565874422893134,1:03:21,makhosi nobhatyi,This man is lying now they see an opportunity to channel millions in their own pocket
1565874425358227,1:03:23,KEITH SINDILE DINABANTU,@Jacob Zuma Family bread winners and graduates need jobs
1565874443738625,1:03:42,Kabelo Katjedi,"Whats the use of destroying our country while he cnt afford to pay his legal fees,Gupta's went home with all the money.He is just the rest of us.I AM free yah Moeletsi Mbeki is regarded as the best"
1565874471039554,1:04:09,KEITH SINDILE DINABANTU,"But South Africa has never ran out of milk, we one of the best in Africa on milk"
1565874471332501,1:04:09,SNOW PATR,jobs are dead
1565874472079794,1:04:10,fikile mbokodi,india is no 1
1565874523671374,1:05:02,Mbuso Ndlovu,@fikile mbokodi agree
1565874526504065,1:05:05,KEITH SINDILE DINABANTU,Don't we have our own milk in RSA? fARMS?
1565874531631993,1:05:10,M Mok,US is no 1
1565874532202647,1:05:10,Born free,India was closer than Switzerland and Germany
1565874534136624,1:05:12,Mbombi,highest milk producer in the world is
1565874540825483,1:05:18,BlitzKat,did malema loot vbs?
1565874559157925,1:05:37,Charlene Botha,"Carnoth, some of the Gupta family came to the farm, ran it...."
1565874585149433,1:06:04,Mbombi,1. USA (91.3 billion kilograms)2. India (60.6 billion kilograms) 3. China (35.7 billion kilograms) 4. Brazil (34.3 billion kilograms)5. Germany (31.1 billion kilograms)
1565874587826992,1:06:06,Kabelo Katjedi,This guy should be charged for lying 2 the commission
1565874629716030,1:06:47,BlitzKat,how dis not corruption?
1565874634965011,1:06:53,John Fagan,LIAR
1565874665219759,1:07:23,Ime Utuk,"According to the google search, USA is the highest milk producer in the world producing 91.3 billion kilograms. India is 2nd producing 60.6 billion kilograms"
1565874665260366,1:07:23,DJ DJ,wow this guy is worse than dumber and dumer
1565874667994816,1:07:26,John Fagan,you did not give the Farm to the Local Community
1565874742410138,1:08:40,Robert Russell,NPA to decide to prosecute Malema for On Point theft of R52m as well as discharging a rifle in public.... I hope they decide not to re-open the On Point case so that a private prosecution can happen
1565874754519637,1:08:52,fikile mbokodi,yah that is right usa
1565874770470675,1:09:09,KEITH SINDILE DINABANTU,"nO !!!! @John Fagan ...lol, you think Ace was playing around there. None, no one received even a jug of milk from that farm!"
1565874800520354,1:09:39,John Fagan,yeah Keith
1565874805827567,1:09:45,John Fagan,lol
1565874811785875,1:09:51,fikile mbokodi,2018 usa
1565874887764221,1:11:06,Lourens De Jager,the research died with the cows
1565874896973384,1:11:16,SA Fitness,SA WILL GROW
1565874902504947,1:11:20,Rangarirai Taruvinga,pls compare small holder dairy development as opposed to commercial dairy development
1565874951221182,1:12:09,makhosi nobhatyi,What is the difference between big and small dairies functionality mr Thabethe
1565874956554222,1:12:15,Rangarirai Taruvinga,look a Kenya model
1565874970097157,1:12:29,carnoth ngomane,"There was no desktop research, Paras was the principal vehicle for milking Free State"
1565875009319859,1:13:08,SA Fitness,LET THE BLACK FARMERS ARISE
1565875029929889,1:13:28,fikile mbokodi,yah she is digging in
1565875031722096,1:13:30,Anne M.,"@Thami Nobela Aren't those figures for beef, not dairy?"
1565875053346065,1:13:52,KEITH SINDILE DINABANTU,Jeez
1565875059935296,1:13:58,fikile mbokodi,tomorrow he will not come am telling you hahahaa
1565875077807046,1:14:16,Mbuso Ndlovu,This poor guy is in trouble
1565875088263303,1:14:27,DJ DJ,so id a small diary milk projects already failed why go large
1565875096071243,1:14:35,SA Fitness,YES WE ARE ALSO WATCHING @IAMFREE
1565875118078428,1:14:56,Jabu Nhlanhla,yes mbuso
1565875154458502,1:15:32,Blaze 613,lets talk about how the anc is milking this cowntry
1565875175432645,1:15:53,Charlene Botha,Here we go......In the corner....
1565875177779067,1:15:57,fikile mbokodi,tomorrow this witness wont come
1565875196555084,1:16:15,SA Fitness,FROM NEXT MONTH WE WILL BE WORKING WITH THE STATE INQUIRY ORG FOR LIVE STREAMING THE COMMISSION
1565875211482760,1:16:29,John Fagan,Hmmmm...where were they going to get the milk ..hmm
1565875223679312,1:16:41,makhosi nobhatyi,It is hot ðŸ¥µ here now
1565875236006503,1:16:55,Robert Russell,ANC spin doctor
1565875238245398,1:16:57,Mbuso Ndlovu,Don't worry Fikile Bheki Cele will collect him if he runs away
1565875251959471,1:17:10,SA Fitness,YES CIC MALEMA IS WATCHING'
1565875254052866,1:17:12,fikile mbokodi,hahaaha cele is here
1565875268746449,1:17:27,Rangarirai Taruvinga,small scale farmers would keep a few milking cows and sell their surplus milk to a buyer.
1565875275923089,1:17:34,Anne M.,@Hosia Modiga Former head of Free State Agriculture Dept
1565875294447857,1:17:53,Lourens De Jager,"he looks thirsty, give him some curry buffalo milk"
1565875333814770,1:18:32,Rangarirai Taruvinga,a milk collection system can be put in place to collect all the surplus milk and take it to a factory for processing
1565875344015244,1:18:43,Mbuso Ndlovu,Why Zondo is not laughing
1565875363273103,1:19:01,Michael Moeketsi Sello,Iâ€™m sorry to say this: this is cross-examination not giving his side of his opinion
1565875367701365,1:19:06,fikile mbokodi,because the witness is laying hahaaha
1565875378111475,1:19:17,Mbuso Ndlovu,Are Judges not allowed to laugh
1565875416610120,1:19:55,Anne M.,@Michael Moeketsi Sello He was implicated by a previous witness. I think the questioning is a bit different under those circumstances.
1565875465398490,1:20:43,DJ DJ,D for Dum
1565875470220530,1:20:48,Cerebis,D for Dummy
1565875487867568,1:21:06,fikile mbokodi,D for denvour
1565875488627634,1:21:07,Isaskar Nghidepo,lol
1565875517818812,1:21:36,Cerebis,Thick file.....lots of travelling??
1565875526281210,1:21:45,Isaskar Nghidepo,"Fikile, are you related to Mbalula?"
1565875534772306,1:21:53,Michael Moeketsi Sello,@Anne M I really understand you but my problem is the way how do they put questions on this man.
1565875541427555,1:22:00,fikile mbokodi,yes bhuti i am
1565875558180540,1:22:17,Charlene Botha,That seat slowly but surely getting Sizzling HOT.....
1565875587168153,1:22:46,TG Swartlane,"hhahahahah, gotchaaa"
1565875597934946,1:22:56,fikile mbokodi,greetings to you my brother how are you
1565875602158607,1:23:01,Thabo Mzamani,I just tuned in - who is this person testifying?
1565875611100839,1:23:09,Mbombi,I'm worried about the news Channels they are not showing evidence live but why
1565875632478398,1:23:30,Isaskar Nghidepo,cool cool my people
1565875644232822,1:23:42,Cerebis,"I love Namibia. Very balanced country that got over it's bad past and only look forward,"
1565875660408648,1:23:58,PeterPete,Kettles make milk?
1565875663547912,1:24:02,Isaskar Nghidepo,Will visit Cape Town soon
1565875699160256,1:24:37,fikile mbokodi,okay welcome to south africa
1565875709144200,1:24:47,Thabo Mzamani,Hosia Modiga and the name?
1565875720715093,1:24:59,Born free,Oh Cry Thy Beloved Country For You Have Been MILKED
1565875766235240,1:25:44,John Fagan,EISHHHHHHHHHHHHH
1565875769366928,1:25:47,Brennan Fredericks,eish eish
1565875775339397,1:25:53,fikile mbokodi,this guy
1565875780490827,1:25:58,Cerebis,Hehehehe
1565875788313574,1:26:07,Thandeka Phakathi,dairy farm not a buffalo farm lol
1565875792079518,1:26:10,Mthuthuzeli Ntlanyana,donkey milk
1565875795645073,1:26:14,Isaskar Nghidepo,"greetings to Mbalula, I like his stance on SA politics"
1565875809747043,1:26:28,Tsepang R,Crying over spilled milk lol
1565875824874961,1:26:43,Brennan Fredericks,wow
1565875825295084,1:26:43,fikile mbokodi,please like it its a nice country
1565875827024948,1:26:45,Brennan Fredericks,wow
1565875833305260,1:26:52,Born free,Goat milk is yucky
1565875844649615,1:27:03,Lourens De Jager,you can milk a snake aswel .
1565875845678806,1:27:04,Brennan Fredericks,i dont know
1565875849842876,1:27:08,Cerebis,I will not try to milk a buffalo....
1565875869427679,1:27:27,Brennan Fredericks,wowowow
1565875870298489,1:27:28,Anne M.,@Thabo Mzamani PeterMbana Thabethe
1565875871288964,1:27:29,fikile mbokodi,you do it now
1565875884784603,1:27:44,TG Swartlane,"he banna, Narayana"
1565875895330298,1:27:53,Motsamai Mokoena,ayeye
1565875900487440,1:27:58,Christy,At this moment he knew he f!cked up
1565875907793655,1:28:05,Remembrance Chimeri,Yes #Zondo
1565875908884761,1:28:06,fikile mbokodi,yah please answer
1565875914164018,1:28:12,TG Swartlane,Magashule
1565875914651000,1:28:12,fikile mbokodi,woow
1565875919208406,1:28:17,Kamogelo Goitseene Molotsi,Narayana Ke Mang Chief?
1565875920761923,1:28:19,M Mok,Done
1565875921967379,1:28:20,Born free,"Breast milk is sweet and much more beneficial, cheaper than powdered milk or cows milk"
1565875922655379,1:28:21,Thabo Mzamani,Thanks @Anne M.
1565875927865342,1:28:26,Cerebis,Zwane
1565875948377731,1:28:46,John Fagan,yip
1565875951477725,1:28:50,fikile mbokodi,h is afraid of zwane
1565875953687669,1:28:52,John Fagan,Zwane
1565875964864910,1:29:02,John Fagan,Yip he is
1565875976159612,1:29:15,Buyiswa Mnyani,we are burying this father this sunday
1565875977252960,1:29:17,Brennan Fredericks,defaq
1565875977991121,1:29:17,fozia safodien,hi
1565875983646934,1:29:21,Cerebis,Protocol....nonsense
1565875986455994,1:29:26,Brennan Fredericks,protocol
1565875995343637,1:29:33,Brennan Fredericks,lol
1565875997432375,1:29:35,DJ DJ,protocol for what a visa
1565876008674291,1:29:46,Brennan Fredericks,can he just speak the truth
1565876009296404,1:29:47,M Mok,done
1565876010453078,1:29:48,carnoth ngomane,Ace protocol
1565876011055216,1:29:49,John Fagan,LIAR
1565876013590867,1:29:51,Charlene Botha,Here we go....Lol....Zwane
1565876017596667,1:29:56,Lourens De Jager,called a holiday
1565876020990811,1:29:59,Robert Russell,Protocol........ they steal as much as the ANC..... so where is the problem
1565876021993456,1:30:00,Brennan Fredericks,it would be so much easier
1565876027709463,1:30:06,fikile mbokodi,please speak the truth pleaase
1565876033410522,1:30:12,fikile mbokodi,please man
1565876034710465,1:30:13,SNENHLANHLA VILAKAZI,wow...I swear I would just speak the truth here
1565876051138673,1:30:29,John Fagan,YEAH I agree Fikile
1565876051856178,1:30:29,Buyiswa Mnyani,does MP attend to the meetings chaired by Zwane and Faith?
1565876068323282,1:30:46,Thabo Mzamani,The former FS Premier had his own protocol. Lol!!
1565876071266518,1:30:49,Jeffrey ramasunga,ðŸ˜‚ðŸ˜€ðŸ˜‚ðŸ˜‚ðŸ˜‚ðŸ˜‚ðŸ˜‚ðŸ˜‚ðŸ˜‚ðŸ˜‚
1565876072459154,1:30:51,Samuel Mompati,This Thabethe is lying with a straight face
1565876079285262,1:30:57,Christy,That dead silence
1565876079440757,1:30:57,fikile mbokodi,hahahahaah
1565876084178580,1:31:02,Buyiswa Mnyani,I meant do any of the MPs
1565876088618889,1:31:07,Mbuso Ndlovu,Jonh are you related to John Legend?
1565876103818034,1:31:22,John Fagan,LOL who me
1565876115667635,1:31:34,fikile mbokodi,did you see him guys yoooh this is deep am telling you
1565876115808078,1:31:34,Wiliam Mnguni,Lol..Protocol ntate
1565876158322493,1:32:16,John Fagan,Hello Mbuso
1565876159899832,1:32:18,Motsamai Mokoena,more lies
1565876167799285,1:32:25,Mkabayi kaSenzangakhona,I'm just waiting for this guy to say he was never in Free State... it's coming soon.
1565876175940407,1:32:34,Thabo Mzamani,Thabethe has agreed to come to the commission but he is not willing to tell the whole truth as it seem to me. Of kanjani?
1565876181085259,1:32:40,Brennan Fredericks,tuyre
1565876184659953,1:32:44,Brennan Fredericks,true
1565876197519707,1:32:55,Christy,I want this travel protocol as well to take anyone to a business trip
1565876212200547,1:33:11,Mbombi,"cumon Mr Thabethe you can do better than this,,, ðŸ˜"
1565876219046339,1:33:17,fikile mbokodi,woow this guy
1565876231947523,1:33:30,John Fagan,Yeahhhhhhhhhhhhhhh
1565876247486016,1:33:46,Mbuso Ndlovu,This guy is did poor
1565876249771900,1:33:49,Anne M.,Mkabayi kaSenzangakhona ðŸ˜‚
1565876255169191,1:33:53,Christy,1/10 for his quality of lying
1565876264880969,1:34:03,John Fagan,LOL
1565876270231663,1:34:09,TG Swartlane,"@Naomi Motshwari hehehehehhhehh, sorry only next week, not today mam"
1565876272121576,1:34:11,John Fagan,JAIL THEM
1565876274801159,1:34:13,Louis Niemand,remember he is under oath and he still lie just show to the character of the man
1565876292319383,1:34:30,fikile mbokodi,am dead with laughester
1565876292976522,1:34:31,John Fagan,indeed
1565876303832590,1:34:42,Christy,IF LYING HAD A FACE
1565876305351957,1:34:43,Pastor J.J,Shem.The SABC sound guy can only count to 2
1565876306237771,1:34:44,Michael Moeketsi Sello,"But Mr. Thabethe just he can comment, but they still questioning him about what he donâ€™t know about as he gave them the answer: itâ€™s a protocol"
1565876312075532,1:34:50,Cerebis,This guy needs some of the Commision water....like zuma?
1565876315800608,1:34:54,fikile mbokodi,this guy is funny
1565876323745184,1:35:02,M Mok,done
1565876341729348,1:35:20,SNENHLANHLA VILAKAZI,I feel sad for him now
1565876343431353,1:35:21,fikile mbokodi,laugh bhuti
1565876345668041,1:35:24,Dominic Przybylski,What is this man employed to do? He seems to have no competence at all.
1565876348431432,1:35:26,SNENHLANHLA VILAKAZI,ðŸ˜­
1565876368194763,1:35:47,fikile mbokodi,when is zwane coming here
1565876369438137,1:35:48,Nelson Musoliwa,What was happening in Free State Vrede dairy farm is pure criminal activities in the name of govt by Ace and agric officials
1565876370027102,1:35:48,Motsamai Mokoena,WOW!!!
1565876376345986,1:35:54,barbara broadbent,Why does the chairman keep reiterating what she is saying?
1565876377390717,1:35:55,Tito 2000,Woow before he was even appointed
1565876384460013,1:36:02,Christy,Yoh this oke should've came with his legal representative
