timestamp,time,author,message
1557130114929598,-0:19,Madelein R,They have started according to Twitter
1557130190008726,0:42,The Truth,Eish SABC and their sound issues!
1557130225851211,1:18,The Truth,You would have thought by now they know how to get it working 100%
1557130233912946,1:27,Madelein R,😂😂
1557130662326160,8:35,Magda Seguin,Polo Molefe testifying today.
1557130713205147,9:26,Magda Seguin,"Brian Molefe again on the agenda,as will be Gama"
1557130793188274,10:46,The Truth,How's every1 today? Are we expecting explosives here? lol
1557130818823725,11:11,babette fagan,My sound super
1557130844641334,11:37,The Truth,Yes is gud now
1557130848470845,11:41,Norman Zwane,"@The Truth Not 'explosive', we are in for the 'long haul' today."
1557130875856156,12:08,The Truth,@Norman Zwane haha... nice one
1557130979710608,13:52,Norman Zwane,Why can't I take my eyes off Miss September today?
1557131033647979,14:46,The Truth,Hai Normz... she looks like she has a babalas vandag...
1557131054132916,15:06,Magda Seguin,*Popo Molefe
1557131063124890,15:15,The Truth,I miss Adv Molefe
1557131115295515,16:08,Sihle Arthur,Vote EFF.. jail the corrupt
1557131140259494,16:33,Deadbeat Cousin,"Is it pronounced as Prima Facie or Prima Facie, I've always said Prima Facie, now Mr Pretorius is saying Prima Facie. I mean is Prima Facie correct or Prima Facie?"
1557131166148628,16:59,Norman Zwane,"Pity she's left handed, I have a thing against left handed baes.@The Truth she looks like the weekend in slow motion. Hope she survives the babalaas."
1557131179505467,17:12,Magda Seguin,CNR received over a billion they have not paid back yet
1557131208598291,17:41,Granny Mokwena,"some of my reasons for not voting the ANC! The blatant looting if taxes is unforgivable, but the fact that no one is in jail for it is painful. i can't"
1557131237968835,18:10,Norman Zwane,@Deadbeat Cousin all those are wrong including Mr Pretorius' model C attempt.
1557131259837598,18:32,Deadbeat Cousin,Hahaha 😂😂😂😂
1557131275285446,18:48,The Truth,@Norman Zwane 😂😂 I'm sure she'll survive. Watch her turn into your babe once she puts on her glasses
1557131301230574,19:14,Sihle Arthur,True Granny Mokwena. Vote EFF vote for Education
1557131422233849,21:15,Norman Zwane,@The Truth To be fair my bae was Nomgcobo Jiba until CupCake Cyril sacked her. I wont me be seen hanging around with lawyers who are improper and unfit persons. I have my pride too.
1557131541713801,23:15,kleophas max,blf is for us.....the others are already on the train.....and mean/doing nothing for the landless......
1557131542195521,23:15,makhosi nobhatyi,Does transnet will tell us who hire Gama? Wat procedures were followed?
1557131544329292,23:17,The Truth,"@Norman Zwane Agrizzi's snake??🙆 Recipe for a ""toxic"" relationship lol. Try the new Adv Batohi"
1557131556097009,23:28,Born free,Prepare for a dark winter folks. China has withdrawn its down payment of R7 billion
1557131626714844,24:40,Sihle Arthur,"ANC and White privilege is one thing.. they all enjoy ear-conditioners while food ,petrol, water and other prices go high and voters fail to afford. Vote EFF"
1557131664982732,25:17,Michael Michael,morning
1557131689805515,25:42,Born free,China has withdrawn its down payment of R7 billion to Eskom to build two power stations. The kian total R33 billion. China is not convinced this money will be spent on the Power Stations.
1557131749504362,26:42,Thami Ngwenya,We know to vote for now
1557131761295687,26:54,Michael Michael,Mr Maleka still here?
1557131763689690,26:56,Born free,Dark times ahead.. load shedding day in and day out 😔
1557131772959729,27:05,Mac Mandla,@val Speirs i hear China has now gotten the surety that the 7 billion will be used on power stations khusile and medupi not on salariea
1557131806287084,27:39,The Truth,@psyfrequency Techno yeah yeah yeah... boring... we've had that sooo many times before. Just go fvote for whoever you want tuu
1557131842182767,28:15,Magda Seguin,McKinley is also involved
1557131856146178,28:29,Magda Seguin,*McKinsey
1557131865727251,28:38,Robert Russell,@Val Speirs ...when the lights are switched off at the voting stations.... so will the countries lights be switched off
1557131875891568,28:49,Sihle Arthur,psyfrequency techno if you count EFF on your pit toilets.. you're being 100% stupid
1557131902034836,29:15,Born free,Guarantees and assurances have not been honoured in the past as per this Commission of Enquiry into State Capture
1557131921417622,29:34,Thinashaka Ramaleba,vote for ANC not overnight parties
1557131935485206,29:48,Khaya Nomoyi,"Ndidikiwe yileCommission finish and klaar. They have evidence, why not take other matters straight to the Commercial Crimes Court for prosecution and not bring them to this snail pace commission."
1557131957218484,30:10,Born free,Malema has promised everything for free but he doesn't say where the money is coming from.
1557131966906544,30:19,Sihle Arthur,let China withdraw their investment we will take our sardine
1557131996022967,30:48,MIKE DURBAN,The EFF will destroy you......
1557131997441066,30:50,Thinashaka Ramaleba,My ANC never failed me only individuals
1557132037321679,31:30,MIKE DURBAN,Never be Married to Any party....facts
1557132041957240,31:34,The Truth,"@Thinashaka Ramaleba leave all these ppl make useless noise. 9th May, ANC will have 60% or more. End of Story"
1557132062887328,31:55,Sihle Arthur,no truth that hurts here you DA puppet. Seek the Vision of the EFF and stop uttering nonsense
1557132067897971,32:01,Magda Seguin,Exactly Judge
1557132069671753,32:02,Cassius Mngomezulu,#Thinashaka Ramaleba​My ANC never failed me only individuals-THANK YOU VERY MUCH
1557132080494041,32:13,MIKE DURBAN,easy too control poor folks....true
1557132080690804,32:13,Thinashaka Ramaleba,Eff young people who gonna destroyed what the ANC have done so far
1557132127649287,33:01,MIKE DURBAN,Too true........
1557132132747330,33:05,Magda Seguin,The Gupta looters were everywhere
1557132180078067,33:53,Born free,The DA is more honest can't promise everything for nothing . DA are realistic and a party that represents all South Africans.
1557132216721214,34:29,Magda Seguin,Waiting to hear what judgement will be delivered today in the Karima Brown /EFF High Court case
1557132230524510,34:43,MIKE DURBAN,Forget the ANC/EFF...they are doomed folks.....
1557132255827080,35:08,The Truth,@Val Speirs DA more honest??? What? Why r they using black ppl to front their political agenda? Didn't see Zille or Tony Lion at the Rally in Soweto on Saturday
1557132290051474,35:43,Sihle Arthur,how can we build to destroy? you are so afraid of change to a point that you think the EFF will destroy. we would have destroy it long time ago if we wanted to don't tell us of destroying
1557132297143452,35:50,MIKE DURBAN,DA are the Lessor of ALL the Evils...think
1557132334316420,36:27,Born free,The only performance I have seen by the ANC.. is looting State Entities.
1557132346981322,36:40,kleophas max,DA...is a window dressing.....had no respect for the dead
1557132353158181,36:46,Robert Russell,@Magda Seguin .... me too... but guess the race card will be played should the WHITE AFRIKAANS judge find against the EFF and Malenema
1557132376506969,37:10,Magda Seguin,EFF is deeply involved in corruption by WhattsApp evidence of Floyd and his ex ANCYL pal at PIC
1557132387953587,37:20,Sihle Arthur,Val Speirs Don't fool yourself DA is for whites in south africa not for all people stop giving us false information
1557132413509418,37:46,The Truth,"@MIKE LOCK could be true, but Devil is still a Devil. In the end, every1 just needs to vote for whoever suits them. Trying to convince others about your party will open can of worms"
1557132417398237,37:50,Norman Zwane,@Val Speirs Definitely not DA for me @Thinashaka Ramaleba Not ANC ever again for me. Still don't think the EFF either.
1557132441577327,38:14,Born free,ANC has abused its power of governance and is in breach of its statutory duties to this country.
1557132516376906,39:30,The Truth,"EFF, COPE, AGANG, UDM, ACDP are all ex ANC, who carry ANC DNA and politics. Voting for any of them is no different for voting for ANC"
1557132520853600,39:34,Sihle Arthur,That why our CIC asked for a proof yesterday that link the EFF with the VBS
1557132531140753,39:44,Norman Zwane,"@psyfrequency Techno Your ""esidemeny"" just proves the point you sought to deny; the DA is white but Black for convenience."
1557132547129438,39:59,Magda Seguin,"The race card is all people have,clean governance by the DA as per the AG reports is overlooked by ANC/EFF followers,they have nothing to base their arguments on,only populism"
1557132549893104,40:02,Tommy Adkins,Vote VF+
1557132590586860,40:43,Norman Zwane,Did you guys see that blond? I'll vote for her anyday.
1557132607782776,41:01,ntsebeng Rakauoane,DA?
1557132617066172,41:10,MIKE DURBAN,@The Truth ....The ANC/EFF have Commie ideologies ........this is a fact.
1557132624462545,41:17,Tommy Adkins,ANC = Absolutely No Current
1557132641196989,41:34,Tommy Adkins,EFF = Everything For Free
1557132644207594,41:37,Magda Seguin,@Sihle Arthur the proof is there in WhattsApp activity wait and see the outcome of Floyd millions by VBS
1557132656582346,41:50,Thinashaka Ramaleba,VBS proof for your CIC will come out very soon just relax
1557132668666045,42:01,Mfundiso Mbhele,"All of these parties are corrupt...liers,selfish and greedy morons who cares less of the voters"
1557132674687264,42:07,Born free,They are communist parties
1557132699596976,42:32,Tommy Adkins,"A commander in Chief is a president, Julius is not the president and never will be]"
1557132724255832,42:57,Magda Seguin,"Floyd lives in Bryanston and Malema in Hyde Park,they lie to the poor and make promises they know they can't keep"
1557132729639079,43:02,Norman Zwane,"@MIKE LOCK Yeah they do you right, but they like play play commies. DA has Obama speak all clothed in racism."
1557132754438614,43:27,MIKE DURBAN,We don't want/need Commies in our country.....facts
1557132774084850,43:46,Magda Seguin,They promise to double grants payments yet it comes more than the Eskom debt...they have no sense of economics
1557132789715135,44:02,Tommy Adkins,Communism is poison to society
1557132817495260,44:30,Sihle Arthur,psyfrequency Techno. what light? white privilege light? come on
1557132818942066,44:31,Mfundiso Mbhele,All these political parties are useless to the people
1557132845352003,44:58,Magda Seguin,"Communism oppresses just look at Russia,North Korea and China"
1557132848550595,45:01,Norman Zwane,@Thando Nkutha Cast your eye to the left of Pretorius and you'll be praying to your gods he does not finish. She's hot!!!
1557132851088121,45:04,The Truth,Is Mr Molefe to be trusted?
1557132854198115,45:07,Born free,Zuma is so dumb he still doesn't know that he was captured by the Guptas and Watson. He was out there campaigning with State Gangster Ace. They have no guilt about their involvement in State capture
1557132868336627,45:21,makhosi nobhatyi,I assume there is no witness today
1557132918042254,46:11,Magda Seguin,"Yes there us a witness,Popo Molefe"
1557132952815000,46:46,Magda Seguin,Mr Pretorious is busy with the introduction only
1557132958861722,46:51,makhosi nobhatyi,@Val speirs I think only one way or another he can know just arrest him
1557132960390539,46:53,Tommy Adkins,"Under white rule the state was not looted, under black rule it took 25 years to destroy what it took whites to build for almost 400years"
1557132988106495,47:21,Thinashaka Ramaleba,popo molefe is going to testify today wait
1557132989774644,47:22,welton paulse,Jirr that Brian Molefe is a liar
1557133003314087,47:36,MIKE DURBAN,@Tommy Adkins ...could't have put it any better.....
1557133018527918,47:51,Magda Seguin,Salim Essa..a Gupta lieutenant
1557133038559613,48:11,makhosi nobhatyi,This is where it all started to loot state money and control executives
1557133047376015,48:20,Tommy Adkins,"Thanks Mike, its the pulse of a volk, and the will of a nation to restore SA to glory"
1557133063753655,48:37,Zola Pinda,Dr. Popo Molefe is the current Chairman of the board. He's a very honorable person.
1557133074120007,48:47,MIKE DURBAN,As it WAS BEFORE.......
1557133080070872,48:53,The Truth,@Thando Nkutha so true. We need Whistle blowers. Chairmen and CEO's r just going to spin a story to us
1557133084022258,48:56,Tommy Adkins,Exactly!
1557133087782507,49:00,Norman Zwane,"@Thando Nkutha It's the trains today Nkutha, they'll be plenty whistle my friend. If you remember trains run on a schedule. wait. Feast your eyes on the three...not the brother at the end though."
1557133100263936,49:13,Magda Seguin,@Zola Pinda agree
1557133115780246,49:28,The Truth,@Norman Zwane hahaha!!!
1557133121020203,49:34,Born free,Yes and I am suffering as a result of the ANC corruption
1557133142397830,49:55,Sihle Arthur,@psyfrequency Techno. it been only 25 years of freedom from your white privilege rulers and we have developed don't you see that?
1557133159157051,50:11,The Truth,@Val Speirs go ask your fathers why are you suffering
1557133161812944,50:15,Tommy Adkins,"Everybody is suffering because of the ANC rule, they never had control"
1557133201009551,50:54,Born free,The entire country is suffering because of the ANC Corruption.
1557133208800501,51:01,Tommy Adkins,@Sihle Arthur Are you blind?
1557133216519575,51:09,Norman Zwane,@Thando Nkutha I bet she has pins to die for. How much you betting Nkutha? with my luck she may just push back on a wheel chair.
1557133228341961,51:21,PETER STAFFEN,Tommy Adkins​ and you will carry on suffering after the election if the ANC wins
1557133247134737,51:40,funicanz,"@Norman Zwane , 😆"
1557133256750517,51:49,Tommy Adkins,@Peter Staffen Unfortunately its true
1557133275059361,52:08,Lazarus Letsoalo,@ Tommy Go read a book by Hennie van Vuuren Apartheid guns and money. it might assist in changing your views
1557133320644299,52:53,makhosi nobhatyi,"Poor Miss was bluntly used to enrich some individuals and herself, all she had to do to speak the truth who send her to act in a way she acted"
1557133328144363,53:01,Norman Zwane,"@Val Speirs You just have a babalaas, nothing to do with the ANC. Give up cheap liquor. Tipple on something decent."
1557133334683565,53:07,Magda Seguin,"My only fear is the behind the scenes scheming of the Zuma faction,those looters are hard criminals"
1557133344234705,53:17,Tommy Adkins,"@ Lazarus Letsoalo I dont need to be lectured pup, you were not even a thought when I was fighting to save apartheid"
1557133376816184,53:50,Tommy Adkins,"Nothing wrong with Apartheid, only wrongful lies in the media coverage"
1557133421890429,54:34,The Truth,"@Norman Zwane true hey @Val Speirs just needs to go ask his forefathers why we are suffering. They know the truth... if they love him, they'll tell him"
1557133426606727,54:39,Magda Seguin,"Apartheid was a crime against humanity,please don't be apologists for oppression no matter where it comes from"
1557133450125482,55:03,carnoth ngomane,"@Tommy Adkins are you for real, anyway for whites nothing was wrong with apartheid"
1557133494538833,55:47,Tommy Adkins,"@carnoth ngomane I am always serious and never lie, unlike your Malema"
1557133502287421,55:55,Born free,Forefathers are dead and gone trust you own judgement while you are on this earth.
1557133514648397,56:07,Norman Zwane,"@The Truth I know for a fact @Val Speirs he has, only problem they are four fathers"
1557133524052451,56:16,Tommy Adkins,The ANC gutted the government
1557133536810862,56:29,carnoth ngomane,@Tommy Adkins has Malema ever lie to yuo
1557133551843033,56:45,Sihle Arthur,Go to your land and be truthful there not in our own expense
1557133553381735,56:46,Tommy Adkins,"Yes, we dont pray to our forfathers"
1557133553728949,56:46,MIKE DURBAN,and Who built this wonderful country......think
1557133578715371,57:11,makhosi nobhatyi,Ramaphosa will win this election with convincingly victory 16 Million will vote for ANC
1557133585667250,57:18,Cassius Mngomezulu,Julius is sponsor by a cigarette smuggler
1557133591195408,57:24,Blue moon Spring,Where is Anoi Sing from Eskom? Just disappeared under a rock.
1557133611437536,57:44,The Truth,@Norman Zwane True. So why is @Val Speirs acting so ignorant towards the truth? Living a lie is shame...
1557133619458893,57:53,Sihle Arthur,Vote EFF.. let Away with DA and their racist followers
1557133652543358,58:25,Gareth Morgan,is anyone ever going to go to jail or will we and them all die of old age
1557133669267261,58:42,PETER STAFFEN,Sihle Arthur what i cannot understand your own people are racists
1557133694657421,59:07,The Vuka Experience,Did someone just say “vote VF+”?
1557133733887495,59:46,Tommy Adkins,"Most blacks are refugees from Zimbabwe, and now they want to claim land. Hypocritical"
1557133743207270,59:56,The Truth,@Gareth Morgan That will be the big test for the ANC post 8May when they win with +60%. We want to see who goes to jail
1557133769830575,1:00:22,Norman Zwane,@The Truth Them 4 fathers of @Val Speirs dont tell the poor guy the same thing thats what. Being Afrikaans hy't gedink die 4 forefathers was vier van hulle soos in sy belowe vierkleur.
1557133774178968,1:00:27,Magda Seguin,"@Cassius Mngomezulu the new SARS boss is going after them.A SARS employee was spying for 3 entities including BAT,she received payment though a London bank account."
1557133779558362,1:00:32,Sihle Arthur,@Peter Staffen. we were educated by your fathers when pulling that card
1557133779624835,1:00:32,Born free,"They also come from Nigeria, Malawi, Mozambique"
1557133798426923,1:00:51,David David,"McKenzie and Trillian pop up again, they've been popping up everywhere around the discussion on state capture"
1557133806846015,1:00:59,Lew464,"Tommy Adkins , Millions came to SA during apartheid era. You wonder why?"
1557133811738277,1:01:04,Tommy Adkins,"@Val Speirs Yes, there too"
1557133813626525,1:01:06,PETER STAFFEN,Sihle Arthur i doubt it
1557133820171299,1:01:12,Born free,Actually I am not Afrikaans
1557133833958804,1:01:26,Magda Seguin,@King Vuka...same WhatsApp group as BLF
1557133838683869,1:01:31,carnoth ngomane,@Val Speirs at least they are Africans not Europeans
1557133841615188,1:01:34,The Truth,"@Norman Zwane What a total shame... the poor guy is now living either an ignorant life, or misinformed one"
1557133874206314,1:02:07,Tommy Adkins,"@Lew464 Because everything worked during apartheid and whites looked after the blacks, they decided to throw out the schools windows"
1557133881843729,1:02:14,Born free,I am really Lucy Khoisan
1557133918927601,1:02:51,Norman Zwane,@Val Speirs Maybe one of the 4 fathers was not Afrikaans; maak net sekeer met die ander klomp vaders.
1557133922752410,1:02:55,Magda Seguin,"@Tommy Adkins people were systematically killed,you are treading on dangerous ground"
1557133954369943,1:03:27,Born free,All those that are citizens of this country belong here whatever colour you are.
1557133966226142,1:03:39,MIKE DURBAN,Well..the Commies will vote for them...'cause they Want everything for Free..........
1557133972819097,1:03:45,Tommy Adkins,"Vote ANC, through all your dreams down the drain and link it to a sinking ship"
1557133983331214,1:03:56,Tommy Adkins,@Magda Seguin Thats a lie
1557133985094953,1:03:57,Magda Seguin,Condoning apartheid is really not on
1557134007690540,1:04:20,Born free,The Titanic the lights will soon go off
1557134025189085,1:04:38,Tommy Adkins,"@Magda Seguin Nothing wrong with apartheid, just people who struggle to live by rules"
1557134026571056,1:04:39,Magda Seguin,Really? So where is my brother buried?At Vlakplaas maybe?
1557134079013746,1:05:31,Afr24News Channel,"BLF was made by Zuma to intimidate white people to scared them on his case as whites rob land before Zuma rob those billions of Rand he then formed ""Black Land First"" to fool you."
1557134085311503,1:05:38,Magda Seguin,Bye @Tommy Adkins it is people like you that perpetuate racism
1557134087219334,1:05:40,carnoth ngomane,@Tommy Adkins you mean barbaric and inhuman rule
1557134099192652,1:05:52,Ahan,hi
1557134104020777,1:05:56,Tommy Adkins,"If they were killed, why is the blacks numbers still at record nubers?"
1557134115312194,1:06:08,MIKE DURBAN,Ummmmm....Apartheid was really separate development...........not condoning it etc...but true...
1557134133365557,1:06:26,Sihle Arthur,it not on like serious @Magda Seguin these whites do not know their wrongful deeds and their privilege here in South Africa. if you do not believe me go to Orania
1557134137564845,1:06:30,Norman Zwane,@Thando Nkutha Downright disgusting. Worse zange baze badle nathi.
1557134144847301,1:06:37,Neville Watson,This got nothing to do with colour of skin but plain criminals and incompetent cadres working under the watch of the ANC and Cyril was the second in command and he did nothing he wants to protect
1557134146288925,1:06:39,Magda Seguin,Block the racists on both sides
1557134181344273,1:07:14,Tommy Adkins,@Jacob Zuma Rubbish has joined the room
1557134183211804,1:07:16,Norman Zwane,@MIKE LOCK I think you are race baiting
1557134211741943,1:07:44,Magda Seguin,It is the white racists who will make me think twice of going back to SA
1557134220528664,1:07:53,Norman Zwane,"Cheers, cant stand the smell now."
1557134221314587,1:07:54,Sihle Arthur,Vote EFF
1557134232704033,1:08:05,Tommy Adkins,Bring back the vierkleur as the national flag
1557134262898560,1:08:35,MIKE DURBAN,eers Norman
1557134289304537,1:09:02,Magda Seguin,I have come to understand the deep pain and anger if my people but the previous privileged have no excuse
1557134290216860,1:09:03,Sihle Arthur,hamba uye ezweni lakho uyolbuysela khona umhlaba kaZulu lo
1557134292882563,1:09:05,MIKE DURBAN,Oops...Cheers Norman....
1557134311128628,1:09:23,Tommy Adkins,"SA needs the death penalty to come back, and a crime that would result in hanging should be voting ANC, EFF and BLF"
1557134316660038,1:09:29,Afr24News Channel,"Then we so fools following BLF ""Black Land First"" why he didn't give land during his rule? Voting the ANC you will muchine wami wa kaZuma to hack state ATM even more"
1557134378852681,1:10:31,Sihle Arthur,vote EFF
1557134392912481,1:10:46,Tommy Adkins,Vote VF+
1557134401844368,1:10:54,Afr24News Channel,Vote the EFF the truth organisation
1557134403089413,1:10:55,Norman Zwane,"To the left of Pretorius hot, hotter, hottest"
1557134433040708,1:11:25,Born free,we will allow Julius Malema to sort the ANC out 😂😂in Parliament. He really has it in for Zuma and Cyril
1557134434240390,1:11:26,The Truth,@Norman Zwane And to his right too!! lol
1557134522891781,1:12:55,Sihle Arthur,VOTE EFF. VOTE EFF..
1557134557810369,1:13:30,Xgratia,DA or Bust 😎
1557134558602331,1:13:31,Born free,Jacob if you don't have the VBS money then Julius must have it.
1557134561182381,1:13:33,Afr24News Channel,ACE tells supporters lets not make the ANC for money after gangsta state!! people lulululu!!! are you agree with him?
1557134583872154,1:13:56,david jacobs,Ace not done by a long shot
1557134593636161,1:14:06,Sihle Arthur,WE DO NOT CARE ABOUT WHITE AND BLACK ALL ARE EQUAL IN THE FACE OF LAW VOTE EFF
1557134594770850,1:14:07,Danie Nilsen,amandla DA amandla
1557134602263904,1:14:15,Norman Zwane,"@The Truth Is more like the lone black piano key to the right, more between hotter and hottest or hottinyana in Bathabile speak."
1557134608926767,1:14:21,Tommy Adkins,Bring back Apartheid and all will be well again.
1557134668930142,1:15:21,The Truth,"@Jacob Zuma what r u trying to say? That the black majority who are voting for ANC r fools, u subsonic racist! This is about trust, simple. All politicians r liars, & they steal. It's a global fact"
1557134691646753,1:15:43,Danie Nilsen,@Sihle Arthur you must stope smoking flaffa it makes you mad
1557134696958696,1:15:49,Sihle Arthur,@TOMMYADKINS go to Orania and you'll find apartheid
1557134698122614,1:15:51,The Truth,@Norman Zwane 🤣🤣🤣
1557134722914740,1:16:15,Norman Zwane,@Danie Nilsen Amandla at Meadowlands stadium? Even Banyana no longer play there. amandla se voet man!!
1557134730565575,1:16:23,Tommy Adkins,"Orania is the only town in SA where there is no crime, whats your point?"
1557134763648735,1:16:56,Sihle Arthur,@Denie Nilsen. as my doctor what do you prefer for smoking?
1557134771631460,1:17:04,Born free,Jacob.. what's wrong with you? I see you and Ace are starting your own party the ATM does that mean Automatic Transfer Machine.. like transferring all state funds to your accounts or what?
1557134796494995,1:17:29,Sihle Arthur,VOTE EFF
1557134801003772,1:17:33,Tommy Adkins,Thats why you must vote VF+
1557134806336754,1:17:39,The Truth,"@Jacob Zuma its is exactly because of your mentality, that the black majority continue to vote ANC. Post 8May, it will be +60%. Nothing u and I can do about it"
1557134859359691,1:18:32,Norman Zwane,"@Tommy Adkins Yeah, just like there's zero car crashes in Gaelishiwe...there's no other car to collide with.DUH"
1557134869787900,1:18:42,Sihle Arthur,MALEMA FOR PRESIDENCY
1557134884249823,1:18:57,Born free,Yes nothing but the DA will be second and in 5 years the ANC and EFF will be history.
1557134910258614,1:19:23,MIKE DURBAN,@Sihle Arthur....just saying what's wrong with that....FREEDOM of CHOICE is everything....
1557134973454806,1:20:26,The Truth,"@Val Speirs you joke... You think DA's problem is ANC, watch what happens post 8May. EFF will be taking from DA's pie. All thanks to Pastor Musi Maimane"
1557134986336057,1:20:39,Tommy Adkins,"@Norman Zwane No comparison, there are thousands of people in Orania. Are smoking Flakka?"
1557135056675703,1:21:49,Born free,Ja but Jacob there is an enquiry going on as we speak about you and your comrades and stealing from the public purse and you act like you are still the man
