timestamp,time,author,message
1599056847520732,2:11:19,Cola Madlela,how many more like this lady are busy signing the rands and cents
1599056847565107,2:11:19,Rox,will she be able to drive herself back home??? shame
1599056848949165,2:11:21,Bianca A,And then???
1599056849997382,2:11:21,felough julius,killer blow 🤣🤣🤣🤣🤣
1599056851380827,2:11:23,Norman Krakra,Thanks now the Advo made me clever
1599056851729773,2:11:23,Lentswe Mothobi,shes flummoxed now
1599056854841611,2:11:26,Yolo More,@Rox Moleme leave adv Notshe alone😂
1599056856415930,2:11:28,TheQueen V,my mense
1599056857492472,2:11:30,Owen Nyilika,@ROZA MR NOTSHA IS TOO SOFT FOR NOMVULAS
1599056858450329,2:11:31,JJ Galaxy,o now you remember
1599056864923185,2:11:37,Samuel Skosana,Lady it is in your interest to come clean NOW
1599056867559350,2:11:42,Sbusiso Dlomo,Vuyo 🤣
1599056869660197,2:11:44,Cerebis,@THEMBA NTEYI HAHAHA.....COMMENT OF THE DAY.......LOL
1599056873030699,2:11:45,Cathy Brondani,"I think she needs more than a Rosary around her ck for protection - she is going to jail, straight to jail and not even Mother Mary can help her LOL"
1599056871147612,2:11:45,Charles Maluleke,my signature came before the HoD
1599056874563190,2:11:46,TheQueen V,"power off for second time, stage 4"
1599056876180731,2:11:48,Lebohang Mofokeng,Alex is true and that may be she also benefited the lady is not stupid ...She was taking instructions from ACE MAGASHULE BASICALLY HOW DO YOU SIGN WITHOUT THE INTRUCTION OF THE THE HOD
1599056881647027,2:11:54,Zalisile Ndzala,Goeie Genade 🤮
1599056882876580,2:11:55,elton van neel,oh au mm ja it wasnt me just my signature
1599056887758796,2:11:59,Mazda MJ,tomorrow is Nomvula vs Noge .... Chair must help other Nomvula wins 🤣🤣😂😆😆😆
1599056898597631,2:12:11,Lebohang Mofokeng,She is going to jail
1599056899677649,2:12:12,Mark Van Der Byl,black excellence
1599056900655534,2:12:13,Vuyo Sono,@Valencia J eish. askies nana
1599056901523150,2:12:14,Norman Krakra,Now she is in a corner with no Doctor nor coach
1599056901852383,2:12:14,Peace Peter,I would need a hospital after this and ask to be taken straight to a comma
1599056902178100,2:12:15,B-Man #YNWA,Adv Gcabashe turn up the heat
1599056911700282,2:12:24,Peter Prentice,just tell the truth . . . it will set you free . . . for a while anyway
1599056921900849,2:12:33,TheQueen V,"@mazda is it true, notche with nomvula?"
1599056924743952,2:12:37,Alex Ngoy,I think I m giving this Advocate my vote straight away
1599056925703435,2:12:38,roza,owen mr notshe is sharp u just have to hear his question its deep
1599056926524641,2:12:39,Victor,We throw the 16.4.64 through the window
1599056928902432,2:12:41,game palace palace,we tricked by old people
1599056930683289,2:12:43,Rox,"Hahah "" Point of view"" there is no vision here"
1599056934976670,2:12:48,JJ Galaxy,you need some milk
1599056936301744,2:12:49,Charles Maluleke,@Mark Van Der Byl stadig oor die klieppe
1599056942560880,2:12:55,Sbusiso Dlomo,This chair is too hot
1599056943379686,2:12:56,Mark Van Der Byl,"""my main interest was with"".....money ...stealing"
1599056943729370,2:12:56,Vuyo Sono,MY MY MY MY.... EISH... YA NEH
1599056949415915,2:13:02,Owen Nyilika,WHERE IS ADV MR MALEKA GUY I MISS HIM A LOT IN ZONDO COMM
1599056955647428,2:13:08,Phakamile Khuzwayo,phez'ukwakhe maGumede
1599056960511370,2:13:13,Elvis Malakoane,that is not the question lady please!
1599056960633055,2:13:13,Mark Van Der Byl,lieg steel en...
1599056962444899,2:13:15,elton van neel,lmklaaaaa your main interest was for millions in your pocket
1599056969604409,2:13:22,Solutions SA,I feel sorry for officials who are compromised by politicians....
1599056971291462,2:13:24,JJ Galaxy,jobs!!!!
1599056971704963,2:13:24,bongile sango,just listen to your self eish this lady no no no
1599056974506207,2:13:27,riyaad sampson,Nomvula gonna have a burst tyre tomorrow she will be traumatized
1599056977600441,2:13:30,Zalisile Ndzala,So? That means you must sign without due diligence
1599056978508930,2:13:31,Rox,Vrede is beyond poor....
1599056985397068,2:13:37,TheQueen V,even me chair
1599056987755545,2:13:41,Yolo More,"With Hofmeyr and Gcabashe vs Notshe and Hulley, its clear that we are ready for a woman President"
1599056989516841,2:13:42,Vuyo Sono,I DID IT FOR JOBS CHAIR
1599056990429473,2:13:43,Rip Torn,"Nou het sy haar plea baaidjie aan, shem!"
1599056991121410,2:13:44,Thulani Nzuza,is there a qualification for one to be a CFO
1599056993127599,2:13:45,Zalisile Ndzala,Hiding from the poor people angle
1599056994733166,2:13:47,Lovejoy Topera Shiripinda,but they are all afraid to incriminate Ace
1599056995084927,2:13:47,Peter Prentice,Job creation!!!! . . . is she still pedaling this rubbish?
1599057000617799,2:13:53,Elvis Malakoane,that is not cfo job
1599057004348823,2:13:56,Victor,@Valencia J I am equally confused now
1599057004962852,2:13:57,Owen Nyilika,BRING ADV MALEKA BAXK
1599057006662109,2:13:59,Naledi Barron,"Ahhh yes, here she goes. Her primary responsibility is to the Department and the perople - NOT to pie in the sky BS artists!!!"
1599057007362116,2:13:59,elton van neel,velencia.....even me too
1599057019727376,2:14:12,Samuel Skosana,"Is this the best the ANC could afford, or is there another reason Ace appointed her? I am confused"
1599057020190406,2:14:13,Anate Halvorsen,Does she think the Chairperson is going to save her or pay her bail???
1599057020417451,2:14:13,felough julius,Lawd !!! help her lol
1599057023525947,2:14:16,roza,if there was no jobs then the blame is on u coz u gave away the money nd the dairy farm went kapoets
1599057026807358,2:14:19,Albert Noah,@Owen Nyilika. Maleka left the Commission to pursue personal interests
1599057030218747,2:14:22,Sal SA,"Please don't say HONESTLY again, you let your country down. its treason!!!"
1599057030666528,2:14:23,Vuyo Sono,DEVIATION FOR JOBS👌
1599057038998095,2:14:31,Lebohang Mofokeng,I dont understand a person toil and struggle to achieve hi/her qualifications & allowed to be usef by nonentities...she is going to jail she speak the truth to exonerate herself
1599057039539571,2:14:31,DollarBill Stearn,here it comes - wait for it
1599057040205156,2:14:32,TheQueen V,talks alot but says nothing
1599057041077515,2:14:33,Paseka Mazibuko,"The people we trust with our taxes, so reckless."
1599057052986816,2:14:45,THEMBA NTEYI,Phihliza whats your problem ?
1599057058561833,2:14:51,elton van neel,first time right
1599057065013693,2:14:57,Alex Ngoy,@Mark Van Der.... 🖐🤣🤣🤣🤣
1599057073166429,2:15:06,Mark Van Der Byl,TAX REVOLT PEOPLE...WAKE UP
1599057074588649,2:15:07,Lebohang Mofokeng,Paseka very very reckless indeed
1599057074731632,2:15:07,TheQueen V,@rox 😭😭😭😭
1599057080341106,2:15:14,Andy,can someone please go and arrest this lady as soon as the commission adjourns
1599057080479404,2:15:14,roza,hulley shud take on nomvula or ms hofmeyer
1599057089896759,2:15:24,Zalisile Ndzala,"It brought none. All the poor black farmers chosen never received a cent, let alone the equipment."
1599057091166522,2:15:26,Bianca A,Are you sure🤣🤣🤣🤣
1599057091635306,2:15:26,elton van neel,same answer.or statemnt or excuse.she gives
1599057093393873,2:15:27,TheQueen V,yes chair go deeper
1599057094124403,2:15:28,Elvis Malakoane,job opportunities is not cfo job just do your job and leave political rhetoric
1599057095322283,2:15:29,Serepa Le Mabona,"@Samuel Skosana, this was the best that could deliver what Ace wanted."
1599057098560390,2:15:31,felough julius,🤣🤣🤣🤣
1599057099185421,2:15:32,Denzil lesch,hahahahaha.. chair is gona nail her now
1599057104470057,2:15:37,Owen Nyilika,@TAKS NOAH
1599057106107293,2:15:38,Victor,Are you sure that's the answer you want to give?????
1599057106259353,2:15:38,Rox,@Valencia it's sad Mam
1599057106655259,2:15:40,Vuyo Sono,AYEYE
1599057109230513,2:15:42,Michael Kaudi,hehehehe first time i see DCJ shocked like this
1599057109404142,2:15:42,Samuel Skosana,"I studied in Canada, and never heard of the :University: she mentioned"
1599057109664085,2:15:43,Nkosinathi Nkabinde,"If u knew that Vrede is a rural area with no job opportunities, why did you take all the monies to the Guptas🤬🤬🤬🤬🤬🤬🤬🤬"
1599057110969920,2:15:44,riyaad sampson,Ooh shame that's her answer
1599057114849772,2:15:48,Solutions SA,eish
1599057115762387,2:15:49,TheQueen V,I'm also laughing chair
1599057117053642,2:15:50,Una Monyatsi,😪😪
1599057117403205,2:15:50,Babazile Mahlalela,yasuka!!!
1599057118537586,2:15:51,Luthando Xhamlayo,Hahaha...Zondo please please please. Let the poor woman go
1599057118979915,2:15:52,wim louw,"I wonder how many of the 100 farmers who should;ve benefitted, will vote for ANC next year"
1599057121147845,2:15:54,roza,yoh chair i feel so sorry for u now
1599057121696597,2:15:55,elton van neel,exactly ask again chair
1599057122672791,2:15:56,zenkonzo mchunu,lool
1599057124225485,2:15:57,Akhonamandla Gala,she's giving you gibberish Mr Zondo face to face
1599057126374801,2:15:59,Peter Prentice,Zondo is losing patience
1599057126506475,2:15:59,Lovejoy Topera Shiripinda,"are you kidding me, did she she say that"
1599057127460039,2:16:00,Naledi Barron,Oooooh!! Honourable Judge - he KNOWS it is a joke!
1599057133440933,2:16:05,Vuyo Sono,ZONDO FINISH HER PLZ
1599057138535271,2:16:11,Sal SA,Looking at Gupta notes
1599057142920840,2:16:16,Bulelani Skaap,",🤣🤣🤣🤣🤣🤣🤣🤣🤣🤣🤣🤣🤣"
1599057143048061,2:16:16,Abel Matshidiso,"I've heard Nomvula Mokonyane is sick, she was not even at Luthuti house for the past 3 days"
1599057144224626,2:16:17,bongile sango,this lady is tired chair
1599057145829859,2:16:18,Solutions SA,Answering​ like a politician
1599057146373937,2:16:19,Vuyo Sono,EISH
1599057146415291,2:16:19,Zalisile Ndzala,Look at it DCJ
1599057147833333,2:16:21,elton van neel,lol she is confused
1599057148394573,2:16:21,Sabata Mafojane,eban Mrs Dlamini
1599057158388637,2:16:31,Cola Madlela,I think this lady was put in place to be the fall
1599057160168624,2:16:33,elton van neel,tired se foot
1599057160523789,2:16:33,JJ Galaxy,lol zondo cant believe the clownery
1599057167200687,2:16:40,Roscoe Brown,check her bank account NOW !! Before she goes to Mexico for ciggarettes
1599057167849918,2:16:40,Zalisile Ndzala,They just deviate
1599057170446431,2:16:43,DollarBill Stearn,she's gonna cry
1599057173338048,2:16:46,Xolile Titus,other bidders could have also said the project will create jobs etc. the explanation for diviation is foolish. why was it not practical to invite other bidders?
1599057174102930,2:16:46,Ghost Mapetla,THE DEVIL WEARS PRADA
1599057174141019,2:16:46,Vuyo Sono,OH OOHHH
1599057176415307,2:16:49,Bianca A,DCJ she thinks she is too clever. You talking to the second highest judge in the land mam
1599057176461019,2:16:49,B-Man #YNWA,Hayi inene ukholiwe ngamaPharas.🤣phezu kwakhe DCJ
1599057176949348,2:16:49,Sal SA,Thats the answer I got from Gupta's.
1599057177626171,2:16:50,roza,get the cops baba
1599057178159968,2:16:50,Rox,is she a CA?
1599057180224978,2:16:53,Rip Torn,I think she is ready to do a runner
1599057181857322,2:16:55,THEMBA NTEYI,She knows she's finished
1599057183914340,2:16:56,Vuyo Sono,OOPS
1599057185890225,2:16:58,Lebohang Mofokeng,We better not pay taxes if others will just tjaw them very annoying/ sickening
1599057186478524,2:16:58,Zalisile Ndzala,Deviate from R16 to R340 million
1599057187622714,2:17:00,mathys botha,paras's investment to date consist of a couple of rusted milk tanks they brought from India
1599057188670781,2:17:01,Sbusiso Dlomo,My heart is beating already
1599057193586286,2:17:06,Phakamile Khuzwayo,zash'emthinomanzi!
1599057194069074,2:17:06,Mazda MJ,chair laughing🤣
1599057198834858,2:17:11,Cola Madlela,possibly she didnt even make more than just a couple of cents
1599057199644676,2:17:12,Mark Van Der Byl,lot of shuffling in that chair...either its the KFC wanting to come out or she is lying
1599057200389447,2:17:13,Ghost Mapetla,THE DEVIL WEARS PRADA
1599057202348491,2:17:15,Labrador Lover,"ANC strategy: employ idiots, so we can loot"
1599057202467079,2:17:15,Vuyo Sono,BATHATHE DCJ
1599057208380314,2:17:21,Ben Cole,Not a CA
1599057219365578,2:17:32,Cerebis,Oooops
1599057237008159,2:17:50,Rox,stop reading that book to them chair its useless to them
1599057238182810,2:17:51,bongile sango,@B man uthi uzithandela amaPhara 😂😂😂😂
1599057238617204,2:17:51,Keletso Mongal,.she is clearly taking a wrap for the big guns
1599057240471265,2:17:53,Ruralworks Music,"Today, Adv have difficulties, and reading from the book"
1599057241875072,2:17:55,stanley molosi,are you sure that's the answer you giving me?
1599057241983527,2:17:55,TheQueen V,"@dlomo why is your heart beating fast?, 😂"
1599057244697153,2:17:57,Zalisile Ndzala,The CAs were used in VBS
1599057263716960,2:18:15,elton van neel,she is accountable
1599057264628071,2:18:16,felough julius,🤣🤣🤣🤣
1599057270891525,2:18:23,Vuyo Sono,EISH..... DE DE DE DE DE
1599057271755575,2:18:24,Sal SA,Its not CFO role to worry about investment potential and job creation. So she doesn't do her actual job
1599057280163501,2:18:32,Rox,"she has never seen this book, she is relying on WhatsApp"
1599057286114932,2:18:39,Cola Madlela,lol de de de
1599057290162706,2:18:43,Ghost Mapetla,THE DEVIL WEARS PRADA
1599057294029553,2:18:45,Zalisile Ndzala,This Paras term is driving me crazy
1599057298215595,2:18:50,elton van neel,lol correct
1599057299373646,2:18:51,Bianca A,"Do you need to phone a friend mama, or maybe 50/50?"
1599057300129789,2:18:52,Sbusiso Dlomo,"@Valencia, I'm in her shoes 🤣"
1599057300606428,2:18:52,Vuyo Sono,SWEATING
1599057304997192,2:18:56,Akhonamandla Gala,@Rox hahahaha
1599057310844412,2:19:04,Rox,where was she sitting ??
1599057311171364,2:19:04,Labrador Lover,Ace logo...lets lie together
1599057314996856,2:19:07,Cola Madlela,Who is Paras
1599057316819964,2:19:09,Frank Jordaan,Stop lying and come clean.
1599057319335935,2:19:12,Samuel Skosana,"I hope the other evidence leaders are taking a leaf out of Ms Gcabash""s book"
1599057323293254,2:19:16,Bulelani Skaap,Para lady🤣🤣🤣🤣
1599057323408690,2:19:16,elton van neel,1 more paaaaaarrrrraaaaaasssss
1599057323485591,2:19:16,riyaad sampson,School her please
1599057323573831,2:19:16,stanley molosi,impractical means??
1599057323647261,2:19:16,Roscoe Brown,Getting PAID !!!!!
1599057325209605,2:19:18,Simba Chisanhu,Ayeyeyeyeye
1599057325843952,2:19:19,Solutions SA,i feel sorry for her
1599057326751604,2:19:20,Yolo More,Chair
1599057328740429,2:19:22,Vuyo Sono,TEACH HER
1599057331760056,2:19:25,ma baker,give the judge a bells
1599057332495560,2:19:26,THEMBA NTEYI,YhOOOOOOOOOOOooooooo
1599057333972376,2:19:27,Lebohang Mofokeng,what goes around goes around
1599057336247226,2:19:29,elton van neel,hahaha
1599057342134266,2:19:35,Peter Prentice,Impractical definition . . . well explained chairman
1599057342662009,2:19:35,MTPOCKET,"you Go DCJ Zondo, nail her"
1599057346079587,2:19:39,Sipho Hlophe,reak
1599057346255278,2:19:39,TheQueen V,"eish it's getting hot in here,"
1599057346482747,2:19:39,felough julius,🤣🤣🤣🤣🤣🤣
1599057349949892,2:19:43,Elvis Malakoane,"NO Ms Dlamini with respect, You are making a fool of your self,."
1599057350350474,2:19:43,Zalisile Ndzala,Paras is the Indian company
1599057355385264,2:19:47,Pastor J.J,@Valencia J Have you given some thought to my proposal?
1599057355850027,2:19:48,Rip Torn,This is now a teaching and learning session
1599057363434001,2:19:56,Nobuhle Jara,Key words...' WAS GOING TO'? there was no investment my dear. You are digging your own grave. you can't justify a R30m deviation for something that was not in place
1599057365410792,2:19:58,Vuyo Sono,ITS GETTING HOT IN HERRRRRRR
1599057370323121,2:20:03,Alex Ngoy,If a bank account had only R16 suddenly R340 Million why the bank didn't report this in the first place????
1599057384255022,2:20:16,Peter Prentice,200 mil . . . oh please . . . they stole 340 mil
1599057384932823,2:20:17,HILTON ZUMA,Ladies and Gentlemen most of the South African Government Departments (ANC) is How they operate this is not a SURPRISE a daily exercise.🤣🤣🤣🤣🤣🤣🤣🤣🤣🤣🤣
1599057395549224,2:20:27,Ruralworks Music,Zondo is getting angry now
1599057396027488,2:20:28,Desiree Silokuthaba,Shame the English language
1599057398126376,2:20:30,Pheladi Lamola,She must have been threatened with death. Why won't she tell the truth of under whose instructions she acted?
1599057400861433,2:20:33,Lethabo Maesela,this girl must get locked up
1599057401083740,2:20:33,Sabata Mafojane,Queen's Language fails CFO.
1599057401687094,2:20:34,felough julius,DCJ🤣🤣🤣
1599057404822180,2:20:37,Victor,Chair is upset with the impracticality
1599057406064415,2:20:38,elton van neel,she is impractically dom
1599057406563424,2:20:38,Melanie Burgers,get her DCJ
1599057407262726,2:20:40,Nkululeko Mdluli,"If she could right now,she would run straight for the door."
1599057414695079,2:20:47,wim louw,"Raymond, how can you explain to a person with a Masters' what impractical means, eh?"
1599057415694338,2:20:48,TheQueen V,I hope this one is wearing panty liners today
1599057420932508,2:20:54,JJ Galaxy,AH Pa zondo putting his foot down
1599057427533371,2:21:00,Rox,"HOD , who's that one?"
1599057430425690,2:21:03,Sipho Hlophe,really confused
1599057433051198,2:21:06,roza,plz chair get her assets frozen nd lock her up
1599057438188400,2:21:10,Sabata Mafojane,valencia😂
1599057439938420,2:21:12,Bianca A,Telling the truth would be impractical cos you could be gunned down
1599057439960025,2:21:12,Mazda MJ,Neel yes
1599057439967908,2:21:12,Una Monyatsi,"She must just come clean,its getting HOT"
1599057440412684,2:21:13,TheQueen V,"@wim masters for what, for who😂😂😂"
1599057442199325,2:21:14,dada ngova,what's reason zondo come to lecture this lady instead of finding her guilty with the facts he has
1599057445941610,2:21:18,Vuyo Sono,Logic has left the group chat
1599057450392987,2:21:23,Cola Madlela,When is the HOD coming here
1599057452491586,2:21:25,dada ngova,why justification
1599057452585204,2:21:25,Ntsikelelo Vani,@Valencia hahahahahahah
1599057453445356,2:21:26,Rox,hayiii leave parmalat out of this
1599057454413220,2:21:27,Benjamin Moshatama,@Valencia J behave
1599057454548731,2:21:27,elton van neel,velencia.jy kan ma ophou
1599057454782066,2:21:27,Queen K,@Thando why is Valencia walking alone its not safe here😅😅😅
1599057455321781,2:21:28,roza,valencia🤣🤣🤣
1599057455907375,2:21:28,Pastor J.J,@Valencia J I am helping him to do what he cannot do. A helping hand we shall call it. A friend in need is a friend indeed they say
1599057456342783,2:21:29,Lebohang Mofokeng,she cant be threatened with death these are the consequences of stupidity such a learned person
1599057458840442,2:21:32,Samuel Skosana,See just how wet her chair is now
1599057461189830,2:21:34,THEMBA NTEYI,This was no investment
1599057461768545,2:21:34,Zalisile Ndzala,She knows exactly. She is well trained in playing stupid nxaa.
1599057464622461,2:21:37,Yolo More,"Valencia J luck you girl. You have 2, while some of us have none🤷‍♀️"
1599057466811956,2:21:39,Peter Prentice,outside the country . . . where the Guptas are from maybe????
1599057468807056,2:21:41,Melanie Burgers,Surely it doesn't make sense
1599057470031197,2:21:42,Owen Nyilika,@MOLELE MR THABETHE
1599057471360190,2:21:43,Cola Madlela,This lady was probably looking for her skaftin
1599057472822715,2:21:45,ma baker,call Nestlé.
1599057479911421,2:21:52,Sal SA,@Valencia she said she arranged tampons lol
1599057481557985,2:21:53,TheQueen V,@benjamin I will try 😂😂😂
1599057485728428,2:21:58,Rox,what investment??? where is ROI now?
1599057486147769,2:21:59,wim louw,#Valencia J Pampers XXXXXXL😊
1599057486565029,2:21:59,Rip Torn,@ Valencia J - panty liner - lol
1599057493063111,2:22:06,Serepa Le Mabona,"@Alex Ngoy, ask that again it seems as if there was a whole chain of collusion here."
1599057494255202,2:22:08,Lebohang Mofokeng,she benefited
1599057499100110,2:22:11,Akhonamandla Gala,@Turtle please don't give up on Valencia she's just playing hard to get....
1599057500945184,2:22:13,Zalisile Ndzala,🤣🤣🤣🤣🤣🤣🤣
1599057503910036,2:22:16,Vuyo Sono,ITS NOT YOUR JOB MAMA
1599057506783278,2:22:19,Zalisile Ndzala,mehlolo
1599057509914592,2:22:23,TheQueen V,"@elton ek begin Dan nou eers, hoe is jy dan"
1599057519799828,2:22:32,THEMBA NTEYI,She'll get a diplomatic post
1599057520087403,2:22:32,Cola Madlela,Zondo is an OG with his giggles
1599057520713308,2:22:33,felough julius,🤣🤣🤣🤣🤣
1599057521129249,2:22:33,Labrador Lover,"this women has serious problems, and us tax payers have to pay for this"
1599057522397496,2:22:35,Rox,"@Owen not Molele, but thanks"
1599057523412547,2:22:36,Peter Prentice,So if I want a tender . . . I must just tell them I want to invest?????
1599057523986111,2:22:36,elton van neel,mofokeng.....big time
1599057524377996,2:22:37,Solutions SA,According to the law Simple
1599057538636374,2:22:50,Sal SA,But u the CFO its not your job
1599057539479706,2:22:51,Lebohang Mofokeng,mtjele JUGDE ZONDO SHE IS A LIAR LIAR
1599057541188500,2:22:53,Alvino Theunissen,Their is a tender process to invite competitive bids
1599057541825587,2:22:54,dada ngova,why lecture a thief on how to steal..msuzo
1599057542572340,2:22:54,Thokozile Mokoenanyana,@Rip you're so correct. Justice Zondo is now turned into a teacher. ABET is loading😄
1599057543000973,2:22:55,Cola Madlela,Actually we need Zondo to be the Gov HEADMASTER
1599057543879579,2:22:56,Zalisile Ndzala,Ndo livhuwa nga maanda DCJ. Dankie meneer
1599057549732357,2:23:02,Pastor J.J,@Akhonamandla Gala I have her right where I want her. On my lap
1599057554450515,2:23:07,Melanie Burgers,whaaat???!!!
1599057555153836,2:23:07,JJ Galaxy,the money went all over
1599057558350644,2:23:11,felough julius,🤣🤣🤣🤣🤣🤣
1599057560949213,2:23:13,Rip Torn,Don't let her somewhere else
1599057563636231,2:23:16,roza,chair dont waste ur tym this 1 is dom she must be arrested
1599057565814166,2:23:18,Vuyo Sono,@THEMBA NTEYI she'll be ambasador to Cayman Islands
1599057569134673,2:23:22,Sal SA,Its a joke
1599057569484331,2:23:22,Yolo More,Liar
1599057570371856,2:23:23,Lebohang Mofokeng,English
1599057571055611,2:23:24,Rox,I hate Tenders!!!!
1599057573611265,2:23:26,Cathren Nkgoeng,imagine been thought what impractical means while having masters from Canada and UK. shem
1599057574064185,2:23:27,Phakamile Khuzwayo,arrest her
1599057574858495,2:23:27,Wildthing,Judge is burning inside
1599057576113608,2:23:29,Eddie Reddy,Ace already instructed her to follow what he desires... guPtas
1599057576882108,2:23:29,ma baker,from where I'm sitting eish maybe say 'I agree chair'
1599057577162054,2:23:30,TheQueen V,"@Cola she must check in the Rama container, her skafti is there"
1599057577301723,2:23:30,Solomon Ndubane,the chair DCJ does not understand the answer of not inviting bids but able to hand pick an indian company on india. explain ma'am....
1599057578359215,2:23:31,treasure Masinga,Yohhhhhh Incompetence at its best
1599057580338271,2:23:33,Siya peace,She just agreed to have accepted a bribe
1599057589231489,2:23:41,Roscoe Brown,STUTTER ING FOOL but RICH !
1599057590298722,2:23:42,Naledi Barron,"I ADORE Judge Z. (Yes, I know he's married - Respect Madam Z)"
1599057591206055,2:23:43,thando cezula,"Her subordinates at COGTA are looking at her like ""Yhooo"""
1599057598314605,2:23:51,Akhonamandla Gala,@Turtle 😂😂😎Bosso ya Mboka
1599057606124660,2:23:57,elton van neel,lmklaaaaa Valencia....lol he panty liners she het stockings an
1599057611065453,2:24:03,JJ Galaxy,yes hit her with the book
1599057615212705,2:24:07,Sbusiso Dlomo,Vuyo🤣🤣🤣🤣😂😂😂😂
1599057616119421,2:24:08,Ghost Mapetla,THIS JUST PURE ANC FRAUD
1599057616584756,2:24:09,Rip Torn,Step by step - heaven help me
1599057617736005,2:24:11,Bianca A,@Naledi Barron same with me.
1599057618157419,2:24:11,Solutions SA,Viva Ace Magashule Viva
1599057624178835,2:24:17,TheQueen V,impractically practical😂😂
1599057625781153,2:24:18,Cola Madlela,There is incompetence and there is THEFT
1599057625940717,2:24:19,thando cezula,Then why is it impractical?
1599057626709617,2:24:19,Ntsikelelo Vani,her mind is slower than the sloth 🙈🙈🙈
1599057627025887,2:24:20,felough julius,So Sad jirre
1599057629865516,2:24:23,Anne M.,Me too @Naledi Barron
1599057633594731,2:24:26,Rox,Female version of Nzeku
1599057635509927,2:24:28,Owen Nyilika,@Rox MOLEME SORRY
1599057637415875,2:24:29,THEMBA NTEYI,She'll be a diplomat to Bapetikosweti wherever that is
1599057638606183,2:24:31,elton van neel,lmklaaaaa ai back to the starting point
1599057647241424,2:24:40,Sanele Ngubane,😝🤪🤪
1599057649883579,2:24:43,Alvino Theunissen,They try to cover up so much
1599057653726211,2:24:45,Rip Torn,She is going forward in reverse
1599057662318347,2:24:55,Yolo More,Zondo is smart. I give up on him.
1599057663996678,2:24:57,Rox,@Owen all is well.. let's listen to lies
1599057666168526,2:24:59,Zalisile Ndzala,She is evil
1599057666334642,2:24:59,Rebone Ramokone,zondo finish her now
1599057667916029,2:25:01,Anne M.,😂@THEMBA NTEYI
1599057667952897,2:25:01,Pastor J.J,@Valencia J Dont make my task difficult.Leave the panty liners out
1599057672734711,2:25:04,Elton Josea,ur eyes are narrow CFO u were looking at your bank balance
1599057673488953,2:25:06,elton van neel,thats their way
1599057674311818,2:25:06,thabiso mngadi,i like that rox.female version of ndzeku
1599057681454212,2:25:14,Lebohang Mofokeng,incompetent with majors in Accounting and applied Accounting yah neh Mzanzi now Judge Zondo is an educator
1599057684309786,2:25:17,thando cezula,The truth shall set you free madam
1599057690102423,2:25:23,JJ Galaxy,'i understand..also i dont '
