timestamp,time,author,message
1559563938854930,11:21,Tharaxis,"I love how a broadcasting company such as the SABC with millions of rands and technology, can put out a more shoddily put together live stream than some every day YouTuber"
1559563947373500,11:30,Tharaxis,Seems they've never heard of Stereo sound
1559563978072729,12:00,Tharaxis,"I also love the soft picture, reminds me of video from the 90s"
1559564136612795,14:38,Magda Seguin,"SABC was captured by Hlhaudi...another Zuma appointee,now there is serious financial problems"
1559564561582363,21:44,Wildthing,yes
1559564636232835,22:58,Queen K,We are not safe
1559564691783268,23:54,Queen K,Annoying
1559564703830010,24:06,Tharaxis,very
1559564714045606,24:16,Tharaxis,should probably just hide chat
1559564716257302,24:18,Carl Schmidt,Gutpa Bots are very busy today
1559564735188239,24:38,Queen K,Very
1559564736072834,24:38,Carl Schmidt,Gutpa robots are very busy today
1559564760460270,25:02,Zee Zondani,i dont know if thats a virus or what😂😂
1559564760792203,25:03,Tharaxis,yeah but they just come in with new names
1559564770998456,25:13,Carl Schmidt,Its probably Tony Gupta himself.....
1559564786037427,25:28,Zee Zondani,probably duduzane
1559564856563850,26:38,Carl Schmidt,Thanks Thando - they are showing as blocked this side too now.
1559565225839926,32:48,Queen K,😂😂😂
1559565244932147,33:07,kenneth mampa,"He is not making up story, on point"
1559565256684768,33:19,hilton modike,"with Zuma's voice .what is state heee? did the guptas captured the legislature, executive & judiciary heeeeee.lol 😂😂😂😂 all the members of the parliament went quite .this guy was a mafiozo"
1559565282238838,33:44,Ntuthuko Mbhamali,😂😂
1559565317009951,34:19,Siyabonga Dladla,WHAT'S GOING ON HERE?
1559565329959557,34:32,Maria Raboshakga,"The guy can talk, shuu!"
1559565351780857,34:54,Gladys Motsima,models
1559565355500927,34:58,Queen K,Tired blocking
1559565366935224,35:09,Gladys Motsima,models
1559565399671571,35:42,frans mofomadi,yerr
1559565419656135,36:02,SBH Shembe,is this a hostile take over ?
1559565420482731,36:03,Tee Makara,Why are people’s comments in codes now
1559565440001541,36:22,Tee Makara,What’s happening🙆🏽‍♀️
1559565440955217,36:23,Queen K,Very hostile indeed
1559565463265092,36:45,Lucky123 Thwala,you tube must act now
1559565464952429,36:47,S Nompozolo,This is sad
1559565469358440,36:51,Tee Makara,Guys it’s not the same without the comments
1559565474688435,36:57,Alauddin Khan,.
1559565492955264,37:15,Magda Seguin,Sabotage...SABC please act on the hackers
1559565519123770,37:41,Tee Makara,Those who have Twitter please do send SABC Digital News a tweet
1559565566582583,38:29,Magda Seguin,SABC Digital please control the invasion of these bots
1559565600861956,39:03,Tee Makara,"This is not ANN7 Aptul, please 🙏🏽"
1559565619957418,39:22,hilton modike,"guess who said this ?did the guptas captured the judiciary,the executive and parliament heeeeee😂😂?? & all Nec committee kept quite. guess who asked that ?"
1559565660518595,40:02,Solly 12,What’s this rubbish here
1559565663926991,40:06,Magda Seguin,Someone mentioned yesterday that the IEC was captured too
1559565857380773,43:19,Magda Seguin,Zuma infiltrated and corrupted each and every institution he could in SA
1559565910758556,44:13,Magda Seguin,@hilton module I remember very well when Zuma said that
1559565993159523,45:35,Magda Seguin,Someone cast aspersions on the new CEO of the IEC...and it may be correct
1559566038018059,46:20,Magda Seguin,This testimony about the OEC is a bombshell...watch the fallout soon
1559566117032432,47:39,Kevin Davis,nothing will happen to these crooks and zuma continues to laugh he he
1559566120487880,47:43,Owen Nyilika,All have smallanyana skeleton says soo bathabile dlamini guys
1559566132227040,47:54,Magda Seguin,The elections were a farce...what about the boxes found and the bad ink etc...nothing was investigated
1559566150779412,48:13,clive oconnell,The rotten 🦈ANC stinks from the head down
1559566263268367,50:05,Solly 12,Anyone who voted for the ANC cannot complain
1559566284548385,50:26,Zee Zondani,who said we are complaining?
1559566324975057,51:07,makhosi nobhatyi,"Anc doesn’t send any one to corruption, we are just surprised as anyone else, ANC send people to do the job, serve the country with service delivery"
1559566340656955,51:22,Zee Zondani,indeed makhosi
1559566349024387,51:31,Magda Seguin,Oh so you are not complaining that the country was stolen?
1559566351119677,51:33,folovmin,do we have to await completion of the hearings /closure of the commission for justice to be seen to be done.?
1559566362147523,51:44,Cassius Mngomezulu,Complain for what exactly\
1559566370568895,51:53,Magda Seguin,Not complaining is complicity
1559566384892185,52:07,Zee Zondani,any party is capable of doing such and even worse.
1559566392798056,52:15,Sthakathi Khumalo,But what is wrong if you want to have a different platform that will show a different version?
1559566398895277,52:21,Nelson Musoliwa,Is zuma still refuting his special relation with the guptas
1559566400774361,52:23,Solly 12,You should be happy that you were propping up a corrupt party with your vote Zikhona Zindani
1559566418417484,52:40,Zee Zondani,"we are far from complain, and when we want to complain. dont stress yourself, we will complain in secret. focus on your party"
1559566429228765,52:51,Magda Seguin,Future generations will be amazed of how some people flocked to the ANC in spite of state capture
1559566437774846,53:00,Van Lier Dreyer,bunch of dumbasses here eeeeeeeh eeee
1559566463488340,53:25,kenneth mampa,"They will be no justice served after this,where is life Esidimeni perpetrators? Commission recommended but action Dololo,only tax payers money was used to compensate thr families"
1559566465092572,53:27,Tee Makara,ANC till jesus comes back.
1559566478375160,53:40,Magda Seguin,Being part of the solution and putting pressure on the NPA to do its job is crucial
1559566509415877,54:11,Zee Zondani,Oh I am very happy about my vote. very pleased with it. The right organisation is leading. now our hurdle is to deal with the aftermath of the zuma maladministration
1559566536880372,54:39,Sthakathi Khumalo,Spice Zondo haha
1559566563739268,55:06,Solly 12,Zokhona Zindani your ignorance is amazing to think anyone will be dealt with
1559566571009565,55:13,kenneth mampa,This commissions is an other wasteful and unaccounted expenditure. we must take law into our own hands and deal with dis criminals
1559566572078669,55:14,Charles Nkadimeng,I also dont think this guy is telling the Trueth?
1559566576457300,55:18,Naledzani Mashau,The ANC owe us as citizens apology for what they did and also pay back the money they stole from our fiscas
1559566590275390,55:33,Magda Seguin,Focus on your party?What party?South Africa belongs to ALL who live it...
1559566604586281,55:47,Cassius Mngomezulu,This is guy knows his telling the truth
1559566605719646,55:48,clive oconnell,"But you still vote for your Mafia leaders, WHY"
1559566631346701,56:13,Thembinkosi Vena,Doing same thing all over again is a sign of stupidity.ANC leaders are corrupt to the core People in ALEXANDRA are evicted just less than a month after voting for the ANC is the shame for Africans
1559566636650942,56:19,kenneth mampa,"i believe in traditional courts,they must be brought to our traditional courts"
1559566644834990,56:26,Magda Seguin,"Most of the implicated are still in the ANC,there will be nothing done to them"
1559566649521814,56:31,makhosi nobhatyi,"I am supporting all NPA what they will do, but not using these institutions to attack those who spoke out about corruption, remember there are still rotten potatoes left there at NPA"
1559566684878928,57:07,Tee Makara,"@Thando Nkutha, I’m asking the same question🤷🏽‍♀️"
1559566694599222,57:16,Millicent Shozi,How many years will this state capture last
1559566741852959,58:03,Cassius Mngomezulu,What happens if Zondo dies Tommorrow
1559566752534475,58:15,Michael Michael,4 years could be enough
1559566796660725,58:58,Zee Zondani,I really dont know how many more years this will continue. we kept asking urselves that last week
1559566799538130,59:02,Magda Seguin,"@makhosi nobhatayi that is exactly what Shamila Batohi said in her presser,she says they are being weeded out"
1559566803299869,59:05,Tee Makara,"Hai State Capture is honestly long dragging, we need arrests. People have to account"
1559566810957906,59:13,Zee Zondani,these people wll be dead by the time its time to act on them
1559566811759863,59:14,hilton modike,"NPA is useless .do u think if the guptas did this in China they would b in Dubai laughing like that . look at this churches in South Africa .will they operate like this if it was in Kenya ,Malawi ...."
1559566837613736,59:40,Solly 12,"It’s not just ANC leaders that can’t tell the difference between state & party, it’s also their ignorant voters"
1559566839030189,59:41,Zee Zondani,"Ramaphosa might not even be president by then, which will make less likely that any action will be taken against them"
1559566847992019,59:50,Millicent Shozi,Evidence still remains @Cassius Mngomezulu
1559566848485365,59:50,Zee Zondani,zondo must be rush this thing
1559566862145136,1:00:04,Zee Zondani,we dont have another 10 years
1559566866984283,1:00:09,Don Laka Kwaai Jazz,"Zondo's line of interrogation on quotes is trying to intimidate the witness ,i just wonder what the motive here."
1559566881921010,1:00:24,hilton modike,bushiri and this bo alph lukau pays the same people we elected to rob the poor with their evil ways of manipulating the poors
1559566891229654,1:00:33,Cassius Mngomezulu,But who will put the pieces together like how zondo is asking questions now
1559566900386849,1:00:42,Judas Sambo,definitely december 2020 end of story guys remember it was given 2 year only
1559566912590249,1:00:54,Magda Seguin,"@Solly 12 Exactly...they act on what they are told.Ace uses the line of party allegiance,not the country...with them it's always about the ANC"
1559566914751036,1:00:57,Tee Makara,"We already know the tsotsis, we want arrests"
1559566930416438,1:01:12,Anubhav Mishra,hiii
1559566943986230,1:01:26,YESH_GAMING,whats wrong with remembering exact words like really
1559566946731854,1:01:29,Nelson Musoliwa,Is he not supposed to remember why
1559566965988271,1:01:48,Sebastian Gudu,zondo is interrupting this guy or is he defending zuma
1559566979619839,1:02:02,Zee Zondani,who would remember the exact words of a conversation that took place 4 years ago
1559566994798721,1:02:17,Sthakathi Khumalo,Zondo is correct!!
1559567008339586,1:02:30,Magda Seguin,"I do,I have a photographic memory"
1559567021830183,1:02:44,Tee Makara,"Ai mahn Ntate Zondo, it’s possible to remember.!!"
1559567022310513,1:02:45,Cassius Mngomezulu,Zondo is losing it
1559567025487926,1:02:48,Sthakathi Khumalo,Thats what journalists do hehe
1559567037992420,1:03:00,Sebastian Gudu,zondo is becoming a problem here
1559567067517775,1:03:30,Tharaxis,"I was about to say, misquoting is exactly what experienced journalists do"
1559567075975497,1:03:38,clive oconnell,ANN7 Zuma designed to brainwash and steal even more from the simple anc voters
1559567077190127,1:03:39,jett888,Truth
1559567087353614,1:03:50,Magda Seguin,"The person who edited his book should have assisted,this man was very ill and had an extremely emotional time running for his life"
1559567088967551,1:03:51,Albert Noah,@Thando Nkutha. He said there was no diary. Rajesh getting pireced on use of quotations
1559567108180933,1:04:10,Millicent Shozi,put an Indian and Zulu together what mixture you get😅
1559567112286381,1:04:14,Big vinny,even though we don't like what the judge is saying but is right
1559567114363180,1:04:16,Sthakathi Khumalo,"This exactly what journalists do, misqoute for headlines"
1559567123721286,1:04:26,makhosi nobhatyi,"Zondo is correct, we want concrete evidence, wat and see we must question every witness"
1559567149171479,1:04:51,Magda Seguin,I am systematically reporting this harassment bots
1559567151727635,1:04:54,Zee Zondani,ay zondo is grilling this guy. tjo what is this going to do to his credibility
1559567153783907,1:04:56,jett888,This is such basic knowledge!!
1559567162792537,1:05:05,Wildthing,me to
1559567163735649,1:05:06,911Engineering,We got the point let's move on
1559567164222972,1:05:06,Nkululeko Ngwenya,Zondo is lecturing the journalist's work
1559567173749624,1:05:16,Zee Zondani,iam sure zuma is smilin right now by this
1559567191653120,1:05:34,jett888,Media should be held accountable!!
1559567192906827,1:05:35,Siyabonga Malinga,"dankie Mr Judge,"
1559567194103064,1:05:36,Nkululeko Ngwenya,unprofessional journalist
1559567204167075,1:05:46,Magda Seguin,Thanks YouTube for removing the bots and also exposing who it is
1559567205614698,1:05:48,Tharaxis,well he did work for ANN7
1559567211031834,1:05:53,Tee Makara,MOVE ALONG ALREADY
1559567217765313,1:06:00,Sthakathi Khumalo,"Can he go back to India now, because curry nje.. verbatim is the word chair"
1559567223470670,1:06:05,Sebastian Gudu,zondo is running the showorld now what happened to this lady now
1559567230723860,1:06:13,Pelisa Vanda,"ooh my goodness, so this quote issue we not gonna move on from it anytime soon"
1559567232560750,1:06:15,jett888,The truth should be the bottom line- too many lies are occurring
1559567271799068,1:06:54,makhosi nobhatyi,Zuma is watching this
1559567277106096,1:06:59,Sthakathi Khumalo,"This is really important becuase it borders on the credibility of this comrade, because the affected individuals will say he is lying.."
1559567284612508,1:07:07,jett888,CREDIBILITY is VERY important!! He should have said “ to the best of my knowledge “
1559567295467722,1:07:17,Tharaxis,100%
1559567297953576,1:07:20,Cassius Mngomezulu,This guys is narrating what happened stop doubting him
1559567319833645,1:07:42,Tharaxis,"people can say ""this is not what I said"" and put his entire testiony in jepoardy"
1559567324144188,1:07:46,Zinhle Omontle,Why is judge Zondo grilling this guy for quotations marks?? like really
1559567326743717,1:07:49,Nkululeko Ngwenya,he is mumbling a lot
1559567348394870,1:08:10,Buyani Mhlongo,Mumbling lol lol
1559567357924914,1:08:20,jett888,He sounds credible- he was trying to convey the Truth - not cover things up-
1559567361450056,1:08:24,Lerato Sithole,Zuma is watching this and he's now smiling
1559567362243591,1:08:24,Tharaxis,"@Zinhle Omontle because it's a legal issue, you work with facts, not stories, and by his own admission he was quoting in a narrative fashion like if your'e writing a book"
1559567367774271,1:08:30,Don Laka Kwaai Jazz,"Is Zondo now saying because the quotes are not verbatim,throws the evidence out?The guy has conceded its points and not verbatim."
1559567377795117,1:08:40,Sthakathi Khumalo,He never made notes as a journalists thixo
1559567380068973,1:08:42,Tharaxis,"and the Judge is right, if you're giving legal testimony and include things in quotes, you're stating ""this is what the person said"""
1559567383699387,1:08:46,911Engineering,Thank you let's move
1559567387817795,1:08:50,YESH_GAMING,hez shaking
1559567412335687,1:09:14,funicanz,"This guy may have a recollection of what transpired then. I guess Chair's issue is he cannot quote but to say: "" to the best of my knowledge, I can recall"" as he doesn't have recordings."
1559567415480384,1:09:18,Sthakathi Khumalo,Throw him out Zondo
1559567424203366,1:09:26,Sebastian Gudu,zuma is being defended here for free
1559567425666139,1:09:27,Magda Seguin,This man was only at ANN7 for FOUR months off course he will remember everything
1559567428711883,1:09:31,funicanz,What happened?
1559567451024889,1:09:53,Nkululeko Ngwenya,no facts written down tjooo
1559567459714494,1:10:01,Sihle Arthur,uZondo wenzan manje
1559567461428829,1:10:03,Wildthing,Pipi time for Judge
1559567477628748,1:10:19,Tharaxis,very likely
1559567482792774,1:10:25,Cerebis,@Tharaxis Nope....legal matters come later....this is a commision of enquiry?
1559567486480297,1:10:28,funicanz,@Michael Wild 😆
1559567492985143,1:10:35,Nkululeko Ngwenya,he is a judge and he needs facts
1559567502978304,1:10:45,nqubeko ngema,5 minutes break for the judge
1559567508799673,1:10:51,Sihle Arthur,aaaaaaaaaawwwwwuuuuu u Zondo
1559567510689386,1:10:52,Magda Seguin,Zumas defence is getting thin...you can see how his previous lawyers disappeared...he will have no place to hide only maybe Dubai
1559567510954758,1:10:53,makhosi nobhatyi,😃😃😃😃 no wait there are more that is coming email and phone
1559567513203671,1:10:55,jett888,Who is the victim??
1559567523352567,1:11:05,Tee Makara,"I don’t believe Mr Zondo is implying that he’s lying, I think he’s just trying to secure factual way of reporting"
1559567525793135,1:11:08,Tshepo Chiloane,watching from Brooklyn in Pta
1559567543369708,1:11:25,Sthakathi Khumalo,"Zondo calling Zuma and he is like, this boys i wasting my time.. just crashed his evidence"
1559567553665410,1:11:35,makhosi nobhatyi,Judge wanted to peer
1559567561791561,1:11:44,Millicent Shozi,one of the reasons I don't buy a news paper
1559567566576810,1:11:48,Magda Seguin,@Tee Makara you are correct
1559567586856106,1:12:09,jett888,@magda sequin lawyers will “ disappear “ when they’ve been threatened for defending the truth too remember
1559567594740941,1:12:16,Antonie Engelbrecht,dont trust this judge
1559567629899641,1:12:52,911Engineering,He is an authentic Judge
1559567640101134,1:13:02,Nkululeko Ngwenya,he should have brought basic principles of journalism and give it to Zondo simple
1559567644880174,1:13:07,michael mbatha,Zondo's attitude towards this guy is similar to that of Adv Pretorius as Agrizzi was concluding his testimony. Behaving like a defence attorney of thieves. If I was this guy I would be discouraged.
1559567677793447,1:13:40,Tee Makara,It’s over for Zumagang.
1559567681503556,1:13:44,jett888,Please help me comprehend who is the victim?
1559567687685807,1:13:50,Solly 12,If Zondo doesn’t bring Zuma to testify then he can forget bout being Chief Justice
1559567711428945,1:14:14,Wildthing,Zonda is making sure it will stand in court. must remove the quotations
1559567728781219,1:14:31,Channel blocker,he is throwing the book out of the evidence submission
1559567732713945,1:14:34,jett888,Who do the people want to defend??
1559567764505072,1:15:06,Yvonne Morudu,went to get cup of tea what happened is this tea break?
1559567785444937,1:15:27,Solly 12,Thando Nkutha obviously u haven’t been paying attention to commission
1559567800060569,1:15:42,YESH_GAMING,poor guy is risking his life and we still say he's lying wow
1559567809055750,1:15:51,Aviwe Nondabula,i wonder 😂😂😂
1559567843442759,1:16:26,Judas Sambo,jett888 do you know what is going on here?
1559567848506999,1:16:30,jett888,Defend the person trying to expose the truth! Help protect him!!
1559567868888276,1:16:51,Magda Seguin,"@michael mbatha I remember,whistleblowers are put off by this kind of thing"
1559567888757294,1:17:11,Channel blocker,every persons biography is questionable
1559567913495673,1:17:36,Millicent Shozi,we want our land
1559567914566560,1:17:37,makhosi nobhatyi,The guy is knows how Guptas behave behind the Scine and board room
1559567921759188,1:17:44,Magda Seguin,Judges are human beings and also has biases it seems
1559567922127109,1:17:44,Solly 12,Thando Nkutha might help u to use your brain a little bit
1559567936450315,1:17:58,jett888,The Truth is what’s important- those who are brave enough for o expose it should be defended!!
1559567980245724,1:18:42,Mashudu Tshikororo,they are just clearing the smoke which is a right approach
1559567985427442,1:18:48,Cerebis,@jett888 100% correct
1559568014907707,1:19:17,jett888,Too much corruption by big elitist and corporations- please protect human rights! We all need to unite to defend the truth! ❤️🌹❤️
1559568044068076,1:19:46,Magda Seguin,In a sense I agree with the Judge but he could have been a bit nicer and not so rough on the guy.He was very lenient to other witnesses like Manuel
1559568046769853,1:19:49,makhosi nobhatyi,"These people have a backup evidence, fake email will come true, because they destroy evidence"
1559568052967732,1:19:55,Tee Makara,@jett888 Finish and Klaar
1559568059869787,1:20:02,Cerebis,Millicent blocked
1559568090715723,1:20:33,watson mutanga,Whether Zondo is biased or not on asking the credibility of the quotes is immaterial. Remember Zuma & company will defend themselves. Their lawyers will definitely ask that question.
1559568134456256,1:21:16,Millicent Shozi,when will Zuma be on the hot seat
1559568143793424,1:21:26,jett888,Propaganda is on the rise- the UN /NWO Depopulation Agenda is on the rise- please protect those defending our human rights and honesty. ❤️
1559568155509550,1:21:38,Magda Seguin,Zumas lawyers was not up to the task in his last appearance..SC Trengrove was far above their argument
1559568204957784,1:22:27,Queen K,Are the boys still at work?
1559568206920211,1:22:29,jett888,Too many people are being intimidated
1559568214926496,1:22:37,Queen K,Bots*
1559568255014710,1:23:17,Magda Seguin,@jett888 true look what they are doing to Julian Assange and Chelsea Manning
1559568297502362,1:23:59,YESH_GAMING,@khanyi what bots
1559568317759545,1:24:20,Solly 12,Are there interpreters there? Zuma will say I want testify in Zulu
1559568332140468,1:24:34,jett888,The President is a public figure- photos shouldn’t be hidden- @Magda Seguin you are so correct- we need to defend those exposing corruption!! Always! 🌹❤️🌹
1559568379982962,1:25:22,Derek Main,"Zuma will say ""I want to testify with forked tongue""."
1559568399870506,1:25:42,Magda Seguin,CJ Moegoeng has stated after consultation that English only must be used in courts...the judge in the Zuma case overruled his Zulu request
1559568430098031,1:26:12,jett888,This affects all of us - whistleblowers and truth tellers need protection- corruption needs to be exposed
1559568441987767,1:26:24,Solly 12,But this is not a court
1559568483496711,1:27:06,Caitlin C,I just saw this on YouTube. what's going on? can anyone explain
1559568491907033,1:27:14,jett888,@Solly 12 the TRUTH doesn’t need a “ court” it only needs to be defended
1559568494347904,1:27:16,KQ-O’ American Lady,Is this Judge a judge the people voted in?
1559568503675401,1:27:26,Magda Seguin,It will go to court...Batohi and Cronje was in fire in their press conference
1559568559591915,1:28:21,jett888,@Caitilin C same here- trying to figure it out- but this person seems to be willing to come forward to expose some sort of corruption
1559568582331479,1:28:44,barbara broadbent,Poor guy getting a bit flustered!!
1559568595587601,1:28:58,Magda Seguin,"In SA the judiciary is independant,this judge was appointed by the President to lead this commission.Same as in the US when witness appear in front of Congress"
1559568608076509,1:29:10,KQ-O’ American Lady,He looks like an honest man
1559568626355309,1:29:28,Solly 12,"Jett888 true, but for him to go to jail for his crimes he must appear in court"
1559568640952848,1:29:43,Magda Seguin,"Yes we trust him,he has been very objective since the commission started"
1559568655740696,1:29:58,KQ-O’ American Lady,Thank You @MagdaSequin 🙏🏼
1559568663357553,1:30:05,Caitlin C,wow this is the first time I'm hearing of this. why is this not on the national news it seems very important
1559568667982455,1:30:10,jett888,@barbara broadbent but he’ll be okay- anytime you are telling the truth- it stays consistent. 🌹❤️🌹
1559568699751694,1:30:42,Magda Seguin,What crimes?who must go to jail @Solly 12
1559568700757792,1:30:43,KQ-O’ American Lady,Truth or Honesty?
1559568715125202,1:30:57,barbara broadbent,"i agree, the judge is obviously trying to clarify for when these cases actually go to court, he is correct!"
1559568731312097,1:31:13,jett888,@Solly 12 when you say “ him” are you talking about the man being questioned right now?
1559568731519980,1:31:14,Magda Seguin,You can follow it on Twitter too
1559568766888567,1:31:49,Khalid Mather,does no one remember this happening lol 🤣🤣🤣
1559568770917292,1:31:53,jett888,What is the mans name being questioned?
1559568775686519,1:31:58,KQ-O’ American Lady,@MagdaSequin Twitter Banned me for a Honest Joke
1559568781773759,1:32:04,Magda Seguin,I assume he meant 'him' who is our ex president
1559568796577726,1:32:19,Solly 12,Magda Seguin everyone who participated in this grand corruption called state capture
1559568796762614,1:32:19,Mashudu Tshikororo,Rajesh Sundaram
1559568800604826,1:32:23,barbara broadbent,Rajesh
1559568817436285,1:32:39,Magda Seguin,Oh very!! really? for a joke?
1559568818071328,1:32:40,Norman Mabunda,ZUMA IS CORRUPT
1559568824713164,1:32:47,barbara broadbent,@jett888
1559568830446651,1:32:52,jett888,@khalid Mather in the USA- much of mainstream media doesn’t show all - so I have no idea what this is about
1559568845545748,1:33:07,Magda Seguin,I agree wholeheartedly @Solly 12
1559568863874286,1:33:26,barbara broadbent,@jett888 watch and learn!
1559568867542405,1:33:30,Buyani Mhlongo,@jett888 State Capture Inquiry of South Africa
1559568875196349,1:33:37,Judas Sambo,guys you're all seemingly new here
1559568885186024,1:33:47,KQ-O’ American Lady,@Magda Both in America We use humor sometimes to help ease the Truth from hurting too much
1559568907667028,1:34:10,jett888,It’s like the Steele Dossier- look at how corrupt that was and how much corruption to keep it under wraps- the truth will be revealed! ❤️🌹❤️
1559568930015129,1:34:32,Magda Seguin,We have a very strong constitutional democracy..but the criminals still have ways especially when they have absolute power like our ex president
