timestamp,time,author,message
1597845938981249,2:04:44,Abel Matshidiso,"monna o o maka bagaetsho ijoo, even my son just mentioned it to me"
1597845956360252,2:05:02,Mfundo,@Natalie Noels super 😎
1597845958191196,2:05:04,Antoinette Meyer,yesssssssss!
1597845961722406,2:05:08,Antoine Johnson,"So The A.N.C Is A Global Currency ,C.F.A A Global Currency And The E.C.O Is A Global Currency ! Which The Contineunt's Residential Inhabitants Gas Pump Tax Insured Every Dollar On Global Currencies NA"
1597845971216262,2:05:17,MOHSIN Pubgy gamer,we have a school problem
1597845972311558,2:05:18,zip reeper,Sodi had a burglary at his office
1597845981111632,2:05:26,TheQueen V,@mfundo are you flirting
1597845984848522,2:05:31,MOHSIN Pubgy gamer,plz opsn the airport
1597845993202941,2:05:38,Abel Matshidiso,Mr Pretorius wants t adjourn
1597846000631206,2:05:45,Antoinette Meyer,awwwe.. when reeper?
1597846001443449,2:05:46,Dave Kirkman,Sodi's responses have the distinct smell of fish !!
1597846024938987,2:06:12,Elton Josea,mr sodi has died in an accident
1597846030331231,2:06:16,Immanuel,Continue✋🏻
1597846042840358,2:06:29,Mfundo,"BREAKING NEWS: Former EThekwini Mayor Zandile Gumede has been appointed to the KZN legislature, replacing the late Ricardo Mthembu, who recently died due to COVID-19. ANC for you"
1597846043258754,2:06:29,Martin van der Breggen,That will be tomorrow
1597846045926013,2:06:32,Alhadiah Khan,his dead partner lost the books.
1597846046807488,2:06:33,R hunter,Sodi's seat is getting hot
1597846047481747,2:06:33,zip reeper,"Antoinette, tonight!"
1597846065093251,2:06:51,Natalie Noels,South Africa is really wild
1597846065717581,2:06:52,mathys botha,does anyone know how his partner died
1597846096650615,2:07:23,English Rose,Sleep less night for the gentleman with the tie
1597846100483308,2:07:26,Sal SA,@Valerie FYI also try Osmans Spice in Gatesville - their HO in Dbn
1597846102903830,2:07:29,Mfundo,@Natalie Noels lets go for tea
1597846106261272,2:07:32,Mr Green,yah your own written statement will nail you
1597846118458586,2:07:43,TheQueen V,sodis collar is hot now
1597846125721584,2:07:52,EDDIE ZONDI Masilo,he was gunned down in sandton carring a bag with R3MILLION
1597846129572120,2:07:55,Ntsholopa Moratho,cannot wait to see this guys in orange overalls...
1597846137950654,2:08:04,Mohamed Mia,Tax returns his guy is going to crap his pants full
1597846141788946,2:08:07,Craig Johnson,"was shot dead in broad daylight in June as he was driving down Sandton's Bowling Avenue in a Bentley worth about R3m.Apr 19, 2018"
1597846141989629,2:08:07,TheQueen V,@mfundo you flirt right in front of me haibo
1597846142008933,2:08:07,Jeremiah Nikani,The guy contradicts his own statement. Typical of liars.
1597846143135986,2:08:08,Gina deW,@mathys botha Shot by hitman
1597846145963406,2:08:12,zip reeper,"I dont, mathys. Probably car accident?"
1597846180638680,2:08:47,Jackie Witbooi,"lies, lies and more lies lol"
1597846181372619,2:08:47,Nondumiso Soko,was on a tea break any arrests???
1597846183025830,2:08:49,English Rose,Craig it was 2017
1597846186408859,2:08:52,Jenny Whitewaves,sorry month
1597846190079221,2:08:55,Antoine Johnson,"Three Continentale Bonds ; Three Travel Section Avion, Navigators Maritime,And Rail-lines ! ANC,CFA,ECO ; Global Currency Notes ! the unofficially one of eight vice president aware"
1597846190099293,2:08:55,zip reeper,"Gina, Craig: so pretorius must be careful"
1597846192975616,2:08:58,Natalie Noels,@mfundo Veerasamy I'm only leaving my house in 2021 😅
1597846201605159,2:09:07,Sal SA,@Valencia see my note above
1597846224646717,2:09:30,Mfundo,@ Valencia J lol its only tea no harm you are the main so chill😎
1597846231089014,2:09:37,Ntsholopa Moratho,this must also be put to sihle zikalala...he seem to be loosing it as well like hus master CR
1597846252120012,2:09:57,barbara broadbent,these crooks have no shame!!
1597846253895967,2:09:59,Dominic Przybylski,@Ndumieh Mokoena I think there were some arrests for people who were not wearing face masks.
1597846255655795,2:10:00,HILTON ZUMA,ANC?ANC?ANC?ANC?ANC? Why South Africans must Vote for ANC? Pls convince US?
1597846255958366,2:10:01,English Rose,Kumnandi la!
1597846256426792,2:10:01,Gina deW,@zip reeper 😅
1597846261170705,2:10:07,Mfundo,@Natalie Noels by 2021 the tea will be cold😆
1597846268637114,2:10:14,Ntsholopa Moratho,patrick...did you mean Vincent maleka
1597846269103870,2:10:14,TheQueen V,"@SAL which one, I don't see anything"
1597846269911472,2:10:15,Natalie Noels,Glad I hopped onto this video. Who needs dstv when we have all this action😅
1597846280255697,2:10:25,Patrick .Solarnfo,YES
1597846284945802,2:10:31,TheQueen V,@mfundo you have no shame wena
1597846331740952,2:11:17,Ntsholopa Moratho,he is such a marvel to watch when he asks questions...Vincent MalekaSC
1597846346128568,2:11:31,Mfundo,@Valencia J dont be jealous allow me to try new things lol
1597846356481913,2:11:43,Patrick .Solarnfo,INDEED
1597846361091978,2:11:47,TheQueen V,I miss the poet Vincent maleka
1597846364206247,2:11:51,Nondumiso Soko,are we done??? anyone planning on looting please do send me an email I'm an engineer by qualification
1597846397278237,2:12:23,Alhadiah Khan,valencia maybe he has no shame but he has a conscience hoefully taking in mind the poor people who r robbed.
1597846404098295,2:12:31,Patrick .Solarnfo,I BET HE WAS A MARVEL AT LAW SCHOOL TOO
1597846424156160,2:12:50,Ntsholopa Moratho,are they load shedding in the South of Jhb today...
1597846481621117,2:13:48,Ntsholopa Moratho,VM is in the mould of bo Marumo Moerane SC
1597846486871783,2:13:53,Mr Green,😗Tea break
1597846493550529,2:13:59,TheQueen V,loadshedding at 6 later
1597846514829740,2:14:21,Gina deW,No loadshedding in the south of CT
1597846523878772,2:14:28,Mfundo,"@Valencia J, I need moola abo Natalie are working with ama spreadsheets meaning there is moola there"
1597846527985849,2:14:33,Mni Nkukwana,what is happening now
1597846541628513,2:14:47,TheQueen V,chancer.
1597846577171626,2:15:23,Donovan Landsberg,Whats the current situation?
1597846586398102,2:15:31,Mfundo,see you have loadshedding I dont want to be in the dark while we are no longer on lockdown
