timestamp,time,author,message
1561129805894443,2:27:06,Khaya Nomoyi,She should have been given her affidavit first to refresh her memory.
1561129838905473,2:27:41,Kearabetswe Ntsane,why did she sign without reading 😭
1561129862321880,2:28:03,Born free,Yes Danie.. it would seem that corruption is the order of the day in S A.
1561129869762408,2:28:11,Magda Seguin,"Normally all witnesses have their a copy of their affadavits,remember they are asked after swearing in if it is their signature.."
1561129878604553,2:28:19,Some guy,I never read either 😱.
1561129938232384,2:29:19,Born free,thanks Pastor 🙋
1561129941304172,2:29:22,Kearabetswe Ntsane,"you will sign your soul away, you must read first"
1561129944089621,2:29:24,Magda Seguin,"The mafia uses coercion,that is their style if she didn't have legal presentation and no knowledge of business they are sitting ducks to be used and abused"
1561129958193413,2:29:38,Danie Nilsen,i have been in a minimum sort of state scam dealing with a previous disadvantage contracter for fencing in a small town village and do the sub contracting for him and what a sham it was(tbc)
1561129967221581,2:29:49,Helen Laing,agree Magda
1561129986151987,2:30:06,Magda Seguin,"She trusted government and parastatal officials,she is not dom."
1561129995649149,2:30:17,Diana Sekatane,You can't win something that is not in a competition.
1561130014818901,2:30:37,Khaya Nomoyi,Seguin they do consult with the evidence leaders to refresh their memory before the start of the proceedings
1561130095711124,2:31:56,Danie Nilsen,"i did the work and did it well but the material suplied from the ""boss"" was sub standerd i asked him about it and was told to do what i signed to do and that was fencing etc (tbc)"
1561130101166654,2:32:02,aurelia nqeto,Is Mr Van Wyk black or white because I heard Tebogo Brian Van Wyk
1561130102592552,2:32:03,Magda Seguin,When this ho yo court any judge worth their salt will see right through the Ban Wyk coercion tactics
1561130111370968,2:32:12,Kearabetswe Ntsane,ehh lekgowa is our for blood
1561130137459718,2:32:38,Born free,A witness rendered to Van Wyk as being very dark
1561130141852446,2:32:43,Magda Seguin,"Skin colour doesn't matter,corruption is corruption"
1561130154860437,2:32:56,Kearabetswe Ntsane,you must never sign without legal representative
1561130187591588,2:33:29,Anne M.,@Danie Nilsen Have you told the municipality (or whoever issued the work) that you were given sub-standard material to work with?
1561130197093444,2:33:38,Magda Seguin,"This lady was naive,she was not aware if her rights that is why she was used as fodder for corruption"
1561130233321273,2:34:14,Born free,This witness looks familiar.. has she ever been a member of Parliament or in the government??
1561130235249019,2:34:16,Magda Seguin,"Eish,I am sorry Mama"
1561130242058732,2:34:22,Danie Nilsen,"at the first inspection from bloemfontein public works they were surprize to meet me and doing the work as they knew me from former work have done as a subcontractor, (tbc)"
1561130255825567,2:34:36,Diana Sekatane,the lady was used as very badly.
1561130269468939,2:34:51,Magda Seguin,"I dont think so Bicyor,she is like anyone who is desperate to make a living"
1561130284209822,2:35:05,Magda Seguin,@Victor
1561130325394583,2:35:46,Magda Seguin,It was a CC!! for goodness sake it was a catering company!!
1561130331893171,2:35:53,Some guy,yooooo🤦
1561130364025811,2:36:25,Anne M.,"@Danie Nilsen Okay, then you've done the right thing."
1561130418056972,2:37:19,Danie Nilsen,@Anne M. yes at the first inspection and showed the results of measurments i took and the contractor was absent on that meeting. long story short he got 21 day site vacation
1561130431601076,2:37:33,Mzalwane Mzala,It doesn't seem like she was a sophisticated business person as she applied for small tenders with only one or two people assisting as employees. the township kind thing
1561130503415922,2:38:44,Victor,Such ignorance shouldnt have given her the business deal
1561130507618074,2:38:49,Born free,This witness is not as ignorant as she is making out to be.
1561130522937509,2:39:03,Magda Seguin,Always rushing....there you have a strategy of coercion right there
1561130538183892,2:39:19,Khaya Nomoyi,She could have handed Corineca over to Van Wyk.
1561130546750105,2:39:27,Magda Seguin,@Victor...she was used and abused
1561130594222631,2:40:15,Some guy,"that's true... seems like the ""African style"" coz there's usually no one checking. suddenly chief Zondo is here to check 😰😨😱"
1561130603140098,2:40:23,aurelia nqeto,love them all but trust no one
1561130609236925,2:40:30,Danie Nilsen,"and i finished the work with the same material and got paid the outstanding contract as a matter of fact there was no shenigans as it is now, we worked got inspected and faults corrected"
1561130628353312,2:40:49,Mzalwane Mzala,Van Wyk saw an opportunity to use a person who have a registered business that did not really have work. Even the big tender was suggested by Mr Van Wyk.
1561130628400885,2:40:49,Magda Seguin,"@Victor this is how criminals work,they steal millions from pensioners with their Ponxi schemes they always go for the vulnerable"
1561130647652159,2:41:09,Magda Seguin,*Ponzi schemes
1561130712124354,2:42:14,Magda Seguin,Van Wyk inserted himself into her business and directed everything
1561130734792747,2:42:35,Magda Seguin,That is not how tenders work
1561130735208738,2:42:36,Anne M.,"@Danie Nilsen It might cost you some work in future, but you have kept your name."
1561130741152318,2:42:42,Bernard Matolino,But who is this van Wyk guy?
1561130761895006,2:43:02,Born free,Is this witness a volunteer or was she supeoned??
1561130768023585,2:43:09,Magda Seguin,Van Wyk was from SA Express
1561130785539831,2:43:26,Mzalwane Mzala,There are many registered businesses out there by people who had dreams but could not get work.
1561130798812670,2:43:39,Anne M.,He was General Manager Commercial at SA Express
1561130838684748,2:44:20,Magda Seguin,You are right @Anne M his name was mentioned with the grounding of SA Express
1561130842611115,2:44:23,Bernard Matolino,But the Deputy Chief Justice is asking some tough questions that make this lady's story very shaky. How do you just sign coz you trust someone? Even if my wife were to bring me something I'd check it
1561130858787791,2:44:40,Mzalwane Mzala,I want to listen to her recordings of Van Wyk
1561130889743302,2:45:11,Danie Nilsen,lol it did cost me some short time but then an coulerd friend asked me to become his partner as we were in the same type of construction. i think it was the only time a white partner
1561130890004920,2:45:11,Born free,I can understand why my luggage had been tampered with 🤤
1561130898477660,2:45:20,Mzalwane Mzala,Please trust your wife @Lex Luger
1561130904681075,2:45:25,Some guy,my wife makes me sign documents in my sleep.
1561130930021727,2:45:52,Magda Seguin,Read my lips @Lex Luger criminals go for the vulnerable and those who are not aware of their rights.According to her he was in authority and she believed and trusted him implicitly
1561130952722442,2:46:14,Born free,@some guy... haha Insurance policy
1561130959088550,2:46:19,Kearabetswe Ntsane,yep as I said
1561130978356785,2:46:40,Some guy,lol oh yeah.
1561130992942824,2:46:53,Phillip Cwazibe,This poor women was taken advantage of.
1561130996977400,2:46:58,Magda Seguin,"Read between the lines,her testimony explained his modus operandi he was forever rushing her and had excuses not to answer her questions"
1561131003916265,2:47:05,Bernard Matolino,Guys you can't even trust your mother's daughter/son. Listen to the deputy chief justice's questions. This lady is not as naive as she is making out
1561131008109090,2:47:10,Magda Seguin,He is an effing criminal
1561131020555510,2:47:22,Magda Seguin,I am getting so angry now
1561131026689595,2:47:27,Kearabetswe Ntsane,poor lady man 💔
1561131041676951,2:47:42,Danie Nilsen,"got in as a bee partner my senior was coulerd person in the company up to this day i still do not get it right and he was on the state procurement list and i was not on the list, wich was fine"
1561131081128332,2:48:21,Bernard Matolino,This lady is stammering now. Her story is not convincing. Under thorough cross examination she will fumble
1561131095450898,2:48:36,Magda Seguin,@Lex Luger you need to learn discernment and analytical skills rather than criticising the witness
1561131129858820,2:49:11,Magda Seguin,Any fool can hear that this lady was conned
1561131138113085,2:49:19,Bernard Matolino,Thanks @Pastor JJ Pastor JJ I can never be as naive as this lady esp when doing business. She thinks she is so likeable van Wyk just liked her so much
1561131163668656,2:49:44,Born free,It's all fishy
1561131178827626,2:49:59,Bernard Matolino,@Magda Seguin Just listen to the deputy chief justice. There is an experienced lawyer there. Not you and I
1561131182369982,2:50:03,Magda Seguin,The DCJ must ask pertinent questions to protect her when it goes to court
1561131198772175,2:50:19,Kearabetswe Ntsane,sounds like a classic scam
1561131209154785,2:50:30,Magda Seguin,@Lex Luger you dont know my background.Sit down
1561131232096328,2:50:53,Magda Seguin,Exactly it's a monumental scam
1561131244382412,2:51:05,Mzalwane Mzala,Her only experience is as a subcontractor in delivering meat. Did she ever get a construction tender?
1561131249132628,2:51:10,Bernard Matolino,This lady sees the trouble she is in and she decides let me make it van Wyk's story. It's pretty much like me trusting you guys. I don't know you. You could be killers.
1561131260251798,2:51:21,Kearabetswe Ntsane,trust is deadly hey
1561131284624292,2:51:45,Born free,Trust leafs
1561131287601981,2:51:49,Grace Kunene Kunene,Lex😂😂😂😂😂😂
1561131288818777,2:51:50,Ben Cole,The crookery and deceit goes beyond any bounds of reason. Naitivity and blind trust in people of authority at any level had got us where we are today.
1561131290213543,2:51:52,Magda Seguin,@Lex Luger it's your perogative but dont make assumptions on who we are
1561131306586227,2:52:07,Born free,Trust leads to Betrayal
1561131312059281,2:52:13,Bernard Matolino,@goolamv you are right
1561131360534197,2:53:02,Mzalwane Mzala,Indlala
1561131371573806,2:53:12,MIKE DURBAN,this lady is acting dumb.......she knew what she was getting into...i
1561131378706215,2:53:20,Some guy,well I'm not a killer...... or am I😏
1561131385145731,2:53:26,Bernard Matolino,@Magda Seguin You misunderstand me. All I am saying is that it is imprudent to trust a stranger. Just like those ladies who hand their babies to strangers at taxi ranks and the strangers run.
1561131386420399,2:53:27,Khaya Nomoyi,It seems like she was being pushed under pressure and the cotract was lucrative.
1561131395815110,2:53:37,Magda Seguin,"I work with people everyday of my life in their most intimate lives,this lady was conned and scammed.I read her body language,voice and her answers"
1561131408071738,2:53:49,Danie Nilsen,she puts her foot in it she opens her mouth keep it very short and mostly yes or no
1561131441237181,2:54:22,Born free,R31 million
1561131442196463,2:54:23,Tsepang R,"GREED! The hallmark of all tenderpreneurs! She was just interested in making easy money, that's the bottom line. No regard for proper procedure whatsoever"
1561131442221840,2:54:23,Bernard Matolino,@Magda Seguin You are obviously not after unearthing truth but defending the witness.
1561131462864761,2:54:44,Magda Seguin,"These tenders are usually millions,ho on www.gov.za and research tenders"
1561131495604050,2:55:16,Magda Seguin,I am impartial but I can see a scam a mile away
1561131500259620,2:55:21,Tsepang R,GREED leads us into scams!
1561131539594176,2:56:00,Zola Pinda,The contract is more than R 400m
1561131558840435,2:56:19,Magda Seguin,"Some people in SA always defends corruption,the Zuma crowd especially"
1561131568340857,2:56:29,Bernard Matolino,"@Magda Seguin I am worried why this lady did not see it. I also would not sign even what a colleague hands me, especially in a rush, at 4pm. She is not 5. People were praising her as a hustler"
1561131585022457,2:56:46,Bernard Matolino,A HUSTLER IS NEVER THIS NAIVE
1561131598985130,2:56:59,Magda Seguin,Semantics @Lex Luger
1561131611266590,2:57:12,Bernard Matolino,THIS HUSTLER HAS BEEN BUSTED
1561131650153863,2:57:52,MIKE DURBAN,No...she is acting like she's naive......
1561131660912955,2:58:02,Bernard Matolino,She didnt even know how she was going to be paid. Easy picking for a half baked lawyer
1561131664628565,2:58:04,Derick Mampuru,"I just came online but I can tell this woman is confused, who's she anyway?"
1561131676698617,2:58:18,Magda Seguin,Whatever @Lex Luger
1561131695879056,2:58:36,Bernard Matolino,"@Derick Mampuru She is not confused, she is sweating under tough questioning"
1561131710584094,2:58:51,Zola Pinda,She can Bank the millions in her account but can’t read the contract.
1561131737413818,2:59:19,MIKE DURBAN,"@Lex Luger ,,,spot on.."
1561131746392956,2:59:27,Magda Seguin,Who knows whether she recieved the millions? Why is she here?
1561131748448960,2:59:29,Bernard Matolino,@Magda Seguin Is she your connection? Were you also in the scam? They will arrest you!!
1561131766817071,2:59:48,Zola Pinda,I think she playing games.
1561131777330084,2:59:58,Kevin Simon,"Her business was identified, hijacked and looted under her nose."
1561131780351031,3:00:01,Anne M.,The agmt was envisaged to move R400 million out of North West gvnmt into SA Express and a third party that SA Express nominated to conduct ground-handling services at those airports named Koroneka.
1561131789758120,3:00:10,Derick Mampuru,@Lex Luger lol I thought she doesn't know what she's talking about... 🤣🤣🤣🤣 look at her glasses lol
1561131791576901,3:00:12,MIKE DURBAN,@Thando Nkutha ...spot on...she's acting dumb..
1561131799505062,3:00:20,Magda Seguin,"This needs to be put in context,it is STILL part of the SAA corruption investigation but it is lost on some people on this thread"
1561131806490799,3:00:27,Anne M.,R97 million of that amount was paid out of the North West government and siphoned off through a “detailed scheme of money laundering”
1561131821788568,3:00:42,Daniella Morgan,ooohhh uhuh
1561131827298611,3:00:48,Zola Pinda,She is trying to avoid jail.
1561131828677656,3:00:50,Magda Seguin,Arrest me? Dont patronise me
1561131839485751,3:01:00,Bernard Matolino,"@Derick Mampuru Exactly, those glasses, you can't con any gogo who does that with her glasses.😁😁😁"
1561131895921801,3:01:57,MIKE DURBAN,No no Chair......she knows....
1561131925354612,3:02:26,Zola Pinda,She’s lying😂😂
1561131939049902,3:02:41,Kevin Simon,Contracts equal money for nothing.
1561131939195603,3:02:41,Magda Seguin,"@Anne M your friend @Lex Luger needs to read and be informed about this commission and why it exists,especially who are whistleblowers and who is subpoenaed"
1561131958883387,3:02:59,Tsepang R,typical tenderpreneur. just signs documents and waits for easy ANC millions
1561131993495382,3:03:35,Born free,The players are all connected. She is acting naive
1561131995485099,3:03:37,lesego gareth,She is lying....
1561131999424905,3:03:40,MIKE DURBAN,@Tsepang Ranneileng ...spot on Bra...
1561132010608579,3:03:52,Chalwe Mwansa,this woman is presenting the front of ignorant. She totally knew the guys where using her company and she was going to get a share without her physically doing to day-to-day stress of doing business
1561132013805456,3:03:54,Bernard Matolino,@Magda Seguin Unfortunately I am illiterate. I can't read or write. Happy Now? Yes you won!!
1561132015166786,3:03:56,Magda Seguin,That R400m was stolen
1561132015943156,3:03:56,Zola Pinda,She said she’s done construction tenders for government before.
1561132041822028,3:04:24,Bernard Matolino,and supplied meat
1561132069195908,3:04:51,Mzalwane Mzala,I don't think she ever won a big tender like construction.
1561132085158104,3:05:06,Derick Mampuru,"okay let me listen some more, this is interesting... doing a job yet not knowing how you'll be paid hmm 🤔🤔"
1561132087110054,3:05:08,Chalwe Mwansa,they knew through that hence they just wanted to use her company
1561132100480659,3:05:21,Mzalwane Mzala,She had two companies what were tendering for government contracts
1561132114110567,3:05:35,MIKE DURBAN,Please Chair .......she's playing you......
1561132136346145,3:05:57,Mzalwane Mzala,Kunjalo Thando
1561132152010163,3:06:13,Chalwe Mwansa,she probably even right the proposal herself
1561132165095017,3:06:26,Chalwe Mwansa,write*
1561132173342093,3:06:33,Kevin Simon,The only reason she agreed is because this system worked before.
1561132175167926,3:06:35,Zola Pinda,Yes🤣🤣
1561132180189658,3:06:41,Magda Seguin,She is what is called a 'patsy' the fall guy for malicious purposes
1561132187595219,3:06:48,Mzalwane Mzala,Vuka mawulele
1561132209569231,3:07:11,Bernard Matolino,When you supp with the devil you must use a long fork.
1561132245869444,3:07:47,Derick Mampuru,@Thando Nkutha my point exactly lol
1561132255194508,3:07:55,Chalwe Mwansa,ultimately she was told for every money that comes into your account you get x-percentage
1561132315684644,3:08:57,Zola Pinda,She had a drive and van loader for her meat delivery in hospitals later end up with close a half a billion. Pathetic
1561132341824853,3:09:22,Francois Cape Town,"Liar,Liar, Pants on fire..."
1561132361308119,3:09:42,Bernard Matolino,"@Mzalwane Mzala It is this belief, which was funny at the beginning of her testimony. Believing that one is blessed is dangerous. She thought she was so blessed and she is no different from blessees"
1561132372687636,3:09:54,Mzalwane Mzala,@Zola Pinda That is exactly the issue
1561132383974816,3:10:04,CHRISTOPHER MOLEFE,"This woman is lying. She should have had relations with the then Premier and was co-corrupt, hence she never questioned this deal. Supra only worked with his people."
1561132397181729,3:10:18,Mzalwane Mzala,@Lex Luger I get you.
1561132402713211,3:10:23,Zola Pinda,Yes
1561132419807805,3:10:41,Bernard Matolino,"A blessee thinks she is so lucky, she gets used, is discarded and she cries crocodile tears"
1561132441689438,3:11:02,Zola Pinda,R400m no contract 😣😣
1561132458999074,3:11:20,Mzalwane Mzala,Many people who work in government find themselves in such relationships.
1561132484896809,3:11:46,Bernard Matolino,A break at 6? What time are they adjourning?
1561132513281694,3:12:14,Zola Pinda,This is very sad for us as tax payers. These looters must go rot in jail
1561132534538392,3:12:35,Bernard Matolino,@Thando Nkutha I like this slender but would have loved Maleka or Hofmeyer
1561132541508862,3:12:42,Chalwe Mwansa,you will now see how quick the money was exiting her account
1561132551953086,3:12:53,Chalwe Mwansa,to show she was just a conduit
1561132559489297,3:13:00,Kevin Simon,"With all this going on, why would there be any foreign direct investment? This is hugely embarrassing to RSA!"
1561132567057264,3:13:08,HERCULAAS KRUGER,This old Judge deserves a Bells !!! I mean...it is 6 o clock already ON A FRIDAY !!!
1561132589130230,3:13:30,Zola Pinda,😀😀
1561132602294950,3:13:43,Danie Nilsen,WOW this lady is unbelieble clever or naive
1561132618162115,3:13:59,Zola Pinda,Very clever
1561132639787089,3:14:20,Bernard Matolino,@HERCULAAS KRUGER You are absolutely right. This judge's work ethic is absolutely wonderful. He was in parliament yesterday and he is making up for it today. Where are our parliamentarians today?
1561132649456601,3:14:31,j b,why was she in business?
1561132668797244,3:14:49,Zola Pinda,To loot
1561132686033705,3:15:06,Bernard Matolino,@Danie Nilsen This lady would sell her soul and her grandmother's feet for a pound!!!
1561132690029625,3:15:12,Magda Seguin,"From the start of this commission it is very clear how peoples lives were destroyed by the Zuptoids they had a specific strategy.People used,abused,forced to resign,death threats and more."
1561132694618378,3:15:15,HERCULAAS KRUGER,Absolutely Lex !!!! We need more of his type in our country !!!
1561132710720203,3:15:31,Magda Seguin,If you are not on the side of justice you are complicit
1561132752629839,3:16:13,Bernard Matolino,@Magda Seguin There you go with your erudite platitudes
1561132951508208,3:19:32,Mzalwane Mzala,Check how JZ operated: Give a senior job to a person who will know that they would have never got it without your intervention. Such a person agrees to everything you say
1561132970078593,3:19:52,Danie Nilsen,she said she signed for millions eish man throw me a Belss and one for the chair too
1561133002494996,3:20:23,Mzalwane Mzala,This lady knew that she owed Van Wyk for that contract and could not question him.
1561133098338996,3:21:59,Bernard Matolino,@Pastor JJ Pastor JJ 😁😁😁😁😁 rhetoric
1561133187205013,3:23:28,Mzalwane Mzala,@Thando Nkutha I don't think she was consciously being criminal but she let go of ethics in order to get the big money. Unfortunately for her she was dealing with a bigger tsotsi.
1561133201464138,3:23:42,Ntokozo Dube,"i think she knew what she was getting into, she was part of the syndicate but not used"
1561133214696283,3:23:55,Danie Nilsen,"i d not know i know how to spend and more, while the rest of her people are jobless and hungry why is our country so full of crime it is hungry people stealing and she correct the judge lol"
1561133239964258,3:24:20,Mzalwane Mzala,She was used and she allowed herself to be used.
1561133282143424,3:25:03,Mzalwane Mzala,Lesson: Always follow processes.
1561133325525304,3:25:48,Ntokozo Dube,Exactly
1561133406460193,3:27:08,Danie Nilsen,"watch the eye play she is doing and the soft tone as she says ""yes chair"""
1561133469767991,3:28:11,KEITH SINDILE DINABANTU,..
1561133472705555,3:28:14,Danie Nilsen,kwaaks
1561133484093658,3:28:25,Ntokozo Dube,"Code of conduct, ethics, polices and procedures are there for a reason."
1561133523235207,3:29:04,Mzalwane Mzala,Short cuts are dangerous.
1561133541042555,3:29:21,KEITH SINDILE DINABANTU,Wow... these people are hard workers. They are only adjourning now?
1561133571453468,3:29:53,Khaya Nomoyi,My worry is that she is not given protection when she talks about lift home.
1561133571903152,3:29:54,HERCULAAS KRUGER,STEM SAAM JOU ...DANIE !!
1561133576874008,3:29:57,KEITH SINDILE DINABANTU,"Thats not South African, on Friday. We just don't work on Fridays...i am shocked!"
1561133586823285,3:30:08,Danie Nilsen,"i know ground handling , you have a wheelbarrow and a shovel plus a heap of ground you take the shovel and handle the ground into the wheelbarrow or what"
1561133625180038,3:30:45,KEITH SINDILE DINABANTU,"Oh, they are going home ....wow! I am shocked in RSA, this is happening. On Friday?"
1561133683560622,3:31:44,Danie Nilsen,she is going to have a horrable week end sipping bells and practice for monday
1561133728284371,3:32:29,Ntokozo Dube,yes lets go
1561133789283653,3:33:30,Kevin Simon,Seems information is all she lacked.
1561133799672824,3:33:40,KEITH SINDILE DINABANTU,@Pastor JJ Pastor JJ The country needs more people like you. My respect to you...
1561133858452870,3:34:40,Danie Nilsen,hou net op lieg jy lieg erger as zuma sies antie
1561133884200568,3:35:05,Chalwe Mwansa,she knew everything .....they were making transaction using are companty
1561133946513169,3:36:07,Danie Nilsen,ifthere are so many storys you dont walk away you run away fast
1561133974294383,3:36:35,KEITH SINDILE DINABANTU,"@Thando Nkutha Americans work non-stop, loot at their economy. I shop there for my car parts, i would be shocked that even on weekends, they respond as soon as i query something"
1561134013910286,3:37:15,Reinette Raubenheimer,chair Zondo is leading her...
1561134027514396,3:37:28,Danie Nilsen,very much so
1561134102700606,3:38:43,Reinette Raubenheimer,he assists her..... this aunty is conveniently confused
1561134126868229,3:39:08,Some guy,"but this is the nature of business . Any person whose making Serious money, certainly has to ""play the game"" ...so to speak. Not every single agreement document is holy and above board."
1561134135339891,3:39:15,KEITH SINDILE DINABANTU,"@Thando Nkutha I am talking about a garage for instance or auto shop or store as they call it in the US, that opens on Sat till 6 pm.... like Pick n Pay."
1561134173513410,3:39:54,Reinette Raubenheimer,🤔
1561134197349044,3:40:19,Some guy,"u just need to know how to duck, dive and defend yourself..... until they finally close u in a corner lol"
1561134200481814,3:40:22,Reinette Raubenheimer,selective memory?🤔
1561134242023829,3:41:02,KEITH SINDILE DINABANTU,@Thando Nkutha I am in the best oiled province in the country and its sickening how early shops closes
1561134275481931,3:41:36,KEITH SINDILE DINABANTU,"@Thando Nkutha Top or best province in the whole country, i meant to say."
1561134322449575,3:42:23,Some guy,she owes the chair a case of beer
1561134363195577,3:43:05,Danie Nilsen,"i am in ace.s old province nd it is wild bro very wild like this aunty,s eyes"
1561134402972696,3:43:44,Danie Nilsen,GROUND HANDLING MOVE DIRT WITH A FOSHOL
1561134405908036,3:43:47,KEITH SINDILE DINABANTU,"@Thando Nkutha The best run province mate! There is only one, net slegs een my broer.... vra van @Danie Nilsen"
1561134411586328,3:43:53,KEITH SINDILE DINABANTU,LOL
1561134438997766,3:44:19,Danie Nilsen,WESTERN CAPE
1561134468669647,3:44:49,KEITH SINDILE DINABANTU,"@Thando Nkutha Let me take a tea break, writing a story now for one newspaper i wont tell you. You love news LOL"
1561134471739537,3:44:52,Some guy,@Tikvah Olam Youtube streaming is completely free
1561134501930535,3:45:23,KEITH SINDILE DINABANTU,@Danie Nilsen lol... i did not say its WC
1561134504313443,3:45:25,KEITH SINDILE DINABANTU,lol
1561134512217187,3:45:33,Some guy,"they just need camera persons and ""some guy"" on the computer"
