timestamp,time,author,message
1556880919589757,2:15:16,Magda Seguin,True @Thapelo Motabogi..everybody made her a laughing stock
1556880932889813,2:15:30,Kay Kay,Jerrrrrr! he went to meet the Guptas
1556880945902827,2:15:42,Cassius Mngomezulu,Agrrzzy is a DA racist why not talk about him
1556880958589074,2:15:54,Marcus Levack,mentor Said the same thing
1556880990140126,2:16:26,Wildthing,mango juice
1556880995579517,2:16:32,Magda Seguin,"Problem with Mrs Mentor is that she spoke from memory,she may never have diaries or noted events"
1556881001235150,2:16:37,Greg Stewart,Jerrrrrrrrrrrrrrrrrrrrrrrrrrrrrrrrrrrr boet!!!!
1556881009926505,2:16:46,Born free,If they could not capture you they got rid of you. How mafiosa.
1556881020191270,2:16:56,delphin yvon Moukouma Mboussi,Let curry eating begin dear friends
1556881034486189,2:17:10,Sthakathi Khumalo,Guptas were not too pushy haha
1556881036472561,2:17:12,Fils de l'homme,So this guy meets these ppl without nknowin why
1556881059419688,2:17:35,future medics,Nothing wrong with meeting the Guptas. It's what you do afterwards that's a problem.
1556881085580956,2:18:02,Felix Muyoba,@future medics 100% corrrect!
1556881095347387,2:18:11,Magda Seguin,Gen Booysen obviously didn't know the Zuma/Zuma connection...All the people who met the Guptas was through Duduzanes who brings in the Guptas by surprise
1556881130784854,2:18:46,Magda Seguin,It was a deliberate pattern to implicate key people
1556881138645737,2:18:55,Kapn Krunch,the guptas didnt become family friends of the whole government over night of you were meeting them something shifty was going down gaurenteed
1556881139620830,2:18:56,funicanz,"So Duduzane was his ""dad's middle man: because he is ""likable"""
1556881142991284,2:18:59,Danie Nilsen,i own computer sale shops and all that goes with it and buy from Sahare shop in gauteng does it makes me corrupt
1556881146869199,2:19:03,Sthakathi Khumalo,future medics Nhlanhla Nene met them but he got an axe
1556881159438417,2:19:15,future medics,@Magda Seguin you are wrong. He knew it very well. He just said that he recognise the compound upon arrival.
1556881161993575,2:19:18,Kay Kay,So he followed Duduzane without knowing were they were going?
1556881171824188,2:19:28,Magda Seguin,He did daddy's dirty work by being likable
1556881172252247,2:19:28,Cassius Mngomezulu,"This Jacob Zuma guy is Clever no where in all this corruption is 100% involved, He uses the second and third hand"
1556881179080676,2:19:35,makhosi nobhatyi,"No one should make an accusation without valid evidence or proof, at this commission we want people whom know something or see come to share what happened"
1556881180923812,2:19:37,delphin yvon Moukouma Mboussi,Thae man forgot to mention that the start by eating curry
1556881197868340,2:19:54,Fils de l'homme,@Val Speirs I think this guys wanted to get his son involved in business
1556881221032560,2:20:17,Magda Seguin,On arrival yes...same thi g happened to others...I listebed to this commission testimonies from the beginning
1556881225393749,2:20:21,Born free,To capture Booysen
1556881229699612,2:20:26,Greg Stewart,you touch that curry you go down literally
1556881254796790,2:20:51,Magda Seguin,@future medics The Zuma/Gupta strategy had a clear pattern
1556881289216981,2:21:25,Born free,for lunch
1556881292603467,2:21:28,Danie Nilsen,you eat their curry it is like the last supper it is over for you
1556881309998486,2:21:46,Kapn Krunch,follow the dirty money simple as that numbers cant hide it'll implicate them all no he say she say just money
1556881315252089,2:21:51,future medics,@Sthakathi Khumalo resigned.
1556881332998123,2:22:09,Born free,Yes Currying favour
1556881360160345,2:22:36,Danie Nilsen,Sabourey curry
1556881379998622,2:22:56,Sthakathi Khumalo,"future medics you are just being mechanical about this whole thing, Nhlanhla was on the firing because he`d lied!!"
1556881553394517,2:25:49,Magda Seguin,I urge everyone to read Hen Booysens book called Blood on their hands
1556881787048067,2:29:43,Sthakathi Khumalo,"future medics I definitely know the differences, but you are omitting purposefully that he had lied about meeting with the guptas, hence I am saying you are being mechanical!"
1556882692392522,2:44:48,Mzalwane Mzala,They did not steal the land
1556883355937496,2:55:51,Channel blocker,They always write a book
